id,msg_id,parent_id,link_id,Count_read,Forum,Time,Author,Rank,Activity,Merit,Trust,Title,Body,ScamHeader
1,msg30170159,https://bitcointalk.org/index.php?topic=2169466.0,,836,Announcements (Altcoins),2018-02-12 23:09:15,coin-investor,Hero Member,1134,506,,[ANN][ICO] Cacao Shares (CcS) Saving the future of Chocolate,"It looks like a great team is behind this, but the announcement is very lousy they should have made it a professional looking one so people will treat them professionally anyway this is something new soon we will have pineapple or milk in the blockchain in the future if this one comes out successful.",False
2,msg30173839,https://bitcointalk.org/index.php?topic=2169466.0,msg30170159,836,Announcements (Altcoins),2018-02-13 01:24:51,analema,Newbie,15,50,,[ANN][ICO] Cacao Shares (CcS) Saving the future of Chocolate,"   Hi Coin-Investor thanks for your reply, indeed we launched the announcement a very long time ago and our junior memebership here in this forum does not allow us to post rich content such as html and images, in any case we are aware of that shortcoming but offer this channel to answer any questions you may have. There is also a telegram group and the main website, please look at the first post  We are now on pre sale and until Feb 28, after that we want to polish all steps to go on with a solid ICO that exceeds expectations of our supporters and the community  thanks in advance  Patino @cacaoshares",False
3,msg30174541,https://bitcointalk.org/index.php?topic=2169466.0,,836,Announcements (Altcoins),2018-02-13 01:51:57,sltshp,Member,140,10,,[ANN][ICO] Cacao Shares (CcS) Saving the future of Chocolate,LOL Chocolate on the blockchain! Not so sure if this project can gain traction though. kinda skeptical on it.,False
4,msg30174930,https://bitcointalk.org/index.php?topic=2169466.0,msg30174541,836,Announcements (Altcoins),2018-02-13 02:05:23,analema,Newbie,15,50,,[ANN][ICO] Cacao Shares (CcS) Saving the future of Chocolate,"   Thanks for your comment, what exactly makes you skeptical?  Chocolate is a worldwide industry of $98.3 billion in 2016 at an estimated CAGR of 2.7% from 2011 to 2016. Some of the major drivers of the industry are health benefits, large variety of applications, and seasonal and festive sales  In the specific case of CacaoShares we are focusing on Origin Chocolate (traceability) and saving Subspecies of Theobroma Cacao which are rare and sought after by luxury chocolatiers  If you have questions please let me know we are happy to share details and shed light into our business proposition  regards  Patino @cacaoshares",False
5,msg30218341,https://bitcointalk.org/index.php?topic=2169466.0,,836,Announcements (Altcoins),2018-02-13 16:15:07,AbraxasCcs,Legendary,1456,1015,,[ANN][ICO] Cacao Shares (CcS) Saving the future of Chocolate,"Hi, I'm Germán Lugo, co-creator of the Chococoin and CVO of the project Bit&Nibs. Currently I'm living in Florence and working in a Dr. Silvio Bessone's project (The Block-to-Bar project) as Project Manager. Silvio Bessone is the CTO of ""Fine Cocoa Research Institute"", and currently we are working to implement a new method of fermentation of the cocoa beans to get the best from very single cocoa bean. The method is called ""Bessone Patented Method"" (BMP). The BMP allows a grade of fermentation of 100%, that means that every single cocoa bean of every batch suffer a process of fermentation with the bacterium chosen to get the most in aroma and flavor.  This kind of cocoa will be placed in the market with a higher quotation.  I can declare:  1) We are going to implement (through the Bit&Nibs foundation in Venezuela) the BMP with the farmers that will work with the cocoa trees of Analema group (the group behind the ICO of Cacaoshare).  2) We are looking for a system of traceability of the all cocoa fermented with BMP, and we are studying to use the system of Analema Group.  3) I'm going to use the Cacaoshare to change the algorithm of Chococoin from Proof of Work to a new one Proof of Tree. This change of algorithm will allow finally that the Chococoin will be backed with a real asset (Chocolate).  4) Dr. Silvio Bessone met Patino Jose Alejandro in Tokyo and Patino shown the first documents asked by Dr. Bessone to consider any join venture with the Analema group.",False
6,msg30236593,https://bitcointalk.org/index.php?topic=2169466.0,,836,Announcements (Altcoins),2018-02-13 21:27:27,snewvine,Member,202,11,,[ANN][ICO] Cacao Shares (CcS) Saving the future of Chocolate,"Wow, This is way cool. And who doesnt just LOVE Chocolate.  Raise your hand",False
7,msg30243439,https://bitcointalk.org/index.php?topic=2169466.0,,836,Announcements (Altcoins),2018-02-14 00:40:05,klofanowik,Newbie,39,0,,[ANN][ICO] Cacao Shares (CcS) Saving the future of Chocolate,"It all sounds great, excepting the 4 year waiting period until you start getting any income. I get it you can't force nature to work faster, at least not if you want something natural, and there will be a lot of work to be done in order to prepare the land and take care of the growing trees, still it's a long wait in this cryptoworld where people have very high expectations. But it's a nice project, i hope you'll find investors with patience and you'll see it through. I'm curios about the app and what options it has, is there a place where we could see more of it? I'll keep watching. Good luck with this project!",False
8,msg30244110,https://bitcointalk.org/index.php?topic=2169466.0,msg30243439,836,Announcements (Altcoins),2018-02-14 01:13:27,analema,Newbie,15,50,,[ANN][ICO] Cacao Shares (CcS) Saving the future of Chocolate,"   Many thanks for your gentle comments! We know 4 years means some time for the crypto world, but precisely that is what gives inherent value to the CcS (specially to the first edition) it is sustented by a real growing asset (in all sense), we cannot say the same about mineral commodities or other digital assets built on more subtle expectations.  You can use CcS to hedge risk in your portfolio respect to other cryptos that are more volatile.  For example your CcS is worth 0.36$ today how much will it be when the tree is about 2 years old and we have the data that shows it s condition?   Let the market say!  I know for some, Chocolate business may come as a surprise or even ludicrous but Cacao has a solid supply and demand market and has been there for years, we are not necessarily inventing the wheel, just making it blockchain transparent!  There are different motivations to support CcS, one is the interest in the simple yield over the Cacao Trees but there are also those who know the problems and scarcity of Cacao Criollo varieties and want to participate in saving its biodiversity, there are also those who dream with this kind of rare Cacao (luxury chocolatiers) and want to make sure they get some for their exclusive use  You can see above the comments of German regarding Silvio, he is one who knows too the situation of Cacao Criollo, we are lucky to be talking with him  thanks again for your analysis  Patino @ cacaoshares",False
9,msg30244343,https://bitcointalk.org/index.php?topic=2169466.0,msg30218341,836,Announcements (Altcoins),2018-02-14 01:23:45,analema,Newbie,15,50,,[ANN][ICO] Cacao Shares (CcS) Saving the future of Chocolate,"   Thanks for the heads up German! Very Glad to have you as our advisor, looking forward to Chococoin taking off again soon!  As a clarification for the public: There are synergies between Chocoin and CacaoShares CcS but are separate projects, German is a friend and advisor on future initiatives to be defined in the Cacao - Chocolate business  Sincerely  Patino@ CacaoShares",False
10,msg30246162,https://bitcointalk.org/index.php?topic=2169466.0,,836,Announcements (Altcoins),2018-02-14 02:35:15,Toxic1234,Member,166,10,,[ANN][ICO] Cacao Shares (CcS) Saving the future of Chocolate,Lol nice project We all love chocolate. Roadmap ?,False
11,msg30249115,https://bitcointalk.org/index.php?topic=2169466.0,msg30246162,836,Announcements (Altcoins),2018-02-14 04:19:32,analema,Newbie,15,50,,[ANN][ICO] Cacao Shares (CcS) Saving the future of Chocolate,      hello friend road map is along with the whitepaper https://cacaoshares.com/cacaoshares-whitepaper/  You can also join our Telegram group http://t.me/cacaoshares  Patino @ cacaoshares,False
12,msg31941966,https://bitcointalk.org/index.php?topic=2169466.0,,836,Announcements (Altcoins),2018-03-09 18:59:09,SamaelDNM,Member,630,13,,[ANN][ICO] Cacao Shares (CcS) Saving the future of Chocolate,Interesting project and more than anything because cacao is Venezuelan  I wish you good luck ,False
13,msg33502810,https://bitcointalk.org/index.php?topic=2169466.0,,836,Announcements (Altcoins),2018-03-30 08:00:00,vijayp,Newbie,10,0,,[ANN][ICO] Cacao Shares (CcS) Saving the future of Chocolate,How can I withdrawal Cacao Shares (CcS) tokens? ,False
14,msg33563216,https://bitcointalk.org/index.php?topic=2169466.0,,836,Announcements (Altcoins),2018-03-31 00:44:00,analema,Newbie,15,50,,[ANN][ICO] Cacao Shares (CcS) Saving the future of Chocolate,Thanks for your message. If you have purchased CacaoShares Tokens at the PreICO you can reach the sales concierge chat at https://cacaoshares.com for any questions you may have  kind regards  Patino @ Cacaoshares,False
15,msg34339336,https://bitcointalk.org/index.php?topic=2169466.0,,836,Announcements (Altcoins),2018-04-10 02:28:26,leningradskiy90,Jr. Member,126,1,,[ANN][ICO] Cacao Shares (CcS) Saving the future of Chocolate,"as i read the information above ,it looks like a comprehensive project and hoping to invest it a little btw does ellon support this?",False
16,msg21741498,https://bitcointalk.org/index.php?topic=2169466.0,,836,Announcements (Altcoins),2017-09-12 01:16:11,analema,Newbie,15,50,,[ANN][ICO] Cacao Shares (CcS) Saving the future of Chocolate,"@@@ Private Round @@@  Cacao Shares (CcS)  You can buy Now CacaoShares at 47% discount! at www.cacaoshares.com  CacaoShares is a digital asset that enables anyone to own Cacao Trees and be rewarded from it, for years  Token based on a tangible fixed assets, Cacao Trees of the Criollo Type. Tagged for Real time traceability of its yield and its genetics. We also have already completed a minimal viable pototype of this app and will be available for beta testing to early contributors  The Cacao Industry has structural problems, particularly the Fine Cacao grown in Venezuela and exported to Japan suffers from low yield and poor productivity because of aging trees and gaps in management  CCS allows People to Invest In the Future of Cacao Trees As Chocolate Becomes Popular In Japan. By using the blockchain Technology we can solve two major problems of the Cacao industry: Traceability and Availability. Our goal is to plant 1 million new Cacao Criollo Trees and tag them to the Blockchain for perfect traceability  Only 1,388,888 CcS will be offered on preSALE @ 47% discount plus bonus of 5% for 1 ETH or more and 10% for 10 ETH or more.  ====================================================== ======================================================  Theobroma Cacao is an outstanding tree species that is vital to the production of chocolate among other foods. The bean is grown in many parts of the world, but it is in Venezuela where it truly stands out. Venezuelan cacao, known as Cacao Criollo is considered to be the most biodiverse cacao in the world. It has especially become a big deal in Japan where 50% of Venezuelan Exports of Cacao representing 10% of the Total Market Share of Cacao Imports into Japan.  ====================================================== ======================================================  It is with this that a CacaoShares ICO is being set up to support the development of cacao trees in Venezuela. Cacao Shares has been set up as an exciting program. The ICO is being backed by numerous people with strong experience in today’s investment field.  An extensive team is currently supporting criollo Sur Del Lago Tokens. Jose Alejandro Patino is the main coordinator of the program. He is an entrepreneur who has been working in the IT sector since 2002. Nakata Hiro, a Japanese entrepreneur with more than twenty years of experience in the food industry, is also a big part of the program. Foreign trade expert Rafael Devia is also participating.  The ICO will help to raise funds to get the Criollo type tree in Sur Del Lago in Venezuela grown and then exported out to Japan. This is a country where the cacao beans are highly valued. Asia has become one of the top consumers of cacao in recent years.  ====================================================== ======================================================  Every share that a person acquires during the ICO will be good for the quota of the entire life of a cacao tree. The sponsor of a tree will be rewarded based on the productivity of that tree . This comes as the value of the Fine Cacao Beans has become greater in recent time.  ====================================================== ======================================================  The ICO is based on the Ethereum blockchain. All Cacao trees will be tagged with physical sensors to monitor how well the trees are producing cacao and how they are being  harvested and sent out to Japan. This helps to identify the varieties of Cacao and how well the trees are growing beans. The above is called traceability and it is highly valued in the Cacao Trade.  The shares being offered will entail ownership of a fixed asset. The people who own Cacao Shares own the trees in question. This works to not only help the economy but to also promote social responsibility through the development of  trees it is expected to help the communities involved to have livelihood for many years .  Additional information on the Cacao Shares ICO can be found online at www.cacaoshares.com. The program is expected to be a big deal for people looking to endorse initiatives related to the environment and new technologies  ====================================================== ======================================================  Other Important links  Elevator pitch (1 minute): https://youtu.be/8JblegUk1d8  White paper: http://cacaoshares.com/cacaoshares-whitepaper/ Team: http://cacaoshares.com/management FAQ: http://cacaoshares.com/faq/ Buy Shares on preSALE: (On Feb 14, 2018 00:00 Japan time) Telegram: [url=http://t.me/cacaoshares] Click here Etherscan:   Click here   ====================================================== ======================================================   Completed Milestones of the Project until Feb 14 2018 (From recent to oldest)  For a list of milestones please refer to our whitepaper      Launch PreSAle Fund Raise -  February 14, 2018     Beta Tree Manager App on Google Play - February 9,  2018     Develop the Beta of the Tree manager App - December 1, 2017     Develop the Smart Contracts - November 30, 2017     Complete the Website - September 9, 2017     Feasibility Studies - August, 2017     Creation of the Conceptual idea - January 2017     Identification of The Problem - August 2016  ====================================================== ======================================================  Our team will be happy to answer your questions or comments via this topic. This is a work in progress",False
17,msg21741605,https://bitcointalk.org/index.php?topic=2169466.0,,836,Announcements (Altcoins),2017-09-12 01:24:53,$crypto$,Hero Member,714,500,,[ANN][ICO] Cacao Shares (CcS) Saving the future of Chocolate,http://cacaoshares.com/   ,False
18,msg21741796,https://bitcointalk.org/index.php?topic=2169466.0,,836,Announcements (Altcoins),2017-09-12 01:39:59,TimeTeller,Hero Member,1092,517,,[ANN][ICO] Cacao Shares (CcS) Saving the future of Chocolate,"Nothing to see yet on the website. Not even the tech specs of this coin. ""The production of those trees will be exported entirely to Japan""  - Maybe you need to re-phrase this. You mean cacao beans right? If there's an ICO with this kind of project as you already stated in your title, you need a reputable escrow. Otherwise, this is just a scam in the making.  ",False
19,msg21741866,https://bitcointalk.org/index.php?topic=2169466.0,,836,Announcements (Altcoins),2017-09-12 01:44:41,Yurkov,Sr. Member,756,250,,[ANN][ICO] Cacao Shares (CcS) Saving the future of Chocolate,It looks like they use even poor translator to describe the project. I'm afraid that nothing good will come out of it.. Anyway i will stay here to watch.,False
20,msg21741971,https://bitcointalk.org/index.php?topic=2169466.0,,836,Announcements (Altcoins),2017-09-12 01:52:37,analema,Newbie,15,50,,[ANN][ICO] Cacao Shares (CcS) Saving the future of Chocolate,"Thanks for your replies, I didn't expect our moderator here at BTT  to pass it live so fast, please check again the website and get back with your comments and questions  http://www.cacaoshares.com  the white paper in english can be sent via email to those interested  thank you  Jose",False
21,msg21742148,https://bitcointalk.org/index.php?topic=2169466.0,msg21741498,836,Announcements (Altcoins),2017-09-12 02:05:48,PandaMiner,Sr. Member,322,250,,[ANN][ICO] Cacao Shares (CcS) Saving the future of Chocolate,   after banana now we have cacao and waiting for apple ICO. Can you give information about your team. and btw I see China language (maybe japanese. I dont known) in your website. Do you known about news China ban ICO. and p.s : I like your website music,False
22,msg21742324,https://bitcointalk.org/index.php?topic=2169466.0,,836,Announcements (Altcoins),2017-09-12 02:16:51,analema,Newbie,15,50,,[ANN][ICO] Cacao Shares (CcS) Saving the future of Chocolate,"Thank you!  Actually Cacao is the Main Commodity that Venezuela exports to Japan. There is an existing market of more than 5,000 tons every year, with the possibility to expand.  The Venezuela bean is quite exceptional and this has been a fact since XIX century, Cacao beans were used by the Spaniards in colonial times as currency to trade with the Aborigins, I can privately share a documentary about this if you like  I read about the ICOS being banned in China, our project is shown mainly in Japanese because it is the #1 consumption market for the Cacao Beans. Of course we acknowledge the need to grow our team and perfect our value proposition with a perfect fit in changing regulatory matters  thanks about the music, it is made by a young venezuelan musician named Mike Gerardino, here is his youtube: https://www.youtube.com/channel/UC7DW4tLoLeAiyVfw_wXmUtg",False
23,msg21742409,https://bitcointalk.org/index.php?topic=2169466.0,,836,Announcements (Altcoins),2017-09-12 02:21:29,vanphummo,Member,112,10,,[ANN][ICO] Cacao Shares (CcS) Saving the future of Chocolate,When ICO start ?,False
24,msg21742628,https://bitcointalk.org/index.php?topic=2169466.0,,836,Announcements (Altcoins),2017-09-12 02:35:31,dominguero,Full Member,332,103,,[ANN][ICO] Cacao Shares (CcS) Saving the future of Chocolate,And Maduro?  I thought that the Venezuela´s Cacao industry was under the control of the government.  And Venezuela government it's not very Crypto friendly.,False
25,msg21743096,https://bitcointalk.org/index.php?topic=2169466.0,msg21742628,836,Announcements (Altcoins),2017-09-12 03:05:03,analema,Newbie,15,50,,[ANN][ICO] Cacao Shares (CcS) Saving the future of Chocolate,"   There is a number of privately funded companies developing Cacao business in Venezuela, we know all of them personally and will decide which one to work with depending on the prospects they bring to us. Cacao is a traditional industry, with long ties to the people and the community.  Something very special is happening now, the industry is at a point of recovery, with low oil prices, attention and shift is happening to agriculture, hence there is growing interest in preserving the quality of Venezuela Cacao. In IVenezuela we have the climate, the experience and the genetics of the cacao  We can't deny the challenge posed by the political system, however we can also rely on the long term experience of the industry as a whole and our operating partners who are responsible of keeping balanced relationships with those in the government and more importantly with the communities.  Our value proposition as CacaoShares is to streamline the ownership of those genetically unique trees and deliver it conveniently and efficiently in the form of Tokens, in a sustainable way.  Thanks for the interest",False
26,msg28759733,https://bitcointalk.org/index.php?topic=2169466.0,msg21741796,836,Announcements (Altcoins),2018-01-23 15:21:50,analema,Newbie,15,50,,[ANN][ICO] Cacao Shares (CcS) Saving the future of Chocolate,"   Hello friends, we are happy to announce that we are on the PRE-sale stage. We have completed the ERC20 contracts and will soon be rolling them out.  If you have comments or questions or want to know more about CacaoShares just ask us here in BitCoinTalk  BTW this is the recent press release of CacaoShares  http://cacaoshares.com/2018/01/23/cacao-shares-ico-supporting-the-production-of-cacao-trees-to-meet-demands-of-the-japanese/   thank you  Alejandro Patino",False
27,msg28760363,https://bitcointalk.org/index.php?topic=2169466.0,msg28759733,836,Announcements (Altcoins),2018-01-23 15:32:42,DOUBLEKAY11,Newbie,56,0,,[ANN][ICO] Cacao Shares (CcS) Saving the future of Chocolate,   But me think it would have been proper for the website to have the full details of the project. I just view the website but its not clear exactly how u guys want to go about it. I'm I missing something here?,False
28,msg28790314,https://bitcointalk.org/index.php?topic=2169466.0,msg28760363,836,Announcements (Altcoins),2018-01-24 02:00:13,analema,Newbie,15,50,,[ANN][ICO] Cacao Shares (CcS) Saving the future of Chocolate,"   Hello , thanks for your reply  We are working on improving the website and providing all necessary details, also the ICO terms and conditions will be posted within this week  - Exactly what information would you like to be added? we will work on it right away.  Some useful links as follows:  White paper: http://cacaoshares.com/wp-content/uploads/2017/12/171207-cacao-shares-extended-english.pdf  Team: http://cacaoshares.com/management  FAQ: http://cacaoshares.com/faq/  GitHub: TBA  Terms and conditions of the ICO TBA (This week)  Your opinions and suggestions are highly valued   Alejandro Patino",False
29,msg28790621,https://bitcointalk.org/index.php?topic=2169466.0,msg28790314,836,Announcements (Altcoins),2018-01-24 02:10:29,Whitefalcon,Member,125,12,,[ANN][ICO] Cacao Shares (CcS) Saving the future of Chocolate,    can you explain what unique program from your project? and will has ICO sale or pre ico? esmitaed ICO rate?,False
30,msg28790743,https://bitcointalk.org/index.php?topic=2169466.0,,836,Announcements (Altcoins),2018-01-24 02:14:12,heuhee,Newbie,8,0,,[ANN][ICO] Cacao Shares (CcS) Saving the future of Chocolate,Is there a feasibility report for exporting the product to Japan? I think we need specific data to deal with it.,False
31,msg28791282,https://bitcointalk.org/index.php?topic=2169466.0,,836,Announcements (Altcoins),2018-01-24 02:32:01,analema,Newbie,15,50,,[ANN][ICO] Cacao Shares (CcS) Saving the future of Chocolate,"Thanks for your questions, replies below:  The unique program from CacaoShares  We will solve two important problems related to The Cacao Beans Trade: Traceability and Availability  Japanese consumers highly appreciate Venezuelan Cacao Criollo Beans, however, existing trees are aging and are less productive, Moreover, at times supply chain mixes premium Cacao with standard Cacao because of lack of proper traceability management  By integrating The Blockchain Technology and linking it to physical tags on the trees, as CacaoShares, we will be able to guarantee perfect traceability of the Cacao Beans, this is what the industry of Chocolate calls Tree to Bar (as a next step to the bean to bar movement)  Feasibility report for Exporting Cacao Beans To Japan  According to data from the International Trade Centre and United Nations 50% of Venezuelan Cacao Exports already land in Japan. Please check the following world map detailing the destination for Venezuela Cacao Beans Exports  http://cacaoshares.com/2018/01/24/prospects-for-diversification-of-venezuela-cacao-exports/   Is it ICO sale or pre ico? It is in the  PRE-ICO stage, we are currently leveraging interested sponsors  Estimated ICO rate? To be announced",False
32,msg28801747,https://bitcointalk.org/index.php?topic=2169466.0,,836,Announcements (Altcoins),2018-01-24 07:24:05,DigitalPenguin,Newbie,9,0,,[ANN][ICO] Cacao Shares (CcS) Saving the future of Chocolate,"The idea seems good, it's like the announced Venezuelan Petro, backed by real stuff but i have some doubts:  Is it politically tied to the Venezuelan government like the Petro? How the token distribution will be? Have you some bounties program? Have you some projections about the Return of Invest on the next years? Have you any form or database to get listed and receive more info?  Thanks for the answers in advance.",False
