id,msg_id,parent_id,link_id,Count_read,Forum,Time,Author,Rank,Activity,Merit,Trust,Title,Body,ScamHeader
165,msg24780498,https://bitcointalk.org/index.php?topic=1934422.0,,67660,Announcements (Altcoins),2017-11-18 09:32:18,Vpower,Newbie,1,0,,[ANN] AGRELLO - Legally-Binding Smart Contracts for all,"Agrello - Behind the scenes!   Just so everyone is aware, big things are happening at the Agrello office! https://www.youtube.com/watch?v=SxWadyLfVQc",False
166,msg24953230,https://bitcointalk.org/index.php?topic=1934422.0,,67660,Announcements (Altcoins),2017-11-21 12:08:39,btcbringer,Full Member,252,101,,[ANN] AGRELLO - Legally-Binding Smart Contracts for all,"whats the ico price of this coin, I see it keeping on losing value after hitting Binance, whats wrong with it?",False
167,msg25327534,https://bitcointalk.org/index.php?topic=1934422.0,msg24605628,67660,Announcements (Altcoins),2017-11-27 17:42:29,Agrello,Full Member,190,100,,[ANN] AGRELLO - Legally-Binding Smart Contracts for all,    That is correct.  ERC20 compatible token layer.,False
168,msg25504384,https://bitcointalk.org/index.php?topic=1934422.0,,67660,Announcements (Altcoins),2017-11-30 17:34:12,Kirilp,Full Member,504,103,,[ANN] AGRELLO - Legally-Binding Smart Contracts for all,"Blockchain and Digital Identity – What You Need to Know  Self-sovereign identity is identity you own, stored only in a place where the owner of the identity has sole control over it, not in a central database. http://www.thebaynet.com/community/technology/blockchain-and-digital-identity-what-you-need-to-know.html",False
169,msg25522827,https://bitcointalk.org/index.php?topic=1934422.0,msg25504384,67660,Announcements (Altcoins),2017-12-01 01:45:20,LEXITco,Newbie,74,0,,[ANN] AGRELLO - Legally-Binding Smart Contracts for all,   So many topics covered. I cannot express how excited I am for future partnerships!!!,False
170,msg25600722,https://bitcointalk.org/index.php?topic=1934422.0,,67660,Announcements (Altcoins),2017-12-02 10:12:15,Swinging Phallus,Full Member,238,101,,[ANN] AGRELLO - Legally-Binding Smart Contracts for all,https://blog.agrello.org/agrello-weekly-update-b2af24de7a4  Nice to see the app being finalized and ready for launch. Excited for the upcoming news.,False
171,msg25699768,https://bitcointalk.org/index.php?topic=1934422.0,,67660,Announcements (Altcoins),2017-12-04 03:44:08,monerovn,Newbie,17,0,,[ANN] AGRELLO - Legally-Binding Smart Contracts for all,"The poor loyal paid shill Anessh dumps all his Delta at last. Eventually, he's not that stupid and stubborn as I thought, at least he managed to get out at the bottom, but I wonder how many people were destroyed by his voice. Poor him! If he and the others listened to me months ago, they will never have to suffer this Agrello disaster. Bitter truth is always hard to hear, but it will save your life, make you learn, and may get you tons of cash.  Might God bless you all.",False
172,msg25709040,https://bitcointalk.org/index.php?topic=1934422.0,,67660,Announcements (Altcoins),2017-12-04 08:26:03,opec45,Jr. Member,56,1,,[ANN] AGRELLO - Legally-Binding Smart Contracts for all,"Can't find Agrello on Etherscan. Why is that so, if it's an ERC20 token?",False
173,msg25709182,https://bitcointalk.org/index.php?topic=1934422.0,,67660,Announcements (Altcoins),2017-12-04 08:29:33,napolun2019,Newbie,38,0,,[ANN] AGRELLO - Legally-Binding Smart Contracts for all,THE team work with the neo team i think it will go far but zhe price is not fit for the hard work team,False
174,msg25771041,https://bitcointalk.org/index.php?topic=1934422.0,,67660,Announcements (Altcoins),2017-12-05 09:28:31,agreetag,Newbie,50,0,,[ANN] AGRELLO - Legally-Binding Smart Contracts for all,Do you have any competitors on the market now? What is your advantage comparing to them?,False
175,msg25931373,https://bitcointalk.org/index.php?topic=1934422.0,,67660,Announcements (Altcoins),2017-12-07 19:24:27,Nyrhalibe,Full Member,140,100,,[ANN] AGRELLO - Legally-Binding Smart Contracts for all,Agrello Delta Token Review - Legally Binding Smart Contracts with AI  https://www.youtube.com/watch?v=2fH5aKC5GjU,False
176,msg25989074,https://bitcointalk.org/index.php?topic=1934422.0,,67660,Announcements (Altcoins),2017-12-08 19:02:34,alexvilis,Sr. Member,588,253,,[ANN] AGRELLO - Legally-Binding Smart Contracts for all,"Agrello Weekly Update    Here’s a summary of this busy and productive week: While attending Moontec 17, which is billed as the largest conference in Northern Europe, and held in Agrello’s hometown of Tallinn — the capital of Europe’s innovative technology, the team made many new contacts. Among them was the team from Rivetz, which led to further discussions, and the prospects for a partnering. More info will be released on the details soon!  blockhive and Agrello together at Moontec 17 The Agrello team gave their full support to blockhive, who had a booth there, and their co-founder Kazuteru Arimura gave a Keynote speech that included Agrello’s role in their upcoming “ILP”, which is a new alternative to the “ICO”.  Taking advantage of being all in the same location, both teams met later in the week for a full-day work session, getting strategy for 2018 laid out, and setting up a test run for new Agrello implementations on the ID & KYC mobile app introduced last week, that will be used in the blockhive ILP launch in January.  The branding update rolled out this week, and we’ve received some good input on the new look! Let us know what you think — as always, your feedback is very important to us!  https://blog.agrello.org/agrello-weekly-update-42abce4b975a",False
177,msg26042185,https://bitcointalk.org/index.php?topic=1934422.0,,67660,Announcements (Altcoins),2017-12-09 18:03:52,Scooby903,Hero Member,896,500,,[ANN] AGRELLO - Legally-Binding Smart Contracts for all,"I am really excited for the agrello update tomorrow, I hope there's something fancy ",False
178,msg26063248,https://bitcointalk.org/index.php?topic=1934422.0,,67660,Announcements (Altcoins),2017-12-10 05:31:42,monerovn,Newbie,17,0,,[ANN] AGRELLO - Legally-Binding Smart Contracts for all,"I am too small to prevent this ICO from scamming people. They are too strong with more than 30 millions USD taken from investor, and they can buy anything they want, including tons of paid shill on reddit. I am too small...",False
179,msg26387229,https://bitcointalk.org/index.php?topic=1934422.0,,67660,Announcements (Altcoins),2017-12-15 17:18:07,Agrello,Full Member,190,100,,[ANN] AGRELLO - Legally-Binding Smart Contracts for all,"Agrello Weekly Update - December 15th, 2017  https://blog.agrello.org/agrello-weekly-update-30ac00f6c79b   ",False
180,msg26452170,https://bitcointalk.org/index.php?topic=1934422.0,,67660,Announcements (Altcoins),2017-12-16 20:26:39,z0n0,Legendary,1274,1006,,[ANN] AGRELLO - Legally-Binding Smart Contracts for all,"Estonia, the Digital Republic - Agrello's home.  ""Its government presents this digitization as a cost-saving efficiency and an equalizing force. Digitizing processes reportedly saves the state two per cent of its G.D.P. a year in salaries and expenses.""",False
181,msg26611413,https://bitcointalk.org/index.php?topic=1934422.0,,67660,Announcements (Altcoins),2017-12-19 15:18:03,revelacaogr,Legendary,1260,1008,,[ANN] AGRELLO - Legally-Binding Smart Contracts for all,Agrello participated in a meeting held in the Estonian parliament to give regulators a practical insight into crypto-world. #blockchain #eresidency #ICO #Estonia   https://twitter.com/AgrelloOfficial/status/943060980489170944  https://medium.com/e-residency-blog/were-planning-to-launch-estcoin-and-that-s-only-the-start-310aba7f3790,False
182,msg26613781,https://bitcointalk.org/index.php?topic=1934422.0,,67660,Announcements (Altcoins),2017-12-19 16:23:05,revelacaogr,Legendary,1260,1008,,[ANN] AGRELLO - Legally-Binding Smart Contracts for all,Agrello participated in a meeting held in the Estonian parliament to give regulators a practical insight into crypto-world. #blockchain #eresidency #ICO #Estonia   https://twitter.com/AgrelloOfficial/status/943060980489170944  https://medium.com/e-residency-blog/were-planning-to-launch-estcoin-and-that-s-only-the-start-310aba7f3790,False
183,msg23537339,https://bitcointalk.org/index.php?topic=1934422.0,,67660,Announcements (Altcoins),2017-10-25 21:01:13,Mobius,Hero Member,988,1000,,[ANN] AGRELLO - Legally-Binding Smart Contracts for all,May I suggest that the OP is updated with all of the current exchanges? I don't want to scroll through 30+ pages to find where to buy to this. I'm assuming I am not the only one.,False
184,msg23537425,https://bitcointalk.org/index.php?topic=1934422.0,msg23466465,67660,Announcements (Altcoins),2017-10-25 21:03:52,misterbigg,Legendary,1064,1001,,[ANN] AGRELLO - Legally-Binding Smart Contracts for all,   I am 1/3rd of my buy price. really struggling with agrello,False
185,msg23598347,https://bitcointalk.org/index.php?topic=1934422.0,msg23470137,67660,Announcements (Altcoins),2017-10-27 01:56:17,Hazara,Member,115,11,,[ANN] AGRELLO - Legally-Binding Smart Contracts for all,"     this huge but i didnt feel anything in my wallet, should i hodl or dump or stake some more??",False
186,msg23598407,https://bitcointalk.org/index.php?topic=1934422.0,,67660,Announcements (Altcoins),2017-10-27 01:58:30,DimiZb,Sr. Member,405,250,,[ANN] AGRELLO - Legally-Binding Smart Contracts for all,"Argello is the competitor of Etherparty and blockcat, so what are the advantages do you have if you persuade users to develop smart contract in your platform?",False
187,msg23630661,https://bitcointalk.org/index.php?topic=1934422.0,,67660,Announcements (Altcoins),2017-10-27 15:50:53,Agrello,Full Member,190,100,,[ANN] AGRELLO - Legally-Binding Smart Contracts for all,"Agrello Weekly Update October 27th, 2017       Read more > https://blog.agrello.org/agrello-weekly-update-a3e536ca446   ",False
188,msg23792214,https://bitcointalk.org/index.php?topic=1934422.0,msg23537339,67660,Announcements (Altcoins),2017-10-31 00:16:53,aneesh84,Newbie,3,0,,[ANN] AGRELLO - Legally-Binding Smart Contracts for all,"   You can buy here, available at deep discount below ico price.  https://hitbtc.com/exchange/DLT-to-BTC",False
189,msg23950165,https://bitcointalk.org/index.php?topic=1934422.0,,67660,Announcements (Altcoins),2017-11-02 21:42:29,Agrello,Full Member,190,100,,[ANN] AGRELLO - Legally-Binding Smart Contracts for all,Cashaa to Partner with Agrello to Offer Borderless Financial Products       Read more here > https://www.prnewswire.com/news-releases/cashaa-to-partner-with-agrello-to-offer-borderless-financial-products-300548824.html,False
190,msg23950322,https://bitcointalk.org/index.php?topic=1934422.0,msg23950165,67660,Announcements (Altcoins),2017-11-02 21:46:47,erv,Full Member,280,100,,[ANN] AGRELLO - Legally-Binding Smart Contracts for all,       nice! agrello holders will have airdrop?,False
191,msg23986154,https://bitcointalk.org/index.php?topic=1934422.0,,67660,Announcements (Altcoins),2017-11-03 15:12:52,Agrello,Full Member,190,100,,[ANN] AGRELLO - Legally-Binding Smart Contracts for all,"Agrello Weekly Update November 3rd, 2017       https://blog.agrello.org/agrello-weekly-update-e6cf7a9fa96f",False
192,msg24145690,https://bitcointalk.org/index.php?topic=1934422.0,,67660,Announcements (Altcoins),2017-11-06 22:17:15,Agrello,Full Member,190,100,,[ANN] AGRELLO - Legally-Binding Smart Contracts for all,"No airdrops planned, Erv.       More coverage on the Cashaa partnering:  https://bitcoinist.com/cashaa-partner-agrello-offer-borderless-financial-products/",False
193,msg24148769,https://bitcointalk.org/index.php?topic=1934422.0,msg23537339,67660,Announcements (Altcoins),2017-11-07 00:00:51,Zechis966,Sr. Member,350,250,,[ANN] AGRELLO - Legally-Binding Smart Contracts for all,"   Not saying this in an insulting way, but people should learn to use the marketcap websites because more often than not they are up to date with the markets.  Quote from: misterbigg on October 25, 2017, 09:03:52 PM Quote from: z0n0 on October 24, 2017, 02:46:52 PM Quote from: The Crypto Peasant on October 24, 2017, 12:20:37 PM Purchased at ICO and have been holding and accumulating more. Really hoping this project gains legs soon.  How is it all coming along?  Same as you, got in at ICO and (still) stucked here. Waiting for better days.   I am 1/3rd of my buy price. really struggling with agrello  The issue is too many different mentalities are at play currently in the crypto market. It seems one day it's about crypto hype as a whole, the next day it's traditional investment fundamentals, the next it's a guaranteed get rich scheme where you invest in an ICO, triple, sell, buy back low....   I too put some into the ICO (not huge, not painless though with price drop) but it seems DLT came right about the time of the shift from the 'guaranteed' ICO wins.... I'm not kidding there were like 2 or 3 months there where it seemed like you couldn't lose, and I remember it was all these wins on even random projects that made me go ""damn, Agrello sounds legit, and if dumb projects go 8x after launch this is a sure thing""  I still believe it's a long term good hold and NEVER sell anyway at lower than you pay...if you just hold, even if the project is doomed, there will invariably come a day where it has a massive surge as a death gurgle. With the millions in tokens, people aren't going to just watch their money burn. But if they go a year or so and see no more movement no more fundamentals, they'll pump another million or few into the project, seemingly out of nowhere. The noobs will see this and think their prayers have been answered, they'll start buying thinking the moon launch has finally come. Then the whale sells his originals now at some possibly small profit, and makes huge profits off the low-buys.  I'm a believer in Agrello, but I'm also keeping an eye on it's price, ready to act if I see a random (without any news from team) skyrocket in price.",False
194,msg24209151,https://bitcointalk.org/index.php?topic=1934422.0,,67660,Announcements (Altcoins),2017-11-08 03:02:50,Agrello,Full Member,190,100,,[ANN] AGRELLO - Legally-Binding Smart Contracts for all,Notice:  Agrello was not effected by the Parity multi-sig wallet problem.,False
195,msg24335250,https://bitcointalk.org/index.php?topic=1934422.0,,67660,Announcements (Altcoins),2017-11-10 08:34:23,MPE Project,Member,122,10,,[ANN] AGRELLO - Legally-Binding Smart Contracts for all,"Agrello listed on Binance (ill be glad if you register my reflink https://www.binance.com/?ref=10803076 ) but only @DLT/BNB(binance own token) now,anyway,price jumped almost double. Binance is big exchange,10 in top 10 at the moment,so good luck holders.   DLT/BNB trading pair is now available on Binance. You can start depositing and trading DLT now.  To celebrate DLT listing on Binance, we have committed a total of 40,000DLT to give away to our fans worldwide. The bounty will be split equally amongst 10 users, each receiving a total of 4,000DLT. Users will be ranked from 1st to 70th based on their total net purchase of DLT on Binance (calculated as total buys minus total sells) during the promotion period. The users ranked 1st, 2nd, 3rd, 10th, 20th, 30th, 40th, 50th, 60th, 70th place will each be selected as a winner.  Promotion period: 2017/11/10 8:00 AM (UTC) - 2017/11/17 0:00 AM (UTC)  DLT/BTC and DLT/ETH trading pairs are now available on Binance. also.",False
196,msg24336977,https://bitcointalk.org/index.php?topic=1934422.0,,67660,Announcements (Altcoins),2017-11-10 09:11:59,mutecoin,Newbie,17,0,,[ANN] AGRELLO - Legally-Binding Smart Contracts for all,https://twitter.com/CryptoExNews/status/928911171972935681  Damn. This Binance listing has caused the price to absolutely explode. I didn't know there was a demand for this.,False
197,msg24348041,https://bitcointalk.org/index.php?topic=1934422.0,,67660,Announcements (Altcoins),2017-11-10 12:58:35,yillusion,Full Member,280,122,,[ANN] AGRELLO - Legally-Binding Smart Contracts for all,"good luck to you guys who hold this coin for such a long time, and who know Biannce will list which coin next? so many coins online these days",False
198,msg24348109,https://bitcointalk.org/index.php?topic=1934422.0,,67660,Announcements (Altcoins),2017-11-10 13:00:08,Agrello,Full Member,190,100,,[ANN] AGRELLO - Legally-Binding Smart Contracts for all,"Agrello DLT listed on Binance: BNB, BTC, ETH pairs!     To really get things started off with a bang, Binance offers the following promotion:       Read full details here:  https://support.binance.com/hc/en-us/articles/115002686212   Thanks for your continued patience & support!  The Agrello team will continue making progress - stay tuned!    ",False
199,msg24475544,https://bitcointalk.org/index.php?topic=1934422.0,,67660,Announcements (Altcoins),2017-11-12 21:20:05,Agrello,Full Member,190,100,,[ANN] AGRELLO - Legally-Binding Smart Contracts for all,"Why Agrello makes for a compelling blockchain use case  Community Op-Ed takes an in-depth look at Agrello, and blockchain         Thanks Aneesh and Tonka!    ",False
200,msg24475852,https://bitcointalk.org/index.php?topic=1934422.0,,67660,Announcements (Altcoins),2017-11-12 21:27:59,erlnd,Newbie,25,0,,[ANN] AGRELLO - Legally-Binding Smart Contracts for all,Do you have a roadmap?,False
201,msg24514053,https://bitcointalk.org/index.php?topic=1934422.0,,67660,Announcements (Altcoins),2017-11-13 14:41:39,jcobra99,Newbie,88,0,,[ANN] AGRELLO - Legally-Binding Smart Contracts for all,roadmap? any updates?,False
202,msg24521562,https://bitcointalk.org/index.php?topic=1934422.0,,67660,Announcements (Altcoins),2017-11-13 17:02:16,Agrello,Full Member,190,100,,[ANN] AGRELLO - Legally-Binding Smart Contracts for all,The last roadmap can be seen here:  https://www.agrello.org/token   But it will be replaced after the new website opens this week.,False
203,msg22985581,https://bitcointalk.org/index.php?topic=1934422.0,,67660,Announcements (Altcoins),2017-10-14 04:32:00,LegendX,Member,248,10,,[ANN] AGRELLO - Legally-Binding Smart Contracts for all,"How is agrello being competitor to CIVIC? I thought he said they are partnering with a digital identity startup? I was thinking ""maybe"" or he could be referring to CiVIC as partner?",False
204,msg22991358,https://bitcointalk.org/index.php?topic=1934422.0,msg22985581,67660,Announcements (Altcoins),2017-10-14 08:11:32,Altzzzzz,Newbie,6,0,,[ANN] AGRELLO - Legally-Binding Smart Contracts for all,"   Not a direct competitor, or I did not think so. I think they do have a digital id however.",False
205,msg22996543,https://bitcointalk.org/index.php?topic=1934422.0,,67660,Announcements (Altcoins),2017-10-14 10:41:14,minkhu,Newbie,5,0,,[ANN] AGRELLO - Legally-Binding Smart Contracts for all,"I was curious about Agrello and went to Ether Delta today, thinking of investing a little in it. Saw many sold for 0.00043 ETH, many sell orders for 0.0005-0.0006, but there someone still bought huge amount of DLT token for 0.0007. I tracked those transactions and found that those address were all funded from a mother address 0xB01cb49fe0D6D6E47EDf3A072d15dfe73155331C. Something like someone inside the company tried to push the price.  For me this is a sign of untruthful business. I'll pass.  https://imgur.com/a/arOK2",False
206,msg22999525,https://bitcointalk.org/index.php?topic=1934422.0,msg22996543,67660,Announcements (Altcoins),2017-10-14 12:11:33,Agrello,Full Member,190,100,,[ANN] AGRELLO - Legally-Binding Smart Contracts for all,"     Many of our users were able to withdraw from the mother address directly to the exchange. We have 0 influence on the token price. If we would want to manipulate it, believe me, we wouldn't let it be so low. And with the low volume it has, it wouldn't require much from us to take it back to Tokensale levels.  Also please check the weekly update a few posts above, the team is more focused on developing the product than about the token price.  Hope this answers your concerns.  Kind regards. Agrello team.  PS: I also noted that this is your first message in the forum so I would assume you are quite new in the crypto world and that's why you are missing some technical details. Feel free to contact me and I can respond any of your concerns.",False
207,msg23085906,https://bitcointalk.org/index.php?topic=1934422.0,msg23032710,67660,Announcements (Altcoins),2017-10-16 12:35:02,Agrello,Full Member,190,100,,[ANN] AGRELLO - Legally-Binding Smart Contracts for all,   Awesome news!,False
208,msg23117387,https://bitcointalk.org/index.php?topic=1934422.0,,67660,Announcements (Altcoins),2017-10-17 03:47:09,Somz1,Full Member,420,102,,[ANN] AGRELLO - Legally-Binding Smart Contracts for all,"Finally sold off this sorry excuse of a token. Pump and dump is the only thing that is happening with this token, while the price falls off each time too. Never looking back, and if these guys actually become serious and do something then good luck to them and others willing to put up with them",False
209,msg23135244,https://bitcointalk.org/index.php?topic=1934422.0,msg23117387,67660,Announcements (Altcoins),2017-10-17 12:04:52,Agrello,Full Member,190,100,,[ANN] AGRELLO - Legally-Binding Smart Contracts for all,"   Sad to see you go just before the party starts. With all the good stuff that's happening looks like you have missed the last announcements and updates, but good luck to you too anyway.",False
210,msg23176331,https://bitcointalk.org/index.php?topic=1934422.0,msg23135244,67660,Announcements (Altcoins),2017-10-18 09:09:26,apesconcert,Member,83,10,,[ANN] AGRELLO - Legally-Binding Smart Contracts for all,"   If you want to be taken seriously, you should stop those kind of childish comments. Just focus on posting useful updates on here and stop wasting time with these sort of snide remarks. Can't believe I have to give you a lesson in community management.",False
211,msg23181809,https://bitcointalk.org/index.php?topic=1934422.0,msg23176331,67660,Announcements (Altcoins),2017-10-18 11:23:32,Agrello,Full Member,190,100,,[ANN] AGRELLO - Legally-Binding Smart Contracts for all,"   Hi! Updates are being posted every week on Fridays, as it was suggested by our community members. Replying to a comment takes about 15 seconds. Is not a waste of time saying good bye to a former user  Thaks for the lesson!  Regards.",False
212,msg23189663,https://bitcointalk.org/index.php?topic=1934422.0,msg23181809,67660,Announcements (Altcoins),2017-10-18 14:09:48,allahabadi,Full Member,504,126,,[ANN] AGRELLO - Legally-Binding Smart Contracts for all,"    Keep replying and keep posting comments... I'm an investor and sincerely believe that if you had to run, you'd already have. Hope you get me good returns... I'm in for the long haul...",False
213,msg23241146,https://bitcointalk.org/index.php?topic=1934422.0,msg23189663,67660,Announcements (Altcoins),2017-10-19 15:22:00,Agrello,Full Member,190,100,,[ANN] AGRELLO - Legally-Binding Smart Contracts for all,   Thank you! We are here for the long haul too!,False
214,msg23282132,https://bitcointalk.org/index.php?topic=1934422.0,,67660,Announcements (Altcoins),2017-10-20 14:29:16,Agrello,Full Member,190,100,,[ANN] AGRELLO - Legally-Binding Smart Contracts for all,Agrello AMA      https://www.reddit.com/r/Agrello/comments/77llga/agrello_ama_is_live/,False
215,msg23293614,https://bitcointalk.org/index.php?topic=1934422.0,,67660,Announcements (Altcoins),2017-10-20 21:58:04,Agrello,Full Member,190,100,,[ANN] AGRELLO - Legally-Binding Smart Contracts for all,"Agrello Weekly Update - October 20, 2017   ",False
216,msg23459331,https://bitcointalk.org/index.php?topic=1934422.0,,67660,Announcements (Altcoins),2017-10-24 12:19:00,Hazara,Member,115,11,,[ANN] AGRELLO - Legally-Binding Smart Contracts for all,"mmm i think i have found a lil gem here, and i want to invest for long term, but i dunno how long it ll keep falling, its better for me to see the weak hands shake and the  price fall a lil bit more, so i buy it in deep cus this investment pays good after 1 year if the devlopments go by the roadmap. i must invest the sum i can miss for a year but as much as possible",False
217,msg23459405,https://bitcointalk.org/index.php?topic=1934422.0,,67660,Announcements (Altcoins),2017-10-24 12:20:37,The Crypto Peasant,Full Member,266,103,,[ANN] AGRELLO - Legally-Binding Smart Contracts for all,Purchased at ICO and have been holding and accumulating more. Really hoping this project gains legs soon.  How is it all coming along?,False
218,msg23466465,https://bitcointalk.org/index.php?topic=1934422.0,msg23459405,67660,Announcements (Altcoins),2017-10-24 14:46:52,z0n0,Legendary,1274,1006,,[ANN] AGRELLO - Legally-Binding Smart Contracts for all,"   Same as you, got in at ICO and (still) stucked here. Waiting for better days. ",False
219,msg23470137,https://bitcointalk.org/index.php?topic=1934422.0,,67660,Announcements (Altcoins),2017-10-24 16:01:19,Agrello,Full Member,190,100,,[ANN] AGRELLO - Legally-Binding Smart Contracts for all,Blockchain LegalTech startup Agrello partners with online-id verifier Veriff         Read more > https://www.cryptoninjas.net/2017/10/24/blockchain-legaltech-startup-agrello-partners-online-id-verifier-veriff/,False
