id,msg_id,parent_id,link_id,Count_read,Forum,Time,Author,Rank,Activity,Merit,Trust,Title,Body,ScamHeader
321,msg21837118,https://bitcointalk.org/index.php?topic=1934422.0,msg21701027,67660,Announcements (Altcoins),2017-09-14 17:03:45,irikefee,Newbie,39,0,,[ANN] AGRELLO - Legally-Binding Smart Contracts for all,  That's really a lucky strike!! Go and light some candles in your church...,False
322,msg21841260,https://bitcointalk.org/index.php?topic=1934422.0,msg21820238,67660,Announcements (Altcoins),2017-09-14 19:20:05,statdude,Legendary,1498,1000,,[ANN] AGRELLO - Legally-Binding Smart Contracts for all,"   Agrello is the first coin I've seen that means to make real the ""smart contract"" use case in a way that is forward-facing and usable by regular folks - not just embedded in systems. You've got to at least roll the dice on it. Otherwise ETH is basically a ponzi/ICO machine without something like this.",False
323,msg21558979,https://bitcointalk.org/index.php?topic=1934422.0,msg21558254,67660,Announcements (Altcoins),2017-09-06 07:21:17,hybrid_x,Newbie,30,0,,[ANN] AGRELLO - Legally-Binding Smart Contracts for all,"    Mine too - which in my case i think is a good thing as i didn't create the ""new custom token"" in MEW before I did the withdrawl.  On their blog it says they are doing sending confirmations manually.....so slow.",False
324,msg21559438,https://bitcointalk.org/index.php?topic=1934422.0,,67660,Announcements (Altcoins),2017-09-06 07:38:56,depassage298,Newbie,49,0,,[ANN] AGRELLO - Legally-Binding Smart Contracts for all,Will it be listed on the exchange anytime soon?,False
325,msg21561019,https://bitcointalk.org/index.php?topic=1934422.0,,67660,Announcements (Altcoins),2017-09-06 08:42:13,z0n0,Legendary,1274,1006,,[ANN] AGRELLO - Legally-Binding Smart Contracts for all,The tokens SHOULD be in your wallets by tonight!,False
326,msg21571073,https://bitcointalk.org/index.php?topic=1934422.0,,67660,Announcements (Altcoins),2017-09-06 14:18:37,migello,Sr. Member,460,250,,[ANN] AGRELLO - Legally-Binding Smart Contracts for all,better to follow bittrex NDA,False
327,msg21573040,https://bitcointalk.org/index.php?topic=1934422.0,,67660,Announcements (Altcoins),2017-09-06 15:22:05,Jayjay04,Legendary,1379,1000,,[ANN] AGRELLO - Legally-Binding Smart Contracts for all,"Being added to bittrex can be a long process, be patient",False
328,msg21576628,https://bitcointalk.org/index.php?topic=1934422.0,,67660,Announcements (Altcoins),2017-09-06 17:17:35,depassage298,Newbie,49,0,,[ANN] AGRELLO - Legally-Binding Smart Contracts for all,I'm wondering why they waited until now to apply in bittrex?,False
329,msg21585848,https://bitcointalk.org/index.php?topic=1934422.0,,67660,Announcements (Altcoins),2017-09-07 00:25:59,self1sch,Full Member,219,100,,[ANN] AGRELLO - Legally-Binding Smart Contracts for all,"After 2 days, still no tokens in my MEW. Site says pending for over 48 hours now. Dev pls PM me",False
330,msg21585938,https://bitcointalk.org/index.php?topic=1934422.0,msg21571073,67660,Announcements (Altcoins),2017-09-07 00:33:28,sebastianpenguen,Sr. Member,308,250,,[ANN] AGRELLO - Legally-Binding Smart Contracts for all,"       This doesn't mean Bittex is coming since they're not adding new tokens into their markets. Check greater projects such as Stox, Monetha, District, Aventus and so. They wasn't added to Bittrex and this is the same for Agreallo as well.  Saying ""we sent the documents to Bittrex"" doesn't mean Bittrex will list this token! ",False
331,msg21593687,https://bitcointalk.org/index.php?topic=1934422.0,,67660,Announcements (Altcoins),2017-09-07 07:44:39,fedmahnkassad,Hero Member,812,500,,[ANN] AGRELLO - Legally-Binding Smart Contracts for all,"Agrello team, would be good if you update your twitter account as well. Last update you provided there was on the 3rd and there is a lot of hate there by people who do not check this forum and probably also provided an e-mail address that is not their main.",False
332,msg21600216,https://bitcointalk.org/index.php?topic=1934422.0,msg21593687,67660,Announcements (Altcoins),2017-09-07 11:55:27,PeterPalmBeach,Sr. Member,336,250,,[ANN] AGRELLO - Legally-Binding Smart Contracts for all,   True to that. I understand they are busy with chain and withdraws but one small post does not take that long.,False
333,msg21604847,https://bitcointalk.org/index.php?topic=1934422.0,,67660,Announcements (Altcoins),2017-09-07 14:18:27,Daytradah,Newbie,6,0,,[ANN] AGRELLO - Legally-Binding Smart Contracts for all,My withdrawal is confirmed on the Agrello site. But the balance of DLT is 0 in My Ether Wallet.. ?? ,False
334,msg21615292,https://bitcointalk.org/index.php?topic=1934422.0,msg21604847,67660,Announcements (Altcoins),2017-09-07 20:26:11,z0n0,Legendary,1274,1006,,[ANN] AGRELLO - Legally-Binding Smart Contracts for all,   Same with me. I contacted the team but still no answer.,False
335,msg21649665,https://bitcointalk.org/index.php?topic=1934422.0,,67660,Announcements (Altcoins),2017-09-08 22:04:08,PeterPalmBeach,Sr. Member,336,250,,[ANN] AGRELLO - Legally-Binding Smart Contracts for all,"Waiting was a bitch but I finally got my precious deltas, ",False
336,msg21658927,https://bitcointalk.org/index.php?topic=1934422.0,,67660,Announcements (Altcoins),2017-09-09 07:52:07,hybrid_x,Newbie,30,0,,[ANN] AGRELLO - Legally-Binding Smart Contracts for all,mine landed too......price not yet shown in MEW tho.,False
337,msg21677122,https://bitcointalk.org/index.php?topic=1934422.0,,67660,Announcements (Altcoins),2017-09-09 21:12:15,Agrello,Full Member,190,100,,[ANN] AGRELLO - Legally-Binding Smart Contracts for all,"Thank you for your patience, and sorry again for the extra days waiting to get your DLT tokens!  Most have been distributed, and the last ones will be appearing in those addresses soon.   Wallet Info:  [""add custom token""]  Address: 0x07e3c70653548b04f0a75970c1f81b4cbbfb606f Symbol: DLT Decimal: 18   We'll have a formal post soon with complete details.",False
338,msg21680134,https://bitcointalk.org/index.php?topic=1934422.0,,67660,Announcements (Altcoins),2017-09-10 00:26:53,Mt_Traditional,Member,73,10,,[ANN] AGRELLO - Legally-Binding Smart Contracts for all,"Hi Everyone, https://etherdelta.github.io/ has this coin. Go now and fill your bags.    Dev, When will this coin be added to Bittrex?                                    ",False
339,msg21684215,https://bitcointalk.org/index.php?topic=1934422.0,,67660,Announcements (Altcoins),2017-09-10 05:49:04,hybrid_x,Newbie,30,0,,[ANN] AGRELLO - Legally-Binding Smart Contracts for all,Some Whales pushed the price down and picked up cheap DELTA......price has now returned to where it was. https://www.reddit.com/r/Aventus/comments/6yrl30/do_not_be_worried_about_avt_on_etherdelta/   When is this on bittrex?  ,False
340,msg21686204,https://bitcointalk.org/index.php?topic=1934422.0,msg21684215,67660,Announcements (Altcoins),2017-09-10 07:45:41,JuanMD,Full Member,220,100,,[ANN] AGRELLO - Legally-Binding Smart Contracts for all,"   Hi, we are talking with exchanges, but they asked us not to announce anything until they give us their Ok. We will let you know when is ready",False
341,msg21686541,https://bitcointalk.org/index.php?topic=1934422.0,,67660,Announcements (Altcoins),2017-09-10 08:00:56,fedmahnkassad,Hero Member,812,500,,[ANN] AGRELLO - Legally-Binding Smart Contracts for all,Finally got my Deltas to MEW. Thanks team. Planning to hold this for quite a while. One of very few ICOs that has a very meaningful use case and respectable team.,False
342,msg21691403,https://bitcointalk.org/index.php?topic=1934422.0,,67660,Announcements (Altcoins),2017-09-10 11:40:27,Somz1,Full Member,420,102,,[ANN] AGRELLO - Legally-Binding Smart Contracts for all,This will be heading to the moon just a matter of time,False
343,msg21388133,https://bitcointalk.org/index.php?topic=1934422.0,msg21364388,67660,Announcements (Altcoins),2017-08-31 18:12:54,PeterPalmBeach,Sr. Member,336,250,,[ANN] AGRELLO - Legally-Binding Smart Contracts for all,    Nothing official yet. Count and withdraw date expected on or before Sept 2nd,False
344,msg21405219,https://bitcointalk.org/index.php?topic=1934422.0,,67660,Announcements (Altcoins),2017-09-01 09:21:44,Daytradah,Newbie,6,0,,[ANN] AGRELLO - Legally-Binding Smart Contracts for all,"Hello guys,  Which exchange is listing Delta? (other than jubi)  Thanks.",False
345,msg21414125,https://bitcointalk.org/index.php?topic=1934422.0,msg21405219,67660,Announcements (Altcoins),2017-09-01 14:51:57,PeterPalmBeach,Sr. Member,336,250,,[ANN] AGRELLO - Legally-Binding Smart Contracts for all,"    Well, it's listed on HitBTC as IOU so I assume they will open to regular trades as well. Hopefully will be cheaper than ICO. I need to buy some more. I'm angry at myself for not getting more.",False
346,msg21441556,https://bitcointalk.org/index.php?topic=1934422.0,msg21414125,67660,Announcements (Altcoins),2017-09-02 14:18:44,Daytradah,Newbie,6,0,,[ANN] AGRELLO - Legally-Binding Smart Contracts for all,"   Well, let's hope it won't be cheaper than ICO! Hope the withdrawal / exchange is available soon.",False
347,msg21470459,https://bitcointalk.org/index.php?topic=1934422.0,,67660,Announcements (Altcoins),2017-09-03 14:14:40,Agrello,Full Member,190,100,,[ANN] AGRELLO - Legally-Binding Smart Contracts for all,"How to Withdraw Your Delta  https://blog.agrello.org/how-to-withdraw-your-delta-c796770b5584   Please check out the blog post for the latest updates.  Withdrawals will be starting on Monday, Sept 4th.   Thank you!   ",False
348,msg21474237,https://bitcointalk.org/index.php?topic=1934422.0,,67660,Announcements (Altcoins),2017-09-03 16:27:47,Agrello,Full Member,190,100,,[ANN] AGRELLO - Legally-Binding Smart Contracts for all,"Dear Agrello community:  Due to last minute technical issues, the manual audit of all sale balances took longer than expected. In order to make room for further double and triple checks, and to ensure that technical assistance will be available to you while withdrawing Delta, we decided to postpone withdrawal activation until tomorrow, Monday Sept 4.  We sincerely apologize for the delay, and thank you for bearing with us. [/b]",False
349,msg21486587,https://bitcointalk.org/index.php?topic=1934422.0,,67660,Announcements (Altcoins),2017-09-04 03:09:43,MsCollec,Legendary,1400,1000,,[ANN] AGRELLO - Legally-Binding Smart Contracts for all,Hopefully everything will be ready for launch on Monday. Good luck,False
350,msg21504084,https://bitcointalk.org/index.php?topic=1934422.0,,67660,Announcements (Altcoins),2017-09-04 14:26:42,fedmahnkassad,Hero Member,812,500,,[ANN] AGRELLO - Legally-Binding Smart Contracts for all,Any news? I am still unable to withdraw. It would be perfect to launch now in all this mess so we can buy some blood from impatient dumpers. Has the team perhaps decided no to  enable withdrawals still today or there is still hope?,False
351,msg21505129,https://bitcointalk.org/index.php?topic=1934422.0,,67660,Announcements (Altcoins),2017-09-04 15:01:41,ensjovis,Member,81,10,,[ANN] AGRELLO - Legally-Binding Smart Contracts for all,"come on release the tokens goddamit  unfortunately they will noot deliver anything, otherwise they would have made a good ico platform  incompetent devs",False
352,msg21508306,https://bitcointalk.org/index.php?topic=1934422.0,msg21505129,67660,Announcements (Altcoins),2017-09-04 16:54:58,PeterPalmBeach,Sr. Member,336,250,,[ANN] AGRELLO - Legally-Binding Smart Contracts for all,"   mj [12:30 PM] They are issuing the contract now.  It will take more than an hour, so just stand by for that info.",False
353,msg21509467,https://bitcointalk.org/index.php?topic=1934422.0,msg21508306,67660,Announcements (Altcoins),2017-09-04 17:38:40,Daytradah,Newbie,6,0,,[ANN] AGRELLO - Legally-Binding Smart Contracts for all,   Any idea when Delta will be listed on any exchanges?,False
354,msg21516348,https://bitcointalk.org/index.php?topic=1934422.0,,67660,Announcements (Altcoins),2017-09-04 22:22:03,stellan0r,Hero Member,574,500,,[ANN] AGRELLO - Legally-Binding Smart Contracts for all,Does anyone know the token address for watching Delta in Mist?,False
355,msg21521780,https://bitcointalk.org/index.php?topic=1934422.0,msg21470459,67660,Announcements (Altcoins),2017-09-05 04:10:33,stefanoste,Full Member,159,100,,[ANN] AGRELLO - Legally-Binding Smart Contracts for all,my delta has  been reduce the last day of the audit .. ..how many delta for every eth on the first day Can you tell  please!!     ,False
356,msg21532425,https://bitcointalk.org/index.php?topic=1934422.0,,67660,Announcements (Altcoins),2017-09-05 11:34:44,self1sch,Full Member,219,100,,[ANN] AGRELLO - Legally-Binding Smart Contracts for all,Does anyone know what to put into MEW to see the tokens?,False
357,msg21533267,https://bitcointalk.org/index.php?topic=1934422.0,,67660,Announcements (Altcoins),2017-09-05 12:04:12,jollyjoker23,Newbie,1,0,,[ANN] AGRELLO - Legally-Binding Smart Contracts for all,"Since the tokens were not made available for withdraw yesterday as announced, there really should be a new announcement with more information asap.",False
358,msg21542325,https://bitcointalk.org/index.php?topic=1934422.0,,67660,Announcements (Altcoins),2017-09-05 17:08:05,Lena_Storifier,Member,88,10,,[ANN] AGRELLO - Legally-Binding Smart Contracts for all,I love the idea. Let's see how well it will be executed.  Please let me know if I missed something in the summary of Agrello business model: https://medium.com/@StorifierCo/what-is-agrello-84290a544c99,False
359,msg21546473,https://bitcointalk.org/index.php?topic=1934422.0,msg21533267,67660,Announcements (Altcoins),2017-09-05 19:50:18,PeterPalmBeach,Sr. Member,336,250,,[ANN] AGRELLO - Legally-Binding Smart Contracts for all,"    hando [2:07 PM] @channel Dear Agrello community, After an eventful few days, we can finally announce that Delta (DLT) is now live. We sincerely apologize for all of the delays. We invested considerable efforts to make you as safe as possible. Past attacks on various projects in the space demanded that we exercise several security measures, which unfortunately took more time than expected.   You can find the DLT smart contract here: https://etherscan.io/address/0x07e3c70653548b04f0a75970c1f81b4cbbfb606f#readContract  To add DLT  to your wallet, please insert the following info under add ""custom token"":  Address: 0x07e3c70653548b04f0a75970c1f81b4cbbfb606f Symbol: DLT Decimal: 18  A complete guide can be found here https://blog.agrello.org/how-to-withdraw-your-delta-c796770b5584  Those who have already posted their withdrawals, should see them as completed by the evening of Tomorrow, CET timezone. etherscan.io Ethereum Account 0x07e3c70653548b04f0a75970c1f81b4cbbfb606f Info The Ethereum BlockChain Explorer, API and Analytics Platform  Agrello How to Withdraw Your Delta – Agrello As from today you can withdraw Delta from the Agrello token sale platform.",False
360,msg21547147,https://bitcointalk.org/index.php?topic=1934422.0,,67660,Announcements (Altcoins),2017-09-05 20:22:17,HarryHaller,Newbie,3,0,,[ANN] AGRELLO - Legally-Binding Smart Contracts for all,"I just received the email: ""You can now withdraw your Delta.""  But I still can not login! ""These credentials do not match our records.""  You did not reply to my mail from 17th July! -> Subject was: My payment (token sale)  You did not reply to my mail from 18th August! -> Subject was: Login not working  I bought 400 Delta tokens!  --------------------------------------------------- EDIT 9th September: The problems with my broken account seems to be solved. I have removed the copy of my e-mail here, because I have received an answer in the meantime. The team has a lot to do at the moment. They replied kindly and fixed the problem. Today I could log in and withdrawal my tokens (still pendig, but it should be confirmed in the next minutes / hours I think). Thank you. I wish you all the best with the project. ---------------------------------------------------",False
361,msg21550556,https://bitcointalk.org/index.php?topic=1934422.0,,67660,Announcements (Altcoins),2017-09-05 23:32:53,hybrid_x,Newbie,30,0,,[ANN] AGRELLO - Legally-Binding Smart Contracts for all,"I moved my DELTA to my MEW...  ...10 hours later I saw they had not arrived, so I looked about and realised I hadn't created ""the custom token"" DLT in MEW.    So I've now just done this.  Will this be a problem for me, will my DELTA still arrive?    Surely when withdrawing the DELTA it should say ""Make sure the custom token is created"" - and not be mentioned hidden away in some random blog post elsewhere.",False
362,msg21558254,https://bitcointalk.org/index.php?topic=1934422.0,,67660,Announcements (Altcoins),2017-09-06 06:52:04,self1sch,Full Member,219,100,,[ANN] AGRELLO - Legally-Binding Smart Contracts for all,"I withdrew my delta over 30 hours ago, and it's still marked as pending on the website ",False
363,msg20971077,https://bitcointalk.org/index.php?topic=1934422.0,msg20953637,67660,Announcements (Altcoins),2017-08-17 23:13:51,yuettse,Newbie,18,0,,[ANN] AGRELLO - Legally-Binding Smart Contracts for all,   its on HitBtc now. You can see it in your wallet,False
364,msg20971720,https://bitcointalk.org/index.php?topic=1934422.0,msg20971077,67660,Announcements (Altcoins),2017-08-17 23:58:34,PeterPalmBeach,Sr. Member,336,250,,[ANN] AGRELLO - Legally-Binding Smart Contracts for all,     Where all those Deltas come from if the ICO just ended ?,False
365,msg20971895,https://bitcointalk.org/index.php?topic=1934422.0,msg20971720,67660,Announcements (Altcoins),2017-08-18 00:12:01,yuettse,Newbie,18,0,,[ANN] AGRELLO - Legally-Binding Smart Contracts for all,   You can withdraw Deltas to Eth wallet before the ICO ended.,False
366,msg20973384,https://bitcointalk.org/index.php?topic=1934422.0,msg20971077,67660,Announcements (Altcoins),2017-08-18 01:57:47,Agrello,Full Member,190,100,,[ANN] AGRELLO - Legally-Binding Smart Contracts for all,"    DLT tokens absolutely are not on ""hitbtc"", they do not even exist yet!  Those are paper promise-bets from that exchange.  As stated above, you will be able to withdraw DLT from your sale wallet after the audit is complete.  Please don't spread misinformation or FUD here!",False
367,msg20984095,https://bitcointalk.org/index.php?topic=1934422.0,,67660,Announcements (Altcoins),2017-08-18 12:50:39,fedmahnkassad,Hero Member,812,500,,[ANN] AGRELLO - Legally-Binding Smart Contracts for all,I am looking forward to withdrawing my deltas. One of very few project that I consider a relatively long term investment. Good luck with the project!,False
368,msg20986528,https://bitcointalk.org/index.php?topic=1934422.0,,67660,Announcements (Altcoins),2017-08-18 14:17:34,ActAshton,Jr. Member,173,2,,[ANN] AGRELLO - Legally-Binding Smart Contracts for all,"Now that the token sale is over, check out the most recent blog post to find out what's next and what to do!  https://blog.agrello.org/the-agrello-sale-has-ended-here-are-some-notes-on-whats-next-a22bddde5c91",False
369,msg21048913,https://bitcointalk.org/index.php?topic=1934422.0,msg20984095,67660,Announcements (Altcoins),2017-08-20 19:24:14,CryptoHopeful,Newbie,35,0,,[ANN] AGRELLO - Legally-Binding Smart Contracts for all,"   Same here. This Legal Tech breakthrough is going to be awesome. I believe DLT is one of those altcoin you can store, forget for a year or two (2019 is going to be amazing on roadmap) and come back cash out and buy yourself a lambo. lol",False
370,msg21059095,https://bitcointalk.org/index.php?topic=1934422.0,,67660,Announcements (Altcoins),2017-08-21 06:00:23,Lena_Storifier,Member,88,10,,[ANN] AGRELLO - Legally-Binding Smart Contracts for all,"I like what Agrello is creating. For those of you who didn't have chance to dig deep into the whitepaper, here is a small visual overview of Agrello business model: https://medium.com/@StorifierCo/what-is-agrello-84290a544c99  Please let me know what you think!",False
371,msg21061148,https://bitcointalk.org/index.php?topic=1934422.0,,67660,Announcements (Altcoins),2017-08-21 07:54:36,depassage298,Newbie,49,0,,[ANN] AGRELLO - Legally-Binding Smart Contracts for all,So any expected date to be released on exchange?,False
372,msg21075191,https://bitcointalk.org/index.php?topic=1934422.0,,67660,Announcements (Altcoins),2017-08-21 17:16:18,The Crypto Baron,Sr. Member,294,250,,[ANN] AGRELLO - Legally-Binding Smart Contracts for all,Agrello discussed and recommended in Crypto Times ep 19: Code is Law  https://youtu.be/ikIFLGV92tQ,False
373,msg21118294,https://bitcointalk.org/index.php?topic=1934422.0,msg20971895,67660,Announcements (Altcoins),2017-08-23 02:09:59,Flex2222,Member,80,10,,[ANN] AGRELLO - Legally-Binding Smart Contracts for all,   i did not do that yet where are my tokens then are they converted into ether? i dont get it? do i need my ether wallet or sth? how can they be stored on a exodus ether adress for example? thx for reply,False
374,msg21134945,https://bitcointalk.org/index.php?topic=1934422.0,msg21118294,67660,Announcements (Altcoins),2017-08-23 15:07:40,migello,Sr. Member,460,250,,[ANN] AGRELLO - Legally-Binding Smart Contracts for all,      delta tokens do not exist yet...  wait for the audit to finish and then delta tokens will be issued and distributed.  when is the time of distribution just login to your agrello token page and insert the ethereum address you want the token sent to.,False
375,msg21140670,https://bitcointalk.org/index.php?topic=1934422.0,msg21134945,67660,Announcements (Altcoins),2017-08-23 18:51:59,Agrello,Full Member,190,100,,[ANN] AGRELLO - Legally-Binding Smart Contracts for all,"    ^ That.  The audit is going smoothly, and should be finishing up this week!  Look for more announcements in the coming weeks.",False
376,msg21183034,https://bitcointalk.org/index.php?topic=1934422.0,msg21140670,67660,Announcements (Altcoins),2017-08-25 06:36:38,CryptoHopeful,Newbie,35,0,,[ANN] AGRELLO - Legally-Binding Smart Contracts for all,        Looking forward to those announcementS!!! Hopefully an English exchange?,False
377,msg21199729,https://bitcointalk.org/index.php?topic=1934422.0,msg21183034,67660,Announcements (Altcoins),2017-08-25 17:38:15,SmartBillions,Newbie,10,0,,[ANN] AGRELLO - Legally-Binding Smart Contracts for all,"   Wasn't it supposed to stick only to Jubi, at the beggining? Even tho IOU is already on HitBTC.",False
378,msg21285170,https://bitcointalk.org/index.php?topic=1934422.0,msg21140670,67660,Announcements (Altcoins),2017-08-28 15:39:59,Orias67,Sr. Member,462,252,,[ANN] AGRELLO - Legally-Binding Smart Contracts for all,        Thanks for keeping us informed about what is happening. Do you already know when (approximately) we can trade this token ? I would like to buy a bit more if possible,False
379,msg21296620,https://bitcointalk.org/index.php?topic=1934422.0,msg21134945,67660,Announcements (Altcoins),2017-08-29 01:33:21,Flex2222,Member,80,10,,[ANN] AGRELLO - Legally-Binding Smart Contracts for all,"   i feel a little bit stupid to ask theese questions because it seems to be obvious to everyone else, but what will happen to my deltas when i send them to an ether wallet?( i assume it has to be a wallet specifically for etherum and no exodus or exchange ether adress). Because i only use exodus to store my ether, but if i send it for example to my exodus account i guess they wouldnt be visible for me and i wouldnt know how i could have acces to them at all.",False
380,msg21303739,https://bitcointalk.org/index.php?topic=1934422.0,msg21296620,67660,Announcements (Altcoins),2017-08-29 08:05:16,Daytradah,Newbie,6,0,,[ANN] AGRELLO - Legally-Binding Smart Contracts for all,    I would like to ask kind of the same question. Can I withraw my Delta directly to my HitBTC wallet? Or do I need to use a ether wallet?,False
381,msg21330188,https://bitcointalk.org/index.php?topic=1934422.0,msg21303739,67660,Announcements (Altcoins),2017-08-30 01:52:05,DominicanCrypto,Newbie,16,0,,[ANN] AGRELLO - Legally-Binding Smart Contracts for all,   Just make sure that your wallet support ERC20 tokens. But the safest is create a wallet in https://www.myetherwallet.com/ then get new brand new ETH Wallet address to claim your Deltas. By the way that is my favorite ethereum's tokens wallet.  WARNING! DO NOT SEND ERC20 TOKENS (Delta in this case) TO A WALLET THAT DOES NOT SUPPORT THEM!!!  I am not sure if that was the answer you were looking for but I did with the best intention.,False
382,msg21364388,https://bitcointalk.org/index.php?topic=1934422.0,,67660,Announcements (Altcoins),2017-08-31 02:26:04,wankle,Newbie,57,0,,[ANN] AGRELLO - Legally-Binding Smart Contracts for all,Anyone know how many Delta were sold and if theyre burning the rest?,False
383,msg20868390,https://bitcointalk.org/index.php?topic=1934422.0,msg20864280,67660,Announcements (Altcoins),2017-08-14 14:02:52,JuanMD,Full Member,220,100,,[ANN] AGRELLO - Legally-Binding Smart Contracts for all,   The maximum supply will be 160 mill.,False
384,msg20877320,https://bitcointalk.org/index.php?topic=1934422.0,,67660,Announcements (Altcoins),2017-08-14 20:13:22,maxsinner,Sr. Member,336,250,,[ANN] AGRELLO - Legally-Binding Smart Contracts for all,I really like it how one of the best projects is flying under the radar. Team is rock solid and Estonia is a paradise for innovation. I am adding this to my long term bag.,False
385,msg20891782,https://bitcointalk.org/index.php?topic=1934422.0,msg20877320,67660,Announcements (Altcoins),2017-08-15 10:22:32,JuanMD,Full Member,220,100,,[ANN] AGRELLO - Legally-Binding Smart Contracts for all,"   Great to hear that! Agrello might be a low profile project but it has a lot of potential, specially with all the knowledge that it has behind! Everything is to be built!",False
