id,msg_id,parent_id,link_id,Count_read,Forum,Time,Author,Rank,Activity,Merit,Trust,Title,Body,ScamHeader
1,msg50977540,https://bitcointalk.org/index.php?topic=1934422.0,,67660,Announcements (Altcoins),2019-05-10 07:48:23,BtcMan2009,Sr. Member,910,326,,[ANN] AGRELLO - Legally-Binding Smart Contracts for all,"The token dlt forms the bottom well and it is correct. While many on the forum are empty talk(water), at this point smart sit quietly and do their thing.  ",False
2,msg51180719,https://bitcointalk.org/index.php?topic=1934422.0,,67660,Announcements (Altcoins),2019-05-23 09:25:07,soulgate,Legendary,1036,1050,,[ANN] AGRELLO - Legally-Binding Smart Contracts for all,"Hi,  I see that  Agrello ID app and contracts website works fine.  But how are used DLT tokens? I need to pay with DLT when I send contract?  Or their use case  to buy Business Packages?",False
3,msg46745288,https://bitcointalk.org/index.php?topic=1934422.0,msg46187850,67660,Announcements (Altcoins),2018-10-11 04:41:51,Phelpsfarm,Newbie,20,0,,[ANN] AGRELLO - Legally-Binding Smart Contracts for all,"   Quite obviously an exit pump. That said, Agrello is starting to look fairly attractive at $5 mil cap.",False
4,msg48004621,https://bitcointalk.org/index.php?topic=1934422.0,,67660,Announcements (Altcoins),2018-11-18 07:31:18,Superfly83,Newbie,28,0,,[ANN] AGRELLO - Legally-Binding Smart Contracts for all,Is this project still working?,False
5,msg48004765,https://bitcointalk.org/index.php?topic=1934422.0,,67660,Announcements (Altcoins),2018-11-18 07:37:05,blockchain-man,Full Member,532,100,,[ANN] AGRELLO - Legally-Binding Smart Contracts for all,"AGRELLO is a platform that provides intelligent contracts that ensure legal issues for participants. Sure, users will choose AGRELLO to limit the cost to the actual legal issue. I still wonder when the dispute occurred, AGRELLO can resolve the point? What is participation fee? What are the incentives for traditional customers?",False
6,msg48367486,https://bitcointalk.org/index.php?topic=1934422.0,,67660,Announcements (Altcoins),2018-12-01 10:38:52,Kirilp,Full Member,504,103,,[ANN] AGRELLO - Legally-Binding Smart Contracts for all,"Elliptic Keys in Agrello ID  In this update, as the elliptic keys version is being gradually rolled out to users, we wanted to elaborate on how elliptic keys contribute to the security and usability of Agrello Digital Identity. You wanted an effective and secure solution for managing and recovering digital keys and wallets in case of losing access to your mobile device. Our solution based on elliptic keys provides these capabilities, whilst reducing any possible exposure of private keys and working natively with public blockchains.  https://blog.agrello.org/elliptic-keys-in-agrello-id-c032ff2882e2",False
7,msg49234290,https://bitcointalk.org/index.php?topic=1934422.0,,67660,Announcements (Altcoins),2019-01-14 20:56:15,Ronbo710,Newbie,12,0,,[ANN] AGRELLO - Legally-Binding Smart Contracts for all,   WOW!! What is going with this one today Yeehaa lol.,False
8,msg49237515,https://bitcointalk.org/index.php?topic=1934422.0,,67660,Announcements (Altcoins),2019-01-15 03:44:51,RuBro,Jr. Member,72,3,,[ANN] AGRELLO - Legally-Binding Smart Contracts for all,"good flies + 130% Binance. thanks to this, I learned about the project. looks impressive ",False
9,msg49304380,https://bitcointalk.org/index.php?topic=1934422.0,,67660,Announcements (Altcoins),2019-01-18 21:36:41,Dashez,Newbie,46,0,,[ANN] AGRELLO - Legally-Binding Smart Contracts for all,just a pump n dump. this crypto not worth $.12   Big dump coming.,False
10,msg49397377,https://bitcointalk.org/index.php?topic=1934422.0,,67660,Announcements (Altcoins),2019-01-24 10:26:26,podpod,Jr. Member,155,2,,[ANN] AGRELLO - Legally-Binding Smart Contracts for all,This is going to crash very soon.....  Team is dumping all that they have LOL,False
11,msg49423347,https://bitcointalk.org/index.php?topic=1934422.0,,67660,Announcements (Altcoins),2019-01-25 21:47:44,Jcga,Legendary,1680,1034,,[ANN] AGRELLO - Legally-Binding Smart Contracts for all,"$0,161370 USD (12,48%) 0,00004483 BTC (12,75%) 0,00138569 ETH (13,57%) DLT Ath on Binance => 0.00148999 ETH  Pretty cool, I think we are above Ico price (in eth).",False
12,msg49620055,https://bitcointalk.org/index.php?topic=1934422.0,,67660,Announcements (Altcoins),2019-02-07 02:04:59,patz22,Full Member,798,104,,[ANN] AGRELLO - Legally-Binding Smart Contracts for all,I am watching this token in a week now. I noticed that it is being pumped and dumped every now and then. Is it from the devs? Or just from pump groups. I really like this project but I want to see stability I mean the price up and down are over reacting.,False
13,msg49675343,https://bitcointalk.org/index.php?topic=1934422.0,msg49620055,67660,Announcements (Altcoins),2019-02-10 14:21:24,Jcga,Legendary,1680,1034,,[ANN] AGRELLO - Legally-Binding Smart Contracts for all,"   We can say that nowadays DLT's price is pretty much stabilisized, waiting for a +30%... hahaha",False
14,msg50126723,https://bitcointalk.org/index.php?topic=1934422.0,msg49675343,67660,Announcements (Altcoins),2019-03-12 08:30:42,Cimmy_revenger,Sr. Member,924,250,,[ANN] AGRELLO - Legally-Binding Smart Contracts for all,"  Maybe today its time good bought some DLT , Volume transaction is low. But if increase always boom.",False
15,msg50416947,https://bitcointalk.org/index.php?topic=1934422.0,,67660,Announcements (Altcoins),2019-04-02 00:50:13,Jcga,Legendary,1680,1034,,[ANN] AGRELLO - Legally-Binding Smart Contracts for all,"""A simpler, smarter way of creating and managing digital documents""      Pretty cool new Agrelllo website, Go DLT!  ""Agrello ID is your own personal self-sovereign digital identity, powered by blockchain, supported by an advanced identification process, and protected by cryptography.""",False
16,msg50417140,https://bitcointalk.org/index.php?topic=1934422.0,,67660,Announcements (Altcoins),2019-04-02 01:34:51,Jcga,Legendary,1680,1034,,[ANN] AGRELLO - Legally-Binding Smart Contracts for all,Agrello - legal agreements of the digital age    Visit at www.agrello.io,False
17,msg50880278,https://bitcointalk.org/index.php?topic=1934422.0,,67660,Announcements (Altcoins),2019-05-03 13:44:11,brother3,Hero Member,980,500,,[ANN] AGRELLO - Legally-Binding Smart Contracts for all,Important notice! Agrello token sales platform will be switching off On 30 September 2020 the Agrello token sales platform will be switching off.  https://blog.agrello.org/important-notice-agrello-token-sales-platform-will-be-switching-off-38c1437f7fdf,False
18,msg50885199,https://bitcointalk.org/index.php?topic=1934422.0,msg50880278,67660,Announcements (Altcoins),2019-05-03 20:39:39,Jcga,Legendary,1680,1034,,[ANN] AGRELLO - Legally-Binding Smart Contracts for all,"   I have also received the mail. I wonder how many people have not withdrawn their tokens yet. Plenty of time in front to do so.  ""On 30 September 2020  the Agrello token sales platform will be switching off. Agrello token sales platform was designed for the purpose of selling tokens during Agrello ICO and releasing them to the buyers. Most of Agrello token buyers have already withdrawn their tokens and for them the platform is no longer relevant. Today we are still maintaining the platform for the very few token holders who despite our efforts have not yet withdrawn their tokens. Since the number of tokens held on the platform has become very small, we’ve decided to switch off the token sales platform to optimise our technology estate.  What does it mean to you?  If you have already withdrawn your tokens and they are stored in your wallet, then switching off the platform DOES NOT AFFECT YOU. But if you have not yet withdrawn your tokens, then we kindly ask you to do that before the closing time. After 30 September 2020 you will no longer be able to withdraw your tokens.""",False
19,msg50914108,https://bitcointalk.org/index.php?topic=1934422.0,,67660,Announcements (Altcoins),2019-05-05 20:55:54,template,Hero Member,1050,500,,[ANN] AGRELLO - Legally-Binding Smart Contracts for all,Team is active?,False
20,msg50916453,https://bitcointalk.org/index.php?topic=1934422.0,,67660,Announcements (Altcoins),2019-05-06 02:39:38,jokerlu,Full Member,490,102,,[ANN] AGRELLO - Legally-Binding Smart Contracts for all,"almost a 100% rise of this altcoin in binance, I see in the next few days similar movements in many altcoin, it's time to buy altcoins.",False
21,msg50916465,https://bitcointalk.org/index.php?topic=1934422.0,,67660,Announcements (Altcoins),2019-05-06 02:41:52,jokerlu,Full Member,490,102,,[ANN] AGRELLO - Legally-Binding Smart Contracts for all,I invite you to see my predictions of the market by twitter now is where the good signals for the investment come...  https://twitter.com/jonasvallecilla?lang=es,False
22,msg50916524,https://bitcointalk.org/index.php?topic=1934422.0,,67660,Announcements (Altcoins),2019-05-06 02:52:19,Jcga,Legendary,1680,1034,,[ANN] AGRELLO - Legally-Binding Smart Contracts for all,"I looked around and can not find any news about the dlt increase, p&d?",False
23,msg36229760,https://bitcointalk.org/index.php?topic=1934422.0,msg36179844,67660,Announcements (Altcoins),2018-05-03 18:28:19,z0n0,Legendary,1274,1006,,[ANN] AGRELLO - Legally-Binding Smart Contracts for all,"    It was a joke of course. He started LOL Pls dont tell me that he doesnt know how to look up the price of some coin..it was just stupid question, so I answered in same manner  ",False
24,msg36269596,https://bitcointalk.org/index.php?topic=1934422.0,,67660,Announcements (Altcoins),2018-05-04 07:26:40,Tonisim,Full Member,532,103,,[ANN] AGRELLO - Legally-Binding Smart Contracts for all,"Weekly Update — Sneak peek for what is coming!  We have a busy month ahead! We would like to share some hints for what is coming in the following weeks and what are we building currently on our platform.  As you know, online identification is a time-consuming process and we aim to solve this problem. But for that, digital ID is needed. Have a quick look how easy is it is to create an Agrello ID with us. Here are some visuals to give a better understanding of the flow.    https://blog.agrello.org/weekly-update-sneak-peek-for-what-is-coming-adb283574ea6",False
25,msg36387650,https://bitcointalk.org/index.php?topic=1934422.0,,67660,Announcements (Altcoins),2018-05-05 14:22:26,galvinfly,Newbie,26,0,,[ANN] AGRELLO - Legally-Binding Smart Contracts for all,Nice to see the update Thanks for your working hard,False
26,msg36636897,https://bitcointalk.org/index.php?topic=1934422.0,,67660,Announcements (Altcoins),2018-05-08 02:33:03,zhugy78,Member,305,10,,[ANN] AGRELLO - Legally-Binding Smart Contracts for all,It may be that there are so many projects that there are so many hoax that many people begin to hesitate to meet such a project. So a new project at the beginning will often be questioned unless all aspects of the project are really powerful.,False
27,msg37934571,https://bitcointalk.org/index.php?topic=1934422.0,,67660,Announcements (Altcoins),2018-05-20 15:37:58,denysrodman,Member,224,11,,[ANN] AGRELLO - Legally-Binding Smart Contracts for all,"Agrello is a plug-in platform with an AI interface that makes it easy to create and manage agreements based on smart contracts that are legally binding, like traditional contracts. Agrello is focused on end users and allows anyone to create intellectual contracts and does not require any programming skills or legal knowledge. All this is done with a team of developers and lawyers who deal with all the questions that the user has.",False
28,msg38216360,https://bitcointalk.org/index.php?topic=1934422.0,,67660,Announcements (Altcoins),2018-05-22 22:23:56,kosaet,Legendary,938,1001,,[ANN] AGRELLO - Legally-Binding Smart Contracts for all,Agrello combines their legal training with the transformative power of the blockchain to create a platform for legally binding smart contracts.,False
29,msg38864774,https://bitcointalk.org/index.php?topic=1934422.0,,67660,Announcements (Altcoins),2018-05-29 11:37:38,Crypto_G,Member,107,10,,[ANN] AGRELLO - Legally-Binding Smart Contracts for all,Users of the Agrello platform will be able to pay for the services with fiat using conventional currency gateways.  Any other currency paid to Agrello will have it`s value transmitted to DLT.,False
30,msg38897940,https://bitcointalk.org/index.php?topic=1934422.0,,67660,Announcements (Altcoins),2018-05-29 18:24:23,-Kaizer-,Member,183,10,,[ANN] AGRELLO - Legally-Binding Smart Contracts for all,"agrello looks big with 45 developers and that great team, team should share some more info of progressing and incoming plans, spread the word to make dlt eligible for mass and advertise it more imo. its almost unknown project for ppl, thats a bit strange. What do you think?",False
31,msg39125649,https://bitcointalk.org/index.php?topic=1934422.0,,67660,Announcements (Altcoins),2018-06-01 09:57:38,anhpro889,Newbie,13,0,,[ANN] AGRELLO - Legally-Binding Smart Contracts for all,"Im so curious, is there any bounty campaigns?",False
32,msg39388559,https://bitcointalk.org/index.php?topic=1934422.0,,67660,Announcements (Altcoins),2018-06-04 20:31:57,rodmanqs,Full Member,280,101,,[ANN] AGRELLO - Legally-Binding Smart Contracts for all,"Agrello develops an AI powered interface, allowing you to easily create and manage smart-contract-based agreements which are legally binding, just like traditional contracts. Agrello is highly end-user oriented and enables anyone to create smart-contracts.  - Blockhive adopts Agrello tech for newest project - Eesty Wallet - Agrello is to partner with LIFT99 and their new projects - Agrello Partners with Bailsman, cloud-based security deposit solution ",False
33,msg39443015,https://bitcointalk.org/index.php?topic=1934422.0,,67660,Announcements (Altcoins),2018-06-05 15:46:24,findico,Newbie,28,0,,[ANN] AGRELLO - Legally-Binding Smart Contracts for all,"Hi everyone! Just added this incredible ICO to my website   https://findico.io/ico/agrello   Findico.io is a leading cryptocurrency and ICOs portal. Whether you are already involved with ICO or other cryptocurrencies or just want to get into it, Findico.io is a resource to keep updated. ICO rating platform supported by investors and financial experts and users. Findico.io mission is to make it easy for users to find the best ICOs to join. We strive to provide useful and transparent information on ICOs, helping users find projects that have a great potential for success. We also offer a whitelabel platform for ICO projects (Wallet, tokensale system, smart contract, audit and etc) to present themselves to potential users. We have steadily increased the quantity and the quality of information required from ICO projects and we will continue to do so to help this new industry flourish.",False
34,msg40637310,https://bitcointalk.org/index.php?topic=1934422.0,,67660,Announcements (Altcoins),2018-06-22 05:29:55,gnol009,Newbie,138,0,,[ANN] AGRELLO - Legally-Binding Smart Contracts for all,"I've been participating since the beta test app, now they are operating a full working model. I ran into a few bugs/errors, but I was able to bypass that by restarting the app and deleting my cache, works smoothly",False
35,msg41063357,https://bitcointalk.org/index.php?topic=1934422.0,,67660,Announcements (Altcoins),2018-06-28 08:07:04,gartmah,Member,413,12,,[ANN] AGRELLO - Legally-Binding Smart Contracts for all,"Q2 Update: Agrello Builds Solid Foundation Gearing Up for Pilot Integrations  Our Q2 was packed with action, with internal workshops, bleeding edge challenges, conferences and engagements, you name it! Wanted to take this opportunity to bring it all together. Pleased to share with you that we’ve made a great progress implementing key features of our foundational products, and have built a number of cornerstone solutions on the way. These include the core aspects of the Agrello Digital Identity as well as the Agrello legal contracts technology on blockchain. https://blog.agrello.org/q2-update-agrello-builds-solid-foundation-gearing-up-for-pilot-integrations-5592b8d6971a",False
36,msg42897931,https://bitcointalk.org/index.php?topic=1934422.0,,67660,Announcements (Altcoins),2018-07-26 09:23:53,naK2,Newbie,21,0,,[ANN] AGRELLO - Legally-Binding Smart Contracts for all,Why has the source code (https://github.com/Agrello) not been updated since October 2017? And why are there only 2 devs on this project?,False
37,msg43681608,https://bitcointalk.org/index.php?topic=1934422.0,msg42897931,67660,Announcements (Altcoins),2018-08-08 01:20:56,bineva17,Member,131,11,,[ANN] AGRELLO - Legally-Binding Smart Contracts for all,   Because this project is obviously a scam. Those guys took money and went on vacation long time ago.,False
38,msg44248899,https://bitcointalk.org/index.php?topic=1934422.0,,67660,Announcements (Altcoins),2018-08-17 16:14:22,nguyenkhactinh,Newbie,1,0,,[ANN] AGRELLO - Legally-Binding Smart Contracts for all,agrello will stand next to eth in the 2021 chart,False
39,msg44296241,https://bitcointalk.org/index.php?topic=1934422.0,,67660,Announcements (Altcoins),2018-08-18 15:24:10,Goodtea168,Newbie,112,0,,[ANN] AGRELLO - Legally-Binding Smart Contracts for all,"As the digital and real legal world will meet, this project can allow for actually all documents to take place and be written into a public blockchain. This will revolutionize the world, as what once go into the blockchain cannot be changed nor forged or counterfeit. The documents will always be there and there will be normal legal means to execute them. It is really a big step.",False
40,msg44814464,https://bitcointalk.org/index.php?topic=1934422.0,,67660,Announcements (Altcoins),2018-08-28 09:43:37,Otap2018,Newbie,98,0,,[ANN] AGRELLO - Legally-Binding Smart Contracts for all,"Crypto world finally becomes significant and smart contracts are now having a real power. I think it has a potential of being widely used.  I really like the fact that they add the ''legally'' part to smart contracts that we've already seen and know, otherwise it wouldn't be that revolutionary.",False
41,msg45763016,https://bitcointalk.org/index.php?topic=1934422.0,,67660,Announcements (Altcoins),2018-09-16 08:59:04,alexinv,Full Member,655,101,,[ANN] AGRELLO - Legally-Binding Smart Contracts for all,"   what is the reason of increasing trading volumes, who knows?",False
42,msg46187850,https://bitcointalk.org/index.php?topic=1934422.0,msg45763016,67660,Announcements (Altcoins),2018-09-26 12:18:36,TrollBoxTroll,Newbie,12,0,,[ANN] AGRELLO - Legally-Binding Smart Contracts for all,   Good old fashioned pump & dump !!,False
43,msg33789907,https://bitcointalk.org/index.php?topic=1934422.0,,67660,Announcements (Altcoins),2018-04-02 20:13:29,graysoon,Copper Member,294,100,,[ANN] AGRELLO - Legally-Binding Smart Contracts for all,"More transparency & honesty with investors would be good for the future, and some marketing at least.",False
44,msg33790242,https://bitcointalk.org/index.php?topic=1934422.0,,67660,Announcements (Altcoins),2018-04-02 20:19:12,abdulaziz07,Sr. Member,504,250,,[ANN] AGRELLO - Legally-Binding Smart Contracts for all,"These are concepts introduced after the whitepaper, they came along after partnerships, they weren't planned.",False
45,msg33866871,https://bitcointalk.org/index.php?topic=1934422.0,,67660,Announcements (Altcoins),2018-04-03 19:29:49,Brilliantrocket,Hero Member,826,500,,[ANN] AGRELLO - Legally-Binding Smart Contracts for all,Does It means agrello dont think about usa market and usa exchange like bittrex poloniex  right?,False
46,msg34093160,https://bitcointalk.org/index.php?topic=1934422.0,,67660,Announcements (Altcoins),2018-04-06 16:52:22,sv.alyona,Member,210,18,,[ANN] AGRELLO - Legally-Binding Smart Contracts for all,Agrello Weekly Update  It is time start with Q&A session second round and get those answers out. It was a long list of interesting and exciting questions you posted via Reddit! We divided the answers into two different posts. https://blog.agrello.org/agrello-weekly-update-ba976d30fc3d,False
47,msg34108028,https://bitcointalk.org/index.php?topic=1934422.0,,67660,Announcements (Altcoins),2018-04-06 20:41:25,Olivia Keyton,Newbie,182,0,,[ANN] AGRELLO - Legally-Binding Smart Contracts for all,"In today's crypto coins, there is really no mess and transparency.! Sounds like a great project. I'll watch how it progresses. I wonder what this project will look like.",False
48,msg34211278,https://bitcointalk.org/index.php?topic=1934422.0,,67660,Announcements (Altcoins),2018-04-08 11:31:17,Mobius,Hero Member,988,1000,,[ANN] AGRELLO - Legally-Binding Smart Contracts for all,Why isn't agrello on binance yet?,False
49,msg34226509,https://bitcointalk.org/index.php?topic=1934422.0,msg34211278,67660,Announcements (Altcoins),2018-04-08 14:55:37,z0n0,Legendary,1274,1006,,[ANN] AGRELLO - Legally-Binding Smart Contracts for all,   https://www.binance.com/trade.html?symbol=DLT_BTC https://coinmarketcap.com/currencies/agrello-delta/#markets  dafuq?,False
50,msg34292399,https://bitcointalk.org/index.php?topic=1934422.0,,67660,Announcements (Altcoins),2018-04-09 12:10:49,graysoon,Copper Member,294,100,,[ANN] AGRELLO - Legally-Binding Smart Contracts for all,"i was reading about the new updates coming and being implemented into the app, when are they due to get implemented?",False
51,msg34684916,https://bitcointalk.org/index.php?topic=1934422.0,,67660,Announcements (Altcoins),2018-04-14 13:34:21,graysoon,Copper Member,294,100,,[ANN] AGRELLO - Legally-Binding Smart Contracts for all,Agrello is not doing marketing at all untill they have a working product which is great for product,False
52,msg34793622,https://bitcointalk.org/index.php?topic=1934422.0,,67660,Announcements (Altcoins),2018-04-15 21:41:49,misterbigg,Legendary,1064,1001,,[ANN] AGRELLO - Legally-Binding Smart Contracts for all,"This project has allot of potential once beta is out easy 20-30x end of year, just hodl",False
53,msg35027666,https://bitcointalk.org/index.php?topic=1934422.0,msg34793622,67660,Announcements (Altcoins),2018-04-18 18:45:35,bitshaperbd,Newbie,133,0,,[ANN] AGRELLO - Legally-Binding Smart Contracts for all,  Is there any timeline for beta release?,False
54,msg35192491,https://bitcointalk.org/index.php?topic=1934422.0,,67660,Announcements (Altcoins),2018-04-20 18:50:03,bgibso01,Legendary,1218,1001,,[ANN] AGRELLO - Legally-Binding Smart Contracts for all,"DLT will be needed for signing documents, using the API, so whats the use case of tokens",False
55,msg35246260,https://bitcointalk.org/index.php?topic=1934422.0,,67660,Announcements (Altcoins),2018-04-21 15:06:22,Kriptobt1,Member,280,10,,[ANN] AGRELLO - Legally-Binding Smart Contracts for all,"Agrello Weekly Update https://blog.agrello.org/agrello-weekly-update-e6857152f9f1  As stated in our last Q&A post, we have been looking into different blockchain solutions lately. We searched for blockchain eco-system, which has same possibilities as Ethereum that we are currently using. We came to an understanding that NEM brings us the required functionality and therefor Agrello will implement their blockchain for selected future projects.  NEM fills our current requirements and gives us additional extended possibilities in comparison to Ethereum. Our main reasons for implementing NEM was the value of money and transaction speed. Ethereum transactions are not always the best choice, because of pricing and time of execution. At the end of the year, CryptoKitties (a game based on Ethereum) was a reason for sixfold increase in pending transactions on Ethereum. We increased transaction price, but it still took some time to be published. Transaction in NEM has fixed price and generally publishing them takes less time. NEM also supports not only hex-messages but also string message and encoded message.  Furthermore, now we are able to use different blockchain solutions and we can easily switch back for Ethereum or start to use another blockchain, this makes our system less dependent on a single blockchain solution. Our first project supported by NEM will be NordCoin. We have been working with their team for a while now and soon we will share their story with all of you.  We are going to participate in Chainges conference as a partner of NEM in Amsterdam. Hando Rand, CEO will present Agrello ID and signature solution after Kristof Van de Reck Interim President, NEM.io Foundation. With our presentation, we aim to tell a story about Agrello ID and show how our solution can improve the way we manage legal matters in a new and more efficient way using blockchain.",False
56,msg35312770,https://bitcointalk.org/index.php?topic=1934422.0,,67660,Announcements (Altcoins),2018-04-22 13:09:38,a123canz999888,Newbie,98,0,,[ANN] AGRELLO - Legally-Binding Smart Contracts for all,"Better to stay away from aridrops, they need all your data including email then they will try to spam and scam you in another way. Airdrop are very easy to create and anyone could do that. So be careful.",False
57,msg35363587,https://bitcointalk.org/index.php?topic=1934422.0,,67660,Announcements (Altcoins),2018-04-23 05:18:14,23sd12122121,Newbie,63,0,,[ANN] AGRELLO - Legally-Binding Smart Contracts for all,"Just wondering, if you guys don't reach 20,000 BTC, will investor's ICO contributions be refunded?",False
58,msg35733187,https://bitcointalk.org/index.php?topic=1934422.0,,67660,Announcements (Altcoins),2018-04-27 16:33:23,phoasdnz1299,Newbie,29,0,,[ANN] AGRELLO - Legally-Binding Smart Contracts for all,"of course make an attempt and tell us about your success, so that everyone understands that there is no deception",False
