id,msg_id,parent_id,link_id,Count_read,Forum,Time,Author,Rank,Activity,Merit,Trust,Title,Body,ScamHeader
585,msg19724846,https://bitcointalk.org/index.php?topic=1934422.0,msg19718709,67660,Announcements (Altcoins),2017-06-23 06:46:24,JuanMD,Full Member,220,100,,[ANN] AGRELLO - Legally-Binding Smart Contracts for all,"   Hi DawQ, check this video, I think it will useful to answer your questions!  https://www.youtube.com/watch?v=kErMMnPiWbo  Regards!",False
586,msg19728843,https://bitcointalk.org/index.php?topic=1934422.0,,67660,Announcements (Altcoins),2017-06-23 11:23:27,Weider,Full Member,248,100,,[ANN] AGRELLO - Legally-Binding Smart Contracts for all,Is it going to be ICO? When it will start and how can i contribute? Very interesting project.,False
587,msg19730444,https://bitcointalk.org/index.php?topic=1934422.0,msg19728843,67660,Announcements (Altcoins),2017-06-23 13:02:27,JuanMD,Full Member,220,100,,[ANN] AGRELLO - Legally-Binding Smart Contracts for all,"   Hi Weider! yeah, the ICO is going to be announced in the following days and will start around late july. You can follow the progress through our Telegram or Slack channels too!  An excellent way to contribute is to help us spreading the word about the project by shearing the news and let other people know about Agrello.  Thnx for your interest!  Regards. JM",False
588,msg19730565,https://bitcointalk.org/index.php?topic=1934422.0,,67660,Announcements (Altcoins),2017-06-23 13:11:26,self1sch,Full Member,219,100,,[ANN] AGRELLO - Legally-Binding Smart Contracts for all,"Wow I'm impressed by your whitepaper, very indepth information in there. It clearly shows that you guys know what you are talking about. Cant wait for the ICO! ",False
589,msg19732853,https://bitcointalk.org/index.php?topic=1934422.0,msg19730565,67660,Announcements (Altcoins),2017-06-23 15:35:02,JuanMD,Full Member,220,100,,[ANN] AGRELLO - Legally-Binding Smart Contracts for all,   Thnx! we are glad to have your support!,False
590,msg19745742,https://bitcointalk.org/index.php?topic=1934422.0,,67660,Announcements (Altcoins),2017-06-24 10:31:24,btcunbranded,Member,126,10,,[ANN] AGRELLO - Legally-Binding Smart Contracts for all,"Have a friend in Legal field, so keenly watching this so i can answer all his questions!",False
591,msg19754995,https://bitcointalk.org/index.php?topic=1934422.0,,67660,Announcements (Altcoins),2017-06-24 22:23:11,Vagnavs,Legendary,1119,1003,,[ANN] AGRELLO - Legally-Binding Smart Contracts for all,How much are you looking to raise? Will there be at hard cap? Didn't have time to look through all the pages..,False
592,msg19768435,https://bitcointalk.org/index.php?topic=1934422.0,msg19754995,67660,Announcements (Altcoins),2017-06-25 17:58:04,JuanMD,Full Member,220,100,,[ANN] AGRELLO - Legally-Binding Smart Contracts for all,   Hi! I don't have the exact number but it should be around 8000 BTC.,False
593,msg19771555,https://bitcointalk.org/index.php?topic=1934422.0,,67660,Announcements (Altcoins),2017-06-25 22:01:51,Weider,Full Member,248,100,,[ANN] AGRELLO - Legally-Binding Smart Contracts for all,In which currency I can contribute to this ICO? If it's ethereum only it's great time to buy right now. Let me know. Thank's,False
594,msg19773877,https://bitcointalk.org/index.php?topic=1934422.0,,67660,Announcements (Altcoins),2017-06-26 02:02:08,Agrello,Full Member,190,100,,[ANN] AGRELLO - Legally-Binding Smart Contracts for all,Thanks for your patience everyone!  We should have all of your sale questions answered this coming week.   Please visit our Slack or Telegram too! (see links below),False
595,msg19774361,https://bitcointalk.org/index.php?topic=1934422.0,msg19730444,67660,Announcements (Altcoins),2017-06-26 02:54:43,learner 7,Full Member,546,100,,[ANN] AGRELLO - Legally-Binding Smart Contracts for all,   We are waiting for ICO and Bounties,False
596,msg19775179,https://bitcointalk.org/index.php?topic=1934422.0,msg19768435,67660,Announcements (Altcoins),2017-06-26 04:17:37,Vagnavs,Legendary,1119,1003,,[ANN] AGRELLO - Legally-Binding Smart Contracts for all,  Okay so you're looking to raise 20 million about. Is that a hard cap?,False
597,msg19775238,https://bitcointalk.org/index.php?topic=1934422.0,,67660,Announcements (Altcoins),2017-06-26 04:23:12,Kawasanz,Sr. Member,280,250,,[ANN] AGRELLO - Legally-Binding Smart Contracts for all,"I think this is a great mega-project where everyone wants a smart contract at blockchain, I will follow your progress and wait ico, campaigns, blog / media",False
598,msg19781542,https://bitcointalk.org/index.php?topic=1934422.0,msg19771555,67660,Announcements (Altcoins),2017-06-26 12:30:52,JuanMD,Full Member,220,100,,[ANN] AGRELLO - Legally-Binding Smart Contracts for all,"   So far, the currencies for the ICO are going to be BTC and ETH",False
599,msg19785488,https://bitcointalk.org/index.php?topic=1934422.0,,67660,Announcements (Altcoins),2017-06-26 16:18:37,migello,Sr. Member,460,250,,[ANN] AGRELLO - Legally-Binding Smart Contracts for all,"I'm Very interested in Agrello Project,  waiting for ico details to invest.",False
600,msg19785618,https://bitcointalk.org/index.php?topic=1934422.0,,67660,Announcements (Altcoins),2017-06-26 16:27:01,nobodywanttocry,Member,126,14,,[ANN] AGRELLO - Legally-Binding Smart Contracts for all,Is there a wechat channel for community?,False
601,msg19786642,https://bitcointalk.org/index.php?topic=1934422.0,,67660,Announcements (Altcoins),2017-06-26 17:27:11,Dorky,Sr. Member,392,250,,[ANN] AGRELLO - Legally-Binding Smart Contracts for all,"Hi, is Agrello smart contract's legal terms internationally applicable or just in Europe/Estonia? Say if I live in some 3rd-world country will the smart contract created with Agrello's app going to be valid/legally enforceable in my country (any country ex-Europe/Estonia)?",False
602,msg19787850,https://bitcointalk.org/index.php?topic=1934422.0,msg19785618,67660,Announcements (Altcoins),2017-06-26 18:43:06,JuanMD,Full Member,220,100,,[ANN] AGRELLO - Legally-Binding Smart Contracts for all,"   Hi!  We do, but looks like the link is broken. Thank you for pointing that out! I will see that it gets fixed  Edit: Sorry, I asked and the Wechat was closed.",False
603,msg19542835,https://bitcointalk.org/index.php?topic=1934422.0,msg19542637,67660,Announcements (Altcoins),2017-06-13 21:03:51,Agrello,Full Member,190,100,,[ANN] AGRELLO - Legally-Binding Smart Contracts for all,   No token data or bounty info is available at the moment.  Please stay tuned to our channels!            https://blog.agrello.org/agrello-asia-tour-june-15-27-9b05253b664,False
604,msg19564323,https://bitcointalk.org/index.php?topic=1934422.0,msg19563712,67660,Announcements (Altcoins),2017-06-14 21:43:17,Ethertrader1,Full Member,121,100,,[ANN] AGRELLO - Legally-Binding Smart Contracts for all,        Very nice the team is in Chengdu. This is the #1 blockchain conference globally. Is Agrello speaking there?,False
605,msg19589069,https://bitcointalk.org/index.php?topic=1934422.0,,67660,Announcements (Altcoins),2017-06-16 04:43:10,Agrello,Full Member,190,100,,[ANN] AGRELLO - Legally-Binding Smart Contracts for all,"Yes, Agrello is speaking there!  Here are a couple photos from the Conference:    The Global Blockchain Conference in Chengdu, China       Visit our Facebook page to see the whole album: https://www.facebook.com/agrellofoundation/posts/1505399012814338",False
606,msg19589115,https://bitcointalk.org/index.php?topic=1934422.0,,67660,Announcements (Altcoins),2017-06-16 04:48:03,puvanb,Full Member,210,100,,[ANN] AGRELLO - Legally-Binding Smart Contracts for all,watching,False
607,msg19600792,https://bitcointalk.org/index.php?topic=1934422.0,,67660,Announcements (Altcoins),2017-06-16 17:29:07,P E K K A,Sr. Member,490,250,,[ANN] AGRELLO - Legally-Binding Smart Contracts for all,Any bounty sir?? if any i would to reserve indonesia translation,False
608,msg19605350,https://bitcointalk.org/index.php?topic=1934422.0,msg19600792,67660,Announcements (Altcoins),2017-06-16 23:43:11,Agrello,Full Member,190,100,,[ANN] AGRELLO - Legally-Binding Smart Contracts for all,"Check Out Our All-New Website https://www.agrello.org/   Also, we published a new Explainer Video today: https://www.youtube.com/watch?v=kErMMnPiWbo&lc=z12twjry0wqci1h2s23nftybwqyoc52ya04               I don't think there will be any banner bounty, but possibly some translations could be useful.  We will keep the order of posting honored here for those reservations.",False
609,msg19605607,https://bitcointalk.org/index.php?topic=1934422.0,,67660,Announcements (Altcoins),2017-06-17 00:11:53,bournekin,Sr. Member,476,250,,[ANN] AGRELLO - Legally-Binding Smart Contracts for all,"This is really nice project you have here, look like the project are progressing well. I'll look forward for great success of it.",False
610,msg19608408,https://bitcointalk.org/index.php?topic=1934422.0,msg19589069,67660,Announcements (Altcoins),2017-06-17 05:31:08,johnsaributua,Full Member,336,100,,[ANN] AGRELLO - Legally-Binding Smart Contracts for all,"       wowww Agrello speaking in Global Blockchain Conference in Chengdu, China. it's great news, will make more trust for investor to invest in Agrello, hopefully",False
611,msg19618576,https://bitcointalk.org/index.php?topic=1934422.0,,67660,Announcements (Altcoins),2017-06-17 18:02:48,ljp7839008,Sr. Member,490,250,,[ANN] AGRELLO - Legally-Binding Smart Contracts for all,I hope this one should do well as many many people are talking about it even before the launch,False
612,msg19619064,https://bitcointalk.org/index.php?topic=1934422.0,msg19605350,67660,Announcements (Altcoins),2017-06-17 18:38:00,one.CAG,Newbie,13,0,,[ANN] AGRELLO - Legally-Binding Smart Contracts for all,     This forum sucks compared to the one at BitCoinGarden that Agrello has https://bitcoingarden.org/forum/index.php?topic=15486.msg162326#msg162326   You can actually just watch videos in posts!  ,False
613,msg19620593,https://bitcointalk.org/index.php?topic=1934422.0,,67660,Announcements (Altcoins),2017-06-17 20:33:40,Meteeray,Sr. Member,330,250,,[ANN] AGRELLO - Legally-Binding Smart Contracts for all,There are lots of good news for the project. At least they need to reach more users with translation bounty.,False
614,msg19631373,https://bitcointalk.org/index.php?topic=1934422.0,,67660,Announcements (Altcoins),2017-06-18 12:47:50,aidit45@gmail.com,Sr. Member,882,251,,[ANN] AGRELLO - Legally-Binding Smart Contracts for all,Must have social bounty to campaign....,False
615,msg19640038,https://bitcointalk.org/index.php?topic=1934422.0,msg19618511,67660,Announcements (Altcoins),2017-06-18 22:49:25,Serco,Sr. Member,770,250,,[ANN] AGRELLO - Legally-Binding Smart Contracts for all,"     Quote from: Agrello on June 16, 2017, 11:47:26 PM Quote from: P E K K A on June 16, 2017, 05:29:07 PM Any bounty sir?? if any i would to reserve indonesia translation  I don't think there will be any banner bounty, but possibly some translations could be useful.  We will keep the order of posting honored here for those reservations.",False
616,msg19642045,https://bitcointalk.org/index.php?topic=1934422.0,,67660,Announcements (Altcoins),2017-06-19 02:45:27,Agrello,Full Member,190,100,,[ANN] AGRELLO - Legally-Binding Smart Contracts for all,“Can’t Infer Every Organization Will Use Ethereum Blockchain”: Agrello Chief Scientist  https://www.cryptocoinsnews.com/agrello-cto-cant-assume-blockchain-orgs-choose-ethereum/   ,False
617,msg19674906,https://bitcointalk.org/index.php?topic=1934422.0,,67660,Announcements (Altcoins),2017-06-20 18:30:50,ActAshton,Jr. Member,173,2,,[ANN] AGRELLO - Legally-Binding Smart Contracts for all,Take a look at our new promo video - which is on our completely re-designed website!  https://www.youtube.com/watch?v=kErMMnPiWbo  And check the other Agrello communities at:  Telegram: https://t.me/agrello Slack: https://agrello.slack.com Twitter: https://twitter.com/AgrelloOfficial Facebook: https://www.facebook.com/agrellofoundation/ Website: https://www.agrello.org Email: info@agrello.org,False
618,msg19683994,https://bitcointalk.org/index.php?topic=1934422.0,msg19674906,67660,Announcements (Altcoins),2017-06-21 06:52:17,JuanMD,Full Member,220,100,,[ANN] AGRELLO - Legally-Binding Smart Contracts for all,   Thnx Ashton!,False
619,msg19690806,https://bitcointalk.org/index.php?topic=1934422.0,msg19605607,67660,Announcements (Altcoins),2017-06-21 13:42:57,JuanMD,Full Member,220,100,,[ANN] AGRELLO - Legally-Binding Smart Contracts for all,   Hey man! thanks for your support! We will continue working hard for that!,False
620,msg19693487,https://bitcointalk.org/index.php?topic=1934422.0,,67660,Announcements (Altcoins),2017-06-21 16:01:50,Agrello,Full Member,190,100,,[ANN] AGRELLO - Legally-Binding Smart Contracts for all,Agrello partners up with ViewFin to develop digital identity engine  https://blog.agrello.org/agrello-partners-up-with-viewfin-to-develop-digital-identity-engine-ca32e3a5ef87    ,False
621,msg19696662,https://bitcointalk.org/index.php?topic=1934422.0,,67660,Announcements (Altcoins),2017-06-21 19:02:32,FYIcryptoz,Full Member,181,100,,[ANN] AGRELLO - Legally-Binding Smart Contracts for all,"Really looking forward to this project, will there be an ICO/crowdsale?",False
622,msg19714089,https://bitcointalk.org/index.php?topic=1934422.0,msg19696662,67660,Announcements (Altcoins),2017-06-22 16:09:11,JuanMD,Full Member,220,100,,[ANN] AGRELLO - Legally-Binding Smart Contracts for all,"   Hey! yeah, there is going to be one around late July. Keep an eye in the social media groups (Slack, Telegram, etc) as is going to be announced there when the date is set.",False
623,msg19483393,https://bitcointalk.org/index.php?topic=1934422.0,msg19443828,67660,Announcements (Altcoins),2017-06-10 22:14:57,one.CAG,Newbie,13,0,,[ANN] AGRELLO - Legally-Binding Smart Contracts for all,       Looking good!,False
624,msg19489571,https://bitcointalk.org/index.php?topic=1934422.0,,67660,Announcements (Altcoins),2017-06-11 08:51:54,Abyss_X,Member,111,10,,[ANN] AGRELLO - Legally-Binding Smart Contracts for all,"   OK, thanks for this information.  regards",False
625,msg19489668,https://bitcointalk.org/index.php?topic=1934422.0,,67660,Announcements (Altcoins),2017-06-11 08:58:30,SwedishGirl,Sr. Member,392,250,,[ANN] AGRELLO - Legally-Binding Smart Contracts for all,Will this be the latest ETH only ICO or you are also going to let people take part with BTC as well? One of the most fair ICOs that I have seen recently was PeerPlays where they had a fixed amount per token in USD and you could select what crypto you gonna pay them with based on the conversion rate. ETH only ICOs are starting to look more and more like a ponzi.,False
626,msg19494517,https://bitcointalk.org/index.php?topic=1934422.0,,67660,Announcements (Altcoins),2017-06-11 14:33:24,S3cco,Hero Member,1659,528,,[ANN] AGRELLO - Legally-Binding Smart Contracts for all,"Bitcoin Garden: Legaltech startup Agrello to develop on Ethereum, announces compatibility with additional blockchain environments https://bitcoingarden.org/legaltech-startup-agrello-develop-ethereum-announces-compatibility-additional-blockchain-environments/    Social media links, for those willing to share the news:  https://twitter.com/BitcoinGarden/status/873909463681556481 https://www.facebook.com/BitcoinGarden/posts/1055291794606192 https://www.linkedin.com/hp/update/6279676130337255424",False
627,msg19496172,https://bitcointalk.org/index.php?topic=1934422.0,msg19476747,67660,Announcements (Altcoins),2017-06-11 16:09:14,Sixty-Miner,Newbie,9,0,,[ANN] AGRELLO - Legally-Binding Smart Contracts for all,"    No, you don't need a lot of paperwork.  Look up the basics of what a contract is.  When you click ""accept"" on any software agreement, you've entered a legal (smart) contract in digital form, that is completely upheld in any court.  Even digital signatures have crossed this threshold already, and various loose forms of ID, like email or IP address (to prove in a court of law that you performed some action, for example).  We're already way beyond what you seem to claim is 5-10 years away.",False
628,msg19496722,https://bitcointalk.org/index.php?topic=1934422.0,msg19496172,67660,Announcements (Altcoins),2017-06-11 16:42:27,Kazadar,Hero Member,644,500,,[ANN] AGRELLO - Legally-Binding Smart Contracts for all,  Where I am from verbal agreements are also legally binding. Just a lot harder to proof unless you record it.,False
629,msg19497879,https://bitcointalk.org/index.php?topic=1934422.0,msg19496722,67660,Announcements (Altcoins),2017-06-11 17:50:47,inck,Member,98,10,,[ANN] AGRELLO - Legally-Binding Smart Contracts for all,"   Mhh, maybe I was thinking too complicated like buying a house or such things.",False
630,msg19499850,https://bitcointalk.org/index.php?topic=1934422.0,,67660,Announcements (Altcoins),2017-06-11 19:54:18,Alexila,Member,90,11,,[ANN] AGRELLO - Legally-Binding Smart Contracts for all,This is a very nice project. I had a chance to meet the team at Consensus. A very bright and ambitious group.,False
631,msg19501036,https://bitcointalk.org/index.php?topic=1934422.0,,67660,Announcements (Altcoins),2017-06-11 21:21:08,Agrello,Full Member,190,100,,[ANN] AGRELLO - Legally-Binding Smart Contracts for all,"User Interface - The Missing Link to Mainstream Adoption of Blockchain  https://cointelegraph.com/news/user-interface-the-missing-link-to-mainstream-adoption-of-blockchain  Hando Rand, Agrello CEO, says:  “Operating at the intersection of the legal system, financial institutions and disruptive technologies, Agrello is highly dependent on the establishment of good industrial relationships with the off-chain world. We regard the work done by the Ethereum Foundation on this matter as invaluable, and seek to be an active player in the field, lending our hand to promote this effort even further.”",False
632,msg19501139,https://bitcointalk.org/index.php?topic=1934422.0,,67660,Announcements (Altcoins),2017-06-11 21:30:45,bitcoinsay,Sr. Member,434,255,,[ANN] AGRELLO - Legally-Binding Smart Contracts for all,"It's a good idea . Interest choices, being physically active gormezmi I have no idea . But I like it.",False
633,msg19501597,https://bitcointalk.org/index.php?topic=1934422.0,,67660,Announcements (Altcoins),2017-06-11 22:11:24,Agrello,Full Member,190,100,,[ANN] AGRELLO - Legally-Binding Smart Contracts for all,A good interview today with Theo Goodman is on Youtube  Interview with Agrello -Legally-Binding Smart Contracts on a Blockchain  https://www.youtube.com/watch?v=aJgMBMCDOnE,False
634,msg19502695,https://bitcointalk.org/index.php?topic=1934422.0,,67660,Announcements (Altcoins),2017-06-12 00:02:22,Meteeray,Sr. Member,330,250,,[ANN] AGRELLO - Legally-Binding Smart Contracts for all,There are similar projects on smart contract but this one interesting. I'm waiting for more information,False
635,msg19508443,https://bitcointalk.org/index.php?topic=1934422.0,,67660,Announcements (Altcoins),2017-06-12 08:59:25,Blaff,Newbie,38,0,,[ANN] AGRELLO - Legally-Binding Smart Contracts for all,Looks like a good project. The news updates from the devs are also good and i hope that this will continue. Have seen good projects but because of bad information policy the don't have a good chance. so please give regulary updates,False
636,msg19524350,https://bitcointalk.org/index.php?topic=1934422.0,,67660,Announcements (Altcoins),2017-06-13 00:24:00,Tupacalyps,Newbie,12,0,,[ANN] AGRELLO - Legally-Binding Smart Contracts for all,"Agrello, I love the idea here but it is vital that you provide a whitepaper which includes details on the ICO in order for investors to make informed decisions.  You guys have a great idea and what looks like a good team but without specifics you're going to have trouble getting traffic your way.  Smith & Crown lists your ICO for July 10th, is that correct?",False
637,msg19541251,https://bitcointalk.org/index.php?topic=1934422.0,msg19524350,67660,Announcements (Altcoins),2017-06-13 19:22:57,Agrello,Full Member,190,100,,[ANN] AGRELLO - Legally-Binding Smart Contracts for all,"   No date has been set yet, but will be known soon along with full details.  The whitepaper also will be released soon.",False
638,msg19541651,https://bitcointalk.org/index.php?topic=1934422.0,,67660,Announcements (Altcoins),2017-06-13 19:47:40,Agrello,Full Member,190,100,,[ANN] AGRELLO - Legally-Binding Smart Contracts for all,"Will post the slides from the Blockchain Expo in Berlin recently two by two, so people can comment or ask specific questions about a specific slide:        .",False
639,msg19542049,https://bitcointalk.org/index.php?topic=1934422.0,,67660,Announcements (Altcoins),2017-06-13 20:12:09,Agrello,Full Member,190,100,,[ANN] AGRELLO - Legally-Binding Smart Contracts for all,,False
640,msg19542088,https://bitcointalk.org/index.php?topic=1934422.0,,67660,Announcements (Altcoins),2017-06-13 20:15:08,Agrello,Full Member,190,100,,[ANN] AGRELLO - Legally-Binding Smart Contracts for all,,False
641,msg19542137,https://bitcointalk.org/index.php?topic=1934422.0,,67660,Announcements (Altcoins),2017-06-13 20:18:10,Agrello,Full Member,190,100,,[ANN] AGRELLO - Legally-Binding Smart Contracts for all,https://blog.agrello.org/agrello-asia-tour-june-15-27-9b05253b664,False
642,msg19542637,https://bitcointalk.org/index.php?topic=1934422.0,,67660,Announcements (Altcoins),2017-06-13 20:52:04,join2,Sr. Member,541,252,,[ANN] AGRELLO - Legally-Binding Smart Contracts for all,please update spec. totalsuplay and bounty camp,False
643,msg19406893,https://bitcointalk.org/index.php?topic=1934422.0,msg19405891,67660,Announcements (Altcoins),2017-06-06 22:32:57,Agrello,Full Member,190,100,,[ANN] AGRELLO - Legally-Binding Smart Contracts for all,    Sure!  Just stop by our Slack sometime and ask away.  https://agrello-slack.herokuapp.com/,False
644,msg19412988,https://bitcointalk.org/index.php?topic=1934422.0,,67660,Announcements (Altcoins),2017-06-07 07:37:34,eroscoin,Newbie,27,0,,[ANN] AGRELLO - Legally-Binding Smart Contracts for all,Its P2P transaction right ? What will you provide to user that can user make transaction reliably ?,False
645,msg19423384,https://bitcointalk.org/index.php?topic=1934422.0,,67660,Announcements (Altcoins),2017-06-07 18:09:44,TrueStory,Newbie,3,0,,[ANN] AGRELLO - Legally-Binding Smart Contracts for all,"   I'm really glad I saw this, I wasn't sure what kind of applications would work, and where the focus would be.  I think this is a gold mine, just taking these easy use cases.  My few BTC are set aside for this ico.",False
646,msg19423813,https://bitcointalk.org/index.php?topic=1934422.0,msg19423384,67660,Announcements (Altcoins),2017-06-07 18:36:04,RavenBitcoins,Member,95,10,,[ANN] AGRELLO - Legally-Binding Smart Contracts for all,     I agree there are many very practical use cases this can be used for. I am very excited for this project. When is the Whitepaper being published?,False
647,msg19424250,https://bitcointalk.org/index.php?topic=1934422.0,msg19423813,67660,Announcements (Altcoins),2017-06-07 19:06:01,RandH,Newbie,3,0,,[ANN] AGRELLO - Legally-Binding Smart Contracts for all,    The whitepaper is having finishing touches to be released very soon together with a brand new website. The team is working very hard. The product development is also in process.  After the release of the whitepaper you can expect a big update with deeper details on the software engineering side.,False
648,msg19425487,https://bitcointalk.org/index.php?topic=1934422.0,,67660,Announcements (Altcoins),2017-06-07 20:30:36,RavenBitcoins,Member,95,10,,[ANN] AGRELLO - Legally-Binding Smart Contracts for all,The new OP looks great. Nice work guys.,False
649,msg19436947,https://bitcointalk.org/index.php?topic=1934422.0,,67660,Announcements (Altcoins),2017-06-08 12:31:58,Altty,Member,72,10,,[ANN] AGRELLO - Legally-Binding Smart Contracts for all,http://www.financemagnates.com/cryptocurrency/innovation/legaltech-startup-agrello-switches-development-qtum-ethereum-blockchain/  Legaltech Startup Agrello Switches Development from Qtum to Ethereum Blockchain   Good choice Agrello team. Ethereum is the clear winner at the moment.,False
650,msg19443741,https://bitcointalk.org/index.php?topic=1934422.0,,67660,Announcements (Altcoins),2017-06-08 19:10:57,Agrello,Full Member,190,100,,[ANN] AGRELLO - Legally-Binding Smart Contracts for all,"Latest blog post:  Agrello homesteads on Ethereum, but remains compatible with other ecosystems   https://blog.agrello.org/agrello-homesteads-on-ethereum-but-remains-compatible-with-other-ecosystems-6669e0b572f0    ",False
651,msg19443828,https://bitcointalk.org/index.php?topic=1934422.0,msg19209350,67660,Announcements (Altcoins),2017-06-08 19:16:50,Agrello,Full Member,190,100,,[ANN] AGRELLO - Legally-Binding Smart Contracts for all,Recently updated OP     ,False
652,msg19446185,https://bitcointalk.org/index.php?topic=1934422.0,,67660,Announcements (Altcoins),2017-06-08 22:02:28,scambust,Legendary,1526,1007,,[ANN] AGRELLO - Legally-Binding Smart Contracts for all,Agrello seems definitely interesting. I'll readthe whitepaper later on.,False
653,msg19452075,https://bitcointalk.org/index.php?topic=1934422.0,,67660,Announcements (Altcoins),2017-06-09 07:30:18,Axy,Sr. Member,794,253,,[ANN] AGRELLO - Legally-Binding Smart Contracts for all,Why are you doing this? FCT has already done this https://uk.news.yahoo.com/factom-inks-another-deal-china-053310625.html,False
654,msg19452399,https://bitcointalk.org/index.php?topic=1934422.0,,67660,Announcements (Altcoins),2017-06-09 07:53:26,Altty,Member,72,10,,[ANN] AGRELLO - Legally-Binding Smart Contracts for all,Agrello Announces Its Distributed Platform Will Operate On The Ethereum Blockchain [/b]   https://www.ethnews.com/agrello-announces-its-distributed-platform-will-operate-on-the-ethereum-blockchain  Very cool news team! Ethereum is the most stable platform for sure.,False
