id,msg_id,parent_id,link_id,Count_read,Forum,Time,Author,Rank,Activity,Merit,Trust,Title,Body,ScamHeader
847,msg25032600,https://bitcointalk.org/index.php?topic=2158545.0,msg25032181,26126,Announcements (Altcoins),2017-11-22 17:37:04,Teal Deer,Sr. Member,714,250,,[ANN][MLD] LAUNCHING MOLD GAME PLATFORM,  In traditional game industry game operators determine almost all features in games which negatively affects on game quality and playability whereas features of games on MOLD platform will be determined by player’s votes. I think that this is very interesting way of making games more popular and friendly to the player.,False
848,msg25033034,https://bitcointalk.org/index.php?topic=2158545.0,msg25032600,26126,Announcements (Altcoins),2017-11-22 17:45:31,Teal Deer,Sr. Member,714,250,,[ANN][MLD] LAUNCHING MOLD GAME PLATFORM,"  As you already said, idea of this project is very ambitious. As a ""of players, from players and for players"" platform, MOLD is going to establish free gaming market where people can benefit from gaming. Since games have long become an integral part of the modern world, I believe this is great idea.",False
849,msg25033815,https://bitcointalk.org/index.php?topic=2158545.0,msg25033034,26126,Announcements (Altcoins),2017-11-22 18:01:03,Mrbee,Full Member,456,100,,[ANN][MLD] LAUNCHING MOLD GAME PLATFORM,"  I really like the way of earning crypto currency and platform’s currency. Just play games, get in-game items, tokenize them and then trade for moldcoins. Then exchange moldcoins to crypto currency. Sounds like a good idea. What do you think?",False
850,msg25034559,https://bitcointalk.org/index.php?topic=2158545.0,msg25033815,26126,Announcements (Altcoins),2017-11-22 18:16:11,Teal Deer,Sr. Member,714,250,,[ANN][MLD] LAUNCHING MOLD GAME PLATFORM,"  Yeah, i totally agree. If you still want to find out new details, there is one more. One of the directions of the projects is to free game developers of often enslaving conditions of publishers by publishing their games via MOLD platform and using moldcoins as a billing system. As we all can see, often publishers and their distribution policies make gaming community pissed off. So this project can easily rid us and game developers of the publisher's greed.",False
851,msg25035593,https://bitcointalk.org/index.php?topic=2158545.0,msg25034559,26126,Announcements (Altcoins),2017-11-22 18:37:38,Teal Deer,Sr. Member,714,250,,[ANN][MLD] LAUNCHING MOLD GAME PLATFORM,"  MOLD platform, as I believe, is very democratic. All earnings made on this platform are distributed by vote where 1 moldcoin represents 1 vote. So users can support development of games they consider worth their attention, which I think is great feature. Besides, other parts of platform’s profit will be used for game advertising, reserve and benefit programs.",False
852,msg25036354,https://bitcointalk.org/index.php?topic=2158545.0,msg25035593,26126,Announcements (Altcoins),2017-11-22 18:53:37,Teal Deer,Sr. Member,714,250,,[ANN][MLD] LAUNCHING MOLD GAME PLATFORM,"  The general idea of the project is to liberate players from operator restrictions and free them to sell in-game items on MOLD platform as it will convert in-game data into game tokens which can be traded for moldcoins. As I think, many gamers will find this interesting.",False
853,msg25040362,https://bitcointalk.org/index.php?topic=2158545.0,,26126,Announcements (Altcoins),2017-11-22 20:23:47,TopGun,Sr. Member,490,252,,[ANN][MLD] LAUNCHING MOLD GAME PLATFORM,I've heard of several similar blockchain projects. How is this different from the others?,False
854,msg25041202,https://bitcointalk.org/index.php?topic=2158545.0,,26126,Announcements (Altcoins),2017-11-22 20:43:29,Mary_Tuedor,Member,98,10,,[ANN][MLD] LAUNCHING MOLD GAME PLATFORM,The sale of tokens has already begun? I do not find this information,False
855,msg25041464,https://bitcointalk.org/index.php?topic=2158545.0,msg25041202,26126,Announcements (Altcoins),2017-11-22 20:49:38,Seidr,Full Member,350,107,,[ANN][MLD] LAUNCHING MOLD GAME PLATFORM,"   Sales started on October 1, but I do not see the end date. Maybe it is still going on?",False
856,msg25041673,https://bitcointalk.org/index.php?topic=2158545.0,msg25041464,26126,Announcements (Altcoins),2017-11-22 20:55:00,Mary_Tuedor,Member,98,10,,[ANN][MLD] LAUNCHING MOLD GAME PLATFORM,"   Okay, thanks a lot. By the way, is there no scale on the website that would reflect the progress of the campaign?",False
857,msg25041972,https://bitcointalk.org/index.php?topic=2158545.0,msg25020514,26126,Announcements (Altcoins),2017-11-22 21:01:44,dedmaroz,Sr. Member,560,255,,[ANN][MLD] LAUNCHING MOLD GAME PLATFORM,"   You're mistaken, this is not the first project. But, it seems to me, this model looks most viable",False
858,msg25042179,https://bitcointalk.org/index.php?topic=2158545.0,msg25041972,26126,Announcements (Altcoins),2017-11-22 21:06:13,kaytokeyos,Sr. Member,343,250,,[ANN][MLD] LAUNCHING MOLD GAME PLATFORM,"   Honestly, I do not recall such systems. Are you sure you're not mistaken?",False
859,msg25042575,https://bitcointalk.org/index.php?topic=2158545.0,,26126,Announcements (Altcoins),2017-11-22 21:15:50,kolinko,Full Member,518,101,,[ANN][MLD] LAUNCHING MOLD GAME PLATFORM,"The project looks interesting. I'm not particularly versed in computer games, tell me, does the community really need such a platform?",False
860,msg25042873,https://bitcointalk.org/index.php?topic=2158545.0,msg25042575,26126,Announcements (Altcoins),2017-11-22 21:23:16,$Darkloard$,Sr. Member,392,250,,[ANN][MLD] LAUNCHING MOLD GAME PLATFORM,"   Yes, gamers lack a reliable platform for selling in-game items. Unfortunately, fraud here suffices",False
861,msg25043026,https://bitcointalk.org/index.php?topic=2158545.0,msg25042873,26126,Announcements (Altcoins),2017-11-22 21:27:04,kolinko,Full Member,518,101,,[ANN][MLD] LAUNCHING MOLD GAME PLATFORM,   But the developers say that you can buy games here. So this will work like Steam?,False
862,msg25043326,https://bitcointalk.org/index.php?topic=2158545.0,msg25043026,26126,Announcements (Altcoins),2017-11-22 21:34:35,23coins,Sr. Member,434,250,,[ANN][MLD] LAUNCHING MOLD GAME PLATFORM,"   If you exaggerate everything, then you are right. As far as I understand, the platform allows even to raise funds for the development of the game. Such a function of Steam does not possess",False
863,msg24955151,https://bitcointalk.org/index.php?topic=2158545.0,msg24954956,26126,Announcements (Altcoins),2017-11-21 12:43:28,miraclebets,Full Member,154,100,,[ANN][MLD] LAUNCHING MOLD GAME PLATFORM,"  Well, in general, the project is translated into the main languages. Japanese, Chinese and English. Is this not enough? In addition, translations are usually handled by members of the campaign bounty, am I not right?",False
864,msg24955641,https://bitcointalk.org/index.php?topic=2158545.0,msg24955151,26126,Announcements (Altcoins),2017-11-21 12:52:35,dedmaroz,Sr. Member,560,255,,[ANN][MLD] LAUNCHING MOLD GAME PLATFORM,"  But I did not find any information about the campaign bounty, so I ask here.",False
865,msg24955660,https://bitcointalk.org/index.php?topic=2158545.0,,26126,Announcements (Altcoins),2017-11-21 12:53:01,Robotboy,Newbie,10,0,,[ANN][MLD] LAUNCHING MOLD GAME PLATFORM,What about the campaign bounty?,False
866,msg24955871,https://bitcointalk.org/index.php?topic=2158545.0,msg24955641,26126,Announcements (Altcoins),2017-11-21 12:57:08,miraclebets,Full Member,154,100,,[ANN][MLD] LAUNCHING MOLD GAME PLATFORM,  Most likely the bounty campaign will soon be available. At least I've seen this information from devs,False
867,msg24956517,https://bitcointalk.org/index.php?topic=2158545.0,,26126,Announcements (Altcoins),2017-11-21 13:08:12,okaypool,Full Member,476,100,,[ANN][MLD] LAUNCHING MOLD GAME PLATFORM,"I do not fully understand the essence, can I make real money in games based on the MOLD game platform?",False
868,msg24956813,https://bitcointalk.org/index.php?topic=2158545.0,msg24955871,26126,Announcements (Altcoins),2017-11-21 13:12:56,spartanrules,Sr. Member,700,250,,[ANN][MLD] LAUNCHING MOLD GAME PLATFORM,  English is the primary language and Japanese and Chinese I do not think so,False
869,msg24956974,https://bitcointalk.org/index.php?topic=2158545.0,msg24956813,26126,Announcements (Altcoins),2017-11-21 13:15:12,miraclebets,Full Member,154,100,,[ANN][MLD] LAUNCHING MOLD GAME PLATFORM,"  Why do not you think so? The developers of this project from Japan and first of all they rely on the Asian market, it seems logical to me that the Japanese and Chinese language developers have priority.",False
870,msg24957064,https://bitcointalk.org/index.php?topic=2158545.0,msg24956517,26126,Announcements (Altcoins),2017-11-21 13:16:41,tarzanbigcity,Sr. Member,602,250,,[ANN][MLD] LAUNCHING MOLD GAME PLATFORM,"  Well, actually, yes. This is the feature of this gaming platform!",False
871,msg24957342,https://bitcointalk.org/index.php?topic=2158545.0,msg24957064,26126,Announcements (Altcoins),2017-11-21 13:20:48,ooxtcoo,Sr. Member,658,250,,[ANN][MLD] LAUNCHING MOLD GAME PLATFORM,  consider this the main advantage of ICO,False
872,msg24957976,https://bitcointalk.org/index.php?topic=2158545.0,,26126,Announcements (Altcoins),2017-11-21 13:30:59,okaypool,Full Member,476,100,,[ANN][MLD] LAUNCHING MOLD GAME PLATFORM,"I do not quite understand how the voting regime will work. Every 3 months, users of the MOLD Platform will vote, but for what? And how will this work?",False
873,msg24958098,https://bitcointalk.org/index.php?topic=2158545.0,,26126,Announcements (Altcoins),2017-11-21 13:33:08,copyfile,Sr. Member,602,251,,[ANN][MLD] LAUNCHING MOLD GAME PLATFORM,How do developers plan to monetize their platform? What will be the basis for the revenue of the MOLD platform?,False
874,msg24958228,https://bitcointalk.org/index.php?topic=2158545.0,,26126,Announcements (Altcoins),2017-11-21 13:35:15,spartanrules,Sr. Member,700,250,,[ANN][MLD] LAUNCHING MOLD GAME PLATFORM,finally found ICO which is a long time pre-sale,False
875,msg24958686,https://bitcointalk.org/index.php?topic=2158545.0,msg24958228,26126,Announcements (Altcoins),2017-11-21 13:42:34,ooxtcoo,Sr. Member,658,250,,[ANN][MLD] LAUNCHING MOLD GAME PLATFORM,  why?,False
876,msg24958739,https://bitcointalk.org/index.php?topic=2158545.0,msg24957976,26126,Announcements (Altcoins),2017-11-21 13:43:22,tarzanbigcity,Sr. Member,602,250,,[ANN][MLD] LAUNCHING MOLD GAME PLATFORM,"  The voting system will use the open mechanism of DAO. Voting will be conducted in order to determine the company's distribution strategy. Following the voting results, the company's dividends will be distributed proportionally taking into account all votes. You can vote only once in 3 months, MOLD will specifically send one ""voice"" to each user of the platform.  ",False
877,msg24958920,https://bitcointalk.org/index.php?topic=2158545.0,msg24958098,26126,Announcements (Altcoins),2017-11-21 13:46:22,Sakiri4,Sr. Member,616,250,,[ANN][MLD] LAUNCHING MOLD GAME PLATFORM,"  I can not say what exactly the profit will come from, most likely from games and developers, from which certain commissions will be charged. Also within the platform will be placed advertising, which will bring profit. Trade in various game items may also bring a portion of the profits",False
878,msg24959093,https://bitcointalk.org/index.php?topic=2158545.0,msg24958686,26126,Announcements (Altcoins),2017-11-21 13:49:07,spartanrules,Sr. Member,700,250,,[ANN][MLD] LAUNCHING MOLD GAME PLATFORM,  never seen before anywhere such a large period of time for pre-sale,False
879,msg24959143,https://bitcointalk.org/index.php?topic=2158545.0,msg24958739,26126,Announcements (Altcoins),2017-11-21 13:50:09,okaypool,Full Member,476,100,,[ANN][MLD] LAUNCHING MOLD GAME PLATFORM,"  Very interesting system, I see this for the first time. It turns out that Moldcoin holders are regarded by the company as investors with a certain right to vote, right?",False
880,msg25018752,https://bitcointalk.org/index.php?topic=2158545.0,,26126,Announcements (Altcoins),2017-11-22 13:23:53,Mrbee,Full Member,456,100,,[ANN][MLD] LAUNCHING MOLD GAME PLATFORM,"Just read whitepaper, got interested and studied project more thoroughly. In my opinion, that’s very interesting and ambitious project. I can only wish good luck to project’s team in its realization.",False
881,msg25019759,https://bitcointalk.org/index.php?topic=2158545.0,msg25018752,26126,Announcements (Altcoins),2017-11-22 13:41:36,Teal Deer,Sr. Member,714,250,,[ANN][MLD] LAUNCHING MOLD GAME PLATFORM,  what specifically seemed interesting to you?,False
882,msg25020514,https://bitcointalk.org/index.php?topic=2158545.0,msg25019759,26126,Announcements (Altcoins),2017-11-22 13:54:26,Mrbee,Full Member,456,100,,[ANN][MLD] LAUNCHING MOLD GAME PLATFORM,"  Basically, project got my attention because of one important thing. MOLD is first project that deal with game industry in general and single games in particular, which means that lot of gamers will be also interested in it.",False
883,msg24949193,https://bitcointalk.org/index.php?topic=2158545.0,,26126,Announcements (Altcoins),2017-11-21 10:49:32,spartanrules,Sr. Member,700,250,,[ANN][MLD] LAUNCHING MOLD GAME PLATFORM,"the fact that the main Director so young is surprising, of course, but also inspires confidence",False
884,msg24949395,https://bitcointalk.org/index.php?topic=2158545.0,msg24949059,26126,Announcements (Altcoins),2017-11-21 10:53:49,kaltar,Sr. Member,805,250,,[ANN][MLD] LAUNCHING MOLD GAME PLATFORM,"  Because the MMO game culture in these countries is much more developed. Asians spend more time in games and virtual worlds than other part of the world population. First of all, this project will be interesting for these countries.",False
885,msg24949673,https://bitcointalk.org/index.php?topic=2158545.0,msg24949395,26126,Announcements (Altcoins),2017-11-21 10:59:24,lg15x,Hero Member,728,500,,[ANN][MLD] LAUNCHING MOLD GAME PLATFORM,"  Well, if you're talking about what will be interesting first of all, you are certainly right but no one does not exclude the interest of other countries",False
886,msg24949928,https://bitcointalk.org/index.php?topic=2158545.0,msg24949395,26126,Announcements (Altcoins),2017-11-21 11:04:22,Sakiri4,Sr. Member,616,250,,[ANN][MLD] LAUNCHING MOLD GAME PLATFORM,"  Why did you draw such conclusions? The whole world plays in the MMO, for example, the same Destiny. In-game currency, various game items, etc. are also an integral part of the game. This is a very interesting concept, to unite all the game items and currency into one single system. Your statement is more like racism than the truth.",False
887,msg24950127,https://bitcointalk.org/index.php?topic=2158545.0,msg24949928,26126,Announcements (Altcoins),2017-11-21 11:08:08,spartanrules,Sr. Member,700,250,,[ANN][MLD] LAUNCHING MOLD GAME PLATFORM,"  you are right,I also think that MMO games are not only interested in Asian countries",False
888,msg24950214,https://bitcointalk.org/index.php?topic=2158545.0,msg24950127,26126,Announcements (Altcoins),2017-11-21 11:09:51,lg15x,Hero Member,728,500,,[ANN][MLD] LAUNCHING MOLD GAME PLATFORM,  if you think it is valid anywhere in the world not so developed game industry in these countries and it is true that these countries have a far higher percentage of interested,False
889,msg24950318,https://bitcointalk.org/index.php?topic=2158545.0,msg24949193,26126,Announcements (Altcoins),2017-11-21 11:11:42,lg15x,Hero Member,728,500,,[ANN][MLD] LAUNCHING MOLD GAME PLATFORM,"  in General, the entire team varied and interesting each member unique",False
890,msg24950343,https://bitcointalk.org/index.php?topic=2158545.0,msg24949928,26126,Announcements (Altcoins),2017-11-21 11:12:12,kaltar,Sr. Member,805,250,,[ANN][MLD] LAUNCHING MOLD GAME PLATFORM,"  Maybe you're right, but not really. If we compare statistical data, in Asian countries MMO games are much more popular and play more people in them than in the rest of the world. I'm not trying to offend or offend anyone, it's just statistics. From these statistics, I concluded that this project will be of interest primarily to the Asian countries.",False
891,msg24950488,https://bitcointalk.org/index.php?topic=2158545.0,msg24950343,26126,Announcements (Altcoins),2017-11-21 11:14:56,lg15x,Hero Member,728,500,,[ANN][MLD] LAUNCHING MOLD GAME PLATFORM,  the statement about the fact that the statement racist is too much and was too harsh said,False
892,msg24950935,https://bitcointalk.org/index.php?topic=2158545.0,msg24950318,26126,Announcements (Altcoins),2017-11-21 11:23:38,hikky22,Sr. Member,490,250,,[ANN][MLD] LAUNCHING MOLD GAME PLATFORM,  of course what kind of project are the developers.,False
893,msg24951096,https://bitcointalk.org/index.php?topic=2158545.0,msg24950935,26126,Announcements (Altcoins),2017-11-21 11:26:50,lg15x,Hero Member,728,500,,[ANN][MLD] LAUNCHING MOLD GAME PLATFORM,  do you think ICO is unusual?,False
894,msg24951161,https://bitcointalk.org/index.php?topic=2158545.0,msg24950343,26126,Announcements (Altcoins),2017-11-21 11:28:02,miraclebets,Full Member,154,100,,[ANN][MLD] LAUNCHING MOLD GAME PLATFORM,"  What is the significance of statistics? If MMO is more popular in one or another region - okay. The main thing is that the project is successful and functioning, right? I see that this project has great potential, and will be interesting. It does not matter in the world market or in the market of Asia. For me, this is a profitable investment!",False
895,msg24951746,https://bitcointalk.org/index.php?topic=2158545.0,msg24951161,26126,Announcements (Altcoins),2017-11-21 11:39:17,Sakiri4,Sr. Member,616,250,,[ANN][MLD] LAUNCHING MOLD GAME PLATFORM,"  I completely agree! If this field of activity and project are popular and relevant, then I am ready to invest in it. What is the difference in which countries it is popular or not, most likely I myself will not use this platform, I'm interested in investing in a successful project in order to get my profit from it!",False
896,msg24952171,https://bitcointalk.org/index.php?topic=2158545.0,,26126,Announcements (Altcoins),2017-11-21 11:48:30,2970566,Sr. Member,280,250,,[ANN][MLD] LAUNCHING MOLD GAME PLATFORM,It seems like this will be a good project for investment,False
897,msg24952726,https://bitcointalk.org/index.php?topic=2158545.0,msg24951746,26126,Announcements (Altcoins),2017-11-21 11:58:53,lg15x,Hero Member,728,500,,[ANN][MLD] LAUNCHING MOLD GAME PLATFORM,  I completely agree with the user who says it doesn't matter where popular MMO games.Worthwhile opinion worthy of support,False
898,msg24952862,https://bitcointalk.org/index.php?topic=2158545.0,msg24951096,26126,Announcements (Altcoins),2017-11-21 12:01:35,hikky22,Sr. Member,490,250,,[ANN][MLD] LAUNCHING MOLD GAME PLATFORM,  I can not say that this project is very unusual just want to say that he was standing and of course he has Japanese features which distinguish it from other,False
899,msg24954187,https://bitcointalk.org/index.php?topic=2158545.0,,26126,Announcements (Altcoins),2017-11-21 12:26:34,spartanrules,Sr. Member,700,250,,[ANN][MLD] LAUNCHING MOLD GAME PLATFORM,what about bounty?,False
900,msg24954229,https://bitcointalk.org/index.php?topic=2158545.0,,26126,Announcements (Altcoins),2017-11-21 12:27:12,dedmaroz,Sr. Member,560,255,,[ANN][MLD] LAUNCHING MOLD GAME PLATFORM,What about the translations of this project?,False
901,msg24954592,https://bitcointalk.org/index.php?topic=2158545.0,msg24954229,26126,Announcements (Altcoins),2017-11-21 12:33:34,miraclebets,Full Member,154,100,,[ANN][MLD] LAUNCHING MOLD GAME PLATFORM,  What exactly do you mean? Which translations?,False
902,msg24954956,https://bitcointalk.org/index.php?topic=2158545.0,msg24954592,26126,Announcements (Altcoins),2017-11-21 12:40:15,spartanrules,Sr. Member,700,250,,[ANN][MLD] LAUNCHING MOLD GAME PLATFORM,  I was also interested in this question probably the user meant that there is no translation of white paper into multiple languages that you want,False
903,msg24938506,https://bitcointalk.org/index.php?topic=2158545.0,msg24938369,26126,Announcements (Altcoins),2017-11-21 07:02:22,Seidr,Full Member,350,107,,[ANN][MLD] LAUNCHING MOLD GAME PLATFORM,"  In any case, this is another project and all of the projects are unique and do not have to be compared",False
904,msg24938703,https://bitcointalk.org/index.php?topic=2158545.0,msg24938506,26126,Announcements (Altcoins),2017-11-21 07:07:19,g2com,Sr. Member,364,250,,[ANN][MLD] LAUNCHING MOLD GAME PLATFORM,"  in any case, have we already found a competitor?",False
905,msg24938847,https://bitcointalk.org/index.php?topic=2158545.0,msg24938703,26126,Announcements (Altcoins),2017-11-21 07:11:11,skovbitcoin,Full Member,532,100,,[ANN][MLD] LAUNCHING MOLD GAME PLATFORM,"  I think by the way that if they are in the direction of MMO games, then more profit will be",False
906,msg24939114,https://bitcointalk.org/index.php?topic=2158545.0,msg24938847,26126,Announcements (Altcoins),2017-11-21 07:17:38,Seidr,Full Member,350,107,,[ANN][MLD] LAUNCHING MOLD GAME PLATFORM,  from what such a decision?,False
907,msg24939241,https://bitcointalk.org/index.php?topic=2158545.0,msg24939114,26126,Announcements (Altcoins),2017-11-21 07:20:51,skovbitcoin,Full Member,532,100,,[ANN][MLD] LAUNCHING MOLD GAME PLATFORM,  think by yourself. a huge number of players 20 percent get their things for donate,False
908,msg24939285,https://bitcointalk.org/index.php?topic=2158545.0,,26126,Announcements (Altcoins),2017-11-21 07:21:50,Seidr,Full Member,350,107,,[ANN][MLD] LAUNCHING MOLD GAME PLATFORM,"in fact, then it is easier to make a separate site allowing players to sell the game currency.  And if it gets embarrassed to introduce this technique into a couple of games so that the exchange can go on without leaving the game",False
909,msg24939396,https://bitcointalk.org/index.php?topic=2158545.0,msg24939285,26126,Announcements (Altcoins),2017-11-21 07:24:24,skovbitcoin,Full Member,532,100,,[ANN][MLD] LAUNCHING MOLD GAME PLATFORM,"  Yes, install a small miner in the game which will not heavily load the CPU and quietly sit watching",False
910,msg24939689,https://bitcointalk.org/index.php?topic=2158545.0,msg24939396,26126,Announcements (Altcoins),2017-11-21 07:30:47,Seidr,Full Member,350,107,,[ANN][MLD] LAUNCHING MOLD GAME PLATFORM,"  I think the miner is superfluous. but you can think of something. by type if you are not at home, turn on our program and in your account will drip a currency that can be deduced",False
911,msg24939788,https://bitcointalk.org/index.php?topic=2158545.0,msg24939689,26126,Announcements (Altcoins),2017-11-21 07:33:14,skovbitcoin,Full Member,532,100,,[ANN][MLD] LAUNCHING MOLD GAME PLATFORM,"  in fact, the only difficulty of this project is to find companies that will work together",False
912,msg24939914,https://bitcointalk.org/index.php?topic=2158545.0,msg24939788,26126,Announcements (Altcoins),2017-11-21 07:36:01,Seidr,Full Member,350,107,,[ANN][MLD] LAUNCHING MOLD GAME PLATFORM,"  yes, but if everything works out I do not know what can happen",False
913,msg24940140,https://bitcointalk.org/index.php?topic=2158545.0,msg24939914,26126,Announcements (Altcoins),2017-11-21 07:41:17,skovbitcoin,Full Member,532,100,,[ANN][MLD] LAUNCHING MOLD GAME PLATFORM,"  in my view, if you add this to all games, it can be changed by a gold between games with real money at the rate that will be set by the program",False
914,msg24940227,https://bitcointalk.org/index.php?topic=2158545.0,msg24940140,26126,Announcements (Altcoins),2017-11-21 07:43:16,Seidr,Full Member,350,107,,[ANN][MLD] LAUNCHING MOLD GAME PLATFORM,  you have too big plans and we moved away from the topic,False
915,msg24940260,https://bitcointalk.org/index.php?topic=2158545.0,msg24940227,26126,Announcements (Altcoins),2017-11-21 07:43:57,skovbitcoin,Full Member,532,100,,[ANN][MLD] LAUNCHING MOLD GAME PLATFORM,  agrees but maybe we helped our developer ideas,False
916,msg24940367,https://bitcointalk.org/index.php?topic=2158545.0,msg24940260,26126,Announcements (Altcoins),2017-11-21 07:46:44,Seidr,Full Member,350,107,,[ANN][MLD] LAUNCHING MOLD GAME PLATFORM,  who knows can and helped,False
917,msg24948423,https://bitcointalk.org/index.php?topic=2158545.0,,26126,Announcements (Altcoins),2017-11-21 10:33:46,hikky22,Sr. Member,490,250,,[ANN][MLD] LAUNCHING MOLD GAME PLATFORM,only etherium?,False
918,msg24948429,https://bitcointalk.org/index.php?topic=2158545.0,,26126,Announcements (Altcoins),2017-11-21 10:33:53,Sakiri4,Sr. Member,616,250,,[ANN][MLD] LAUNCHING MOLD GAME PLATFORM,What about the campaign bounty? Where is it?,False
919,msg24948792,https://bitcointalk.org/index.php?topic=2158545.0,msg24948423,26126,Announcements (Altcoins),2017-11-21 10:41:04,spartanrules,Sr. Member,700,250,,[ANN][MLD] LAUNCHING MOLD GAME PLATFORM,  as you can see Yes,False
920,msg24948956,https://bitcointalk.org/index.php?topic=2158545.0,,26126,Announcements (Altcoins),2017-11-21 10:44:41,kaltar,Sr. Member,805,250,,[ANN][MLD] LAUNCHING MOLD GAME PLATFORM,"I'm not sure that a similar project will be of interest to all users. I think it is more focused on the market of Japan, Korea and other Asian countries.",False
921,msg24949043,https://bitcointalk.org/index.php?topic=2158545.0,,26126,Announcements (Altcoins),2017-11-21 10:46:27,lg15x,Hero Member,728,500,,[ANN][MLD] LAUNCHING MOLD GAME PLATFORM,Japanese ICO is associated with the games this means that everything will be done very efficiently,False
922,msg24949059,https://bitcointalk.org/index.php?topic=2158545.0,msg24948956,26126,Announcements (Altcoins),2017-11-21 10:46:42,lg15x,Hero Member,728,500,,[ANN][MLD] LAUNCHING MOLD GAME PLATFORM,  why do you think so?,False
