id,msg_id,parent_id,link_id,Count_read,Forum,Time,Author,Rank,Activity,Merit,Trust,Title,Body,ScamHeader
1,msg46002722,https://bitcointalk.org/index.php?topic=2158545.0,,26126,Announcements (Altcoins),2018-09-21 21:13:12,europesss,Sr. Member,546,250,,[ANN][MLD] LAUNCHING MOLD GAME PLATFORM,"Our new articles on official Medium! It explains the proper protocol to maintain consistency between replicas on MOLD blockchain. Please check it!!  ""Consistency and Duplication in a distributed system (What is the protocol MOLD needs?)"" https://t.co/oTLSIUkgNV https://t.co/5ZjQzGWfjJ",False
2,msg48149462,https://bitcointalk.org/index.php?topic=2158545.0,,26126,Announcements (Altcoins),2018-11-23 06:25:53,Kruncha,Sr. Member,644,250,,[ANN][MLD] LAUNCHING MOLD GAME PLATFORM,"We updated Medium. In the article, we will briefly introduce the background of deciding the development on Tendermint, the concept of MOLD’s original chain in the future, and future prospects.  ""MOLD, guidelines for building decentralised game platform""  https://t.co/xFcZwLjqVr https://t.co/JGDiijtK1P",False
3,msg33704621,https://bitcointalk.org/index.php?topic=2158545.0,,26126,Announcements (Altcoins),2018-04-01 18:58:03,paladium,Sr. Member,448,250,,[ANN][MLD] LAUNCHING MOLD GAME PLATFORM,https://hitbtc.com/exchange/MLD-to-USD  【MOLD is listed on Hitbtc！！]  Thank you for waiting so long. Now MLD can be traded on HitBTC.,False
4,msg33705567,https://bitcointalk.org/index.php?topic=2158545.0,msg33704621,26126,Announcements (Altcoins),2018-04-01 19:11:34,rendravolt,Hero Member,1035,500,,[ANN][MLD] LAUNCHING MOLD GAME PLATFORM,"   This is good news in early April, of course I am also waiting for this, everyone is very happy, just play the volume and make MLD getting bigger.",False
5,msg33737605,https://bitcointalk.org/index.php?topic=2158545.0,,26126,Announcements (Altcoins),2018-04-02 08:06:11,kriptom,Hero Member,644,502,,[ANN][MLD] LAUNCHING MOLD GAME PLATFORM,Very good news. The team is hardworking only because the price has passed since bad times.,False
6,msg33764598,https://bitcointalk.org/index.php?topic=2158545.0,msg33704621,26126,Announcements (Altcoins),2018-04-02 14:25:07,Myrik_BY,Sr. Member,602,265,,[ANN][MLD] LAUNCHING MOLD GAME PLATFORM,"   Good job! Thank You, team!",False
7,msg33777570,https://bitcointalk.org/index.php?topic=2158545.0,,26126,Announcements (Altcoins),2018-04-02 17:10:05,21joker,Jr. Member,289,1,,[ANN][MLD] LAUNCHING MOLD GAME PLATFORM,Hi friends!  MOLD is now listed on Bitgur: https://bitgur.com/coin/MLD,False
8,msg33812250,https://bitcointalk.org/index.php?topic=2158545.0,,26126,Announcements (Altcoins),2018-04-03 06:20:32,Crytocoin,Sr. Member,672,281,,[ANN][MLD] LAUNCHING MOLD GAME PLATFORM,"MOLD is listed on the 链向財経 Project Database, which is famous blockchain project database in china!  https://www.chainfor.com/project/projectDetail.html?projectId=181&projectName=MOLD&from=singlemessage&isappinstalled=0",False
9,msg35943006,https://bitcointalk.org/index.php?topic=2158545.0,,26126,Announcements (Altcoins),2018-04-30 10:11:45,bircoin,Sr. Member,532,251,,[ANN][MLD] LAUNCHING MOLD GAME PLATFORM,"【MOLD announced original chain concept at Harvard CSSA】  At the Harvard CSSA held at Harvard University on April 29, MOLD Project team presented specific details on the original blockchain concept.  New WhitePaper will be released soon, so please be patient for a while.",False
10,msg35998571,https://bitcointalk.org/index.php?topic=2158545.0,,26126,Announcements (Altcoins),2018-05-01 02:56:10,bountyhunter433,Newbie,70,0,,[ANN][MLD] LAUNCHING MOLD GAME PLATFORM,"Mold is a really interesting project, which truly reveals the potential of the platform Ethereum! It is very cool!",False
11,msg37685239,https://bitcointalk.org/index.php?topic=2158545.0,,26126,Announcements (Altcoins),2018-05-18 14:37:11,mavelmateli6,Newbie,12,0,,[ANN][MLD] LAUNCHING MOLD GAME PLATFORM,Is it worth it anyway to start all this?,False
12,msg37833889,https://bitcointalk.org/index.php?topic=2158545.0,,26126,Announcements (Altcoins),2018-05-19 19:40:28,frirstfootonthemoon1989,Newbie,98,0,,[ANN][MLD] LAUNCHING MOLD GAME PLATFORM,"game industry in crypto not succesful now. Just look and gimli, refereum and bitguild. How you gonna be better than them?",False
13,msg38408626,https://bitcointalk.org/index.php?topic=2158545.0,,26126,Announcements (Altcoins),2018-05-24 14:52:41,mimipupu11,Newbie,128,0,,[ANN][MLD] LAUNCHING MOLD GAME PLATFORM,With whom from the marketing department can I talk?,False
14,msg38408857,https://bitcointalk.org/index.php?topic=2158545.0,,26126,Announcements (Altcoins),2018-05-24 14:55:09,remodex9,Newbie,132,0,,[ANN][MLD] LAUNCHING MOLD GAME PLATFORM,"Mold is a really pro project, which truly reveals the potential of the platform Ethereum!",False
15,msg38610703,https://bitcointalk.org/index.php?topic=2158545.0,msg33704621,26126,Announcements (Altcoins),2018-05-26 11:15:24,gweigster,Full Member,560,102,,[ANN][MLD] LAUNCHING MOLD GAME PLATFORM,"   Awesome, all we need now is some more publicity to get the trading volume up and a listing on more exchanges. Once it reaches enough volume for coinmarketcap it will all be good",False
16,msg39508590,https://bitcointalk.org/index.php?topic=2158545.0,,26126,Announcements (Altcoins),2018-06-06 14:05:08,yourselfe99z9,Newbie,98,0,,[ANN][MLD] LAUNCHING MOLD GAME PLATFORM,"Honestly,Can I take part in a bounty program? I wanna join but I dont know how to do it",False
17,msg40166623,https://bitcointalk.org/index.php?topic=2158545.0,,26126,Announcements (Altcoins),2018-06-15 11:40:32,DogTheHunter,Sr. Member,784,272,,[ANN][MLD] LAUNCHING MOLD GAME PLATFORM,Our new official blog is released on Medium! We will update articles about MOLD development several times per month. Please check it!  https://medium.com/mold-project,False
18,msg42168602,https://bitcointalk.org/index.php?topic=2158545.0,,26126,Announcements (Altcoins),2018-07-14 16:27:18,Transformers,Full Member,313,100,,[ANN][MLD] LAUNCHING MOLD GAME PLATFORM,When will MLD be listed on Coinmarketcap.com ?,False
19,msg42924807,https://bitcointalk.org/index.php?topic=2158545.0,,26126,Announcements (Altcoins),2018-07-26 17:10:54,bitbouillion,Sr. Member,870,250,,[ANN][MLD] LAUNCHING MOLD GAME PLATFORM,"In the official Medium, we updated articles about synchronization between nodes in distributed system. This article describes about clock synchronization and exclusive control algorithm performed in Blockchain network.  https://medium.com/mold-project/synchronization-609369558ce7",False
20,msg43768954,https://bitcointalk.org/index.php?topic=2158545.0,,26126,Announcements (Altcoins),2018-08-09 13:08:46,smic,Sr. Member,831,250,,[ANN][MLD] LAUNCHING MOLD GAME PLATFORM,"We’ve published a new article on our official Medium about the Relationship between Tendermint & MOLD. With the analysis and benchmark of  transaction thorough put, we explain about the features of Tendermint and possibility for the vision of MOLD.",False
21,msg44167411,https://bitcointalk.org/index.php?topic=2158545.0,,26126,Announcements (Altcoins),2018-08-16 08:01:41,pumawolf,Sr. Member,970,250,,[ANN][MLD] LAUNCHING MOLD GAME PLATFORM,We’ve published a new article on our official Medium about The possibility of adopting Plasma as a scaling solution. We summarize the Plasma and mention the possibility of becoming one of the scaling means on the MOLD platform. https://medium.com/mold-project/plasma-scaling-en-782aba7ca04b,False
22,msg44167481,https://bitcointalk.org/index.php?topic=2158545.0,,26126,Announcements (Altcoins),2018-08-16 08:02:52,OlEl,Newbie,14,0,,[ANN][MLD] LAUNCHING MOLD GAME PLATFORM,"Wow, great work!  Hope everything will be good!! ",False
23,msg32345853,https://bitcointalk.org/index.php?topic=2158545.0,,26126,Announcements (Altcoins),2018-03-15 06:40:17,thew3apon,Hero Member,784,500,,[ANN][MLD] LAUNCHING MOLD GAME PLATFORM,"Good two new ;  1-We look forward to adding token of MOLD Decentralized Game Platform on @HitBTC. $MLD will be listed on April 1st, 2018 with 0% trading commission!  BTC, ETH and USDT pairs available. Stay tuned!  2- 【ETH present campaign !】  0.1 ETH will be gifted to 10 people every month. Follow @MOLD_games_EN and RT & like to our tweet.  This month, we'll choose 10 people from those who give like or RT to our tweet in March and we'll them on April 1st.  Please join our campaign!",False
24,msg32349605,https://bitcointalk.org/index.php?topic=2158545.0,msg32345853,26126,Announcements (Altcoins),2018-03-15 07:50:21,ELE.ZYK,Full Member,434,100,,[ANN][MLD] LAUNCHING MOLD GAME PLATFORM,  MOLD is finally going to go to the exchange. It's a good news. I can't wait for it. I hope everything goes well.,False
25,msg32438564,https://bitcointalk.org/index.php?topic=2158545.0,,26126,Announcements (Altcoins),2018-03-16 11:19:33,nopedope89,Legendary,1082,1059,,[ANN][MLD] LAUNCHING MOLD GAME PLATFORM, MOLD Gaming-platform PV」 was released on Youtube.  https://www.youtube.com/watch?v=payCfMnxUsk&feature=youtu.be,False
26,msg32619807,https://bitcointalk.org/index.php?topic=2158545.0,,26126,Announcements (Altcoins),2018-03-18 19:36:56,Shadow Night,Newbie,4,0,,[ANN][MLD] LAUNCHING MOLD GAME PLATFORM,https://idex.market/eth/mld  On IDEX!,False
27,msg32627882,https://bitcointalk.org/index.php?topic=2158545.0,msg32619807,26126,Announcements (Altcoins),2018-03-18 22:01:19,kriptom,Hero Member,644,502,,[ANN][MLD] LAUNCHING MOLD GAME PLATFORM,   Hitbtc was really nice news first. I am still hopeful of this project.,False
28,msg32628103,https://bitcointalk.org/index.php?topic=2158545.0,msg32627882,26126,Announcements (Altcoins),2018-03-18 22:06:25,Shadow Night,Newbie,4,0,,[ANN][MLD] LAUNCHING MOLD GAME PLATFORM,   yes indeed. I just hope they dont fuck up with the deposit/withdrawal or putting MOLD in maintenance for month...been 4 month and still no ignis drop...and then the other token for ignis holders...but better than nothing I suppose. They need marketing tho. No one knows about MOLD and since its been 4 month of inactivity we really need some shilling.,False
29,msg32628936,https://bitcointalk.org/index.php?topic=2158545.0,,26126,Announcements (Altcoins),2018-03-18 22:23:09,Red Lanterns,Member,140,11,,[ANN][MLD] LAUNCHING MOLD GAME PLATFORM,Yet another game platform. How would you be different from other?,False
30,msg32629172,https://bitcointalk.org/index.php?topic=2158545.0,msg32628936,26126,Announcements (Altcoins),2018-03-18 22:28:23,Shadow Night,Newbie,4,0,,[ANN][MLD] LAUNCHING MOLD GAME PLATFORM,   This project is actually really good. Read the WP and look at videos at youtube. Even though the team is young they are more than capable. There are some really interesting ideas they want to implement. I hope their marketing kicks in soon. Its going to moon. .Only 15 million marketcap. Maybe even less but that the amount raised in ICO.,False
31,msg32706335,https://bitcointalk.org/index.php?topic=2158545.0,msg32349605,26126,Announcements (Altcoins),2018-03-19 21:21:14,Shadow Night,Newbie,4,0,,[ANN][MLD] LAUNCHING MOLD GAME PLATFORM,    Why isnt MOLD team announcing the listing on IDEX as well?,False
32,msg32734648,https://bitcointalk.org/index.php?topic=2158545.0,,26126,Announcements (Altcoins),2018-03-20 08:25:51,paladium,Sr. Member,448,250,,[ANN][MLD] LAUNCHING MOLD GAME PLATFORM,"1 RT or 1 like within the term is regarded as 1 vote. So the more you retweet or like our tweet, the higher the possibility you can get ETH will be.  Please join our campaign!",False
33,msg32812345,https://bitcointalk.org/index.php?topic=2158545.0,,26126,Announcements (Altcoins),2018-03-21 08:45:07,Cryptosis,Full Member,280,102,,[ANN][MLD] LAUNCHING MOLD GAME PLATFORM,"2018 TokenSky Greetings  A speech greeting video on the conference ""TokenSky"" held in Seoul, Korea. Shunsuke Yoda, CTO of MOLD project, joined the interview! MOLD will start from 5: 08.  https://www.youtube.com/watch?v=6higK9vDsfE",False
34,msg32883946,https://bitcointalk.org/index.php?topic=2158545.0,,26126,Announcements (Altcoins),2018-03-22 07:28:43,bircoin,Sr. Member,532,251,,[ANN][MLD] LAUNCHING MOLD GAME PLATFORM,"In March 24th & 25th,  MOLD will participate in the Asia-Pacific Blockchain Forum-ToKyo and deliver a speech about MOLD game platform.  http://ullqax.epub360.cn/v2/manage/book/0vdd0t/?from=singlemessage&isappinstalled=0",False
35,msg32950015,https://bitcointalk.org/index.php?topic=2158545.0,,26126,Announcements (Altcoins),2018-03-23 03:49:57,phatgiao,Newbie,80,0,,[ANN][MLD] LAUNCHING MOLD GAME PLATFORM,I think I understand why Mold has not been placed on  exchanges. Look at the market. It is now reeling. Our tokens could already depreciate on the exchange. Maybe this is correct. It's worth a while to wait,False
36,msg32980278,https://bitcointalk.org/index.php?topic=2158545.0,,26126,Announcements (Altcoins),2018-03-23 13:01:04,Easy2Mine,Hero Member,854,500,,[ANN][MLD] LAUNCHING MOLD GAME PLATFORM,"In April 4th & 5th, MOLD will participate in Beyond Blocks Summit Tokyo as an official sponsor and  exhibit our booth there!  https://beyondblocks.com/",False
37,msg32996861,https://bitcointalk.org/index.php?topic=2158545.0,,26126,Announcements (Altcoins),2018-03-23 16:44:20,nopedope89,Legendary,1082,1059,,[ANN][MLD] LAUNCHING MOLD GAME PLATFORM,"Today MOLD will also join to the ""TEAMZ BUSINESS SUMMIT TOKYO"". Medias from all over the world are participating, so we will actively engage in promoting our project!  It's good that the team is active recently.",False
38,msg33456296,https://bitcointalk.org/index.php?topic=2158545.0,msg32345853,26126,Announcements (Altcoins),2018-03-29 15:28:33,Kuala Lumpur,Member,420,69,,[ANN][MLD] LAUNCHING MOLD GAME PLATFORM,"  Seriously? Will the MLD Token be added to HitBTC? Can I ask for proof of this information? If it's still true, then they are gorgeous news. Another would be added to the coinmarketcap ...",False
39,msg33456562,https://bitcointalk.org/index.php?topic=2158545.0,msg33456296,26126,Announcements (Altcoins),2018-03-29 15:31:23,Visesrion,Sr. Member,826,314,,[ANN][MLD] LAUNCHING MOLD GAME PLATFORM,  coinmarketcap is very important that would quickly add to it,False
40,msg33657847,https://bitcointalk.org/index.php?topic=2158545.0,,26126,Announcements (Altcoins),2018-04-01 08:56:38,kim-yon,Sr. Member,546,251,,[ANN][MLD] LAUNCHING MOLD GAME PLATFORM,"MLD listing is delaying  Now MOLD project team has confirmed MLD is not reflected in Hitbtc on the time we announced.  We are asking the support of hitBTC about it, so please wait for a while. We’ll report as soon as confirmation is received regarding further details.",False
41,msg33658544,https://bitcointalk.org/index.php?topic=2158545.0,,26126,Announcements (Altcoins),2018-04-01 09:06:12,spawn4ever,Full Member,574,111,,[ANN][MLD] LAUNCHING MOLD GAME PLATFORM,"game industry in crypto not succesful now. Just look and gimli, refereum and bitguild. How you gonna be better than them?",False
42,msg33693428,https://bitcointalk.org/index.php?topic=2158545.0,,26126,Announcements (Altcoins),2018-04-01 16:29:46,kim-yon,Sr. Member,546,251,,[ANN][MLD] LAUNCHING MOLD GAME PLATFORM,"【MOLD, About Hitbtc listing time change】  We apologize for the delay.  Currently MOLD has received notice from HitBTC that listing time is going to be further postponed from 3.00pm UTC by 2 to 3 hours  Please wait for a while.",False
43,msg29165202,https://bitcointalk.org/index.php?topic=2158545.0,msg29137164,26126,Announcements (Altcoins),2018-01-29 12:22:50,skratchface,Newbie,5,0,,[ANN][MLD] LAUNCHING MOLD GAME PLATFORM,   Pls tell the team to make sure they have read what I have written in slack. Confirm that you have conveyed this message to them pls. This is very urgent!,False
44,msg29248395,https://bitcointalk.org/index.php?topic=2158545.0,,26126,Announcements (Altcoins),2018-01-30 15:30:25,skratchface,Newbie,5,0,,[ANN][MLD] LAUNCHING MOLD GAME PLATFORM,"An important announcement is coming up guys! Stay tuned, 1 of februari is going to be breathtaking!",False
45,msg29293659,https://bitcointalk.org/index.php?topic=2158545.0,,26126,Announcements (Altcoins),2018-01-31 08:00:55,sezyumx,Hero Member,686,500,,[ANN][MLD] LAUNCHING MOLD GAME PLATFORM,When will the stock market be listed. I have sympathies with Far East projects but Starbase and mold projects can not be listed in exchange.,False
46,msg29337695,https://bitcointalk.org/index.php?topic=2158545.0,msg29293659,26126,Announcements (Altcoins),2018-01-31 19:49:23,skratchface,Newbie,5,0,,[ANN][MLD] LAUNCHING MOLD GAME PLATFORM,  ¨  What do you mean by that they can not be listed on exchanges? Why not?,False
47,msg29384943,https://bitcointalk.org/index.php?topic=2158545.0,,26126,Announcements (Altcoins),2018-02-01 13:38:38,makalu,Sr. Member,441,250,,[ANN][MLD] LAUNCHING MOLD GAME PLATFORM,"Looking forward to landing on the exchange platform, but it doesn't seem like a good time now, the whole market is going down.",False
48,msg29630086,https://bitcointalk.org/index.php?topic=2158545.0,,26126,Announcements (Altcoins),2018-02-05 07:05:24,zyrenhufalar11,Newbie,126,0,,[ANN][MLD] LAUNCHING MOLD GAME PLATFORM,Very interesting ! Love the roadmap ,False
49,msg29927192,https://bitcointalk.org/index.php?topic=2158545.0,,26126,Announcements (Altcoins),2018-02-09 12:50:39,thew3apon,Hero Member,784,500,,[ANN][MLD] LAUNCHING MOLD GAME PLATFORM,No volume in Etherdelta. It has to be listed on a new stock exchange. You need to do advertising.,False
50,msg30038771,https://bitcointalk.org/index.php?topic=2158545.0,msg29927192,26126,Announcements (Altcoins),2018-02-11 03:07:11,Mary_Tuedor,Member,98,10,,[ANN][MLD] LAUNCHING MOLD GAME PLATFORM,   We negotiate at once with 5 exchanges,False
51,msg30225086,https://bitcointalk.org/index.php?topic=2158545.0,,26126,Announcements (Altcoins),2018-02-13 18:01:53,tetrisdancyo,Jr. Member,192,5,,[ANN][MLD] LAUNCHING MOLD GAME PLATFORM,It's sound good,False
52,msg30225844,https://bitcointalk.org/index.php?topic=2158545.0,,26126,Announcements (Altcoins),2018-02-13 18:14:15,tetrisdancyo,Jr. Member,192,5,,[ANN][MLD] LAUNCHING MOLD GAME PLATFORM,I try bountyBTC,False
53,msg30226049,https://bitcointalk.org/index.php?topic=2158545.0,msg29362380,26126,Announcements (Altcoins),2018-02-13 18:17:26,Arrrvin,Member,700,42,,[ANN][MLD] LAUNCHING MOLD GAME PLATFORM, ,False
54,msg30276920,https://bitcointalk.org/index.php?topic=2158545.0,msg30226049,26126,Announcements (Altcoins),2018-02-14 13:51:30,Cashcash,Sr. Member,644,250,,[ANN][MLD] LAUNCHING MOLD GAME PLATFORM,     I hope it does not scam. Because I invested 7 ETH. They do not make any updates on the site.,False
55,msg30321227,https://bitcointalk.org/index.php?topic=2158545.0,,26126,Announcements (Altcoins),2018-02-15 06:46:06,zyrenhufalar11,Newbie,126,0,,[ANN][MLD] LAUNCHING MOLD GAME PLATFORM, wish for good luck to the developers and all future investors of this project.,False
56,msg30504485,https://bitcointalk.org/index.php?topic=2158545.0,,26126,Announcements (Altcoins),2018-02-17 21:33:12,lordzc,Sr. Member,588,253,,[ANN][MLD] LAUNCHING MOLD GAME PLATFORM,Where can I look at the road map? Or where can I find the team's developments.,False
57,msg31288440,https://bitcointalk.org/index.php?topic=2158545.0,,26126,Announcements (Altcoins),2018-02-28 20:09:19,skratchface,Newbie,5,0,,[ANN][MLD] LAUNCHING MOLD GAME PLATFORM,Guys I found that MOLD is already being traded on forkdelta since ages ago:  https://forkdelta.github.io/#!/trade/MLD-ETH,False
58,msg31337416,https://bitcointalk.org/index.php?topic=2158545.0,,26126,Announcements (Altcoins),2018-03-01 13:58:10,kim-yon,Sr. Member,546,251,,[ANN][MLD] LAUNCHING MOLD GAME PLATFORM,I expect a surprise. Poloniex and Bittrex may be listed. It's just my feelings.,False
59,msg31442101,https://bitcointalk.org/index.php?topic=2158545.0,msg31288440,26126,Announcements (Altcoins),2018-03-02 21:16:52,coinsniperX,Member,224,11,,[ANN][MLD] LAUNCHING MOLD GAME PLATFORM,  When some popular exchange? Why so long?,False
60,msg31442203,https://bitcointalk.org/index.php?topic=2158545.0,msg31337416,26126,Announcements (Altcoins),2018-03-02 21:19:01,coinsniperX,Member,224,11,,[ANN][MLD] LAUNCHING MOLD GAME PLATFORM,"  I don't think so, at least hitbtc or kucoin..or binance..that would be great.",False
61,msg31733511,https://bitcointalk.org/index.php?topic=2158545.0,,26126,Announcements (Altcoins),2018-03-06 20:37:41,thew3apon,Hero Member,784,500,,[ANN][MLD] LAUNCHING MOLD GAME PLATFORM,He's probably trying not to be listed on a stock exchange. I hope the team is working.,False
62,msg32213613,https://bitcointalk.org/index.php?topic=2158545.0,,26126,Announcements (Altcoins),2018-03-13 12:29:31,Easy2Mine,Hero Member,854,500,,[ANN][MLD] LAUNCHING MOLD GAME PLATFORM,There is no innovation in social media. We can not keep up with new news from anywhere.,False
63,msg27884372,https://bitcointalk.org/index.php?topic=2158545.0,msg27870586,26126,Announcements (Altcoins),2018-01-11 04:31:33,grifinmch,Sr. Member,756,250,,[ANN][MLD] LAUNCHING MOLD GAME PLATFORM,"  Yes, it is true that the most important there is also developing projects confidence and teamwork with honest will certainly get big and satisfying results for investors who invest large or great.",False
64,msg28015759,https://bitcointalk.org/index.php?topic=2158545.0,,26126,Announcements (Altcoins),2018-01-13 00:08:44,kriptom,Hero Member,644,502,,[ANN][MLD] LAUNCHING MOLD GAME PLATFORM,When will the tokens be sent? Is there a certain date?,False
65,msg28051251,https://bitcointalk.org/index.php?topic=2158545.0,,26126,Announcements (Altcoins),2018-01-13 13:46:36,kim-yon,Sr. Member,546,251,,[ANN][MLD] LAUNCHING MOLD GAME PLATFORM,I guess the team is not interested in the forum. They never respond to questions.,False
66,msg28137506,https://bitcointalk.org/index.php?topic=2158545.0,,26126,Announcements (Altcoins),2018-01-14 20:06:51,thew3apon,Hero Member,784,500,,[ANN][MLD] LAUNCHING MOLD GAME PLATFORM,Is there a problem with this project? Why are not tokens distributed? I hope it isn't scam.,False
67,msg28320815,https://bitcointalk.org/index.php?topic=2158545.0,,26126,Announcements (Altcoins),2018-01-17 11:21:12,juarezweiss,Member,308,13,,[ANN][MLD] LAUNCHING MOLD GAME PLATFORM,They just posted on Telegram:   ,False
68,msg28357191,https://bitcointalk.org/index.php?topic=2158545.0,msg28320815,26126,Announcements (Altcoins),2018-01-17 21:12:46,paladium,Sr. Member,448,250,,[ANN][MLD] LAUNCHING MOLD GAME PLATFORM,   Thank you for the news. That's good news. I'm starting to be afraid of the project.,False
69,msg28532473,https://bitcointalk.org/index.php?topic=2158545.0,msg28051251,26126,Announcements (Altcoins),2018-01-20 10:20:50,Mary_Tuedor,Member,98,10,,[ANN][MLD] LAUNCHING MOLD GAME PLATFORM,"   Well, we really do not respond very often here. But now we will pay more attention to the forum. Tokens have already been distributed!",False
70,msg28705711,https://bitcointalk.org/index.php?topic=2158545.0,msg28532473,26126,Announcements (Altcoins),2018-01-22 19:59:19,Arrrvin,Member,700,42,,[ANN][MLD] LAUNCHING MOLD GAME PLATFORM,   Unfortunately my bounty tokens have not been sent.  I have translated your ANN thread into Dutch and moderated it: https://bitcointalk.org/index.php?topic=2575008  My given ERC20 adress is: 0xbF6b6F17eC2cDC4FF6406634747F36Ab4837682c  Ethplorer shows that no tokens were sent. Could you please check and send the bounty reward for which I worked?,False
71,msg28776980,https://bitcointalk.org/index.php?topic=2158545.0,,26126,Announcements (Altcoins),2018-01-23 20:10:17,cryptobali,Member,616,11,,[ANN][MLD] LAUNCHING MOLD GAME PLATFORM,"Sorry. I have not received payment for the Twitter campaign №19   https://twitter.com/cryptobali2 Check, please.",False
72,msg28842736,https://bitcointalk.org/index.php?topic=2158545.0,,26126,Announcements (Altcoins),2018-01-24 18:19:24,jhairrobernas,Member,98,10,,[ANN][MLD] LAUNCHING MOLD GAME PLATFORM,"I think that decentralization is the main distinguishing feature.However, I'm not sure that this is what you need for games.So far gamers are suspicious of crypto currency",False
73,msg28946153,https://bitcointalk.org/index.php?topic=2158545.0,msg28776980,26126,Announcements (Altcoins),2018-01-26 07:04:53,Mary_Tuedor,Member,98,10,,[ANN][MLD] LAUNCHING MOLD GAME PLATFORM,"   Write, please, in the Telegram channel about this situation",False
74,msg28953164,https://bitcointalk.org/index.php?topic=2158545.0,,26126,Announcements (Altcoins),2018-01-26 09:12:13,Cashcash,Sr. Member,644,250,,[ANN][MLD] LAUNCHING MOLD GAME PLATFORM,My MLDs have arrived. I hope to be listed on the exchange as soon as possible. I am very hopeful of this project.,False
75,msg28976621,https://bitcointalk.org/index.php?topic=2158545.0,,26126,Announcements (Altcoins),2018-01-26 15:15:45,juarezweiss,Member,308,13,,[ANN][MLD] LAUNCHING MOLD GAME PLATFORM,"I received my MLDs. Thank you for the team, and let's moon! ",False
76,msg28977531,https://bitcointalk.org/index.php?topic=2158545.0,,26126,Announcements (Altcoins),2018-01-26 15:27:51,Arrrvin,Member,700,42,,[ANN][MLD] LAUNCHING MOLD GAME PLATFORM,I received my bounty MLD. I'm very happy with it. Thank you team for being trustworthy!,False
77,msg29047451,https://bitcointalk.org/index.php?topic=2158545.0,,26126,Announcements (Altcoins),2018-01-27 16:45:54,bircoin,Sr. Member,532,251,,[ANN][MLD] LAUNCHING MOLD GAME PLATFORM,Do you have any work to be listed on any exchange? Will it be listed on Japanese exchanges?,False
78,msg29049745,https://bitcointalk.org/index.php?topic=2158545.0,,26126,Announcements (Altcoins),2018-01-27 17:22:43,blobje,Newbie,3,0,,[ANN][MLD] LAUNCHING MOLD GAME PLATFORM,"Hee I invested 30 ETH (and got 300.000 MLD), but two days ago I suddenly got 2.000.000 MLD?!? - Very kind but why is  that? that's a value of 200 ETH!",False
