id,msg_id,parent_id,link_id,Count_read,Forum,Time,Author,Rank,Activity,Merit,Trust,Title,Body,ScamHeader
1,msg16016293,https://bitcointalk.org/index.php?topic=1571738.0,,1299766,Announcements (Altcoins),2016-08-23 17:17:04,paolo77,Legendary,910,1000,,[ANN][rICO]Antshares Blockchain Mainnet is ONLINE!,Update signature I hope not to be wrong . ,False
2,msg16016744,https://bitcointalk.org/index.php?topic=1571738.0,,1299766,Announcements (Altcoins),2016-08-23 17:58:05,chichidori,Legendary,1386,1003,,[ANN][rICO]Antshares Blockchain Mainnet is ONLINE!,"I am not trolling here antshare is gaining lot of popularity and attracted some wealthy investors 4.4k BTC  can get you a good apartment in china and  its not a joke this kind of amount can make heads turn and eyeballs pop out of their sockets, to make it shorter Hackers, ETH and THE DAO had the taste of it. hope antshare have a good security to counter any attacks.",False
3,msg16016944,https://bitcointalk.org/index.php?topic=1571738.0,,1299766,Announcements (Altcoins),2016-08-23 18:16:29,loremipsum,Hero Member,644,501,,[ANN][rICO]Antshares Blockchain Mainnet is ONLINE!,"The english at antshares.org have some grammar mistakes, and so does the subscription email. If you want help with improving the english level let me know, I'm an editor of an english journal and a proofreader",False
4,msg16017429,https://bitcointalk.org/index.php?topic=1571738.0,,1299766,Announcements (Altcoins),2016-08-23 19:10:35,Crypto_FreeMan,Full Member,154,100,,[ANN][rICO]Antshares Blockchain Mainnet is ONLINE!,nice project. and good that this ico have refund. If will be refund of 50% i will receive on 50% more tokens,False
5,msg16017444,https://bitcointalk.org/index.php?topic=1571738.0,,1299766,Announcements (Altcoins),2016-08-23 19:12:10,cryptobart,Full Member,160,100,,[ANN][rICO]Antshares Blockchain Mainnet is ONLINE!,"Good project, support!",False
6,msg16017624,https://bitcointalk.org/index.php?topic=1571738.0,msg16011362,1299766,Announcements (Altcoins),2016-08-23 19:33:45,aqris,Legendary,1288,1003,,[ANN][rICO]Antshares Blockchain Mainnet is ONLINE!,"  Course start bidding on Chinese stock exchanges is very good, but such exchanges as Bittrex and Poloniex must be in the forefront at the start. I hope that it will be.",False
7,msg16018175,https://bitcointalk.org/index.php?topic=1571738.0,,1299766,Announcements (Altcoins),2016-08-23 20:40:17,szachta,Hero Member,518,500,,[ANN][rICO]Antshares Blockchain Mainnet is ONLINE!,Good afternoon.,False
8,msg16018970,https://bitcointalk.org/index.php?topic=1571738.0,msg16013357,1299766,Announcements (Altcoins),2016-08-23 22:38:37,cryptodv,Hero Member,1078,507,,[ANN][rICO]Antshares Blockchain Mainnet is ONLINE!,   For someone to throw 1000 BTC at this project means the investor knows something that average investor doesn't.   ,False
9,msg16019014,https://bitcointalk.org/index.php?topic=1571738.0,msg16018970,1299766,Announcements (Altcoins),2016-08-23 22:46:01,TeamButtcoin,Sr. Member,467,500,,[ANN][rICO]Antshares Blockchain Mainnet is ONLINE!,"  1000 BTC? woow, just woow! I believe in this project but 1000 BTC.... there is something about we don't know. I'll buy more ANT.",False
10,msg16019029,https://bitcointalk.org/index.php?topic=1571738.0,msg16016744,1299766,Announcements (Altcoins),2016-08-23 22:48:29,dahongfei,Member,100,12,,[ANN][rICO]Antshares Blockchain Mainnet is ONLINE!,"   Thank you chichidori for your advice.  Security is always our first priority. For example, we immediately reevaluated our multisig setup after the bitfinex/bitgo hack, and decided to switch to a more conventional manual setup instead of relying on third-party multisig wallet which in some case may extend the attach surface.",False
11,msg16019072,https://bitcointalk.org/index.php?topic=1571738.0,msg16016944,1299766,Announcements (Altcoins),2016-08-23 22:55:38,dahongfei,Member,100,12,,[ANN][rICO]Antshares Blockchain Mainnet is ONLINE!,"   Thank you loremipsum, some of the English materials are produced by our developers. It must contain mistakes.  loremipsum, can you contact ""antshares"" to do editing/proofreading for us?  antshares.org will be revamped after the ICO.",False
12,msg16019211,https://bitcointalk.org/index.php?topic=1571738.0,msg16018970,1299766,Announcements (Altcoins),2016-08-23 23:22:46,DomainMagnate,Hero Member,602,500,,[ANN][rICO]Antshares Blockchain Mainnet is ONLINE!,"  Yes that is absolutely correct.1000 btc is a big investment and unless you are cock sure that something is going to pay back,nobody will invest such a huge amount.",False
13,msg16019439,https://bitcointalk.org/index.php?topic=1571738.0,msg16019072,1299766,Announcements (Altcoins),2016-08-23 23:57:38,loremipsum,Hero Member,644,501,,[ANN][rICO]Antshares Blockchain Mainnet is ONLINE!,"   Sure, I will PM him",False
14,msg16019458,https://bitcointalk.org/index.php?topic=1571738.0,,1299766,Announcements (Altcoins),2016-08-24 00:00:32,Crypto_FreeMan,Full Member,154,100,,[ANN][rICO]Antshares Blockchain Mainnet is ONLINE!,not bad half way and 4400 btc. In  last 2 days this sum can double ),False
15,msg16019969,https://bitcointalk.org/index.php?topic=1571738.0,msg16019439,1299766,Announcements (Altcoins),2016-08-24 01:39:08,antshares,Sr. Member,350,250,,[ANN][rICO]Antshares Blockchain Mainnet is ONLINE!,   come to our slack or add me on skype @DavidthePangwaer ^ ^,False
16,msg16020164,https://bitcointalk.org/index.php?topic=1571738.0,msg16016744,1299766,Announcements (Altcoins),2016-08-24 02:15:29,electronicash,Legendary,1414,1006,,[ANN][rICO]Antshares Blockchain Mainnet is ONLINE!,"   with that much of funds, the could hire and buy devices for the security of their investors. Its just not sure how the coin is going to be used by the rest of the people. one thing is certain though is that this coin is going to attract more attention and will be traded with volume in the months tocome.",False
17,msg16020204,https://bitcointalk.org/index.php?topic=1571738.0,,1299766,Announcements (Altcoins),2016-08-24 02:22:21,Crpto4$,Full Member,182,100,,[ANN][rICO]Antshares Blockchain Mainnet is ONLINE!,"I dont have my own btc address but I use exchanger address ,so can I invest with ex-changer btc address? If yes the then guide please.",False
18,msg16020228,https://bitcointalk.org/index.php?topic=1571738.0,,1299766,Announcements (Altcoins),2016-08-24 02:27:01,ecawyna,Sr. Member,294,250,,[ANN][rICO]Antshares Blockchain Mainnet is ONLINE!,Any news after ending of ICO? Do we need to trade it on Chinese exchange too?,False
19,msg16020243,https://bitcointalk.org/index.php?topic=1571738.0,msg16020204,1299766,Announcements (Altcoins),2016-08-24 02:29:20,grandFX,Legendary,1610,1000,,[ANN][rICO]Antshares Blockchain Mainnet is ONLINE!,"   for more details how to participate https://www.antshares.org/Blog/Details/26  Quote from: ecawyna on August 24, 2016, 02:27:01 AM Any news after ending of ICO? Do we need to trade it on Chinese exchange too?  of course.",False
20,msg16020316,https://bitcointalk.org/index.php?topic=1571738.0,msg16020228,1299766,Announcements (Altcoins),2016-08-24 02:43:12,MR_Zach,Newbie,19,0,,[ANN][rICO]Antshares Blockchain Mainnet is ONLINE!,"   There'll be both China-based and overseas exchanges. So dont worry, you can trade on oversea exchange.",False
21,msg16010873,https://bitcointalk.org/index.php?topic=1571738.0,msg16009908,1299766,Announcements (Altcoins),2016-08-23 08:25:21,Menereron,Member,105,10,,[ANN][rICO]Antshares Blockchain Mainnet is ONLINE!,"   But there is no escrow so the chances of nothing being delivered and the so called team running, are very high. Invest at your own risk, I have my doubts that there is even 10% of the 4k btc raised. Love to see the dev show me proof I'm wrong. I doubt that very much though huh dev? I'll just get some BS spill.",False
22,msg16011028,https://bitcointalk.org/index.php?topic=1571738.0,,1299766,Announcements (Altcoins),2016-08-23 08:44:40,tusandii,Hero Member,924,506,,[ANN][rICO]Antshares Blockchain Mainnet is ONLINE!,"Antshare team wich market you aim for antcoin ? maybe its to far because it just In early phase, but i really want to know it, thanks !",False
23,msg16011282,https://bitcointalk.org/index.php?topic=1571738.0,msg16010873,1299766,Announcements (Altcoins),2016-08-23 09:12:16,antshares,Sr. Member,350,250,,[ANN][rICO]Antshares Blockchain Mainnet is ONLINE!,"   Here we go again. There is nowhere to run. Our members are pretty well-know in the Chinese blockchain industry. Onchain, the company founded by members are working closely with major Chinese financial institutions. Our names, ID, contact....all sorts of information are out there. Plus, there's no incentive to ""run"". 4k btc is not even enough for a decent office/apartment in Shanghai, do you even have a notion of this?  In fact, Antshares is a like a baby that the dev team has been taking care of for the last 2 years. We, our volunteers, the community are all expecting it to grow great. Same in the bitcoin economic incentive model, ask yourself, where we stand to gain the most? It goes without saying.  These are my personal opinions, and I really shouldn't be answering to this kind of trolling.",False
24,msg16011310,https://bitcointalk.org/index.php?topic=1571738.0,msg16011028,1299766,Announcements (Altcoins),2016-08-23 09:15:41,antshares,Sr. Member,350,250,,[ANN][rICO]Antshares Blockchain Mainnet is ONLINE!,"   There'll be both China-based and overseas exchanges. When selecting possible choices, we act very cautiously.",False
25,msg16011362,https://bitcointalk.org/index.php?topic=1571738.0,msg16011310,1299766,Announcements (Altcoins),2016-08-23 09:23:09,zengryT,Hero Member,745,500,,[ANN][rICO]Antshares Blockchain Mainnet is ONLINE!,"   That is great to hear Bittrex and Poloniex are the go to exchanges for the west, you probably already know that. Great to see a coin bridging the gap! This will be very popular coin as has been shown so far in the sale.",False
26,msg16011388,https://bitcointalk.org/index.php?topic=1571738.0,,1299766,Announcements (Altcoins),2016-08-23 09:25:06,Elenkareem,Newbie,41,0,,[ANN][rICO]Antshares Blockchain Mainnet is ONLINE!,"any proof the 4400btc is 'real investor' ? sometimes i think the bitcoin is only 'fake ico' , dev send the bitcoin to his ico address for make more people invest at rICO ? ",False
27,msg16011475,https://bitcointalk.org/index.php?topic=1571738.0,msg16011388,1299766,Announcements (Altcoins),2016-08-23 09:32:49,antshares,Sr. Member,350,250,,[ANN][rICO]Antshares Blockchain Mainnet is ONLINE!,"   I didn't quite get the logic here. Most people think it's over priced and we send btc to those address just to avoid people from investing? Also we are trying to distribute ANS if we invest in ourselves it just beats the purpose of ICO... Again, we are not fake nor runners. Feel free to check transaction history for every investing address listed on our websites. Thanks!",False
28,msg16011483,https://bitcointalk.org/index.php?topic=1571738.0,msg16011388,1299766,Announcements (Altcoins),2016-08-23 09:33:13,tempus,Legendary,1666,1086,,[ANN][rICO]Antshares Blockchain Mainnet is ONLINE!,"   Wouldn't make that much sense. The more Bitcoins flows into the ICO, the higher the price will be and the more cautious potential Investors will be. With other words: They wouldn't necessarily make it more attractive if they would pump it up.",False
29,msg16011542,https://bitcointalk.org/index.php?topic=1571738.0,msg16011388,1299766,Announcements (Altcoins),2016-08-23 09:40:02,disconnectme,Hero Member,1120,504,,[ANN][rICO]Antshares Blockchain Mainnet is ONLINE!,   The 1000BTC invested in this project is still a mystery to me. I don't understand. I just there is no more to it than we already know,False
30,msg16011576,https://bitcointalk.org/index.php?topic=1571738.0,msg16009222,1299766,Announcements (Altcoins),2016-08-23 09:43:45,Sharma,Legendary,1092,1000,,[ANN][rICO]Antshares Blockchain Mainnet is ONLINE!,  I wish you guys best of luck and hope it doesn't go the Waves way.More successfull cryptos are good for all cryptocurruncies including bitcoin,False
31,msg16011583,https://bitcointalk.org/index.php?topic=1571738.0,,1299766,Announcements (Altcoins),2016-08-23 09:44:17,szachta,Hero Member,518,500,,[ANN][rICO]Antshares Blockchain Mainnet is ONLINE!,Invested some BTC.Some much BTC collect.,False
32,msg16011675,https://bitcointalk.org/index.php?topic=1571738.0,msg16011542,1299766,Announcements (Altcoins),2016-08-23 09:52:18,antshares,Sr. Member,350,250,,[ANN][rICO]Antshares Blockchain Mainnet is ONLINE!,"   This is kinda normal in China, part of a high-value's individual's portfolio. One day you may do the same once landed on the moon.(Bitcoin will do that for you, antshare may be able to supply some parts to the ship).  Haha. This is not a serious reply, but you get the point.",False
33,msg16011719,https://bitcointalk.org/index.php?topic=1571738.0,msg16011576,1299766,Announcements (Altcoins),2016-08-23 09:58:03,antshares,Sr. Member,350,250,,[ANN][rICO]Antshares Blockchain Mainnet is ONLINE!,"   Oh we won't, the thing is, this project has been under dev for more than 2 years. And had been in good communications with Chinese community. But I must say this, the success of a project does not only rely on the integrity and decency and capability of its core dev team, but also its community. That's why we also need good members we met here to join us and help to build a better Antshares ecosystem.  I totally agree with you on bitcoin. I myself is kinda a bitcoin fundamentalist (you get the point). This is exactly the tangible, solid progress that the industry and the market is demanding and craving for. In the end it will do good for the entire industry, and achieve sth we all want.",False
34,msg16011799,https://bitcointalk.org/index.php?topic=1571738.0,msg16011362,1299766,Announcements (Altcoins),2016-08-23 10:06:23,DomainMagnate,Hero Member,602,500,,[ANN][rICO]Antshares Blockchain Mainnet is ONLINE!,  True.I haven't seen any coin with so much craze among crypto enthusiasts. Antshares is definitely going to taking the world by storm,False
35,msg16012660,https://bitcointalk.org/index.php?topic=1571738.0,,1299766,Announcements (Altcoins),2016-08-23 11:29:59,altscaner,Member,210,10,,[ANN][rICO]Antshares Blockchain Mainnet is ONLINE!,Ok im follow signature campaign  ...,False
36,msg16012936,https://bitcointalk.org/index.php?topic=1571738.0,msg16011675,1299766,Announcements (Altcoins),2016-08-23 12:00:40,bitwhizz,Legendary,910,1000,,[ANN][rICO]Antshares Blockchain Mainnet is ONLINE!,"   Some rich chineese dude believes in Antshares and invested 1000 BTC, what is so mysterious about that?",False
37,msg16013109,https://bitcointalk.org/index.php?topic=1571738.0,msg16011542,1299766,Announcements (Altcoins),2016-08-23 12:16:56,moppang,Legendary,1134,1000,,[ANN][rICO]Antshares Blockchain Mainnet is ONLINE!,"   You know, bitcoin is anonymous, it is always a mystery for everyone and the bitcoin community in china is very a big. So there are many rich and easy to invest it.",False
38,msg16013357,https://bitcointalk.org/index.php?topic=1571738.0,msg16012936,1299766,Announcements (Altcoins),2016-08-23 12:38:57,rudolfaxl,Legendary,1316,1001,,[ANN][rICO]Antshares Blockchain Mainnet is ONLINE!,   VALUABLE Antshares from chinese!!,False
39,msg16013784,https://bitcointalk.org/index.php?topic=1571738.0,,1299766,Announcements (Altcoins),2016-08-23 13:20:29,paolo77,Legendary,910,1000,,[ANN][rICO]Antshares Blockchain Mainnet is ONLINE!,"Good morning, I need to update the signature?  i'm early user .",False
40,msg16015878,https://bitcointalk.org/index.php?topic=1571738.0,msg16013784,1299766,Announcements (Altcoins),2016-08-23 16:31:44,sri.bima,Sr. Member,602,250,,[ANN][rICO]Antshares Blockchain Mainnet is ONLINE!,"  I think, you must visited on this thread Antshares signature campaign",False
41,msg16007923,https://bitcointalk.org/index.php?topic=1571738.0,msg16007207,1299766,Announcements (Altcoins),2016-08-23 00:33:52,Tauja,Legendary,1162,1000,,[ANN][rICO]Antshares Blockchain Mainnet is ONLINE!,"    yes, I think so. this project is looks promising. already 4474 btc participant in ICO is a big project in the future",False
42,msg16007959,https://bitcointalk.org/index.php?topic=1571738.0,msg16007240,1299766,Announcements (Altcoins),2016-08-23 00:42:08,electronicash,Legendary,1414,1006,,[ANN][rICO]Antshares Blockchain Mainnet is ONLINE!,4474 btc!    Few more weeks and we'll see more than 8k BTC. it does look great.    One way for this project not to end up like how waves project does is to update the users the development of the platform. waves didn't do that. and maybe announce in advance if for instance the team can't make it in time with the roadmap target.,False
43,msg16008304,https://bitcointalk.org/index.php?topic=1571738.0,msg15999674,1299766,Announcements (Altcoins),2016-08-23 01:46:02,pusaka,Hero Member,641,500,,[ANN][rICO]Antshares Blockchain Mainnet is ONLINE!,   I dont think this is another waves project its different,False
44,msg16008428,https://bitcointalk.org/index.php?topic=1571738.0,msg16008304,1299766,Announcements (Altcoins),2016-08-23 02:08:26,Joint Force,Hero Member,799,500,,[ANN][rICO]Antshares Blockchain Mainnet is ONLINE!,"    This project uses IBM HyperLedger as the blockchain code base. I think Waves uses a different blockchain code base. I looked at HyperLedger a bit. It's pretty useful. I might use the same blockchain code base for my DApp. I want to create an entire living economy of digital assets for my popular ""Anything, Anywhere"" App that's becoming a DApp w/ a 1CO happening soon.  It's hard to tell where these ""ideas"" will end up or whether they'll gain popularity. That's why I decided to turn my App into a DApp. It gives more confidence on what will be happening.",False
45,msg16008789,https://bitcointalk.org/index.php?topic=1571738.0,msg16008304,1299766,Announcements (Altcoins),2016-08-23 03:15:06,Golftech,Hero Member,1344,510,,[ANN][rICO]Antshares Blockchain Mainnet is ONLINE!,   same here mate i think many of us already learn some lesson coming from waves and we are supporting this coin because we believe that dev will bring something for us i just keep wishing them the best and for the success of this project.,False
46,msg16008837,https://bitcointalk.org/index.php?topic=1571738.0,msg16008789,1299766,Announcements (Altcoins),2016-08-23 03:23:46,tottong,Hero Member,1061,500,,[ANN][rICO]Antshares Blockchain Mainnet is ONLINE!,"   thats right, I also believe that dev and the anstshare team will do the best of this project and this coin will be the future for cryptocurrency.",False
47,msg16008905,https://bitcointalk.org/index.php?topic=1571738.0,,1299766,Announcements (Altcoins),2016-08-23 03:37:07,Palodar,Sr. Member,376,250,,[ANN][rICO]Antshares Blockchain Mainnet is ONLINE!,i send an email regarding translation and twitter bounty and no reply received from the devs team. i hope you see it.. thanks,False
48,msg16008928,https://bitcointalk.org/index.php?topic=1571738.0,msg16008905,1299766,Announcements (Altcoins),2016-08-23 03:39:54,PhilPrime,Sr. Member,378,250,,[ANN][rICO]Antshares Blockchain Mainnet is ONLINE!,"   i think the project already have a translation in different language and didn't accepted any translation offer, but i don't know about twitter bounty. hahaha. i invest 0.1btc for this coin. i hope it meets what i am expecting on this. cheers",False
49,msg16008930,https://bitcointalk.org/index.php?topic=1571738.0,msg16008837,1299766,Announcements (Altcoins),2016-08-23 03:40:27,Joint Force,Hero Member,799,500,,[ANN][rICO]Antshares Blockchain Mainnet is ONLINE!,    The future of all cryptocurrency seems too big... Maybe part of it all.,False
50,msg16009141,https://bitcointalk.org/index.php?topic=1571738.0,msg16007240,1299766,Announcements (Altcoins),2016-08-23 04:23:32,antshares,Sr. Member,350,250,,[ANN][rICO]Antshares Blockchain Mainnet is ONLINE!,"    LOL I totally agree with you. We will definitely do our best, but every project has risks. Don't invest more than what you can afford",False
51,msg16009222,https://bitcointalk.org/index.php?topic=1571738.0,msg16007959,1299766,Announcements (Altcoins),2016-08-23 04:37:56,antshares,Sr. Member,350,250,,[ANN][rICO]Antshares Blockchain Mainnet is ONLINE!,   That's a good point. We'll announce in advance in case there is unexpected things happening. Speaking of roadmap I'll paste the link here for those who are interested: https://www.antshares.org/en-US/Blog/Details/28,False
52,msg16009235,https://bitcointalk.org/index.php?topic=1571738.0,msg16008905,1299766,Announcements (Altcoins),2016-08-23 04:39:17,antshares,Sr. Member,350,250,,[ANN][rICO]Antshares Blockchain Mainnet is ONLINE!,   We'll make keep the records as long as you send the email. Don't worry,False
53,msg16009267,https://bitcointalk.org/index.php?topic=1571738.0,msg16008428,1299766,Announcements (Altcoins),2016-08-23 04:45:07,antshares,Sr. Member,350,250,,[ANN][rICO]Antshares Blockchain Mainnet is ONLINE!,"   Cool, your DApp thing sounds very interesting. Hope you very good luck with that!  As for HyperLedger, one more thing to note. We are proposing to become a hyperledger incubation project. Find the Antshares Incubation Project Proposal here:https://github.com/hyperledger/hyperledger/wiki/Proposals",False
54,msg16009305,https://bitcointalk.org/index.php?topic=1571738.0,,1299766,Announcements (Altcoins),2016-08-23 04:50:46,szachta,Hero Member,518,500,,[ANN][rICO]Antshares Blockchain Mainnet is ONLINE!,Good morning.,False
55,msg16009344,https://bitcointalk.org/index.php?topic=1571738.0,,1299766,Announcements (Altcoins),2016-08-23 04:58:14,operabit,Legendary,1162,1000,,[ANN][rICO]Antshares Blockchain Mainnet is ONLINE!,4400 BTC? It's cool man,False
56,msg16009783,https://bitcointalk.org/index.php?topic=1571738.0,msg16009344,1299766,Announcements (Altcoins),2016-08-23 05:58:10,moppang,Legendary,1134,1000,,[ANN][rICO]Antshares Blockchain Mainnet is ONLINE!,   At the moment currenct total invested in the ico is 4490.24 btc I think it will rise a few day. Still many of time to participated.,False
57,msg16009903,https://bitcointalk.org/index.php?topic=1571738.0,msg16008304,1299766,Announcements (Altcoins),2016-08-23 06:13:15,jacaf01,Hero Member,742,500,,[ANN][rICO]Antshares Blockchain Mainnet is ONLINE!,"    Of course investors need to be concern with the over valuation of this project with affect waves growth, Yesterday I decided to invested more BTC but now that the issue of waves come up I am concerned about the valuation of the token, with only 25million token to be distributed compared to 100million in waves. I am concerned that the margin for growth for this project may be shrinking with more BTC invested. The good thing is that there is option to withdraw ones investment. Lets wait and see",False
58,msg16009908,https://bitcointalk.org/index.php?topic=1571738.0,,1299766,Announcements (Altcoins),2016-08-23 06:14:16,Coin_trader,Hero Member,1092,513,,[ANN][rICO]Antshares Blockchain Mainnet is ONLINE!,4400+ is awesome! it means that many people are encouraged to invest in this good project because they believe it is a sure profitable project that will hit the trading soon.,False
59,msg16010190,https://bitcointalk.org/index.php?topic=1571738.0,,1299766,Announcements (Altcoins),2016-08-23 06:53:29,LitcoinCollector,Legendary,1092,1000,,[ANN][rICO]Antshares Blockchain Mainnet is ONLINE!,Updated Dutch thread.  https://bitcointalk.org/index.php?topic=1581415.msg15878251#msg15878251,False
60,msg16010720,https://bitcointalk.org/index.php?topic=1571738.0,,1299766,Announcements (Altcoins),2016-08-23 08:03:07,knobson,Hero Member,602,500,,[ANN][rICO]Antshares Blockchain Mainnet is ONLINE!,Russian thread updated  https://bitcointalk.org/index.php?topic=1572557.msg15785088#msg15785088,False
61,msg15998228,https://bitcointalk.org/index.php?topic=1571738.0,,1299766,Announcements (Altcoins),2016-08-22 02:38:40,Coin_trader,Hero Member,1092,513,,[ANN][rICO]Antshares Blockchain Mainnet is ONLINE!,"what a great project, using fiat in some areas is good knowing the volatility of the altcoins, this will help in some ways.",False
62,msg15998725,https://bitcointalk.org/index.php?topic=1571738.0,msg15998025,1299766,Announcements (Altcoins),2016-08-22 04:10:46,darkagentx,Full Member,213,100,,[ANN][rICO]Antshares Blockchain Mainnet is ONLINE!,    Okay thanks I will closely monitor it. Glad to see that your ICO is doing great,False
63,msg15998765,https://bitcointalk.org/index.php?topic=1571738.0,,1299766,Announcements (Altcoins),2016-08-22 04:20:37,Watanabe1505,Sr. Member,434,250,,[ANN][rICO]Antshares Blockchain Mainnet is ONLINE!,Ant ICO reach 4k4 Btc fund already. This coin is really potential so let's invest before too late,False
64,msg15998778,https://bitcointalk.org/index.php?topic=1571738.0,,1299766,Announcements (Altcoins),2016-08-22 04:26:05,casinobonusgiveaway,Hero Member,529,500,,[ANN][rICO]Antshares Blockchain Mainnet is ONLINE!,4K btc and 112% bonus??    This is so fucking hot project.,False
65,msg15998841,https://bitcointalk.org/index.php?topic=1571738.0,,1299766,Announcements (Altcoins),2016-08-22 04:36:59,antshares,Sr. Member,350,250,,[ANN][rICO]Antshares Blockchain Mainnet is ONLINE!,"Guys you're welcomed to our slack channel and subreddit as well, join in the community so we can reach greater potentials.",False
66,msg15998848,https://bitcointalk.org/index.php?topic=1571738.0,msg15998778,1299766,Announcements (Altcoins),2016-08-22 04:38:10,MR_Zach,Newbie,19,0,,[ANN][rICO]Antshares Blockchain Mainnet is ONLINE!,   112% bonus means you will get 12% extra bonus. invest 100 get 112.,False
