id,msg_id,parent_id,link_id,Count_read,Forum,Time,Author,Rank,Activity,Merit,Trust,Title,Body,ScamHeader
137,msg21457501,https://bitcointalk.org/index.php?topic=2077763.0,,21373,Announcements (Altcoins),2017-09-03 04:22:24,ontimepass,Member,63,10,,[ANN] [ICO] FUJINTO – Decentralized Cryptocurrency for Travel Industry,I have 1920 token in myetherwallet. now I would like to send my token to coinexchange. I am trying but I failed. Please help me to send it to the coinexchange site.,False
138,msg21458291,https://bitcointalk.org/index.php?topic=2077763.0,,21373,Announcements (Altcoins),2017-09-03 05:13:31,ontimepass,Member,63,10,,[ANN] [ICO] FUJINTO – Decentralized Cryptocurrency for Travel Industry,automatic exchange. I got it automatically after sending eth . thanks,False
139,msg21462562,https://bitcointalk.org/index.php?topic=2077763.0,msg21457501,21373,Announcements (Altcoins),2017-09-03 08:52:18,jajafan,Newbie,1,0,,[ANN] [ICO] FUJINTO – Decentralized Cryptocurrency for Travel Industry,"   Hi same problem, any solution ? The smart contract send me the following error: "" Warning! Error encountered during contract execution [Bad instruction] ""  Thanks for any help.",False
140,msg21462875,https://bitcointalk.org/index.php?topic=2077763.0,,21373,Announcements (Altcoins),2017-09-03 09:07:17,maximum26,Newbie,23,0,,[ANN] [ICO] FUJINTO – Decentralized Cryptocurrency for Travel Industry,I bought it with coinexchange.,False
141,msg21462941,https://bitcointalk.org/index.php?topic=2077763.0,,21373,Announcements (Altcoins),2017-09-03 09:10:31,okane818,Legendary,1176,1000,,[ANN] [ICO] FUJINTO – Decentralized Cryptocurrency for Travel Industry,"HELLO dEV,  How awesome to this coins. I loved this NTO. I bought some of it.  Thanks and regards,  Okane Satoshi",False
142,msg21463494,https://bitcointalk.org/index.php?topic=2077763.0,,21373,Announcements (Altcoins),2017-09-03 09:34:58,swedenrt,Member,80,10,,[ANN] [ICO] FUJINTO – Decentralized Cryptocurrency for Travel Industry,is the product is ready i mean protype?,False
143,msg21463947,https://bitcointalk.org/index.php?topic=2077763.0,,21373,Announcements (Altcoins),2017-09-03 09:54:09,nikolake,Jr. Member,56,10,,[ANN] [ICO] FUJINTO – Decentralized Cryptocurrency for Travel Industry,Is there any suport on the site or here? I made a mistake and i have not take the token. I pay for the ICO TxHash:0x6c6565a4b943621077a915a815bcbf0a09088546323b406adccdccc93779e72c,False
144,msg21464933,https://bitcointalk.org/index.php?topic=2077763.0,,21373,Announcements (Altcoins),2017-09-03 10:35:26,okane818,Legendary,1176,1000,,[ANN] [ICO] FUJINTO – Decentralized Cryptocurrency for Travel Industry,"HELLO INVESTORS,  BUY HERE and HOLD for the FUTURE MOON AT https://www.coinexchange.io/market/NTO/BTC  to avoid transaction problem.  regards  Okane Satoshi.",False
145,msg20761444,https://bitcointalk.org/index.php?topic=2077763.0,,21373,Announcements (Altcoins),2017-08-10 09:03:41,fujinto,Newbie,3,0,,[ANN] [ICO] FUJINTO – Decentralized Cryptocurrency for Travel Industry,"WHAT IS FUJINTO? https://www.youtube.com/watch?v=8VW2cvoqa3w http://fujinto.io/ FUJINTO token – NTO The FUJINTO token is a decentralized cryptocurrency based on the Ethereum blockchain platform and is not controlled by any central authorities. NTO is the symbol of FUJINTO token, like JPY or USD. NTO was created to be a cryptocurrency to pay for hotel or travel ticket reservations. NTO is the open source cryptocurrency, using advanced blockchain technology. With NTO your money will be stored in your personal purse, strictly confidential and absolutely private. At the transaction, money from the sending account will come directly to the recipient, not through any intermediaries.  TRAVEL INDUSTRY Tourism Industry in 2016 - Accounts for 9% of global GDP - In 11 people, has 1 person works in Tourism industry - 1.3 trillion $ in exports - 6% of the world export - From 25 million international tourists in 1950 - Increased to 1,035 million visitors in 2012 - And 2016 the number of international visitors is 1,235 billion. - 1.8 billion international visitors until 2030.  According to general perception of the World Tourism Organization (UNWTO), in the future, tourism continues to grow on a global scale. The number of international visitors is forecasted to reach 1.8 billion by 2030. The development of information technology has changed the way people interact and share information of tourist, especially the impact of social networking and internet applications, mobile phones increasingly popular. The experience of countries which has development tourism industry shows that when internet users are increasing, advertising using online payment tools is a channel that the tourism industry can not ignore. According to statistics, the collection of major travel companies around the world, more than 99% of people online before the selection of tours. According to a Neilson report, global online travel sales in 2016 reached 565 billion $, up 13.8%. Asia-Pacific and America-Latin are the two markets which contribute for this impressive growth. Even, Neilson forecast that in 2017, Asia-Pacific will first time surpass North America, becoming the world's largest online travel market.  VISION In recent years, there are a number of crypto-currencies have been created on the market which are mainly used in goods and services industry. So what are the differences between NTO and the other crypto-currencies? NTO is created with the purpose of providing an alternative payment method for transportation and accommodation booking websites. By using NTO, the booking process would be simplified and more efficient for both providers and consumers. Furthermore, one does not need to pay a huge amount for transaction or change of currency fee because of using international transfer system. In addition, NTO is secured payment solution with minimal transaction fee and the amount will be transferred to user’s account within milliseconds. FUJINTO Team has many years of experience in building and developing online payment solution which is the foundation of introducing FUJINTO service. Firstly, FUJINTO will be linked with accommodation and transportation websites which allows NTO to be used as one of the secured payment methods other than cash. A number of potential partners that are -   Rome2rio.com,  Goeuro.com, Skyscanner,  Momondo, Seat61.com, Rail Europe, B-europe.com, Loco2.com, Captaintrain.com, Busradar.com, Eurolines, Megabus, Student Agency Bus, IC Bus, greyhound.com, amtrak.com, kayak.com, Traveloka.com ( transportations) -   Airbnb.com, Only-apartments.com, Booking.com, Hotelscombined.com, Expedia.com, Agoda.com (accommodation booking) -   TripAdvisor, Foursquare (tourism services)  Secondly, introducing FUJINTO application that quicken accomdation and transportation booking services with NTO currcency and it applied Blockchain technology which helps the FUJINTO to be more secured and safe for users.  ICO Token distribution The number of issued tokens is limited by 400 000 000 NTO -   2.5% ( 10 million tokens) are reserved for early adopters in pre-ICO. -   60% ( 240 million tokens) will be available for crowdsale. -   0.5% ( 2 million tokens) are reserved for ICO bonuses. -   30% ( 120 million tokens) will remain in the FUJINTO Foundation until the official exchange is launched, the tokens will be used to form a stable market and for further development. -    7% (28 million tokens) will be distributed among team members    ICO parameters ICO Start Date 10 August 2017 12:00 UTC ICO End Date 10 September 2017 12:00 UTC ICO Tokens Amount 240 000 000 NTOs Total Bonus Amount 2 000 000 NTOs Token Exchange rate 1 ETH = 4 000 NTOs Minimum transaction amount 400 NTOs (0.1 ETH) Maximum transaction amount 12 000 000 NTOs (3 000 ETH) Total Sale goal 60 000 ETH Minimal Sale goal 5 000 ETH Currency accepted Only ETH  ICO Bonuses -   1st week 15% -   2nd week 10% -   3rd week 5% -   4th week no bonus  Uses of funds raised -   20% will be used for Support Market -   30% will be used for Marketing, SEO, promos -   10% will be used for Admin and Operation -   40% will be used for Development.  FUJINTO tokens distribution is not available to U.S and Hong Kong residents. After ICO NTO will be available for purchase in cryptocurrency exchanges https://www.facebook.com/Fujinto/  http://fujinto.io/ (Reserved this spot for Additional Information, Faq, Bounty details. but I'll use this Place to Post the main Thread till the Official Account Rank up as a Fujinto Member and will be allowed to Post Images.. )",False
146,msg20761513,https://bitcointalk.org/index.php?topic=2077763.0,,21373,Announcements (Altcoins),2017-08-10 09:06:52,Cryp_wolf19,Sr. Member,463,250,,[ANN] [ICO] FUJINTO – Decentralized Cryptocurrency for Travel Industry,Reserved,False
147,msg20768907,https://bitcointalk.org/index.php?topic=2077763.0,,21373,Announcements (Altcoins),2017-08-10 14:30:42,Stompper,Newbie,8,0,,[ANN] [ICO] FUJINTO – Decentralized Cryptocurrency for Travel Industry,"Website = 99% ICO, 1% product.   ",False
148,msg20769162,https://bitcointalk.org/index.php?topic=2077763.0,,21373,Announcements (Altcoins),2017-08-10 14:41:04,alterego087,Full Member,518,104,,[ANN] [ICO] FUJINTO – Decentralized Cryptocurrency for Travel Industry,bounty content yes?,False
149,msg20770258,https://bitcointalk.org/index.php?topic=2077763.0,,21373,Announcements (Altcoins),2017-08-10 15:24:29,hung12301,Newbie,1,0,,[ANN] [ICO] FUJINTO – Decentralized Cryptocurrency for Travel Industry,I like this token because of website and whitepaper ,False
150,msg20770477,https://bitcointalk.org/index.php?topic=2077763.0,,21373,Announcements (Altcoins),2017-08-10 15:32:58,poiseulle,Sr. Member,448,250,,[ANN] [ICO] FUJINTO – Decentralized Cryptocurrency for Travel Industry,"reserved. follow this project. if you have translation bounty, PM me",False
151,msg20779659,https://bitcointalk.org/index.php?topic=2077763.0,,21373,Announcements (Altcoins),2017-08-10 23:22:34,noname92,Newbie,9,0,,[ANN] [ICO] FUJINTO – Decentralized Cryptocurrency for Travel Industry,Wating and follow this project. So excited about it.,False
152,msg20808509,https://bitcointalk.org/index.php?topic=2077763.0,,21373,Announcements (Altcoins),2017-08-12 04:38:07,phantailaptopbl,Member,112,10,,[ANN] [ICO] FUJINTO – Decentralized Cryptocurrency for Travel Industry,I bought NTO ICO and hope your project successfull in future. This project is very helpfull for many people when they pay for hotel and travel ticket reservation all over the world,False
153,msg20828488,https://bitcointalk.org/index.php?topic=2077763.0,,21373,Announcements (Altcoins),2017-08-12 23:48:36,kofe,Newbie,13,0,,[ANN] [ICO] FUJINTO – Decentralized Cryptocurrency for Travel Industry,Very interesting project. Right direction. People like to travel more and more.,False
154,msg20828898,https://bitcointalk.org/index.php?topic=2077763.0,msg20770258,21373,Announcements (Altcoins),2017-08-13 00:23:15,tazmantasik,Hero Member,784,506,,[ANN] [ICO] FUJINTO – Decentralized Cryptocurrency for Travel Industry,"  Yeah right, the ico website is very detailed, it's very easy to read and understand about fujinto token",False
155,msg20828935,https://bitcointalk.org/index.php?topic=2077763.0,,21373,Announcements (Altcoins),2017-08-13 00:27:11,samantadegrenet,Hero Member,686,500,,[ANN] [ICO] FUJINTO – Decentralized Cryptocurrency for Travel Industry,"What about the bounty details dev , could we join the social bounty?",False
156,msg20832663,https://bitcointalk.org/index.php?topic=2077763.0,,21373,Announcements (Altcoins),2017-08-13 05:47:15,sakahayang,Full Member,418,100,,[ANN] [ICO] FUJINTO – Decentralized Cryptocurrency for Travel Industry,Is there any bounty campaign dev.  wait for the sosial media bounty good luck for the project ,False
157,msg20850147,https://bitcointalk.org/index.php?topic=2077763.0,,21373,Announcements (Altcoins),2017-08-13 21:26:36,nohad,Member,111,10,,[ANN] [ICO] FUJINTO – Decentralized Cryptocurrency for Travel Industry,"Most project in travel industry very fast growing due to the global demand is quite a lot using travel service , such an interesting will help a lot and hope for success. Good luck",False
158,msg20875911,https://bitcointalk.org/index.php?topic=2077763.0,,21373,Announcements (Altcoins),2017-08-14 19:01:33,veranika55,Full Member,504,104,,[ANN] [ICO] FUJINTO – Decentralized Cryptocurrency for Travel Industry,Open topin on MMGP http://mmgp.ru/showthread.php?t=530663,False
159,msg20964157,https://bitcointalk.org/index.php?topic=2077763.0,,21373,Announcements (Altcoins),2017-08-17 17:48:54,coinsminer2017,Newbie,58,0,,[ANN] [ICO] FUJINTO – Decentralized Cryptocurrency for Travel Industry,Reserve for Indonesian Translation if you need.,False
160,msg21023977,https://bitcointalk.org/index.php?topic=2077763.0,,21373,Announcements (Altcoins),2017-08-19 21:27:58,Ukraine2020,Sr. Member,826,284,,[ANN] [ICO] FUJINTO – Decentralized Cryptocurrency for Travel Industry,"Good luck, team! =)",False
161,msg21024351,https://bitcointalk.org/index.php?topic=2077763.0,,21373,Announcements (Altcoins),2017-08-19 21:51:22,niknik1966,Sr. Member,266,251,,[ANN] [ICO] FUJINTO – Decentralized Cryptocurrency for Travel Industry,The coin is Japanese? On which exchanges is the sale of coins planned? On the Asian?,False
162,msg21106170,https://bitcointalk.org/index.php?topic=2077763.0,,21373,Announcements (Altcoins),2017-08-22 16:05:38,fujinto,Newbie,3,0,,[ANN] [ICO] FUJINTO – Decentralized Cryptocurrency for Travel Industry,"ALERT!! There are some fake site out there trying to scam people who want to join the ICO of NTO tokens. We only have one official website is http://fujinto.io/. All other sites are scam. Please be careful. LIST OF FAKE SITE (Websites below are not our official site, do not contribute there): http://fujinto.co/",False
163,msg21106424,https://bitcointalk.org/index.php?topic=2077763.0,,21373,Announcements (Altcoins),2017-08-22 16:15:18,CaVO32,Full Member,770,102,,[ANN] [ICO] FUJINTO – Decentralized Cryptocurrency for Travel Industry,why in the world would any one go out of their way to copy a website and register its domain name and put it up on a website trying to pretend to be someone who they are not? lolololololol!,False
164,msg21231957,https://bitcointalk.org/index.php?topic=2077763.0,,21373,Announcements (Altcoins),2017-08-26 20:05:28,Wasimalik,Full Member,574,100,,[ANN] [ICO] FUJINTO – Decentralized Cryptocurrency for Travel Industry,reserving urdu translatins,False
