id,msg_id,parent_id,link_id,Count_read,Forum,Time,Author,Rank,Activity,Merit,Trust,Title,Body,ScamHeader
645,msg43355744,https://bitcointalk.org/index.php?topic=2209815.0,msg43353518,175194,Announcements (Altcoins),2018-08-02 18:49:35,Bernart,Jr. Member,154,1,,[ANN]Potentiam-The Blockchain Music Platform,"  Potentiam team - good guys, because they making opportunity for every artist break through in this type of business and become independent.",False
646,msg43399214,https://bitcointalk.org/index.php?topic=2209815.0,,175194,Announcements (Altcoins),2018-08-03 13:35:33,Stuart little,Newbie,140,0,,[ANN]Potentiam-The Blockchain Music Platform,"Blockchain technology can give artists and music lovers financial freedom, which they never knew and did not even suspect that someday this will be possible.",False
647,msg43408440,https://bitcointalk.org/index.php?topic=2209815.0,msg43400222,175194,Announcements (Altcoins),2018-08-03 16:19:38,Bernart,Jr. Member,154,1,,[ANN]Potentiam-The Blockchain Music Platform,  The Potentiam platform wants to use the block chain to encourage artists to connect directly to their fans by demonstrating their talents!,False
648,msg43410199,https://bitcointalk.org/index.php?topic=2209815.0,msg43408440,175194,Announcements (Altcoins),2018-08-03 16:51:38,crypto reva,Newbie,154,0,,[ANN]Potentiam-The Blockchain Music Platform,  The current state of the music world is very outdated and stored in such a way as to impede the growth of musicians and to save money not where necessary!,False
649,msg43410589,https://bitcointalk.org/index.php?topic=2209815.0,msg43408440,175194,Announcements (Altcoins),2018-08-03 16:58:19,LV5ME,Full Member,364,100,,[ANN]Potentiam-The Blockchain Music Platform,"   It really will be convenient and interesting for both sides, in my opinion the team of this project has set itself a really good and sought-after goal, and if they manage to implement everything correctly, it will surely be a success for many people around the world. We will believe that the team will succeed.",False
650,msg43411555,https://bitcointalk.org/index.php?topic=2209815.0,,175194,Announcements (Altcoins),2018-08-03 17:15:39,cryptoplane,Newbie,154,0,,[ANN]Potentiam-The Blockchain Music Platform,"A very impressive feature of Potentiam Core and Potentiam Classic, the two main modules on the network will use the tools above to completely redefine the music industry, as we know it today.",False
651,msg43412943,https://bitcointalk.org/index.php?topic=2209815.0,msg43411555,175194,Announcements (Altcoins),2018-08-03 17:41:49,Stuart little,Newbie,140,0,,[ANN]Potentiam-The Blockchain Music Platform,"  Oh, yes, I agree with you, because in this way artists can create and upload music to the platform, which can be quickly accessible to their fans.",False
652,msg43415775,https://bitcointalk.org/index.php?topic=2209815.0,msg43414778,175194,Announcements (Altcoins),2018-08-03 18:43:18,Bernart,Jr. Member,154,1,,[ANN]Potentiam-The Blockchain Music Platform,"  Users of the platform will also have the opportunity to earn, listening and recognizing their favorite artists. Cool, is not it ?!",False
653,msg43418510,https://bitcointalk.org/index.php?topic=2209815.0,,175194,Announcements (Altcoins),2018-08-03 19:45:07,crypto reva,Newbie,154,0,,[ANN]Potentiam-The Blockchain Music Platform,"this project will provide all participants with the necessary tools and necessary data, and it does not depend on whether you are a beginner or an experienced user.",False
654,msg43452784,https://bitcointalk.org/index.php?topic=2209815.0,,175194,Announcements (Altcoins),2018-08-04 11:59:10,Stuart little,Newbie,140,0,,[ANN]Potentiam-The Blockchain Music Platform,What are all the superproperties of the project? What is different from competitors?,False
655,msg43455034,https://bitcointalk.org/index.php?topic=2209815.0,msg43453844,175194,Announcements (Altcoins),2018-08-04 12:44:50,Bernart,Jr. Member,154,1,,[ANN]Potentiam-The Blockchain Music Platform,"  I'm not sure that it will help break out to a significant level in this direction, because the competition is simply rabid, but if you get stuck, then it's all right!",False
656,msg43456571,https://bitcointalk.org/index.php?topic=2209815.0,,175194,Announcements (Altcoins),2018-08-04 13:14:31,crypto reva,Newbie,154,0,,[ANN]Potentiam-The Blockchain Music Platform,"Super project, Potentiam creates a music network in which users can hear their music without damaging the data, advertisers can get tokens to promote artists and content support. It's just super opportunity, great advantages!",False
657,msg43459052,https://bitcointalk.org/index.php?topic=2209815.0,msg43456571,175194,Announcements (Altcoins),2018-08-04 13:58:27,cryptoplane,Newbie,154,0,,[ANN]Potentiam-The Blockchain Music Platform,"  Yes, it's really good, but along with these all the advantages, there may be some problems that in the future will be very difficult to solve, and I'm afraid that the project will not suffer.",False
658,msg43461000,https://bitcointalk.org/index.php?topic=2209815.0,msg43459052,175194,Announcements (Altcoins),2018-08-04 14:33:19,Stuart little,Newbie,140,0,,[ANN]Potentiam-The Blockchain Music Platform,"  Well, it's impressive, of course, I hope the team will not get out of the way and will keep a high bar until the end of platform advancement and creating something new and grandiose in the world of crypto currency!",False
659,msg43464671,https://bitcointalk.org/index.php?topic=2209815.0,,175194,Announcements (Altcoins),2018-08-04 15:38:20,Bernart,Jr. Member,154,1,,[ANN]Potentiam-The Blockchain Music Platform,All right! You immediately noticed that the business was done by professionals. Everything is very thought out and interesting!,False
660,msg43465855,https://bitcointalk.org/index.php?topic=2209815.0,msg43464671,175194,Announcements (Altcoins),2018-08-04 15:58:50,paulus51,Sr. Member,616,321,,[ANN]Potentiam-The Blockchain Music Platform,  it's sad that developers for 1 year of the project were able to take it only on very small exchanges with scanty volumes. Team Potentiam must correct this!,False
661,msg43471377,https://bitcointalk.org/index.php?topic=2209815.0,,175194,Announcements (Altcoins),2018-08-04 17:47:20,crypto reva,Newbie,154,0,,[ANN]Potentiam-The Blockchain Music Platform,This was the first of the best and most worthy works I've seen lately. The guys are working for the result!,False
662,msg43474766,https://bitcointalk.org/index.php?topic=2209815.0,,175194,Announcements (Altcoins),2018-08-04 18:56:23,cryptoplane,Newbie,154,0,,[ANN]Potentiam-The Blockchain Music Platform,"Awfully cool! This is called fine work. You are professionals in your business, do not stop, you are very well, you know how to be interested in the world of crypto-currency)))",False
663,msg43161865,https://bitcointalk.org/index.php?topic=2209815.0,,175194,Announcements (Altcoins),2018-07-30 16:02:33,Stuart little,Newbie,140,0,,[ANN]Potentiam-The Blockchain Music Platform,"You have a great project. Thank you for help, you are very careful ! Young artists are very fortunate that they will have such a cool opportunity. Have a nice evening!",False
664,msg43164183,https://bitcointalk.org/index.php?topic=2209815.0,msg43162975,175194,Announcements (Altcoins),2018-07-30 16:43:16,Bernart,Jr. Member,154,1,,[ANN]Potentiam-The Blockchain Music Platform,"  Then the cost of the token will also grow .... So there is sense in development. I hope, guys will gayn success. I say as a token holder))",False
665,msg43209105,https://bitcointalk.org/index.php?topic=2209815.0,msg43160522,175194,Announcements (Altcoins),2018-07-31 11:09:55,queenofbtc,Member,96,10,,[ANN]Potentiam-The Blockchain Music Platform,   Bitpaction doesn't exist. Go to mercatox! Good volume there!!!,False
666,msg43211209,https://bitcointalk.org/index.php?topic=2209815.0,,175194,Announcements (Altcoins),2018-07-31 11:47:53,Stuart little,Newbie,140,0,,[ANN]Potentiam-The Blockchain Music Platform,"The potential is created to give a huge opportunity to new new musicians or performers, writers of music content in the music industry and all those who contributed to its implementation.",False
667,msg43213048,https://bitcointalk.org/index.php?topic=2209815.0,msg43212442,175194,Announcements (Altcoins),2018-07-31 12:19:34,Bernart,Jr. Member,154,1,,[ANN]Potentiam-The Blockchain Music Platform,  This is because for young artists there were really big problems to raise one step higher.,False
668,msg43214342,https://bitcointalk.org/index.php?topic=2209815.0,msg43213048,175194,Announcements (Altcoins),2018-07-31 12:42:31,crypto reva,Newbie,154,0,,[ANN]Potentiam-The Blockchain Music Platform,"  The project was created in order to eliminate intermediaries so that a young artist could earn money personally for himself, demonstrating his talent so that the music industry could grow.",False
669,msg43215693,https://bitcointalk.org/index.php?topic=2209815.0,msg43214342,175194,Announcements (Altcoins),2018-07-31 13:05:58,cryptoplane,Newbie,154,0,,[ANN]Potentiam-The Blockchain Music Platform,"  The structure of the music industry is concentrated in the hands of several intermediaries, which were a serious problem for young performers, and this limited the growth of the industry.",False
670,msg43216602,https://bitcointalk.org/index.php?topic=2209815.0,,175194,Announcements (Altcoins),2018-07-31 13:21:42,Stuart little,Newbie,140,0,,[ANN]Potentiam-The Blockchain Music Platform, I like that information about the project is always presented in ways that do not complicate the life of a beginner in this field too much !!!,False
671,msg43218899,https://bitcointalk.org/index.php?topic=2209815.0,,175194,Announcements (Altcoins),2018-07-31 13:59:54,Bernart,Jr. Member,154,1,,[ANN]Potentiam-The Blockchain Music Platform," I do not see anything new in this, but still cool, but you can think of something new and interesting.",False
672,msg43265229,https://bitcointalk.org/index.php?topic=2209815.0,,175194,Announcements (Altcoins),2018-08-01 09:45:38,Stuart little,Newbie,140,0,,[ANN]Potentiam-The Blockchain Music Platform, It is very sad that the creators of the content get their fees through intermediaries… POTENTIAM team found an alternative how to solve this problem and created such a wonderful project!And everybody can start with own way in this field) Everybody can buy some token on,False
673,msg43274362,https://bitcointalk.org/index.php?topic=2209815.0,msg43273240,175194,Announcements (Altcoins),2018-08-01 12:39:22,Bernart,Jr. Member,154,1,,[ANN]Potentiam-The Blockchain Music Platform,"  In fact, yes, the Internet gives us a great opportunity to get a huge audience and communicate with it on an equal footing.",False
674,msg43275500,https://bitcointalk.org/index.php?topic=2209815.0,,175194,Announcements (Altcoins),2018-08-01 12:59:34,alienwarrior,Newbie,7,0,,[ANN]Potentiam-The Blockchain Music Platform,"Music is a pretty interesting space to be in and a place where some real issues exist where blockchain can definitely play a huge part. Sort of democratising the music industry. Now that Potentiam is on exchanges, things seem to be progressing very well. Good luck team.",False
675,msg43275620,https://bitcointalk.org/index.php?topic=2209815.0,msg43274362,175194,Announcements (Altcoins),2018-08-01 13:01:40,crypto reva,Newbie,154,0,,[ANN]Potentiam-The Blockchain Music Platform,"  Yes, I agree with you, team has created such a project as POTENTIAM, which sees the solution of this problem in the development of a decentralized platform. Thanks to which all problems will disappear, and thus will send the listener directly to the performer, which is very cool!",False
676,msg43276587,https://bitcointalk.org/index.php?topic=2209815.0,msg43275620,175194,Announcements (Altcoins),2018-08-01 13:20:13,cryptoplane,Newbie,154,0,,[ANN]Potentiam-The Blockchain Music Platform,"  I understand that the POTENTIAM platform allows creative people, new performers and professionals to choose their own destiny, and decide how they should work better!",False
677,msg43277843,https://bitcointalk.org/index.php?topic=2209815.0,,175194,Announcements (Altcoins),2018-08-01 13:43:17,Stuart little,Newbie,140,0,,[ANN]Potentiam-The Blockchain Music Platform," I do not see anything new in this, but it's still cool, but you can think of something new and interesting.",False
678,msg43279999,https://bitcointalk.org/index.php?topic=2209815.0,,175194,Announcements (Altcoins),2018-08-01 14:18:36,Bernart,Jr. Member,154,1,,[ANN]Potentiam-The Blockchain Music Platform,"Hmm, that's really what I need, I'm delighted, I've been looking for something like that for a long time, I'm looking forward to the end of the project and the final result.",False
679,msg43336099,https://bitcointalk.org/index.php?topic=2209815.0,,175194,Announcements (Altcoins),2018-08-02 12:56:44,Stuart little,Newbie,140,0,,[ANN]Potentiam-The Blockchain Music Platform,creators of the content get their fees through intermediaries… I think it is very bad Potentiam - gives opportunity to earn by own hands)  They can create from the urge and  soul for own audience)),False
680,msg43342448,https://bitcointalk.org/index.php?topic=2209815.0,,175194,Announcements (Altcoins),2018-08-02 14:45:53,Bernart,Jr. Member,154,1,,[ANN]Potentiam-The Blockchain Music Platform,"It's nice to see that the project is being implemented. This means that it makes sense to invest. Constantly the price of the PTM can not be all time grow. But you are right. In small steps, the project team is developing Potentiam in a bright future.",False
681,msg43343772,https://bitcointalk.org/index.php?topic=2209815.0,msg43275500,175194,Announcements (Altcoins),2018-08-02 15:07:16,LV5ME,Full Member,364,100,,[ANN]Potentiam-The Blockchain Music Platform,"   Yes, I agree that music and blockade is a good tandem, and relevant in our time. The project is really a good and useful idea, which will be really in demand, if of course it is properly implemented. I hope that with time, interest in the token itself will grow.",False
682,msg43347498,https://bitcointalk.org/index.php?topic=2209815.0,,175194,Announcements (Altcoins),2018-08-02 16:12:27,crypto reva,Newbie,154,0,,[ANN]Potentiam-The Blockchain Music Platform,"Thanks to Potentiam many problems in this business will disappear, and you will agree, even if a very talented musician becomes popular thanks to the Internet, in the end, he will make music not himself but with the help of: the producer, the record company and so on .",False
683,msg42963468,https://bitcointalk.org/index.php?topic=2209815.0,,175194,Announcements (Altcoins),2018-07-27 10:42:31,Bernart,Jr. Member,154,1,,[ANN]Potentiam-The Blockchain Music Platform,"I am glad that Potentiam Classic will be launched in parallel with the central part of the Potentiam Core platform, which is a blockchain alternative to annual investments.",False
684,msg42964471,https://bitcointalk.org/index.php?topic=2209815.0,msg42963468,175194,Announcements (Altcoins),2018-07-27 11:02:44,crypto reva,Newbie,154,0,,[ANN]Potentiam-The Blockchain Music Platform,  thanks to Potentiam there will be an opportunity to walk around a number of large and steep record companies in marketing and management of the selection of artists and repertoire,False
685,msg42965440,https://bitcointalk.org/index.php?topic=2209815.0,,175194,Announcements (Altcoins),2018-07-27 11:21:45,cryptoplane,Newbie,154,0,,[ANN]Potentiam-The Blockchain Music Platform,"Very cool social network! I saw that there is a digital recording studio, which includes all the necessary tools for the creators",False
686,msg42966455,https://bitcointalk.org/index.php?topic=2209815.0,msg42965440,175194,Announcements (Altcoins),2018-07-27 11:44:07,Stuart little,Newbie,140,0,,[ANN]Potentiam-The Blockchain Music Platform,"  In addition, there everybody can manage own content, and it's very cool that all copyright!  I hope this project will be success!",False
687,msg42972421,https://bitcointalk.org/index.php?topic=2209815.0,,175194,Announcements (Altcoins),2018-07-27 13:41:43,Bernart,Jr. Member,154,1,,[ANN]Potentiam-The Blockchain Music Platform,Large companies will lose huge amounts of money. They simply will not have the opportunity to compete. I think that many intermediaries will use the platform services for themselves. And it is even possible to resell its services.,False
688,msg43011615,https://bitcointalk.org/index.php?topic=2209815.0,,175194,Announcements (Altcoins),2018-07-28 07:50:52,Stuart little,Newbie,140,0,,[ANN]Potentiam-The Blockchain Music Platform,"And how do they compete? Only the largest will be kept at the expense of the fact that they have regular customers. Although we will wait and see, the most interesting is what will happen next.",False
689,msg43016073,https://bitcointalk.org/index.php?topic=2209815.0,,175194,Announcements (Altcoins),2018-07-28 09:27:24,Bernart,Jr. Member,154,1,,[ANN]Potentiam-The Blockchain Music Platform,Did you know that PTM owners have the option to stake their tokens in the Potentiam Vault which will earn them special rights and privileges (50% of platform fees generated).,False
690,msg43016871,https://bitcointalk.org/index.php?topic=2209815.0,msg43016073,175194,Announcements (Altcoins),2018-07-28 09:44:56,crypto reva,Newbie,154,0,,[ANN]Potentiam-The Blockchain Music Platform,"  Yes, this is a unique opportunity to be the holder of tokens and to receive from this a huge share of profits. This is cool I think",False
691,msg43018435,https://bitcointalk.org/index.php?topic=2209815.0,msg43016871,175194,Announcements (Altcoins),2018-07-28 10:17:40,cryptoplane,Newbie,154,0,,[ANN]Potentiam-The Blockchain Music Platform,"   And besides, you do not need to do anything, just tokens are introduced as in bank and they benefit you, this is an incredibly cool possibility)))",False
692,msg43019802,https://bitcointalk.org/index.php?topic=2209815.0,msg43018435,175194,Announcements (Altcoins),2018-07-28 10:45:18,Stuart little,Newbie,140,0,,[ANN]Potentiam-The Blockchain Music Platform,"  And who knows, when such function will be available and how many tokens for this? I’m interested in this issue. While the value of the token is good, I would buy it and put it in the cell.",False
693,msg43021421,https://bitcointalk.org/index.php?topic=2209815.0,,175194,Announcements (Altcoins),2018-07-28 11:20:53,Bernart,Jr. Member,154,1,,[ANN]Potentiam-The Blockchain Music Platform,"And you knew that Potentiam Classic will work with voluntary collective investments, which will allow you to raise money for new promising performers, and so they can buy home studio!",False
694,msg43022262,https://bitcointalk.org/index.php?topic=2209815.0,,175194,Announcements (Altcoins),2018-07-28 11:40:13,crypto reva,Newbie,154,0,,[ANN]Potentiam-The Blockchain Music Platform,"Cool! I like it, good idea! This will attract young performers to the platform What is the most attractive in the Potentiam platform?",False
695,msg43023430,https://bitcointalk.org/index.php?topic=2209815.0,msg43022262,175194,Announcements (Altcoins),2018-07-28 12:06:56,cryptoplane,Newbie,154,0,,[ANN]Potentiam-The Blockchain Music Platform,"  So this is complete decentralization! In addition, security and integrity is provided by cryptographic algorithms. Trust is above all!",False
696,msg43024198,https://bitcointalk.org/index.php?topic=2209815.0,msg43023430,175194,Announcements (Altcoins),2018-07-28 12:23:34,Stuart little,Newbie,140,0,,[ANN]Potentiam-The Blockchain Music Platform,"  guys and you knew that the company's history is very long-term, because the founders of Potentiam worked in the field of music management for a number of years!",False
697,msg43029254,https://bitcointalk.org/index.php?topic=2209815.0,msg43024198,175194,Announcements (Altcoins),2018-07-28 14:04:07,zee123,Full Member,392,100,,[ANN]Potentiam-The Blockchain Music Platform,"   Hi, thanks for the support kindly have a look at out sister company https://neonmusic.co.uk. Its proof we do not have any problems on boarding artists once the Potentiam platform is ready.",False
698,msg43047365,https://bitcointalk.org/index.php?topic=2209815.0,,175194,Announcements (Altcoins),2018-07-28 20:21:13,Cornett,Hero Member,686,500,,[ANN]Potentiam-The Blockchain Music Platform,"the platforms core function is to bring fresh faces to light through varying interactions within the music industry. in this respect, it reveals its difference from other projects. I'm watching them work with interest.",False
699,msg43155535,https://bitcointalk.org/index.php?topic=2209815.0,,175194,Announcements (Altcoins),2018-07-30 14:16:36,Stuart little,Newbie,140,0,,[ANN]Potentiam-The Blockchain Music Platform," Very cool, because in the modern world is very difficult to break through without the help of certain professionals in their field. So Potentiam is the hand of helping young musicians.!",False
700,msg43158100,https://bitcointalk.org/index.php?topic=2209815.0,,175194,Announcements (Altcoins),2018-07-30 14:58:17,Bernart,Jr. Member,154,1,,[ANN]Potentiam-The Blockchain Music Platform,"Did you guys see that PTM token is traded on the bitpaction? The volume of trading is also growing, great news!",False
701,msg43159359,https://bitcointalk.org/index.php?topic=2209815.0,,175194,Announcements (Altcoins),2018-07-30 15:20:13,crypto reva,Newbie,154,0,,[ANN]Potentiam-The Blockchain Music Platform,"As I understand, there some exchangers on wich I can buy PTM tokens. And what is the cost of the coin and where is it better to buy it?",False
702,msg43160522,https://bitcointalk.org/index.php?topic=2209815.0,msg43159359,175194,Announcements (Altcoins),2018-07-30 15:39:26,cryptoplane,Newbie,154,0,,[ANN]Potentiam-The Blockchain Music Platform,"  Now on one exchange, you can buy here: bitpaction.com and 5 another exchanger Also you can look at the price there.",False
703,msg42789801,https://bitcointalk.org/index.php?topic=2209815.0,,175194,Announcements (Altcoins),2018-07-24 13:13:43,Stuart little,Newbie,140,0,,[ANN]Potentiam-The Blockchain Music Platform,"Any purchase should be well considered. If an expensive purchase then you need to think long. All in your hands, think OWN HAD",False
704,msg42791532,https://bitcointalk.org/index.php?topic=2209815.0,,175194,Announcements (Altcoins),2018-07-24 13:46:19,crypto Deddy,Newbie,98,0,,[ANN]Potentiam-The Blockchain Music Platform,"As I now, Potentiam was made for indie musicians wanting to receive more advertising and exposure for their music.  And now they will get that!",False
705,msg42794223,https://bitcointalk.org/index.php?topic=2209815.0,msg42793716,175194,Announcements (Altcoins),2018-07-24 14:33:48,Bernart,Jr. Member,154,1,,[ANN]Potentiam-The Blockchain Music Platform,"  But it's will be possible to used for musicians from another genre of music. Maybe not only for musicians))) Thanks to this, young artists will be able to make a good profit.",False
706,msg42799957,https://bitcointalk.org/index.php?topic=2209815.0,,175194,Announcements (Altcoins),2018-07-24 16:13:38,crypto reva,Newbie,154,0,,[ANN]Potentiam-The Blockchain Music Platform,"Founders of Potentiam has over 75 years of music industry experience! So, they know the complications of promoting new artists and created Potentiam to assist them in their musical development.",False
707,msg42802187,https://bitcointalk.org/index.php?topic=2209815.0,,175194,Announcements (Altcoins),2018-07-24 16:53:51,cryptoplane,Newbie,154,0,,[ANN]Potentiam-The Blockchain Music Platform," It's very cool, a great opportunity to earn on own talent! I know, maybe it's will sound stupid, but why they will use blockchain? What advantages it will give?",False
708,msg42806325,https://bitcointalk.org/index.php?topic=2209815.0,,175194,Announcements (Altcoins),2018-07-24 18:12:08,Stuart little,Newbie,140,0,,[ANN]Potentiam-The Blockchain Music Platform,Platform  has a decentralized book that is also a peer-to-peer network. Potentiam’s blockchain is used to store data without the need of an intermediary.,False
709,msg42807837,https://bitcointalk.org/index.php?topic=2209815.0,,175194,Announcements (Altcoins),2018-07-24 18:43:35,crypto reva,Newbie,154,0,,[ANN]Potentiam-The Blockchain Music Platform,"A huge flow of information everyone can find by simply using Potentiam, all in one place, simply and very conveniently, without spending a lot of time.",False
710,msg42836850,https://bitcointalk.org/index.php?topic=2209815.0,,175194,Announcements (Altcoins),2018-07-25 09:04:08,Stuart little,Newbie,140,0,,[ANN]Potentiam-The Blockchain Music Platform,"Maybe thank's that, they can provide the lowest rates so that users can gain momentum within the social media community and receive the maximum commitment and exposure.",False
711,msg42848422,https://bitcointalk.org/index.php?topic=2209815.0,msg42837665,175194,Announcements (Altcoins),2018-07-25 12:41:58,Bernart,Jr. Member,154,1,,[ANN]Potentiam-The Blockchain Music Platform,"  Thanks to this, young artists will be able to make a good profit. It is very sad that the creators of the content get their fees through intermediaries… But really great that Potentiam team created this project, and will help people to gain success.",False
712,msg42849372,https://bitcointalk.org/index.php?topic=2209815.0,msg42848422,175194,Announcements (Altcoins),2018-07-25 12:58:18,crypto reva,Newbie,154,0,,[ANN]Potentiam-The Blockchain Music Platform,"  Sure man, soon everybody will be available start on the own way in music industry) Now even if a very talented musician becomes popular thanks to the Internet, in the end, he will make music not himself but with the help of: the producer, the record company and so on ..",False
