id,msg_id,parent_id,link_id,Count_read,Forum,Time,Author,Rank,Activity,Merit,Trust,Title,Body,ScamHeader
1310,msg38271056,https://bitcointalk.org/index.php?topic=2209815.0,msg38194050,175194,Announcements (Altcoins),2018-05-23 11:12:03,sjuzze,Newbie,168,0,,[ANN]Potentiam-The Blockchain Music Platform,"  Great news! Now I know, that team work on PTM token. And in near future it's be very ease to buy or sell it.",False
1311,msg38271882,https://bitcointalk.org/index.php?topic=2209815.0,msg38267223,175194,Announcements (Altcoins),2018-05-23 11:22:23,Patrick777,Newbie,98,0,,[ANN]Potentiam-The Blockchain Music Platform,"   In fact, it is not yet known. Because there is a business where competition will not allow two identical companies to be located. But I think that Potentiam will succeed.",False
1312,msg38273498,https://bitcointalk.org/index.php?topic=2209815.0,msg38271882,175194,Announcements (Altcoins),2018-05-23 11:42:28,cold beer,Jr. Member,168,1,,[ANN]Potentiam-The Blockchain Music Platform,"  I understand you, but competition is a very subjective concept. And it is in this business  there is free space. It's just about that people should have a choice.",False
1313,msg38275084,https://bitcointalk.org/index.php?topic=2209815.0,,175194,Announcements (Altcoins),2018-05-23 12:02:07,Medyna,Member,132,10,,[ANN]Potentiam-The Blockchain Music Platform,"And what should happen, that people would choose Potentiam, not competitors",False
1314,msg38276892,https://bitcointalk.org/index.php?topic=2209815.0,msg38275084,175194,Announcements (Altcoins),2018-05-23 12:23:49,Medyna,Member,132,10,,[ANN]Potentiam-The Blockchain Music Platform,"  Usually, thay need to be a little bit better, steeper, faster. This will usually be enough. And Potentiam has it all.",False
1315,msg38278802,https://bitcointalk.org/index.php?topic=2209815.0,msg38276892,175194,Announcements (Altcoins),2018-05-23 12:46:27,killerbot,Jr. Member,71,1,,[ANN]Potentiam-The Blockchain Music Platform,   Everyone understands that people are first of all coming for bonuses and shares. But this can not hold them.,False
1316,msg38285051,https://bitcointalk.org/index.php?topic=2209815.0,msg38278802,175194,Announcements (Altcoins),2018-05-23 13:55:01,cryptoplane,Newbie,154,0,,[ANN]Potentiam-The Blockchain Music Platform,"  People usually like usability, usability and usability. In general, it is because of this that users remain.",False
1317,msg38287757,https://bitcointalk.org/index.php?topic=2209815.0,msg38285051,175194,Announcements (Altcoins),2018-05-23 14:23:20,cryptoplanet,Newbie,70,0,,[ANN]Potentiam-The Blockchain Music Platform,"  So here everything is in the hands of the developers Potentiam. If they put their best efforts on the development stage, people will remain on their platform.",False
1318,msg38289527,https://bitcointalk.org/index.php?topic=2209815.0,,175194,Announcements (Altcoins),2018-05-23 14:41:36,cryptoeclipse,Newbie,168,0,,[ANN]Potentiam-The Blockchain Music Platform,Let's see what kind of playground they will have. Judging by the site will be a bright and beautiful design on platform. I hope that it will be convenient to use.,False
1319,msg38291911,https://bitcointalk.org/index.php?topic=2209815.0,,175194,Announcements (Altcoins),2018-05-23 15:05:43,Jack Cparrow,Newbie,42,0,,[ANN]Potentiam-The Blockchain Music Platform,"I think that in the first place must be clarity and speed. If it is in Potentiam, then the love from users is guaranteed.",False
1320,msg38295949,https://bitcointalk.org/index.php?topic=2209815.0,msg38291911,175194,Announcements (Altcoins),2018-05-23 15:46:49,Hmelnitsky,Member,102,10,,[ANN]Potentiam-The Blockchain Music Platform,"   By the way, I agree with you, from my experience - if it's not convenient for me to use, and the application slows down - I quickly delete it.",False
1321,msg38298054,https://bitcointalk.org/index.php?topic=2209815.0,msg38295949,175194,Announcements (Altcoins),2018-05-23 16:09:03,punkster,Newbie,168,0,,[ANN]Potentiam-The Blockchain Music Platform,  And I like what design is now at Potentiam. Such bright and saturated colors. I hope in the same style will be the design of applications,False
1322,msg38299472,https://bitcointalk.org/index.php?topic=2209815.0,,175194,Announcements (Altcoins),2018-05-23 16:24:00,Neither,Newbie,98,0,,[ANN]Potentiam-The Blockchain Music Platform,"Still ahead, the project is young and has just begun to develop. I am sure that in the near future we will see a full-fledged platform for supporting young performers",False
1323,msg38069919,https://bitcointalk.org/index.php?topic=2209815.0,msg38068125,175194,Announcements (Altcoins),2018-05-21 17:40:37,cryptoplanet,Newbie,70,0,,[ANN]Potentiam-The Blockchain Music Platform,"  Very cool, it is visible that the project team work on and develops the project. This is very encouraging.",False
1324,msg38072417,https://bitcointalk.org/index.php?topic=2209815.0,msg38069919,175194,Announcements (Altcoins),2018-05-21 18:07:16,cryptozian,Newbie,210,0,,[ANN]Potentiam-The Blockchain Music Platform,"  Yes, guys are great. Already a token on 2 exchanges. And I think that on this they are not going to stop.",False
1325,msg38074147,https://bitcointalk.org/index.php?topic=2209815.0,msg38068125,175194,Announcements (Altcoins),2018-05-21 18:26:13,cryptoeclipse,Newbie,168,0,,[ANN]Potentiam-The Blockchain Music Platform,  Someone was already trading on this exchange? I wonder what their commission is,False
1326,msg38075686,https://bitcointalk.org/index.php?topic=2209815.0,msg38074147,175194,Announcements (Altcoins),2018-05-21 18:42:14,Jack Cparrow,Newbie,42,0,,[ANN]Potentiam-The Blockchain Music Platform,  The commision is like an ordinary exchange. I did not see any promotions or special offers there. Go and look yourself. He will not bite you)),False
1327,msg38077416,https://bitcointalk.org/index.php?topic=2209815.0,msg38075686,175194,Announcements (Altcoins),2018-05-21 19:00:30,Hmelnitsky,Member,102,10,,[ANN]Potentiam-The Blockchain Music Platform,  And the value of the token immediately grew. Although recently it was very cheap to buy.,False
1328,msg38079506,https://bitcointalk.org/index.php?topic=2209815.0,,175194,Announcements (Altcoins),2018-05-21 19:22:51,crypto Deddy,Newbie,98,0,,[ANN]Potentiam-The Blockchain Music Platform,What is the difference between a simple exchange and a decentralized one? Who can explain in simple words.,False
1329,msg38081437,https://bitcointalk.org/index.php?topic=2209815.0,msg38077416,175194,Announcements (Altcoins),2018-05-21 19:44:09,punkster,Newbie,168,0,,[ANN]Potentiam-The Blockchain Music Platform,"  And I think it's still ahead. After all, on this step they don't stop, there will be other exchanges, with other possibilities. All ahead.",False
1330,msg38178309,https://bitcointalk.org/index.php?topic=2209815.0,msg38141086,175194,Announcements (Altcoins),2018-05-22 15:25:11,punkster,Newbie,168,0,,[ANN]Potentiam-The Blockchain Music Platform,"  Very cool, because in the modern world is very difficult to break through without the help of certain professionals in their field. So Potentiam is the hand of helping young musicians!",False
1331,msg38179930,https://bitcointalk.org/index.php?topic=2209815.0,msg38178309,175194,Announcements (Altcoins),2018-05-22 15:42:49,crypto Deddy,Newbie,98,0,,[ANN]Potentiam-The Blockchain Music Platform,"  No less important is what Potentiam will create in order to give voice to new artists in the music world, and to all those who love their work) The volume of trading is also growing, great news!",False
1332,msg38181782,https://bitcointalk.org/index.php?topic=2209815.0,,175194,Announcements (Altcoins),2018-05-22 16:02:26,Neither,Newbie,98,0,,[ANN]Potentiam-The Blockchain Music Platform,"Potentiam developers created a very cool project, because we will be able to see many new talented people with diverse talents)))",False
1333,msg38184120,https://bitcointalk.org/index.php?topic=2209815.0,,175194,Announcements (Altcoins),2018-05-22 16:24:29,cryptoicicle,Newbie,98,0,,[ANN]Potentiam-The Blockchain Music Platform,"It is great that Potentiam project is based on the blockchain technology, it introduces confidence!",False
1334,msg38186091,https://bitcointalk.org/index.php?topic=2209815.0,msg38184120,175194,Announcements (Altcoins),2018-05-22 16:43:47,Mike Mike,Newbie,154,0,,[ANN]Potentiam-The Blockchain Music Platform,"  In this way, with the help of blockchain, we can store information without relying on intermediaries, security is provided by cryptographic algorithms.",False
1335,msg38188212,https://bitcointalk.org/index.php?topic=2209815.0,msg38186091,175194,Announcements (Altcoins),2018-05-22 17:03:25,sjuzze,Newbie,168,0,,[ANN]Potentiam-The Blockchain Music Platform,"  It is very important and valuable, because the protection of each of us must be at the highest level. Blockchain will change the system of trust users to the company, because everything is transparent, clean, and verified)",False
1336,msg38190435,https://bitcointalk.org/index.php?topic=2209815.0,msg38179930,175194,Announcements (Altcoins),2018-05-22 17:26:14,Starkon,Newbie,70,0,,[ANN]Potentiam-The Blockchain Music Platform,"  And also they work on listing PTM token on the exchangers, and it's great that team develop this part.",False
1337,msg38191990,https://bitcointalk.org/index.php?topic=2209815.0,,175194,Announcements (Altcoins),2018-05-22 17:42:06,cryptoicicle,Newbie,98,0,,[ANN]Potentiam-The Blockchain Music Platform,"As I know, tokens PTM is available on 2 exchangers? Or not?",False
1338,msg38194050,https://bitcointalk.org/index.php?topic=2209815.0,msg38191990,175194,Announcements (Altcoins),2018-05-22 18:02:11,Mike Mike,Newbie,154,0,,[ANN]Potentiam-The Blockchain Music Platform,"  Yes, few time ago, team listed token on one more exchange - http://idex.market. It's old decentrelised market.",False
1339,msg38196621,https://bitcointalk.org/index.php?topic=2209815.0,msg38194050,175194,Announcements (Altcoins),2018-05-22 18:29:01,cryptozian,Newbie,210,0,,[ANN]Potentiam-The Blockchain Music Platform,"  Great news! Now I know, that team work on PTM token. And in near future it's be very ease to buy or sell it.",False
1340,msg38197726,https://bitcointalk.org/index.php?topic=2209815.0,msg38196621,175194,Announcements (Altcoins),2018-05-22 18:41:13,cold beer,Jr. Member,168,1,,[ANN]Potentiam-The Blockchain Music Platform,"  The volume of trading is not small, to say the truth. But the price has fallen a little, is it normal?",False
1341,msg38199658,https://bitcointalk.org/index.php?topic=2209815.0,msg38188212,175194,Announcements (Altcoins),2018-05-22 19:02:05,botkiller,Newbie,112,0,,[ANN]Potentiam-The Blockchain Music Platform,  Great advantage is the ability of the performers themselves to earn more because they will be considered independent of the producers and the rest of the,False
1342,msg38201306,https://bitcointalk.org/index.php?topic=2209815.0,,175194,Announcements (Altcoins),2018-05-22 19:19:31,Medyna,Member,132,10,,[ANN]Potentiam-The Blockchain Music Platform,I see that on the exchange idex.market and bitpaction the volume of trades is growth.,False
1343,msg37971789,https://bitcointalk.org/index.php?topic=2209815.0,,175194,Announcements (Altcoins),2018-05-20 21:46:19,turenkopolina1992,Jr. Member,238,2,,[ANN]Potentiam-The Blockchain Music Platform,"They can create from the urge and  soul for own audience)) All that need - buy some PTM tokens on the exchengers, and you can star))",False
1344,msg37973096,https://bitcointalk.org/index.php?topic=2209815.0,msg37971789,175194,Announcements (Altcoins),2018-05-20 22:02:39,cryptoicicle,Newbie,98,0,,[ANN]Potentiam-The Blockchain Music Platform,"   And this is great, because POTENTIAM creating platform where talented people have more opportunities to profit for the development their interests and talents.",False
1345,msg37974666,https://bitcointalk.org/index.php?topic=2209815.0,,175194,Announcements (Altcoins),2018-05-20 22:23:00,NatalieVishneva,Jr. Member,252,1,,[ANN]Potentiam-The Blockchain Music Platform,please tell me what are the advantages of PTM tokens? Is it worth buying them?,False
1346,msg37976632,https://bitcointalk.org/index.php?topic=2209815.0,msg37974666,175194,Announcements (Altcoins),2018-05-20 22:49:18,Starkon,Newbie,70,0,,[ANN]Potentiam-The Blockchain Music Platform,"   It's worth to buy, because being the owner of PTM, you will be able to put your tokens in the Potentiam Vault store, which will give them special rights and privilege, agree, it's not bad) And price of token now really good!",False
1347,msg37979374,https://bitcointalk.org/index.php?topic=2209815.0,msg37977888,175194,Announcements (Altcoins),2018-05-20 23:28:21,Neither,Newbie,98,0,,[ANN]Potentiam-The Blockchain Music Platform,"   As an example: that it can be seen in a large number of growth of the young performers market, which means using PTM tokens that exceed the offer. They provide the potential for growth.",False
1348,msg38000920,https://bitcointalk.org/index.php?topic=2209815.0,,175194,Announcements (Altcoins),2018-05-21 05:22:50,Blockchain kitty,Jr. Member,168,2,,[ANN]Potentiam-The Blockchain Music Platform,"A very promising project and their tokens are even more promising))) Because the owners of PTM tokens can design music, и влaдeть пpaвaми нa нee. Will I participate in the development of such a project? Definitely - yes! I think the guys have a great future!",False
1349,msg38003845,https://bitcointalk.org/index.php?topic=2209815.0,,175194,Announcements (Altcoins),2018-05-21 06:01:05,crypto Deddy,Newbie,98,0,,[ANN]Potentiam-The Blockchain Music Platform,I can buy token on http://idex.market and https://www.bitpaction.com?? Or there some another way?,False
1350,msg38041108,https://bitcointalk.org/index.php?topic=2209815.0,,175194,Announcements (Altcoins),2018-05-21 12:49:28,Jack Cparrow,Newbie,42,0,,[ANN]Potentiam-The Blockchain Music Platform,"Also I saw that there is a digital recording studio, which includes all the necessary tools for the creators In addition, there you can manage your content, and it's very cool that all copyrights copyright! Cool Project!",False
1351,msg38042460,https://bitcointalk.org/index.php?topic=2209815.0,,175194,Announcements (Altcoins),2018-05-21 13:03:14,punkster,Newbie,168,0,,[ANN]Potentiam-The Blockchain Music Platform,"I am glad that Potentiam Classic will be launched in parallel with the central part of the Potentiam Core platform, which is a blockchain alternative to investments",False
1352,msg38044572,https://bitcointalk.org/index.php?topic=2209815.0,,175194,Announcements (Altcoins),2018-05-21 13:25:28,crypto Deddy,Newbie,98,0,,[ANN]Potentiam-The Blockchain Music Platform,"Thanks to Potentiam there will be an opportunity to walk around all record companies and marketing specialists, managers of the selection of artists and repertoire",False
1353,msg38046326,https://bitcointalk.org/index.php?topic=2209815.0,msg38041108,175194,Announcements (Altcoins),2018-05-21 13:43:26,Hmelnitsky,Member,102,10,,[ANN]Potentiam-The Blockchain Music Platform,"   Live performances and shows, hmm this is something interesting, I wonder if it will help performers and promoters find each other !?",False
1354,msg38048300,https://bitcointalk.org/index.php?topic=2209815.0,,175194,Announcements (Altcoins),2018-05-21 14:01:42,Neither,Newbie,98,0,,[ANN]Potentiam-The Blockchain Music Platform,"Is this true that Potentiam Classic will work with voluntary collective investments, which will allow to raise money for new promising performers?",False
1355,msg38050536,https://bitcointalk.org/index.php?topic=2209815.0,,175194,Announcements (Altcoins),2018-05-21 14:24:01,cryptoicicle,Newbie,98,0,,[ANN]Potentiam-The Blockchain Music Platform,I like your idea! This will attract young performers to the platform) What is the most attractive in the Potentiam platform?,False
1356,msg38052479,https://bitcointalk.org/index.php?topic=2209815.0,msg38050536,175194,Announcements (Altcoins),2018-05-21 14:42:53,Mike Mike,Newbie,154,0,,[ANN]Potentiam-The Blockchain Music Platform,"  So this is complete decentralization! In addition, security and integrity is provided by cryptographic algorithms. Trust is above all!",False
1357,msg38054428,https://bitcointalk.org/index.php?topic=2209815.0,,175194,Announcements (Altcoins),2018-05-21 15:02:00,sjuzze,Newbie,168,0,,[ANN]Potentiam-The Blockchain Music Platform,"Guys, do you knew that the company's history is very long-term, because the founders of Potentiam worked in the field of music management for a number of years!",False
1358,msg38056347,https://bitcointalk.org/index.php?topic=2209815.0,msg38054428,175194,Announcements (Altcoins),2018-05-21 15:20:43,botkiller,Newbie,112,0,,[ANN]Potentiam-The Blockchain Music Platform,"  Sure, they understanding all the difficulties associated with promoting new musicians-beginners.",False
1359,msg38058380,https://bitcointalk.org/index.php?topic=2209815.0,msg38056347,175194,Announcements (Altcoins),2018-05-21 15:40:31,Patrick777,Newbie,98,0,,[ANN]Potentiam-The Blockchain Music Platform,"  Yes, I read the history of creating this company and found very interesting information that in 2016 they founded the Britznbeatz music edition.That company help to find and promote musicians who gain respect in their audience)",False
1360,msg38060573,https://bitcointalk.org/index.php?topic=2209815.0,,175194,Announcements (Altcoins),2018-05-21 16:02:50,Medyna,Member,132,10,,[ANN]Potentiam-The Blockchain Music Platform,"Guys, did you see that the token was listed  to another exchange?",False
1361,msg38066226,https://bitcointalk.org/index.php?topic=2209815.0,msg38060573,175194,Announcements (Altcoins),2018-05-21 17:00:40,killerbot,Jr. Member,71,1,,[ANN]Potentiam-The Blockchain Music Platform,"   Cool, I have not heard about it yet. And what kind of exchange? What about registration?",False
1362,msg38068125,https://bitcointalk.org/index.php?topic=2209815.0,,175194,Announcements (Altcoins),2018-05-21 17:21:30,cryptoplane,Newbie,154,0,,[ANN]Potentiam-The Blockchain Music Platform,"Decentralized exchange http: //idex.market. There are a lot of good tokens , and now also PTM. And by the way a very simple registration.",False
1363,msg37592768,https://bitcointalk.org/index.php?topic=2209815.0,msg37584760,175194,Announcements (Altcoins),2018-05-17 17:18:45,crypto mommy,Jr. Member,85,1,,[ANN]Potentiam-The Blockchain Music Platform,"   I agree with you, the prospects for this business are simply huge, so that's still to come. And I think it's worth taking part in the project, as long as there is an opportunity",False
1364,msg37595533,https://bitcointalk.org/index.php?topic=2209815.0,,175194,Announcements (Altcoins),2018-05-17 17:52:09,bonick,Newbie,98,0,,[ANN]Potentiam-The Blockchain Music Platform,"By the way on bitpaction held a contest, free distribution of tokens! I managed to take part and getmore than 500 tokens))",False
1365,msg37597824,https://bitcointalk.org/index.php?topic=2209815.0,msg37595533,175194,Announcements (Altcoins),2018-05-17 18:19:12,NatalieVishneva,Jr. Member,252,1,,[ANN]Potentiam-The Blockchain Music Platform,"  Wow, cool. I didn't know that so opportunity was happening. I hope there will be such contests, it's very cool.",False
1366,msg37601280,https://bitcointalk.org/index.php?topic=2209815.0,msg37597824,175194,Announcements (Altcoins),2018-05-17 19:02:50,Botaisk,Newbie,168,0,,[ANN]Potentiam-The Blockchain Music Platform,"  There should be similar contests, because now the token is traded on only one exchange. In the future, it will be on the other.",False
1367,msg37603233,https://bitcointalk.org/index.php?topic=2209815.0,msg37601280,175194,Announcements (Altcoins),2018-05-17 19:27:33,crypto reva,Newbie,154,0,,[ANN]Potentiam-The Blockchain Music Platform,"  Interestingly, on other exchanges, too, will hold contests, what do you think?",False
1368,msg37605101,https://bitcointalk.org/index.php?topic=2209815.0,msg37603233,175194,Announcements (Altcoins),2018-05-17 19:50:23,Bernart,Jr. Member,154,1,,[ANN]Potentiam-The Blockchain Music Platform,  Looking at which listing will be listed. Now mostly young stock exchanges hold such contests.,False
1369,msg37606299,https://bitcointalk.org/index.php?topic=2209815.0,msg37584760,175194,Announcements (Altcoins),2018-05-17 20:05:36,Blockchain kitty,Jr. Member,168,2,,[ANN]Potentiam-The Blockchain Music Platform,"   every interested person can buy tokens on the exchange, they are available on bitpaction. This will help support the company, and in the future it will be possible to earn on it.",False
1370,msg37654710,https://bitcointalk.org/index.php?topic=2209815.0,,175194,Announcements (Altcoins),2018-05-18 09:07:23,yurez,Hero Member,1288,505,,[ANN]Potentiam-The Blockchain Music Platform,"The new design of the site I like, it has become more suitable for the design of the music platform.  Now I will wait for Q4 2018 - Potentiam Beta Release.",False
1371,msg37907096,https://bitcointalk.org/index.php?topic=2209815.0,,175194,Announcements (Altcoins),2018-05-20 11:04:57,Botaisk,Newbie,168,0,,[ANN]Potentiam-The Blockchain Music Platform,It is very bad that the creators of the content get their fees through intermediaries… With Potentiam - everybody can start with own way in this field),False
1372,msg37909163,https://bitcointalk.org/index.php?topic=2209815.0,msg37907096,175194,Announcements (Altcoins),2018-05-20 11:27:46,Medyna,Member,132,10,,[ANN]Potentiam-The Blockchain Music Platform,  POTENTIAM team found an alternative how to solve this problem and created such a wonderful project! Everybody can buy some token on http://idex.market or https://www.bitpaction.com And strat to creat own content)),False
1373,msg37911824,https://bitcointalk.org/index.php?topic=2209815.0,msg37909163,175194,Announcements (Altcoins),2018-05-20 11:57:01,crypto mommy,Jr. Member,85,1,,[ANN]Potentiam-The Blockchain Music Platform,"  Wow, the project now listed on idex.market . Cool, one more exchanger)",False
1374,msg37915013,https://bitcointalk.org/index.php?topic=2209815.0,msg37911824,175194,Announcements (Altcoins),2018-05-20 12:29:57,cold beer,Jr. Member,168,1,,[ANN]Potentiam-The Blockchain Music Platform,"   Yes, and the volume of trades is constantly growing. If you notice. I'm watching from the outside, and already want to try.",False
1375,msg37918331,https://bitcointalk.org/index.php?topic=2209815.0,,175194,Announcements (Altcoins),2018-05-20 13:04:15,super stas,Newbie,168,0,,[ANN]Potentiam-The Blockchain Music Platform,"It's nice to see that the project is being implemented. This means that it makes sense to invest, the price of the PTM will only grow.",False
1376,msg37957538,https://bitcointalk.org/index.php?topic=2209815.0,msg37918331,175194,Announcements (Altcoins),2018-05-20 19:16:10,Patrick777,Newbie,98,0,,[ANN]Potentiam-The Blockchain Music Platform,"   Constantly the price of the PTM can not be all time grow. But you are right. In small steps, the project team is developing Potentiam in a bright future.",False
1377,msg37960350,https://bitcointalk.org/index.php?topic=2209815.0,,175194,Announcements (Altcoins),2018-05-20 19:43:19,Great Man,Jr. Member,168,2,,[ANN]Potentiam-The Blockchain Music Platform,"But guys, you will agree, even if a very talented musician becomes popular thanks to the Internet, in the end, he will make music not himself but with the help of: the producer, the record company and so on .",False
1378,msg37962396,https://bitcointalk.org/index.php?topic=2209815.0,msg37960350,175194,Announcements (Altcoins),2018-05-20 20:03:16,botkiller,Newbie,112,0,,[ANN]Potentiam-The Blockchain Music Platform,"   In fact, yes, the Internet gives us a great opportunity to get a huge audience and communicate with it on an equal footing. Team has created such a great project, which sees the solution of this problem.",False
1379,msg37964397,https://bitcointalk.org/index.php?topic=2209815.0,,175194,Announcements (Altcoins),2018-05-20 20:23:54,cryptozian,Newbie,210,0,,[ANN]Potentiam-The Blockchain Music Platform,"Thanks to Potentiam many problems in this business will disappear, and thus will send the listener directly to the performer, which is very cool!",False
1380,msg37965965,https://bitcointalk.org/index.php?topic=2209815.0,msg37964397,175194,Announcements (Altcoins),2018-05-20 20:40:10,sjuzze,Newbie,168,0,,[ANN]Potentiam-The Blockchain Music Platform,"   I understand that the POTENTIAM platform allows creative people, new performers and professionals to choose their own destiny, and decide how they should work better!",False
1381,msg37968823,https://bitcointalk.org/index.php?topic=2209815.0,,175194,Announcements (Altcoins),2018-05-20 21:11:47,JooBra,Full Member,462,100,,[ANN]Potentiam-The Blockchain Music Platform,"Finally one project that involves music industry, well there have been other projects but I believe this project is by far the best.",False
1382,msg37969291,https://bitcointalk.org/index.php?topic=2209815.0,,175194,Announcements (Altcoins),2018-05-20 21:17:11,Mike Mike,Newbie,154,0,,[ANN]Potentiam-The Blockchain Music Platform,"Completely agree with you, it's cool that there is such  project that allows young performers to occupy their niche in the industry without depending on the intermediaries, and their opinions.",False
1383,msg37444105,https://bitcointalk.org/index.php?topic=2209815.0,,175194,Announcements (Altcoins),2018-05-16 10:19:32,Great Man,Jr. Member,168,2,,[ANN]Potentiam-The Blockchain Music Platform,"Very cool social network!A very interesting central part of the platform is Potentiam Core, created for creators, inside of which everyone can create their own page for further promotion of their creativity, as well as find partners for joint creative projects.",False
