id,msg_id,parent_id,link_id,Count_read,Forum,Time,Author,Rank,Activity,Merit,Trust,Title,Body,ScamHeader
1874,msg33794481,https://bitcointalk.org/index.php?topic=2209815.0,msg22258508,175194,Announcements (Altcoins),2018-04-02 21:38:29,VIBETECHNOLOGIES,Newbie,13,0,,[ANN]Potentiam-The Blockchain Music Platform, ,False
1875,msg33798372,https://bitcointalk.org/index.php?topic=2209815.0,,175194,Announcements (Altcoins),2018-04-02 23:20:49,nambangkoin484,Newbie,126,0,,[ANN]Potentiam-The Blockchain Music Platform,Is this project promising??,False
1876,msg33802566,https://bitcointalk.org/index.php?topic=2209815.0,msg31871326,175194,Announcements (Altcoins),2018-04-03 01:53:17,zee123,Full Member,392,100,,[ANN]Potentiam-The Blockchain Music Platform,   Thank you for your support. Don't forget to take part in the 50% Easter bonus. https://www.potentiam.io,False
1877,msg33822947,https://bitcointalk.org/index.php?topic=2209815.0,,175194,Announcements (Altcoins),2018-04-03 09:19:23,urbenji,Newbie,30,0,,[ANN]Potentiam-The Blockchain Music Platform,"Hello everyone, look forward to being part of the success journey. Interesting and promising project! As a creative I am very interested in watching this develop.",False
1878,msg33880012,https://bitcointalk.org/index.php?topic=2209815.0,msg33568236,175194,Announcements (Altcoins),2018-04-03 23:30:58,zee123,Full Member,392,100,,[ANN]Potentiam-The Blockchain Music Platform,   Thanks for the support. Don't miss out on the Easter 0.5 ETH 50% bonus.It ends in the next 48 hours.,False
1879,msg33881687,https://bitcointalk.org/index.php?topic=2209815.0,msg33568236,175194,Announcements (Altcoins),2018-04-04 00:24:48,zee123,Full Member,392,100,,[ANN]Potentiam-The Blockchain Music Platform,   Thank you hope we can count on your support.,False
1880,msg33882803,https://bitcointalk.org/index.php?topic=2209815.0,msg33573533,175194,Announcements (Altcoins),2018-04-04 01:07:45,zee123,Full Member,392,100,,[ANN]Potentiam-The Blockchain Music Platform,  Thanks for the kind words. Be sure to take advantage of the Easter bonus. For a minimum contribution of 0.5 ETH you get a 50% bonus. https://www.potentiam.io,False
1881,msg33883917,https://bitcointalk.org/index.php?topic=2209815.0,msg33576100,175194,Announcements (Altcoins),2018-04-04 01:50:01,zee123,Full Member,392,100,,[ANN]Potentiam-The Blockchain Music Platform,   Thank you! Potentiam was created not only for music artists but the fans/investors that make the industry function. Hope you are onboard to support us. The token sale is now on with a 50% Easter bonus for a minimum contribution of 0.5 ETH. Visit to purchase tokens now. https://www.potentiam.io,False
1882,msg33885384,https://bitcointalk.org/index.php?topic=2209815.0,msg33597383,175194,Announcements (Altcoins),2018-04-04 02:37:49,zee123,Full Member,392,100,,[ANN]Potentiam-The Blockchain Music Platform,   Thanks for the support.,False
1883,msg31615108,https://bitcointalk.org/index.php?topic=2209815.0,,175194,Announcements (Altcoins),2018-03-05 09:27:34,queenofbtc,Member,96,10,,[ANN]Potentiam-The Blockchain Music Platform,I would just like to say i am very impressed with team Potentiam.  Over 3400 members on telegram and growing every hour. For the your vision on how you guys are going to contribute to the multi billion dollar industry in music.  I want a slice of that too.  The sky the limit  Join in guys. These people wont disappoint!!!!!,False
1884,msg31655549,https://bitcointalk.org/index.php?topic=2209815.0,,175194,Announcements (Altcoins),2018-03-05 19:57:56,artursimsonfrg,Newbie,126,0,,[ANN]Potentiam-The Blockchain Music Platform,"Potentiam was created to give a voice to emerging artists, content writers in the music world and all those who strive to make it possible.",False
1885,msg31839085,https://bitcointalk.org/index.php?topic=2209815.0,,175194,Announcements (Altcoins),2018-03-08 10:01:03,alexa1303,Newbie,42,0,,[ANN]Potentiam-The Blockchain Music Platform,WEEK 8 (02.03-08.03) Hoмep тaблицы: 89  Fasebook username: Aлeкcaндpa Гaвpилeнкo Fasebook url: https://www.facebook.com/piatniza.alexa Followers:  3670  repost & like: https://www.facebook.com/piatniza.alexa/posts/2153297428232343 https://www.facebook.com/piatniza.alexa/posts/2152995684929184 https://www.facebook.com/piatniza.alexa/posts/2152730234955729 https://www.facebook.com/piatniza.alexa/posts/2152729714955781 https://www.facebook.com/piatniza.alexa/posts/2154513118110774 https://www.facebook.com/piatniza.alexa/posts/2155084721386947 https://www.facebook.com/photo.php?fbid=2155092654719487&set=a.1385836764978417.1073741828.100006563199201&type=3 https://www.facebook.com/piatniza.alexa/posts/2155248401370579 https://www.facebook.com/piatniza.alexa/posts/2155248324703920 https://www.facebook.com/piatniza.alexa/posts/2156285554600197,False
1886,msg31871326,https://bitcointalk.org/index.php?topic=2209815.0,,175194,Announcements (Altcoins),2018-03-08 18:53:56,4gu5dr4g0n,Full Member,476,104,,[ANN]Potentiam-The Blockchain Music Platform,providing opportunities for talented artists to earn a better income also provides an opportunity for the community to obtain and benefit from the music industry. Good Luck Dev And Team ,False
1887,msg31903736,https://bitcointalk.org/index.php?topic=2209815.0,,175194,Announcements (Altcoins),2018-03-09 08:56:27,Kuala Lumpur,Member,420,69,,[ANN]Potentiam-The Blockchain Music Platform,"Guys, how are the fees going? After all, until the end of the sale is not so much time .. And I read here 1 very important nuance: As a decentralized public ledger sitting on top of a peer-to-peer network, the blockchain can be used to store information without relying on any intermediary, but relying instead on the contribution of every peer in the network in order to deploy a fully decentralized database, whose security and integrity is ensured by cryptographic algorithms.",False
1888,msg32122406,https://bitcointalk.org/index.php?topic=2209815.0,msg31323608,175194,Announcements (Altcoins),2018-03-12 08:37:25,zee123,Full Member,392,100,,[ANN]Potentiam-The Blockchain Music Platform,   Thanks for your support. We are going to have more exciting news coming out shortly. Join us on telegram if you haven't. https://t.me/potentiamgroup,False
1889,msg33006694,https://bitcointalk.org/index.php?topic=2209815.0,,175194,Announcements (Altcoins),2018-03-23 19:07:53,alexa1303,Newbie,42,0,,[ANN]Potentiam-The Blockchain Music Platform,WEEK 9 (17.03-23.03) Hoмep тaблицы: 89  Fasebook username: Aлeкcaндpa Гaвpилeнкo Fasebook url: https://www.facebook.com/piatniza.alexa Followers:  4123  repost & like: https://www.facebook.com/piatniza.alexa/posts/2162403893988363 https://www.facebook.com/piatniza.alexa/posts/2162403943988358 https://www.facebook.com/piatniza.alexa/posts/2162403990655020 https://www.facebook.com/piatniza.alexa/posts/2162404090655010 https://www.facebook.com/piatniza.alexa/posts/2162404213988331 https://www.facebook.com/piatniza.alexa/posts/2162404317321654 https://www.facebook.com/piatniza.alexa/posts/2163174260577993 https://www.facebook.com/piatniza.alexa/posts/2163962533832499 https://www.facebook.com/piatniza.alexa/posts/2164600543768698 https://www.facebook.com/potentiam.io/posts/555773024783058 https://www.facebook.com/piatniza.alexa/posts/2164831470412272,False
1890,msg33403662,https://bitcointalk.org/index.php?topic=2209815.0,,175194,Announcements (Altcoins),2018-03-28 22:07:06,queenofbtc,Member,96,10,,[ANN]Potentiam-The Blockchain Music Platform,Amazing thread.. I suggest everyone to join this project. Invite friends and family. Let's start the music revolution in the multi billion dollar industry powered by blockchain technology.. woohoo! Cant wait! Keep up the good work Potentiam team!  The family in telegram channel is growing now at 4.4k and getting bigger  t.me/potentiamgroup,False
1891,msg33485155,https://bitcointalk.org/index.php?topic=2209815.0,,175194,Announcements (Altcoins),2018-03-30 00:15:37,Jaephoenix,Jr. Member,182,2,,[ANN]Potentiam-The Blockchain Music Platform,I would like to know what is Potentiam's vision in the next 10 years,False
1892,msg33557527,https://bitcointalk.org/index.php?topic=2209815.0,msg33403662,175194,Announcements (Altcoins),2018-03-30 21:56:40,zee123,Full Member,392,100,,[ANN]Potentiam-The Blockchain Music Platform,      Only going to get bigger. We have started a massive airdrop campaign. Be sure to sign up.,False
1893,msg33559161,https://bitcointalk.org/index.php?topic=2209815.0,msg33485155,175194,Announcements (Altcoins),2018-03-30 22:36:22,zee123,Full Member,392,100,,[ANN]Potentiam-The Blockchain Music Platform,   To be at the forefront of the music industry. Getting music from all over the world featured on Potentiam. To be the platform where independent artists come to raise funds and promote their work. The number one source for independent music.,False
1894,msg33559249,https://bitcointalk.org/index.php?topic=2209815.0,msg31655549,175194,Announcements (Altcoins),2018-03-30 22:38:33,rohman69,Jr. Member,86,1,,[ANN]Potentiam-The Blockchain Music Platform,"  yes of course, because that is one of the main goals created this crypto",False
1895,msg33568236,https://bitcointalk.org/index.php?topic=2209815.0,,175194,Announcements (Altcoins),2018-03-31 03:55:21,tamaa,Newbie,26,0,,[ANN]Potentiam-The Blockchain Music Platform,This is good project,False
1896,msg33573533,https://bitcointalk.org/index.php?topic=2209815.0,,175194,Announcements (Altcoins),2018-03-31 06:20:45,tonyteo0120,Newbie,97,0,,[ANN]Potentiam-The Blockchain Music Platform,"Wohh, Good project... Good luck Team Thanks!",False
1897,msg33576100,https://bitcointalk.org/index.php?topic=2209815.0,,175194,Announcements (Altcoins),2018-03-31 07:15:23,nugezmils,Jr. Member,394,1,,[ANN]Potentiam-The Blockchain Music Platform,Great and interesting project. Nice work guys. Keep it up,False
1898,msg33597383,https://bitcointalk.org/index.php?topic=2209815.0,,175194,Announcements (Altcoins),2018-03-31 13:02:45,coinwoot,Newbie,84,0,,[ANN]Potentiam-The Blockchain Music Platform,"Hello,  We have added Potentiam ICO profile to CoinWoot website (link - http://coinwoot.com/ico/potentiam).  If you have any question about Potentiam ICO profile, feel free to contact us.",False
1899,msg33600853,https://bitcointalk.org/index.php?topic=2209815.0,,175194,Announcements (Altcoins),2018-03-31 13:52:06,ndogsemut,Newbie,107,0,,[ANN]Potentiam-The Blockchain Music Platform,I strongly support this cryptocurrency project on music base,False
1900,msg33614712,https://bitcointalk.org/index.php?topic=2209815.0,,175194,Announcements (Altcoins),2018-03-31 16:54:25,patndy,Newbie,11,0,,[ANN]Potentiam-The Blockchain Music Platform,This can turn out to be great if the project plan is followed through. But how do you intend to beat existing rival projects?,False
1901,msg33616392,https://bitcointalk.org/index.php?topic=2209815.0,,175194,Announcements (Altcoins),2018-03-31 17:17:55,davidkakeko,Full Member,322,100,,[ANN]Potentiam-The Blockchain Music Platform,Potentiam  most awaited music project 2018 Always monitor the project from the beginning,False
1902,msg33618681,https://bitcointalk.org/index.php?topic=2209815.0,,175194,Announcements (Altcoins),2018-03-31 17:52:40,chunhocxitrum,Newbie,336,0,,[ANN]Potentiam-The Blockchain Music Platform,THis is a perfect project that i've seen. Many bounties to join and I will invite to my friends to join and waiting for the ICO begins Best wishes for all of you POTENTIAM !!,False
1903,msg30651994,https://bitcointalk.org/index.php?topic=2209815.0,msg30650050,175194,Announcements (Altcoins),2018-02-20 01:42:32,zee123,Full Member,392,100,,[ANN]Potentiam-The Blockchain Music Platform,"   Hi, we have been advised by our legal representatives not to talk about exchanges till after the ICO.  Thanks",False
1904,msg30652767,https://bitcointalk.org/index.php?topic=2209815.0,msg30649794,175194,Announcements (Altcoins),2018-02-20 02:10:54,zee123,Full Member,392,100,,[ANN]Potentiam-The Blockchain Music Platform,"   Hi Aminra, glad you enjoyed reading the white paper and also impressed by the new advisors. You can listen to music on the alpha site at the moment though it is not yet open to the public fully. But you have an idea of the look and feel we are going for. Please bear in mind its still work in progress, so kindly let us know what you would like us to improve on. If you detect any bugs kindly let us know. In regards to the new website, we wanted to provide a clear and direct message of what Potentiam is about. We will work to improve it as time goes on.  Thanks",False
1905,msg30743955,https://bitcointalk.org/index.php?topic=2209815.0,,175194,Announcements (Altcoins),2018-02-21 09:23:15,queenofbtc,Member,96,10,,[ANN]Potentiam-The Blockchain Music Platform,The relauch of Potentiam with alpha version live especially with 5000+ independent artist on there. Wow! Just wow. Its the solution and its going to be the future for the music industry powered by blockchain technology. Cutting all these middle man who have had the power and influence. Great job!!! 18% bonus available right now until Friday I believe!,False
1906,msg30799680,https://bitcointalk.org/index.php?topic=2209815.0,msg30743955,175194,Announcements (Altcoins),2018-02-22 02:05:25,zee123,Full Member,392,100,,[ANN]Potentiam-The Blockchain Music Platform,"   Thanks for the support. Please use the alpha platform and give us feedback in regards to how you think we can make it better. Also, let us know of any bugs or problems you detect.",False
1907,msg30819452,https://bitcointalk.org/index.php?topic=2209815.0,,175194,Announcements (Altcoins),2018-02-22 09:58:55,OZZYMANDIAS,Newbie,37,0,,[ANN]Potentiam-The Blockchain Music Platform,"I dont know if anyone else is checking out the Alpha Test Site, i have to say the new music releases section on the Alpha has some beautiful, beautiful music. i know this is just the test site, but i wonder how great their playlist would be when the Alpha becomes fully functional and all the hidden features begin to work. Thank God for Blockchain, Thank God for Potentiam.",False
1908,msg30820084,https://bitcointalk.org/index.php?topic=2209815.0,msg30819452,175194,Announcements (Altcoins),2018-02-22 10:09:35,Aminra,Newbie,5,0,,[ANN]Potentiam-The Blockchain Music Platform,"   Yeah Ozzy, i was in the Alpha too, and you are right the new releases are very nice tunes, i like Ego Trip by Kojo Stone, now that is beautiful music. i dont know what potentiam guys are planning for the future in regards to new updates and more user friendly features on the Alpha, but i am impressed so far with the test site. i have a good feeling about this project, the sky is the limit theres so much scope for add ons, customised features and third party plug ins with partners. am excited",False
1909,msg30843876,https://bitcointalk.org/index.php?topic=2209815.0,msg30819452,175194,Announcements (Altcoins),2018-02-22 16:24:56,queenofbtc,Member,96,10,,[ANN]Potentiam-The Blockchain Music Platform,   Yes ive been testing the alpha version demo online. It's amazing! Cant wait for the final version. Well done to Potentiam for changing the way music is with block chain technology.,False
1910,msg30882817,https://bitcointalk.org/index.php?topic=2209815.0,msg30819452,175194,Announcements (Altcoins),2018-02-23 08:04:07,zee123,Full Member,392,100,,[ANN]Potentiam-The Blockchain Music Platform,   Hi Ozzymandias we appreciate the support especially you taking time out to try out the alpha platform. We are giving artists from around the world the tools and resources to build a successful career. As you can imagine that is a lot of talent to cater to. So as you can see already there are lots of talented independent artists that need Potentiam. Please keep on testing the platform and report any bugs detected.,False
1911,msg30885318,https://bitcointalk.org/index.php?topic=2209815.0,,175194,Announcements (Altcoins),2018-02-23 08:51:07,FishSkin,Newbie,1,0,,[ANN]Potentiam-The Blockchain Music Platform,"I hope there would be space here for Brazilian Artist, we have great music here in Brazil. And I think this platform can help play a role in showcasing some good Brazilian Talents...I like the Alpha Test Site A lot. Yes its true the songs there now on the New Releases Section are beautiful songs more like this please.",False
1912,msg30948775,https://bitcointalk.org/index.php?topic=2209815.0,,175194,Announcements (Altcoins),2018-02-24 06:44:37,deepika the crypto girl,Member,308,10,,[ANN]Potentiam-The Blockchain Music Platform,Week 5 (24/02/2018- 02/03/2018)  TWITTER CAMPAIGN Twitter URL: https://twitter.com/deepi1591 Followers: 2662 Twitter Audit: https://www.twitteraudit.com/deepi1591 Spreadsheet no: 91 Retweets: 1. https://twitter.com/Potentiam_io/status/967066739841355777 2. https://twitter.com/Potentiam_io/status/967006363950964736 3. https://twitter.com/Potentiam_io/status/968275594843688960 4. https://twitter.com/Potentiam_io/status/968908861875908608 5. https://twitter.com/Potentiam_io/status/969297482244075520 Tweet: 1. https://twitter.com/deepi1591/status/967740077945352193 2. https://twitter.com/deepi1591/status/967974375147352064 3. https://twitter.com/deepi1591/status/968699648729694209,False
1913,msg30959296,https://bitcointalk.org/index.php?topic=2209815.0,msg30885318,175194,Announcements (Altcoins),2018-02-24 10:17:06,zee123,Full Member,392,100,,[ANN]Potentiam-The Blockchain Music Platform,   Thanks for visiting the platform and glad you enjoyed using it. Please keep using it and let us know if you detect any problems or have suggestions on how to make it better.  If you haven't join us on telegram too https://t.me/potentiamgroup The ICO is now live so invite friends to come and support.,False
1914,msg30979534,https://bitcointalk.org/index.php?topic=2209815.0,,175194,Announcements (Altcoins),2018-02-24 15:50:11,reftresa,Newbie,4,0,,[ANN]Potentiam-The Blockchain Music Platform,can we buy this token via credit card or only via Ether?,False
1915,msg30981847,https://bitcointalk.org/index.php?topic=2209815.0,msg22262856,175194,Announcements (Altcoins),2018-02-24 16:29:08,evgenij.burchak,Member,282,10,,[ANN]Potentiam-The Blockchain Music Platform,"  Ecли пpoeкт бyдeт выдeлятьcя cвoeй индивидyaльнocтью, тo ecть вce шaнcы чтo eгo зaмeтят!",False
1916,msg31000188,https://bitcointalk.org/index.php?topic=2209815.0,msg30979534,175194,Announcements (Altcoins),2018-02-24 22:31:03,zee123,Full Member,392,100,,[ANN]Potentiam-The Blockchain Music Platform,   At the moment via Ether but we are looking to possibly introduce other ways shortly. Contact info@potentiam.io,False
1917,msg31033379,https://bitcointalk.org/index.php?topic=2209815.0,,175194,Announcements (Altcoins),2018-02-25 12:23:30,alexa1303,Newbie,42,0,,[ANN]Potentiam-The Blockchain Music Platform,WEEK 6 (18.02-25.02) Hoмep тaблицы: 89  Fasebook username: Aлeкcaндpa Гaвpилeнкo Fasebook url: https://www.facebook.com/piatniza.alexa Followers:  1038  repost & like: https://www.facebook.com/piatniza.alexa/posts/2149938001901619 https://www.facebook.com/piatniza.alexa/posts/2149937531901666 https://www.facebook.com/piatniza.alexa/posts/2148943152001104 https://www.facebook.com/piatniza.alexa/posts/2148943092001110 https://www.facebook.com/piatniza.alexa/posts/2148943035334449 https://www.facebook.com/piatniza.alexa/posts/2148942992001120 https://www.facebook.com/piatniza.alexa/posts/2148942865334466 https://www.facebook.com/piatniza.alexa/posts/2147801055448647 https://www.facebook.com/piatniza.alexa/posts/2147800958781990 https://www.facebook.com/piatniza.alexa/posts/2147800852115334 https://www.facebook.com/piatniza.alexa/posts/2146895728872513 https://www.facebook.com/piatniza.alexa/posts/2146895655539187 https://www.facebook.com/piatniza.alexa/posts/2146895575539195,False
1918,msg31318206,https://bitcointalk.org/index.php?topic=2209815.0,,175194,Announcements (Altcoins),2018-03-01 08:59:11,reftresa,Newbie,4,0,,[ANN]Potentiam-The Blockchain Music Platform,"when will the Alpha be fully functional, you guys are the only crypto project i know of that actually have a product to showcase to we the stakeholders, even if it is just a test phase for now, but i get to see a glimpse of how the platform would look. Potentiam are very serious with your plans. am supoorting you guys all the way to the moon",False
1919,msg31321850,https://bitcointalk.org/index.php?topic=2209815.0,msg31318206,175194,Announcements (Altcoins),2018-03-01 10:00:34,zee123,Full Member,392,100,,[ANN]Potentiam-The Blockchain Music Platform,"   Thanks, but I'm sure there are others. The finished product will definitely look way nicer and be better. It was actually created as a test to show the service is needed by music artists. Which we have clearly identified by the onboard of +5000 artists. Stay tuned we have more information coming out shortly.",False
1920,msg31323608,https://bitcointalk.org/index.php?topic=2209815.0,,175194,Announcements (Altcoins),2018-03-01 10:28:52,OZZYMANDIAS,Newbie,37,0,,[ANN]Potentiam-The Blockchain Music Platform,This is why i am for potentiam with potentiam about potentiam all the way to the moon,False
1921,msg31334764,https://bitcointalk.org/index.php?topic=2209815.0,,175194,Announcements (Altcoins),2018-03-01 13:22:53,alexa1303,Newbie,42,0,,[ANN]Potentiam-The Blockchain Music Platform,WEEK 7 (25.02-1.03) Hoмep тaблицы: 89  Fasebook username: Aлeкcaндpa Гaвpилeнкo Fasebook url: https://www.facebook.com/piatniza.alexa Followers:  1117  repost & like: https://www.facebook.com/piatniza.alexa/posts/2150454925183260 https://www.facebook.com/piatniza.alexa/posts/2150454875183265 https://www.facebook.com/piatniza.alexa/posts/2149938001901619 https://www.facebook.com/piatniza.alexa/posts/2149937531901666 https://www.facebook.com/piatniza.alexa/videos/2151068868455199/ https://www.facebook.com/piatniza.alexa/posts/2151139221781497 https://www.facebook.com/piatniza.alexa/posts/2151795471715872 https://www.facebook.com/piatniza.alexa/posts/2151795598382526 https://www.facebook.com/piatniza.alexa/posts/2151795555049197 https://www.facebook.com/piatniza.alexa/posts/2152195048342581 https://www.facebook.com/piatniza.alexa/posts/2152195115009241,False
1922,msg31456238,https://bitcointalk.org/index.php?topic=2209815.0,,175194,Announcements (Altcoins),2018-03-03 04:15:30,deepika the crypto girl,Member,308,10,,[ANN]Potentiam-The Blockchain Music Platform,Week 6 (03/03/2018- 09/03/2018)  TWITTER CAMPAIGN Twitter URL: https://twitter.com/deepi1591 Followers: 2662 Twitter Audit: https://www.twitteraudit.com/deepi1591 Spreadsheet no: 91 Retweets: 1. https://twitter.com/Potentiam_io/status/970426420181782530 2. https://twitter.com/Potentiam_io/status/970578525815300096 3. https://twitter.com/Potentiam_io/status/969743114020761600 4. https://twitter.com/Potentiam_io/status/971068220848377866 5. https://twitter.com/Potentiam_io/status/971309486899171328 Tweets: 1. https://twitter.com/deepi1591/status/969788105703084033 2. https://twitter.com/deepi1591/status/970199235890040832 3. https://twitter.com/deepi1591/status/970639841057632257,False
1923,msg29978337,https://bitcointalk.org/index.php?topic=2209815.0,,175194,Announcements (Altcoins),2018-02-10 07:59:32,deepika the crypto girl,Member,308,10,,[ANN]Potentiam-The Blockchain Music Platform,Week 4 (10/02/2018- 16/02/2018)  TWITTER CAMPAIGN Twitter URL: https://twitter.com/deepi1591 Followers: 2662 Twitter Audit: https://www.twitteraudit.com/deepi1591 Spreadsheet no: 91 Retweets: 1. https://twitter.com/Potentiam_io/status/962001225460932609 2. https://twitter.com/Potentiam_io/status/962310337054871554 3. https://twitter.com/Potentiam_io/status/963080491816685568 4. https://twitter.com/Potentiam_io/status/963443015934185488 5. https://twitter.com/Potentiam_io/status/963805439266828291 6. https://twitter.com/Potentiam_io/status/964167642746585089 Tweet: 1. https://twitter.com/deepi1591/status/962266431172747264 2. https://twitter.com/deepi1591/status/962601118302814209 3. https://twitter.com/deepi1591/status/962910464198967296,False
1924,msg30008106,https://bitcointalk.org/index.php?topic=2209815.0,,175194,Announcements (Altcoins),2018-02-10 16:51:26,Bakscher,Full Member,658,105,,[ANN]Potentiam-The Blockchain Music Platform,Week (05/02-11/02) Twitter URL: https://twitter.com/bakscher Follower: 4100  Tweet: https://twitter.com/bakscher/status/960889338895716352 https://twitter.com/bakscher/status/961595514251829248  Retweet & Like: https://twitter.com/Potentiam_io/status/962001225460932609 https://twitter.com/Potentiam_io/status/960452394105655296 https://twitter.com/Potentiam_io/status/960861516038885376 https://twitter.com/Potentiam_io/status/960121277263568896 https://twitter.com/Potentiam_io/status/961585586644619264 https://twitter.com/Potentiam_io/status/961643760022061056  Facebook URL: https://www.facebook.com/bakscher Friend:4600  Post: https://www.facebook.com/bakscher/posts/213548149220758  Share & Like: https://www.facebook.com/bakscher/posts/214925279083045 https://www.facebook.com/bakscher/posts/214555872453319 https://www.facebook.com/bakscher/posts/214211062487800 https://www.facebook.com/bakscher/posts/213856652523241 https://www.facebook.com/bakscher/posts/213548089220764 https://www.facebook.com/bakscher/posts/213109395931300,False
1925,msg30031010,https://bitcointalk.org/index.php?topic=2209815.0,,175194,Announcements (Altcoins),2018-02-10 23:20:14,Sagemark,Full Member,135,100,,[ANN]Potentiam-The Blockchain Music Platform,"Good luck guys, looks great!",False
