id,msg_id,parent_id,link_id,Count_read,Forum,Time,Author,Rank,Activity,Merit,Trust,Title,Body,ScamHeader
1,msg29773286,https://bitcointalk.org/index.php?topic=2617201.0,,681,Announcements (Altcoins),2018-02-07 08:47:28,Gyoung,Newbie,5,0,,[ANN][PRESALE-ICO] SmartGold - Unique token of real gold.,I am trying to join bounty,False
2,msg30212710,https://bitcointalk.org/index.php?topic=2617201.0,,681,Announcements (Altcoins),2018-02-13 14:53:10,sakokinak,Full Member,518,101,,[ANN][PRESALE-ICO] SmartGold - Unique token of real gold.,"Another project that tries to tie a token to gold. I'm not sure that something good will come out of it. All the same, crypto-currency and real assets are completely different things and it is wrong to connect it.",False
3,msg30266514,https://bitcointalk.org/index.php?topic=2617201.0,,681,Announcements (Altcoins),2018-02-14 10:51:57,darkr,Full Member,560,100,,[ANN][PRESALE-ICO] SmartGold - Unique token of real gold.,"I think this is a very promising project, because the value of the tokens will be tied to the value of gold. I will monitor the development of the idea",False
4,msg30329830,https://bitcointalk.org/index.php?topic=2617201.0,,681,Announcements (Altcoins),2018-02-15 09:36:16,noblex,Member,294,10,,[ANN][PRESALE-ICO] SmartGold - Unique token of real gold.,Promising project and very intersesting test of the Universa platform.  Will keep an eye on it ,False
5,msg30347737,https://bitcointalk.org/index.php?topic=2617201.0,,681,Announcements (Altcoins),2018-02-15 14:40:02,dani1989,Newbie,31,0,,[ANN][PRESALE-ICO] SmartGold - Unique token of real gold.,"It is not so easy to tie a token to gold (or any other real assets)  but looks like a good team that maybe can handle it.  good luck team, i will  keep an eye on too.",False
6,msg30349426,https://bitcointalk.org/index.php?topic=2617201.0,,681,Announcements (Altcoins),2018-02-15 15:07:29,kapac,Member,322,11,,[ANN][PRESALE-ICO] SmartGold - Unique token of real gold.,I think that your bounty campaign is very short for such a large-scale project... Why did it start so late?,False
7,msg31579674,https://bitcointalk.org/index.php?topic=2617201.0,,681,Announcements (Altcoins),2018-03-04 19:10:04,@Uranty3,Newbie,107,0,,[ANN][PRESALE-ICO] SmartGold - Unique token of real gold.,the idea of the project is very interesting. this is undeniable. the main thing is that on the way many obstacles are not got.,False
8,msg31765597,https://bitcointalk.org/index.php?topic=2617201.0,,681,Announcements (Altcoins),2018-03-07 09:47:45,Yuriy909,Member,84,10,,[ANN][PRESALE-ICO] SmartGold - Unique token of real gold.,Cool project,False
9,msg31873466,https://bitcointalk.org/index.php?topic=2617201.0,,681,Announcements (Altcoins),2018-03-08 19:35:43,@Uranty3,Newbie,107,0,,[ANN][PRESALE-ICO] SmartGold - Unique token of real gold.,"This is the main idea of the project. associate a digital asset with a tangible. if this happens, it will be a revolution. personally I really like it.",False
10,msg31909619,https://bitcointalk.org/index.php?topic=2617201.0,,681,Announcements (Altcoins),2018-03-09 10:39:41,@Uranty3,Newbie,107,0,,[ANN][PRESALE-ICO] SmartGold - Unique token of real gold.,"The first fact in support of the project. The rarity of gold has always supported its high price. Nowadays, more than half of the gold produced comes from South Africa. The world's richest gold reserves were discovered there in 1886.",False
11,msg31924812,https://bitcointalk.org/index.php?topic=2617201.0,,681,Announcements (Altcoins),2018-03-09 14:42:56,Tumanus,Newbie,41,0,,[ANN][PRESALE-ICO] SmartGold - Unique token of real gold.,"The number of tokens and fanatics grows every day. But there is almost no gold. Therefore, this project will become a reliable year for 2018! What do citizens think?",False
12,msg31930424,https://bitcointalk.org/index.php?topic=2617201.0,,681,Announcements (Altcoins),2018-03-09 16:00:28,sasha45366,Newbie,1,0,,[ANN][PRESALE-ICO] SmartGold - Unique token of real gold.,"Здpaвcтвyйтe, дopoгиe пoдпиcчики, xoтeл бы вaм ceгoдня paccкaзaть o тaкoм пpoeктe кaк @SmartGoldToken. Я cчитaю, чтo этo oдин из быcтpopaзвивaющиxcя пpoeктoв нa дaнный мoмeнт. Coвeтyю пepeйти к ним нa oфициaльнyю cтpaницy и нe пpeкpaщaть cлeдить зa кoмпaниeй! Кoмпaния #smartgold плaниpyeт пocтpoить зoлoтoдoбывaющий зaвoд и oбecпeчить этим зoлoтoм cвoи тoкeны. 1 тoкeн бyдeт paвнятьcя 1 гp. зoлoтa выcшeй пpoбы. Уcпeйтe пoyчaвcтвoвaть в ICO и пoлyчить тoкeны пo выгoднoй цeнe. Ha ceгoдняшний дeнь, cтoимocть 1 гpaммa зoлoтa oкoлo 40$. Цeнa oднoгo тoкeнa SGT дo oкoнчaния тoкeн-ceйлa 16$. Пocлe выxoдa нa биpжы цeнa пpиpaвняeтcя к pынoчнoй cтoимocти зoлoтa. Пpoeкт SmartGold пpeдлaгaeт пpocтoй пpoцecc вoвлeчeния блoкчaинa в peaльнyю экoнoмикy. Ocнoвнaя экoнoмичecкaя идeя: тpaдициoнныe pиcки paзвeдки и дoбычи зoлoтa oбмeнивaютcя нa pиcки вoлaтильнocти кpиптoвoлoкнoв и жeтoнoв.smartgold дocтигнeт бoльшиx выcoт c вeликoлeпным мeнтopoм Киpcaнoм Илюмжинoвим, кoтopый являeтcя пpeзидeнтoм Meждyнapoднoй Шaxмaтнoй Фeдepaции(FIDE), пoлитичecким дeятeлeм и пpeкpacным бизнecмeнoм.Кoмпaния coбиpaeт cpeдcтвa для пocтpoйки  Зoлoтo извлeкaтeльнaя фaбpикa. Уcпeй пpинять yчacтиe в ICO пoкa ecть вoзмoжнocть , yникaльный пpoeкт ! Зoлoтo вceгдa былo глaвным cимвoлoм pocкoши и бoгaтcтвa! Уcпeйтe инвecтиpoвaть в пepвoe мeждyнapoднoe ICO @SmartGold, гдe 1 тoкeн = 1 гpaммy чиcтoгo зoлoтa 999 пpoбы! Heдaвнo был зaключeн кoнтpaкт c мecтнoй кoмпaниeй-пapтнepoм пo зoлoтoдoбычe для пocтaвки зoлoтa  нaчинaющийcя c мoмeнтa зaпycкa зoлoтoизвлeкaтeльнoгo зaвoдa. Toт cpoк пocтaвки мeтaллoпpoкaтa пo кoнтpaктy-дeкaбpь 2018 гoдa-Mapт 2020 гoдa.Зoлoтo вceгдa cтaбильнo, cтoимocть из вeкa в вeк пoкaзывaeт pocт! Зoлoтy нe cтpaшны ни caнкции, ни кpизиc! Зoлoтo-миpoвoй cтaндapт pocкoши и блaгococтoяния, нa нeгo вceгдa ecть cпpoc! Пpoeкт SmartGold пpeдлaгaeт инвecтиpoвaть, в peaльнoe зoлoтo! Кoмaндy cтoль пepcпeктивнoгo пpoeктa ocтaeтcя тoлькo пoxвaлить зa paбoтy и cтapaния.Инвecтиции в зoлoтo cчитaю caмым бeзoпacным и пpибыльным дeлoм! Oфиц. caйт пpoeктa: https://smartgold.so/ Telegram- https://t.me/SmartGoldEng facebook - https://www.facebook.com/SmartGold-146213982711086/ twitter - https://twitter.com/SmartGoldToken",False
13,msg31930593,https://bitcointalk.org/index.php?topic=2617201.0,,681,Announcements (Altcoins),2018-03-09 16:02:56,@Uranty3,Newbie,107,0,,[ANN][PRESALE-ICO] SmartGold - Unique token of real gold.,"the second fact in support of the project. the cost of gold production in Tanzania is much lower than, for example, in Yakutia. so I think that the collected money will be enough to open a plant in Africa.",False
14,msg31930930,https://bitcointalk.org/index.php?topic=2617201.0,msg30212710,681,Announcements (Altcoins),2018-03-09 16:07:30,Ridorie,Full Member,322,100,,[ANN][PRESALE-ICO] SmartGold - Unique token of real gold.,"   Why, in this market now is not calm. The coin that will be provided with gold will be more stable. I think it should please investors.",False
15,msg31933634,https://bitcointalk.org/index.php?topic=2617201.0,,681,Announcements (Altcoins),2018-03-09 16:47:01,mr_lenar,Newbie,56,0,,[ANN][PRESALE-ICO] SmartGold - Unique token of real gold.,Кaкиe eщe плaны y вac ecть нa бyдyщee? Плaниpyeтe ли вы coздaвaть нoвыe пpoэкты в дaльнeм бyдyщeм? Зapaнee cпacибo зa вaш oтвeт.,False
16,msg31934309,https://bitcointalk.org/index.php?topic=2617201.0,,681,Announcements (Altcoins),2018-03-09 16:56:55,Tumanus,Newbie,41,0,,[ANN][PRESALE-ICO] SmartGold - Unique token of real gold.,"mr_lenar, they willingly share all the plans in social networks. And on the official website, all the necessary links are there. In general, before you invest, you need to understand what you are laying out and what will happen to the project. Here!",False
17,msg35231081,https://bitcointalk.org/index.php?topic=2617201.0,,681,Announcements (Altcoins),2018-04-21 10:49:28,Jekwizor,Sr. Member,630,250,,[ANN][PRESALE-ICO] SmartGold - Unique token of real gold.,"What a productive week for SmartGold! We have attended several events and the 3rd annual blockchain conference in Silicon Valley, and we are so happy to expend our network.  Bay Area has this whole different vibe there, almost everyone we met was striving to utilize blockchain to make difference in this world. It was great being on the same page and getting all the feedback about our project. We are very excited to keep growing our network and making it possible for everyone to invest in gold and get higher returns.  We have yet soon to announce our news to you guys, we appreciate your patience and support. Again, the token sale phase 1 ends on April 25.  https://medium.com/@SmartGoldToken/what-a-productive-week-for-smartgold-c60815771d1c",False
18,msg26630118,https://bitcointalk.org/index.php?topic=2617201.0,,681,Announcements (Altcoins),2017-12-19 22:57:43,temviela,Newbie,8,0,,[ANN][PRESALE-ICO] SmartGold - Unique token of real gold.,"WEB SITE | WHITEPAPER | DOC'S | TWITTER | TELEGRAM | REDDIT | MEDIUM | YOUTUBE  SMARTGOLD ICO OFFICIAL ANNOUNCEMENT  Our project offers a simple process of involving the blockchain in the real economy. The core economic idea: traditional risks of exploration and production of gold are exchanged for risks of volatility of cryptocurrencies and tokens (insecurity with valuable, liquid assets, protection from inflation). The release of tokens is secured by a contract for the supply of goods. Fixing the risks ratio occurs in the price of the purchase of goods in the form of a discount from the market price and is fixed in a unit of physical mass. The commodity of the contract is gold which is universal measure of value.  These solutions create a simple, secure investment tool for secondary circulation being an accurate measure of the value expressed in a unit weight and fulfilling the classical role of gold. We have prepared a co-investment project for the simultaneous start of gold production and development of the gold deposit.  Pre-Sale ends 30 DECEMBER 2017 | ICO Starts At 25 JANUARY 2018  :: The Main Idea ::  The goal of the project is to release 1,000,000 (one million) SGT tokens to raise funds for the construction of the gold plant and to start the extraction of gold concentrate in Tanzania. Owners of tokens become co-owners of the Main Contract for the supply of gold. One token is equal to 1 g of gold from the Main Contract for the supply of physical gold in the amount of 1 ton (one ton or one million grams). The contract is signed with the local partner company for gold mining for the supply of gold in the period starting since the launch of the gold-recovery plant (the gold plant). The delivery time of the metal under the contract is December 2018 to March 2020. Click here for more information.  This project involves crowd-funding investments in blockchain asset SGT which is backed by gold in physical terms and will be placed on the Universa platform. 1 ton or 1,000,000 grams of gold is allocated for crowd-funding to ensure the emission of 1,000,000 SGT. Of the total number of tokens in the course of Pre-Sale and Token-Sale, 85% SGT will be realized, 10% SGT team reserve,  3% SGT bounty campaign,  2% SGT advisors reserve.   :: Advantages of the Project ::  Tanzania is one of the top three countries in terms of reserves and gold mining in Africa. The legislation provides no profit tax in the first 5 years. Providing tokens in the form of a contract for the supply of gold. The contract provides for:  - terms of delivery of metal with transfer to the buyer in accordance with Incoterms 2010; - the metal will be deposited in an international bank with the opening of a metal account. With the opening of the metal account, a register is opened for the owners of the tokens.  Transparent technology of the blockchain in the form of register of tokens. The discount principle applied is fixed in the price for the physical weight of the goods and is protected from inflation. Availability of government support in Tanzania for gold production projects. Cross-border circulation of goods (the possibility of using metal accounts). Installation of a Web-camera on the site, on-line translation of progress. Constant control over the course of development of investments is carried out by an independent international auditor.   :: Road Map ::  Stage 1. Pre-Sale. December, 2017 Placing 5 % of the issue through closed subscription. The number of tokens implemented at this stage is limited, the price for one token is 15 USD + 20% bonus. The planned soft cap amount of attracted investments at the stage of Pre-Sale is equal to 850,000 USD. The collected investments will be used to implement the full Token-Sale, part of the amount will go to preparatory work, project promotion, legal support, expenses of outside organizations. At this stage, the potential investor receives an increased yield of more than 200% in relation to the market price of gold today.  Stage 2. Conducting the Token-Sale. January, 2017 At the stage of conducting a full-scale Token-Sale, the main part, 80% SGT, will be realized, which will be 800,000 SGT, at a price for one token 16 to 20 USD. Tokens will be sold at a yield to the market price of gold from 50 to 150%. The planned amount of attracted investment in the project at the end of the Token-Sale is 13,600,000 USD.  Stage 3. Ordering of turnkey plant equipment, purchase and storage of gold ore. February 2018  Stage 4. Beginning of geological exploration work in the license area. March 2018  Stage 5. The launch of metal production at the gold-extraction plant (mill). December 2018  Stage 6. The beginning of the delivery of gold ore from the license area to the plant. March 2019  Stage 7. Completion of the contract for the supply of metal. March 2020 Transfer of gold to an international bank. Opening a metal account with the transfer of the register of token holders for access to the escrow account agent. It is possible to receive physical metal according to a pre-order.   :: Important Links & Social Footprints :: ::  Website : https://smartgold.so/ Whitepaper : https://smartgold.so/docs/WPeng.pdf Youtube : https://www.youtube.com/watch?v=-pMkuCsgInQ Medium : https://medium.com/@altncoin Twitter : https://twitter.com/SmartGoldToken Telegram : https://t.me/SmartGoldEng Reddit : https://www.reddit.com/user/SmartGold/ Support & Queries : info@smartgold.so    Thank you so much!",False
19,msg26630892,https://bitcointalk.org/index.php?topic=2617201.0,,681,Announcements (Altcoins),2017-12-19 23:19:30,Bfljosh,Hero Member,714,500,,[ANN][PRESALE-ICO] SmartGold - Unique token of real gold.,This is a token. There is a token section.,False
20,msg26631658,https://bitcointalk.org/index.php?topic=2617201.0,,681,Announcements (Altcoins),2017-12-19 23:40:41,tippytoes,Sr. Member,896,257,,[ANN][PRESALE-ICO] SmartGold - Unique token of real gold.,"Now gold-related project are going to the ethereum platform.  Projects backed by real gold are usually scam, very very few here are real like the xaurum. You have a long way to go to prove that you will be doing legit business here.",False
21,msg26632236,https://bitcointalk.org/index.php?topic=2617201.0,,681,Announcements (Altcoins),2017-12-19 23:57:28,temviela,Newbie,8,0,,[ANN][PRESALE-ICO] SmartGold - Unique token of real gold.,"We have all the documents, our team includes well-known personalities. See for yourself by going to our website. We will be placed on the Universa platform.",False
22,msg26633279,https://bitcointalk.org/index.php?topic=2617201.0,,681,Announcements (Altcoins),2017-12-20 00:30:56,btcgreen00,Newbie,37,0,,[ANN][PRESALE-ICO] SmartGold - Unique token of real gold.,I could not unscrew the site and white paper.    SSL_ERROR_NO_CYPHER_OVERLAP,False
23,msg26645963,https://bitcointalk.org/index.php?topic=2617201.0,,681,Announcements (Altcoins),2017-12-20 07:21:53,3dyx,Full Member,420,102,,[ANN][PRESALE-ICO] SmartGold - Unique token of real gold.,I see this project is very promising. started from digital to build a gold mine factory. but I have not seen the review of this project. so it may be too early to invest.,False
24,msg26647589,https://bitcointalk.org/index.php?topic=2617201.0,msg26633279,681,Announcements (Altcoins),2017-12-20 07:55:12,temviela,Newbie,8,0,,[ANN][PRESALE-ICO] SmartGold - Unique token of real gold.,  please download and install the latest version of firefox from https://www.mozilla.org/en-US/firefox/all/ in order to solve that problem.,False
25,msg26658531,https://bitcointalk.org/index.php?topic=2617201.0,,681,Announcements (Altcoins),2017-12-20 11:44:32,pavel_08,Newbie,2,0,,[ANN][PRESALE-ICO] SmartGold - Unique token of real gold.,"I've read your project, Very interesting. I believe that you will succeed. after my investment, when will it be possible to receive gold?",False
26,msg26675911,https://bitcointalk.org/index.php?topic=2617201.0,msg26658531,681,Announcements (Altcoins),2017-12-20 16:55:23,temviela,Newbie,8,0,,[ANN][PRESALE-ICO] SmartGold - Unique token of real gold.,  The first delivery of gold is scheduled for December 2018,False
27,msg26676920,https://bitcointalk.org/index.php?topic=2617201.0,,681,Announcements (Altcoins),2017-12-20 17:14:39,carmelabrown,Newbie,6,0,,[ANN][PRESALE-ICO] SmartGold - Unique token of real gold.,I really like SMARTGOLDTOKEN idea. How to participate if there is no twitter? Hope I did everything right. Good luck!,False
28,msg26679298,https://bitcointalk.org/index.php?topic=2617201.0,msg26676920,681,Announcements (Altcoins),2017-12-20 18:03:13,temviela,Newbie,8,0,,[ANN][PRESALE-ICO] SmartGold - Unique token of real gold.,  Our twitter address https://twitter.com/SmartGoldToken Telegram https://t.me/SmartGoldEng,False
29,msg26743460,https://bitcointalk.org/index.php?topic=2617201.0,,681,Announcements (Altcoins),2017-12-21 19:55:41,AlexOgro,Newbie,1,0,,[ANN][PRESALE-ICO] SmartGold - Unique token of real gold.,Smartgold -a very interesting idea of the project to fix the profit in the discount. It is possible to plan for crypto income,False
30,msg27054037,https://bitcointalk.org/index.php?topic=2617201.0,,681,Announcements (Altcoins),2017-12-27 17:17:36,pavel_08,Newbie,2,0,,[ANN][PRESALE-ICO] SmartGold - Unique token of real gold.,"Very real project, I like that the SGT token will not be subject to volatility, like bitcoin because it is provided with gold.",False
31,msg27225216,https://bitcointalk.org/index.php?topic=2617201.0,,681,Announcements (Altcoins),2017-12-30 20:26:53,temviela,Newbie,8,0,,[ANN][PRESALE-ICO] SmartGold - Unique token of real gold.,"Pre-sale is finished, collected $ 851,160. Thank you all!  Token sale starts on January 25",False
32,msg27226583,https://bitcointalk.org/index.php?topic=2617201.0,,681,Announcements (Altcoins),2017-12-30 21:02:59,Yos Sudarso,Member,108,10,,[ANN][PRESALE-ICO] SmartGold - Unique token of real gold.,"hello sir, may i know if this project will located in Tanzania, Mbeya Sowento, Block T, 7 or in another place?? and also could you tell me is your government allowed cryptocurrency ?  from your roadmap ACQUISITION OF FACTORY EQUIPMENT, PURCHASE AND STORAGE OF GOLD ORE : Q1 2018 where it will located sir?? thanks b4",False
33,msg27466501,https://bitcointalk.org/index.php?topic=2617201.0,msg27226583,681,Announcements (Altcoins),2018-01-04 13:01:03,temviela,Newbie,8,0,,[ANN][PRESALE-ICO] SmartGold - Unique token of real gold.,"  Acquisition of factory equipment  is in China (company Synovate), purchase & storage of gold ore is in Tanzania. In Tanzania cryptocurrency is tolerated. We (it is the Irish company) signed a contract with the Tanzanian company that produces metal. And currently we are inviting to this projects co-investors.",False
34,msg27546843,https://bitcointalk.org/index.php?topic=2617201.0,,681,Announcements (Altcoins),2018-01-05 18:07:01,DeathGrasp,Full Member,532,103,,[ANN][PRESALE-ICO] SmartGold - Unique token of real gold.,"Hello friends, what about Bounty?",False
35,msg28029525,https://bitcointalk.org/index.php?topic=2617201.0,msg27546843,681,Announcements (Altcoins),2018-01-13 07:38:59,temviela,Newbie,8,0,,[ANN][PRESALE-ICO] SmartGold - Unique token of real gold.,"  Now we are developing the system, we will soon make a release! more information https://t.me/SmartGoldEng",False
36,msg29759520,https://bitcointalk.org/index.php?topic=2617201.0,msg27546843,681,Announcements (Altcoins),2018-02-07 03:11:28,Jaath,Member,238,10,,[ANN][PRESALE-ICO] SmartGold - Unique token of real gold.,  https://bitcointalk.org/index.php?topic=2894537.0 welcome,False
37,msg29772071,https://bitcointalk.org/index.php?topic=2617201.0,,681,Announcements (Altcoins),2018-02-07 08:25:24,semenrublev,Newbie,196,0,,[ANN][PRESALE-ICO] SmartGold - Unique token of real gold.,SmartGold - A unique token backed by mining and supplying of real gold.,False
