id,msg_id,parent_id,link_id,Count_read,Forum,Time,Author,Rank,Activity,Merit,Trust,Title,Body,ScamHeader
55,msg26307561,https://bitcointalk.org/index.php?topic=2443093.0,msg25711417,2327,Announcements (Altcoins),2017-12-14 12:00:18,Nakoel,Newbie,3,0,,[ANN][ICO] wysker - Join the Mobile Shopping Revolution✨,"   Still waiting for a response from the team.  Meanwhile, I'm investing in other coins such as Ethereum and EOS and I'm making really good profits.",False
56,msg26502498,https://bitcointalk.org/index.php?topic=2443093.0,,2327,Announcements (Altcoins),2017-12-17 18:29:22,wysker,Newbie,52,0,,[ANN][ICO] wysker - Join the Mobile Shopping Revolution✨,wysker is producing advertising content that will be available all over the world!  https://i.imgur.com/mXiCNoZl.jpg  Capitalize on your first mover advantage and secure a whopping 30% Bonus on the ICO now!,False
57,msg26535343,https://bitcointalk.org/index.php?topic=2443093.0,msg26307561,2327,Announcements (Altcoins),2017-12-18 10:07:23,wysker,Newbie,52,0,,[ANN][ICO] wysker - Join the Mobile Shopping Revolution✨,"    If you don't want to wait until January 31st and don't want to miss the opportunity, we suggest getting wys tokens now. If you don't mind waiting you can also secure the 15% bonus in the first week of February, however then the bonus will drop every week.  We don't have an influence on the current extreme rise of Ether and other coins, as our smart contract is already written and we can not adapt it.",False
58,msg26535957,https://bitcointalk.org/index.php?topic=2443093.0,,2327,Announcements (Altcoins),2017-12-18 10:22:53,wysker,Newbie,52,0,,[ANN][ICO] wysker - Join the Mobile Shopping Revolution✨,Finally a Christmas present that will be worth more in the future 🎄🎁    Get your wys wtoken now on wystoken.org  https://i.imgur.com/XdUkHczl.jpg,False
59,msg26604140,https://bitcointalk.org/index.php?topic=2443093.0,,2327,Announcements (Altcoins),2017-12-19 13:08:36,wysker,Newbie,52,0,,[ANN][ICO] wysker - Join the Mobile Shopping Revolution✨,"Press Coverage Update:  ""Unlike many other initial coin offerings, wysker is more focused on thoughtful token distribution than sheer quantity"" Thanks International Business Times  😊  read it all here: http://www.ibtimes.com/beauty-brands-show-benefits-bitcoin-payments-2627945  https://i.imgur.com/7wYHNBdl.jpg",False
60,msg26611480,https://bitcointalk.org/index.php?topic=2443093.0,msg26165753,2327,Announcements (Altcoins),2017-12-19 15:19:42,Mlester,Member,80,10,,[ANN][ICO] wysker - Join the Mobile Shopping Revolution✨,"  Alokasi untuk bounty nya 1% dari total token yang terjual, nampaknya masih belom terlalu besar nominalnya, karena di proyek2 yang lain, terkadang dapat meng alokasikan 2% dari total token yang terjual. Mantau dulu aja deh.",False
61,msg26612936,https://bitcointalk.org/index.php?topic=2443093.0,msg26610731,2327,Announcements (Altcoins),2017-12-19 15:57:31,CryptoCurators,Newbie,67,0,,[ANN][ICO] wysker - Join the Mobile Shopping Revolution✨,"  Thank you set08air, will check it",False
62,msg26729003,https://bitcointalk.org/index.php?topic=2443093.0,,2327,Announcements (Altcoins),2017-12-21 15:03:45,CryptoCurators,Newbie,67,0,,[ANN][ICO] wysker - Join the Mobile Shopping Revolution✨,"Our toke sale going strong, if you want you can get some free tokens here! https://bitcointalk.org/index.php?topic=2418514.msg26728727#msg26728727",False
63,msg26832080,https://bitcointalk.org/index.php?topic=2443093.0,,2327,Announcements (Altcoins),2017-12-23 12:50:06,CryptoCurators,Newbie,67,0,,[ANN][ICO] wysker - Join the Mobile Shopping Revolution✨,If you have any questions make sure to join in the best Telegram group where you can get answers live! https://t.me/joinchat/GdV8ekvBPvz1J0uTqGEfvw,False
64,msg27000541,https://bitcointalk.org/index.php?topic=2443093.0,,2327,Announcements (Altcoins),2017-12-26 18:38:11,CryptoCurators,Newbie,67,0,,[ANN][ICO] wysker - Join the Mobile Shopping Revolution✨, hope that all of you had a Merry Christmas and I wish happy holidays to everyone!  🎁🎅🎄,False
65,msg27112616,https://bitcointalk.org/index.php?topic=2443093.0,,2327,Announcements (Altcoins),2017-12-28 17:32:25,CryptoCurators,Newbie,67,0,,[ANN][ICO] wysker - Join the Mobile Shopping Revolution✨,"The presale is still running, and the bonus is avaliable!",False
66,msg27203132,https://bitcointalk.org/index.php?topic=2443093.0,,2327,Announcements (Altcoins),2017-12-30 11:47:18,wysker,Newbie,52,0,,[ANN][ICO] wysker - Join the Mobile Shopping Revolution✨,Hope you all had a wonderful christmas! The german 'Welt' magazine wrote an article about us. Check out the german version here:  https://www.welt.de/wirtschaft/article171129163/Kryptowaehrungen-Wysker-will-die-Bitcoin-Welle-reiten.html,False
67,msg27226678,https://bitcointalk.org/index.php?topic=2443093.0,,2327,Announcements (Altcoins),2017-12-30 21:05:33,sanator1,Newbie,2,0,,[ANN][ICO] wysker - Join the Mobile Shopping Revolution✨,"Dear Wysker Team  Why is it that you would like to create 3,000,000,000 WysTokens, which means that in cash given the 1 ETH = 18'123 WYS exchange rate you expect to collect 165,535 ETH, which is currently (with the ETH price @ coinbase of this very moment I am writing this post) arround 120,000,000 EUR with a UG company?  If I am correct you want to sell slightly above half of it in the ICO (1'782'692'308 WYS), which brings the above figure down to let's say 60,000,000 EUR. Ok, let us even take the 30% and 15% discounts, make it an average of 20% and deduct this from this 60mln EUR. We still end up with 48,000,000 EUR.  And you want to persuade the community, that your highly educated and experienced founders do not have 25,000 EUR to set up a regular limited liability company in Germany, which requires a minimal capital of 25,000 EUR? I can only draw the following conclusion: the team - or at least the founders - do not believe in this project enought to put 25K EUR out of their own pockets in order to get 50 mln EUR from the market! What kind of approach is that?!?  For the readers, who do not understand the difference between GmbH and UG companies I paste some links below from official sites https://www.stuttgart.ihk24.de/english/fairplay/Company_Law/GmbH_and_UG_haftungsbeschraenkt_Information_on_their_Foundati/679026 (IHK stands for Chamber of Commerce and Industry) https://de.wikipedia.org/wiki/Unternehmergesellschaft_(haftungsbeschr%C3%A4nkt) (You can translate this into English easily)  The bottom-line dear friends is, that a UG is considered as a joke in the German reality - no one wants to deal with you as an UG because you are not treated serious - to have a capital of a few Euros...Ask any notary or lawyer or experienced enterpreneur in Germany if you do not believe teh above. I know what I am saying, because I had such a company set up myself.  Oh, and by the way - if you would like to see where the seat of this not-yet-48MLN EUR company is, then here you go - in a HOSTEL?!?  https://www.google.pl/maps/place/Novalisstra%C3%9Fe+14,+10115+Berlin,+Niemcy/@52.5282767,13.3887483,3a,75y,228h,90t/data=!3m7!1e1!3m5!1su7K8hGe69p5OqrIJvDA59Q!2e0!6s%2F%2Fgeo2.ggpht.com%2Fcbk%3Fpanoid%3Du7K8hGe69p5OqrIJvDA59Q%26output%3Dthumbnail%26cb_client%3Dsearch.TACTILE.gps%26thumb%3D2%26w%3D86%26h%3D86%26yaw%3D228.45786%26pitch%3D0%26thumbfov%3D100!7i13312!8i6656!4m5!3m4!1s0x47a851e94ed83f83:0xf3af760922b9a863!8m2!3d52.5281506!4d13.3885664  Congrats on you credibility...again!   Would be great to read your reasonable explanations on the above.  Cheers!  P.S. I can understand that someone did not advise you well, but how can one trust you even 1 EUR - not to speak of 1 ETH - if you even cannot pick the right advisors for a ""multi-bilion-dollar opportunity"" as we can read on your webpage?",False
68,msg27467727,https://bitcointalk.org/index.php?topic=2443093.0,msg27226678,2327,Announcements (Altcoins),2018-01-04 13:21:23,wysker,Newbie,52,0,,[ANN][ICO] wysker - Join the Mobile Shopping Revolution✨,"    Hi sanator1,  this is Ann-Lauriene, COO and co-founder of wysker. As you have pointed out some interesting thoughts and concerns, I would like to use the opportunity to provide some clarification. First, wysker being an UG and not a GmbH has the very simple reason. We started the company almost two years ago and back then founded everything from our own pockets. Choosing a UG to startup back then was the fastest and easiest way to set up a legal entity for our endeavours. For that, we also invested 6k EUR personally and financed us privately until the beginning of our ICO. However, you’re right a GmbH has a more solid appeal and we’re currently in the process of converting wysker UG to wysker GmbH.  Second, our office being in a Hostel sounds off course scary. However, that’s just the problem of Google Maps we’re the hostel shares the same address. Since November 2017, we also moved to another location at Paul-Lincke-Ufer 8d in Berin Kreuzberg as we needed a bigger office. You can check out our Facebook or Twitter we”re you can find some impression from the inside. It’s 220 square meters filled with real people working on wysker full time. Lastly, regarding the high hard cap, I totally understand your point. We’ve set this cap back in in September where the Ether value was much lower. Due to the parity hack we had to extend our ICO we did not want to change many conditions to make all further token purchases fair to our existing investors. However, we”re currently considering to adjust the hardcap accordingly.  I really hope the short statement reduces your concerns. I’m well aware that in the ICO space, there are a lot of sketchy and spammy projects and I understand that each project should be analyzed with extreme care. I can assure you that wysker is real and that every member involved in the project is committed to make it a success. Let me know if that was helpful or if you have any more concerns.  All the Best from Berlin, Ann-Lauriene",False
69,msg27637621,https://bitcointalk.org/index.php?topic=2443093.0,,2327,Announcements (Altcoins),2018-01-07 09:51:15,CryptoCurators,Newbie,67,0,,[ANN][ICO] wysker - Join the Mobile Shopping Revolution✨,"December 2017 will go down as the most lucrative month to date, with over US $1 billion raised from Initial Coin Offerings for the first time. https://news.bitcoin.com/icos-raise-1-billion-month-first-time/",False
70,msg27792638,https://bitcointalk.org/index.php?topic=2443093.0,,2327,Announcements (Altcoins),2018-01-09 18:17:29,CryptoCurators,Newbie,67,0,,[ANN][ICO] wysker - Join the Mobile Shopping Revolution✨,"Hope you all have a successful 2018 so far! We’re working extensively on the details of the wysker App. Fixing last bugs, testing all user flows and working on heavily extending our product catalog. As with most big projects, the task list becomes a bit overwhelming at times. Especially shortly before launch. But with our team working around the clock, we’re hundred percent sure that the wysker App will have a significant impact right from the start. Soon the official wysker.com website will also be updated, stay tuned!  You can find the rest of updates here https://medium.com/wysker/2018-were-ready-36164c4f72ad",False
71,msg27798661,https://bitcointalk.org/index.php?topic=2443093.0,msg27792638,2327,Announcements (Altcoins),2018-01-09 20:12:12,wysker,Newbie,52,0,,[ANN][ICO] wysker - Join the Mobile Shopping Revolution✨,   and here a great impression from the wysker office in Berlin.  https://i.imgur.com/0RM8Bq0l.jpg,False
72,msg27810553,https://bitcointalk.org/index.php?topic=2443093.0,msg27798661,2327,Announcements (Altcoins),2018-01-10 01:01:00,CryptoCurators,Newbie,67,0,,[ANN][ICO] wysker - Join the Mobile Shopping Revolution✨,  Looking busy! Keep up the good work guys and gals!,False
73,msg25018675,https://bitcointalk.org/index.php?topic=2443093.0,,2327,Announcements (Altcoins),2017-11-22 13:22:49,wysker,Newbie,52,0,,[ANN][ICO] wysker - Join the Mobile Shopping Revolution✨,"Website               Whitepaper               FAQ               Press                    |                    Deutsch               中文               日本語   https://i.imgur.com/uA2uPcd.png  Join the mobile shopping revolution  Our token sale is over!   [ Join Telegram ]   [ View Demo ]      Germany's first ICO / Massive Press Coverage / High-Calibre Team / Launch-ready Product   https://i.imgur.com/2F7McfG.jpg  Launched on Android and soon iOS. Download wysker for Android : Google App Store     The future of e-commerce is driven by consumer data  The Internet lets you buy, but it doesn't let you shop. Over the last 15 years there has been no radical innovation in e-commerce. By solving mobile discovery, the wysker platform unlocks a multi-billion dollar opportunity. It is a radically new shopping experience that generates breakthrough data. Through the use of the blockchain it returns data ownership to its users. The result is consumer empowerment and unparalleled sales potential for retailers and advertisers.   [ View Whitepaper ]      Introducing the next generation in mobile shopping  The wysker app is a high-intensity visual shopping experience made for Generation Snapchat. Imagine browsing through thousands of online shops with just a single button. It is a curated and highly personalized experience with instant gratification through a novel reward model. The wysker app launches globally on Janaury 31, 2018 on Android and iOS. Get early access on [ wysker.com ]        The benefits of blockchain- based advertising  The blockchain is at the core of the wysker platform, allowing users and advertisers to have a direct relationship while protecting consumer privacy and preventing fraud. It cuts out the middleman and enables a new concept we call “advertising based on consent”. In this model, the user is in control of their data and can give selective access in exchange for wys tokens.      A new token designed for digital commerce  The wys token gives consumers discounts for product views, advertisers access to customers, and retailers new opportunities to increase their sales. It’s an ERC20 utility token that runs on the Ethereum blockchain. Here is how it works:   https://i.imgur.com/695jPZY.png     Sustained growth of the wys token economy  The wys token  follows the basic principle of supply and demand. The more users join the wysker platform, the greater the advertiser demand and the higher the wys Token value. To maximise user growth, 10% of all wys Tokens are reserved for user incentivization. An install bonus and a referral program are in place to boost product adoption.   https://i.imgur.com/VzNJwvc.png     Our goal is to establish a stable and fast-growing wys token economy. We have reserved 60% of all tokens for investors to fuel the growth of the wysker platform. With the remainder, we are inviting a growing number of retailers and advertisers to become major players in the wysker ecosystem.  https://i.imgur.com/VgOG6sn.png       Our roadmap to growing the wys token value  1⃣    11/17 - Presale wys token exclusive presale  2⃣    01/18 - wysker App launch global on Android / iOS  3⃣    01/18 - Token sale public wys token ICO  4⃣    04/18 - Trading token listed on exchanges  5⃣    06/18 - Retailer growth retailers onboarding  6⃣    01/19 - Ad Platform ad platform launched     Our vision for expanding the wysker experience  The wysker technology has the potential to be integrated into all kinds of platforms. From Virtual Reality, to in flight entertainement, our API enables omnichannel e-commerce giving everyone access to the wysker experience.   https://i.imgur.com/7GtkGaV.jpg      The future of digital commerce is now  The wysker platform changes the fundamental dynamics of digital commerce by putting the consumers in control of their data and creating a new form of advertising that is based on consent. We increase the level of trust between consumers and advertisers which leads to higher sales and positive brand relationships.   https://i.imgur.com/plh2kam.png      A world-class team ready to make a difference   https://i.imgur.com/9LXhla8.png  Tobias Haag Founder/CEO Google, SV Entrepreneur https://i.imgur.com/aYW0U1O.png  Kai Jäger Founder/CTO Deutsche Bank, Microsoft https://i.imgur.com/LiZ83ot.png  Dr. Ann-Lauriene Haag Founder/COO McGill Physicist, Caltech https://i.imgur.com/Zx2U93w.png  Etienne Kiefer CMO BBDO, Heimat Berlin  [ +20 more members ]   Token Sale Terms   Current Bonus: 30% Current Bonus Ends: 2018/01/31 at 14:00 (UTC) Minimum Buy-in: 25 ETH Current Rate: 1 ETH = 18'123 WYS Accepted Currencies: ETH  Token Supply: 3'000'000'000 WYS For Sale: 1'782'692'308 WYS Presale Supply: 500'000'000 WYS    Presale Period: 2017/11/17 at 14:00 (UTC) - 2018/01/31 at 14:00 (UTC)  Token Sale Period: 2018/01/31 at 14:00 (UTC) - 2018/02/28 at 14:00 (UTC)       Connect with us directly or through our community  General Inquiries contact@wystoken.org  [ Telegram ] [ Medium ] [ Instagram ]  [ GitHub ]  [ YouTube ]   [ Twitter ]   [ Facebook ]          In the Media   October 18, 2017             ICOs in Germany: Shopping-App as the first mover Der Aktionär (German)   October 9, 2017             The next Revolution in Online-Shopping could be coming from Berlin WIRED Magazine (German)   October 10, 2017             Germany's first ICO is happening at the 'Tinder for Shopping' manager magazin (German)   October 2, 2017             Token instead of IPO Handelsblatt (Germany's leading financial newspaper, German)   October 2, 2017             First German ICO: wysker brings Shopping to the Blockchain t3n (Magazine for all things Digital, German)   October 1, 2017             This Idea is more radical than Google and Facebook ever were Frankfurter Allgemeine Zeitung (One of Germany's largest Newspapers, German)    [ More Press ]",False
74,msg25034262,https://bitcointalk.org/index.php?topic=2443093.0,,2327,Announcements (Altcoins),2017-11-22 18:10:29,aiderwar,Full Member,170,100,,[ANN][ICO] wysker - Join the Mobile Shopping Revolution✨,"the Demo is very cool, but for me, this shopping experience is not good, so fast switching speed, i even haven't time to see what it was",False
75,msg25036727,https://bitcointalk.org/index.php?topic=2443093.0,,2327,Announcements (Altcoins),2017-11-22 19:01:14,wysker,Newbie,52,0,,[ANN][ICO] wysker - Join the Mobile Shopping Revolution✨,This demo just shows how fast a user can switch between articles. The timer will be fully customisable to ensure a great individual experience.,False
76,msg25081403,https://bitcointalk.org/index.php?topic=2443093.0,,2327,Announcements (Altcoins),2017-11-23 13:59:29,EMPEROR007,Newbie,1,0,,[ANN][ICO] wysker - Join the Mobile Shopping Revolution✨,got in before the price rose.. would have grabbed more tokens investing the same before the rates have improved due to ETH going up  Current Bonus: 30% Current Bonus Ends: 69:05:42:33 Next Bonus: 15% Current Rate 1 ETH = 18'123 WYS good time to get into this,False
77,msg25198070,https://bitcointalk.org/index.php?topic=2443093.0,,2327,Announcements (Altcoins),2017-11-25 14:36:42,CryptoCurators,Newbie,67,0,,[ANN][ICO] wysker - Join the Mobile Shopping Revolution✨,"Great ICO, great team! Goodluck!",False
78,msg25245865,https://bitcointalk.org/index.php?topic=2443093.0,,2327,Announcements (Altcoins),2017-11-26 12:17:41,CryptoCurators,Newbie,67,0,,[ANN][ICO] wysker - Join the Mobile Shopping Revolution✨,Thank you everyone for joining! Let us know if you have any questions!,False
79,msg25310726,https://bitcointalk.org/index.php?topic=2443093.0,,2327,Announcements (Altcoins),2017-11-27 13:08:05,wysker,Newbie,52,0,,[ANN][ICO] wysker - Join the Mobile Shopping Revolution✨,"Forget about cybermonday, we're turning today into cryptomonday!  https://i.imgur.com/iRSWLxl.png  Secure your 30% Bonus now.",False
80,msg25421506,https://bitcointalk.org/index.php?topic=2443093.0,,2327,Announcements (Altcoins),2017-11-29 09:04:25,LuBro,Member,210,12,,[ANN][ICO] wysker - Join the Mobile Shopping Revolution✨,"Great, that you offer the presale without any limit again. So what about the old ones? I keep them in my wallet, but they're nearly senseless, aren't they?  I wanna buy some more WYS, I'm happy that I don't have to invest 25 ETH in it, that would have been too much. ",False
81,msg25432484,https://bitcointalk.org/index.php?topic=2443093.0,msg25421506,2327,Announcements (Altcoins),2017-11-29 12:42:21,wysker,Newbie,52,0,,[ANN][ICO] wysker - Join the Mobile Shopping Revolution✨,"   Awesome   Old wys Tokens will not be used in the app, however they can be regarded as an early investor badge. They are very limited",False
82,msg25433142,https://bitcointalk.org/index.php?topic=2443093.0,,2327,Announcements (Altcoins),2017-11-29 12:54:54,wysker,Newbie,52,0,,[ANN][ICO] wysker - Join the Mobile Shopping Revolution✨,"https://i.imgur.com/tpvlwShl.jpg  Presale Open — No Minimum!  Recap: After the recent Parity bug we had to restatr https://medium.com/wysker/solving-a-big-challenge-our-ico-continuous-today-13d8ace52fb4. We successfully moved all existing wys tokens to our new smart contract and granted each investor a 1.25 multiple. On November 17th, 2017, our new presale kicked-off with a minimum investment of 25 ETH. Since the launch, we’ve received tons of requests from people wanting to invest smaller amounts. At the same time, the ETH price is exploding and because of this we’ve made a decision.  News: From today onwards, we’re opening our presale to all investors by removing the minimum investment requirement. To keep it fair for the community and for anyone who has already invested, all investments below 25 ETH will get a 15% token bonus and the exceeding ones still receive the existing 30% bonus. The presale volume for smaller investments is also capped to a maximum of 2460 ETH, the equivalent of roughly one million USD. The supply is limited on a first come first serve basis. Everyone who wants to stock up their wys tokens or wants to invest smaller amounts can do so on www.wystoken.org  Hardcap: We also want to use the opportunity to address our hardcap. When we started our ICO back in October, we’ve set our hard cap to 108k ETH (approx. 25m USD at that time). With the change of plans due to the Parity incident, our timeline has stretched to quite an extend. As we didn’t want to make any changes to our existing plan, we kept the hardcap and continued our ICO under the same conditions. As the ETH price has almost doubled since October, our hardcap increased to a whooping $50m USD.  Reality: With the rising ETH value, our hardcap is now an ambitious goal. However, we’re a platform with enormous potential. The wysker app is ready to launch worldwide on Android and iOS on January 31st, 2018 and features a portfolio exceeding 50'000 products. No matter what the final result of our ICO will be, we’re investing all of our efforts into expanding the wysker platform, improving its performance and scaling it globally. What follows is an increase of the wys token value.  Thank you for being a part of wysker and joining us along the way. Together we can make it happen.  Best from Berlin, Tobi (Founder CEO)",False
83,msg25484703,https://bitcointalk.org/index.php?topic=2443093.0,,2327,Announcements (Altcoins),2017-11-30 11:24:50,wysker,Newbie,52,0,,[ANN][ICO] wysker - Join the Mobile Shopping Revolution✨,"Check out our short sneak preview of our wysker app that's launching on January 31st, 2018 on Android and iOS - https://www.youtube.com/watch?v=_1FHa_QftP4.  If you wanna try it out first, go to www.wysker.com and sign up for our beta 👌",False
84,msg25539861,https://bitcointalk.org/index.php?topic=2443093.0,,2327,Announcements (Altcoins),2017-12-01 09:39:36,Nakoel,Newbie,3,0,,[ANN][ICO] wysker - Join the Mobile Shopping Revolution✨,"Good morning,  I'm interested in investing in your project but the conditions make no sense at all.  If I decide to invest now 10 ETH, I'll get a 15% instead of 30% bonus right? I would assume a higher risk and I would have around 4.000€ ""frozen"" for a 15% bonus.  Or I can wait until the ICO, the bonus would still be the same 15%, I would have more information, plus in the meantime, I can use the 4.000€ to invest in other cryptos/business.  So... What is the incentive to invest now?",False
85,msg25569348,https://bitcointalk.org/index.php?topic=2443093.0,,2327,Announcements (Altcoins),2017-12-01 18:32:21,CryptoCurators,Newbie,67,0,,[ANN][ICO] wysker - Join the Mobile Shopping Revolution✨,Great news publishers! If your article is of at least medium quality posted on a quality site you are entitled to special reward! Each of the first 5 articles that reaches our criteria will receive extra 5000 nwys tokens!  Rules: You must submit the publication using our publications form You must submit it before 08.12.2017 12:00 GMT+1 The article must be original and posted on site/blog with actual readers   Good luck everybody!  Join here: https://bitcointalk.org/index.php?topic=2418514.0,False
86,msg25674289,https://bitcointalk.org/index.php?topic=2443093.0,,2327,Announcements (Altcoins),2017-12-03 16:27:58,CryptoCurators,Newbie,67,0,,[ANN][ICO] wysker - Join the Mobile Shopping Revolution✨,I invite you all to check our bounty campaign as well! https://bitcointalk.org/index.php?topic=2418514.0,False
