id,msg_id,parent_id,link_id,Count_read,Forum,Time,Author,Rank,Activity,Merit,Trust,Title,Body,ScamHeader
1,msg39000807,https://bitcointalk.org/index.php?topic=2443093.0,msg38709963,2327,Announcements (Altcoins),2018-05-30 21:20:43,CryptoCurators,Newbie,67,0,,[ANN][ICO] wysker - Join the Mobile Shopping Revolution✨,    Awesome update!!,False
2,msg39574717,https://bitcointalk.org/index.php?topic=2443093.0,,2327,Announcements (Altcoins),2018-06-07 12:12:03,MSh5737,Newbie,28,0,,[ANN][ICO] wysker - Join the Mobile Shopping Revolution✨,Great platform. Would like to get more information tho.,False
3,msg41359684,https://bitcointalk.org/index.php?topic=2443093.0,msg39574717,2327,Announcements (Altcoins),2018-07-02 13:26:25,wysker,Newbie,52,0,,[ANN][ICO] wysker - Join the Mobile Shopping Revolution✨,   Happy to have a chat and provide all the info you want  Find us at https://t.me/wysker and make sure to subscribe to our telegram newsfeed at https://t.me/wyskernews !,False
4,msg41584453,https://bitcointalk.org/index.php?topic=2443093.0,,2327,Announcements (Altcoins),2018-07-05 17:32:19,Alexbt,Full Member,546,102,,[ANN][ICO] wysker - Join the Mobile Shopping Revolution✨,"Neural Networks at wysker A brief explanation of wysker’s image recognition technology.  One of wysker’s main value proposition is to provide users with new and exciting content through what we call product streams. It’s a novel form for displaying content in an extremely fast and receptive way. Streams in the wysker mobile app are looped, just like a GIF. They are built by piling up visually matching product images belonging to the same product category, style or other visually appealing features. https://medium.com/wysker/neural-networks-at-wysker-6b99b54b0c55",False
5,msg42731488,https://bitcointalk.org/index.php?topic=2443093.0,,2327,Announcements (Altcoins),2018-07-23 13:00:56,walletinvestordotcom,Newbie,42,0,,[ANN][ICO] wysker - Join the Mobile Shopping Revolution✨,"We welcome Wysker to our website where we feature coin statistics, market capitalization, coin investment ratings and Machine Learning based price forecasts. We wish the best in the future!  Website: https://walletinvestor.com/  Wysker: https://walletinvestor.com/currency/wys-token  Forecasts and additional information will be present soon as we gather data.",False
6,msg43308062,https://bitcointalk.org/index.php?topic=2443093.0,,2327,Announcements (Altcoins),2018-08-02 02:22:17,Halono,Newbie,159,0,,[ANN][ICO] wysker - Join the Mobile Shopping Revolution✨,"Interesting project, I think this sort of idea can thrive and build strong communities in the crypto world, especially with more and more adoption.",False
7,msg43308095,https://bitcointalk.org/index.php?topic=2443093.0,,2327,Announcements (Altcoins),2018-08-02 02:23:35,nival,Newbie,70,0,,[ANN][ICO] wysker - Join the Mobile Shopping Revolution✨,"So there will be another way for advertisers to buy wys token. But if it is traded over the counter, how the trade can positively affect wys price?",False
8,msg45059600,https://bitcointalk.org/index.php?topic=2443093.0,,2327,Announcements (Altcoins),2018-09-02 06:59:41,Tonisim,Full Member,532,103,,[ANN][ICO] wysker - Join the Mobile Shopping Revolution✨,"wysker - Play, Discover, Shop https://www.youtube.com/watch?v=b4v50MqTAC0&feature=youtu.be&a=  Wysker is your discovery shopping cat.  It helps you find things you love faster than ever before. It’s like browsing all your favorite stores in just a few seconds. Life’s moving fast, and so is wysker.  Discover stuff from all over the world. Browse curated stories that sum up the latest releases. Find awesome things from over 1’000 global stores and get the best deals first!",False
9,msg45176427,https://bitcointalk.org/index.php?topic=2443093.0,,2327,Announcements (Altcoins),2018-09-04 10:43:25,elitecstrike,Full Member,560,101,,[ANN][ICO] wysker - Join the Mobile Shopping Revolution✨,Shopping App Comparison - wysker See how the wysker app compares to regular shopping apps. It makes finding things online faster and more fun than ever before. Try it out and tell us your thoughts in the comment section below. https://www.youtube.com/watch?v=FGdnr95JK7c&feature=youtu.be&a=,False
10,msg45443158,https://bitcointalk.org/index.php?topic=2443093.0,,2327,Announcements (Altcoins),2018-09-09 15:31:37,ngangngang,Newbie,56,0,,[ANN][ICO] wysker - Join the Mobile Shopping Revolution✨," A great project with a very cool idea!These are the projects I always suggest to friends and acquaintances,because I believe in their success! Good luck guys!   ",False
11,msg45519656,https://bitcointalk.org/index.php?topic=2443093.0,,2327,Announcements (Altcoins),2018-09-11 06:47:08,frazzlednetwork,Newbie,6,0,,[ANN][ICO] wysker - Join the Mobile Shopping Revolution✨,I found the project very credible and will be a solid foundation. It's very interesting and received much praise from everyone. I believe it will succeed and thrive in the future.,False
12,msg49099606,https://bitcointalk.org/index.php?topic=2443093.0,,2327,Announcements (Altcoins),2019-01-07 13:31:02,xtrusion,Full Member,437,133,,[ANN][ICO] wysker - Join the Mobile Shopping Revolution✨,is there any other communication channel? a bit little conversation here,False
13,msg31060622,https://bitcointalk.org/index.php?topic=2443093.0,,2327,Announcements (Altcoins),2018-02-25 19:03:05,CryptoCurators,Newbie,67,0,,[ANN][ICO] wysker - Join the Mobile Shopping Revolution✨,Last 5 days of the token sale!,False
14,msg31119873,https://bitcointalk.org/index.php?topic=2443093.0,,2327,Announcements (Altcoins),2018-02-26 15:33:10,MihailJ,Full Member,504,102,,[ANN][ICO] wysker - Join the Mobile Shopping Revolution✨,"Vote now for the wys token to get listed on NextExchange https://nextexchange.featureupvote.com/suggestions/4886/wysker-wys  Wysker is a revolutionary platform for consumers/shopping and e-commerce in general. It redefines the online shopping experience with a hyper-speed product discovery app, which includes an integrated token to reward buyers with discounts and advertisers with exposure! Great use of the blockchain to incentivize all parties while providing a unique and addicting shopping experience. App is launched on Android and iOS, with marketing expanding globally (ad currently running in Times Square)!",False
15,msg31204650,https://bitcointalk.org/index.php?topic=2443093.0,,2327,Announcements (Altcoins),2018-02-27 17:55:46,inlovewithcrypto,Newbie,42,0,,[ANN][ICO] wysker - Join the Mobile Shopping Revolution✨,I'm interested in your bounty campaign!,False
16,msg33271929,https://bitcointalk.org/index.php?topic=2443093.0,,2327,Announcements (Altcoins),2018-03-27 08:57:25,cryptodev30,Newbie,46,0,,[ANN][ICO] wysker - Join the Mobile Shopping Revolution✨,wysker was added to TokensRecord ICO Directory. https://tokensrecord.com/project/wysker,False
17,msg34094527,https://bitcointalk.org/index.php?topic=2443093.0,,2327,Announcements (Altcoins),2018-04-06 17:10:41,sv.alyona,Member,210,18,,[ANN][ICO] wysker - Join the Mobile Shopping Revolution✨,"wys Token Listing https://medium.com/wysker/wys-token-listing-9ffb0064ca27  As stated in our timeline, the wys token will be listed on exchanges in April 2018. Over the course of the past months we have been assessing all listing options. We opted for two main exchange platforms to list the wys token in the beginning. Three main factors were essential for our decision: Listing fees, security and exchange architecture.  The crypto exchange market has been overheating in the past months. Crypto Exchanges nowadays charge up to USD 1 million for token listings. A listing in one of the major exchanges can certainly have a positive effect on daily trading volume. However, at the same time, it is not appropriate for projects like wysker to pay excessive sums for listings on these major centralized exchanges (CEX).  Our plan is to further establish the wys token as an utility token in the e-commerce market. Thus we are working on a steady growth of the wysker platform and allocate our ICO funds accordingly. For this reason, we opted to list the wys token on two decentralized exchanges (DEX) in the beginning.  So what is the difference between a centralized and decentralized exchange? To put it short, CEXs act like banks. You have to create a new exchange-controlled wallet and need to trust the provider with your funds. In contrast, DEXs enable trading of tokens directly from a holder’s private wallet. You never have to give up control over your funds.  CEXs can not always provide full security, as shown in several cases. The whole point of decentralized concepts is to not hand over control to third parties. The centralized approach raises the risk of mismanagement, scams and hacking.  With increasing adoption, it seems like 2018 will be the year for DEXs. Nearly all major CEXs, such as Binance, are working on their own version of DEXs to keep up with the game. We are pleased to announce that we were able to list the wys token on two of the most promising DEX projects in the market: Radar Relay and Next.Exchange.",False
18,msg34096058,https://bitcointalk.org/index.php?topic=2443093.0,,2327,Announcements (Altcoins),2018-04-06 17:32:28,idioma1,Newbie,266,0,,[ANN][ICO] wysker - Join the Mobile Shopping Revolution✨,Is this app already available?,False
19,msg34183137,https://bitcointalk.org/index.php?topic=2443093.0,,2327,Announcements (Altcoins),2018-04-07 22:56:49,cryptomane,Newbie,36,0,,[ANN][ICO] wysker - Join the Mobile Shopping Revolution✨, i was stupid enough and bought some aswell^ thats real craptoken,False
20,msg34183683,https://bitcointalk.org/index.php?topic=2443093.0,,2327,Announcements (Altcoins),2018-04-07 23:14:41,arifmuhammad,Newbie,125,0,,[ANN][ICO] wysker - Join the Mobile Shopping Revolution✨,hopefully this future project will be successful and many supporters.,False
21,msg34338919,https://bitcointalk.org/index.php?topic=2443093.0,,2327,Announcements (Altcoins),2018-04-10 02:13:19,moirahpascual11,Newbie,126,0,,[ANN][ICO] wysker - Join the Mobile Shopping Revolution✨,"as i read the information above ,it look a great one and I hope there'll be a lot of people joining us. This is definitely going to be a big deal this year, I'm curious to see what's coming. and will definitely continue to support it.",False
22,msg37355876,https://bitcointalk.org/index.php?topic=2443093.0,,2327,Announcements (Altcoins),2018-05-15 14:04:55,CryptoCurators,Newbie,67,0,,[ANN][ICO] wysker - Join the Mobile Shopping Revolution✨,wysker 2.0 is taking shape 🔥 Stay tuned! https://s7.postimg.cc/w7y3dpxiz/wysa1.jpg https://twitter.com/wysker_/status/996374740964175872,False
23,msg37360003,https://bitcointalk.org/index.php?topic=2443093.0,,2327,Announcements (Altcoins),2018-05-15 14:49:22,Bertram89,Member,294,12,,[ANN][ICO] wysker - Join the Mobile Shopping Revolution✨,maybe you need to add a whitepaper for this project so that participants are interested to join.,False
24,msg37363281,https://bitcointalk.org/index.php?topic=2443093.0,,2327,Announcements (Altcoins),2018-05-15 15:21:49,Rowane,Member,294,11,,[ANN][ICO] wysker - Join the Mobile Shopping Revolution✨,It's very attractive to build projects on a real technology factory. I believe this is quite different from many ICO projects nowadays.,False
25,msg37443579,https://bitcointalk.org/index.php?topic=2443093.0,,2327,Announcements (Altcoins),2018-05-16 10:14:04,21joker,Jr. Member,289,1,,[ANN][ICO] wysker - Join the Mobile Shopping Revolution✨,Hi friends!  Wysker is now listed on Bitgur price index - https://bitgur.com/coin/WYS! You can add it to customizable watchlist and create advanced price alerts.,False
26,msg37460728,https://bitcointalk.org/index.php?topic=2443093.0,msg37360003,2327,Announcements (Altcoins),2018-05-16 13:14:47,CryptoCurators,Newbie,67,0,,[ANN][ICO] wysker - Join the Mobile Shopping Revolution✨,"   Hey, you can find the whitepaper here https://www.wystoken.org/media/wysker-whitepaper.pdf and our token sale is already over",False
27,msg37462698,https://bitcointalk.org/index.php?topic=2443093.0,,2327,Announcements (Altcoins),2018-05-16 13:35:03,wysker,Newbie,52,0,,[ANN][ICO] wysker - Join the Mobile Shopping Revolution✨,Great article by our $WYS token community member @Muhonen✌️  https://www.reddit.com/r/CryptoCurrency/comments/8jo5xj/wysker_discovery_shopping_app_7m_marketcap/,False
28,msg38551234,https://bitcointalk.org/index.php?topic=2443093.0,,2327,Announcements (Altcoins),2018-05-25 20:51:42,CryptoCurators,Newbie,67,0,,[ANN][ICO] wysker - Join the Mobile Shopping Revolution✨,More hints for Treasure hunt dropped at https://t.me/wyskernews  Search for the clues and find 100k WYS!,False
29,msg38598805,https://bitcointalk.org/index.php?topic=2443093.0,,2327,Announcements (Altcoins),2018-05-26 08:40:46,hughbt,Hero Member,605,501,,[ANN][ICO] wysker - Join the Mobile Shopping Revolution✨,This project is a hidden gem. I can't wait for the upcoming release.,False
30,msg38683314,https://bitcointalk.org/index.php?topic=2443093.0,,2327,Announcements (Altcoins),2018-05-27 10:13:02,CryptoCurators,Newbie,67,0,,[ANN][ICO] wysker - Join the Mobile Shopping Revolution✨,"wysker 2.0 coming soon, make sure to join official telegram https://t.me/wysker",False
31,msg38709963,https://bitcointalk.org/index.php?topic=2443093.0,,2327,Announcements (Altcoins),2018-05-27 15:52:44,NightDream,Full Member,644,103,,[ANN][ICO] wysker - Join the Mobile Shopping Revolution✨,"The Evolution of wysker wysker is more than shopping. It is a revolution. It turns the common online retail and advertising data model on its head — by using blockchain technology to secure and “pay” users for their data. It is inspiration and shopping platform at once. It offers a unique way to “speed browse” unique and care and thoughtfully curated products in a variety of categories.  All those ideas put wysker in the spotlight — at speed we didn’t expect. For us, it feels a bit like browsing products with the wysker app. There is always a pleasant surprise around the corner. Getting awarded at the prestigious Netexplo and UNESCO Innovation Awards 2018 for example. Or reaching the semi-finals at the equally important Slush Tokyo conference 2018. Another symptom: the web is turning magenta and violet. A simple image search for wysker turns screens mauve. wysker is present, and wysker is everywhere.  Now cynics may point out that probably the marketing & communications department does an excellent job here. Hard work and a great branding strategy: and voìla! But that is only a part of the truth. wysker’s branding strategy is more than just a marketing idea. It is an entire belief system. Our app and our marketing are just tools to make these beliefs a reality.  Every single wysker image on the Google search marks a milestone for us. Every mauve picture has meaning. Because it marks us getting one step closer to turning beliefs into facts.    But progress to where? We would be dishonest if we’d claim, we don’t want economic success. Yes, financial success is important to us. But even more important is to establish the idea of a one-to-one data trade between retailers and advertisers on one side and users on the other. Even more, weight carries the fact that we get closer to hand back the control over data to the users.  In the wake of the EU law, we see many data giants claiming the same. But none is as radical and revolutionary as wysker. Full data rights for our users are ingrained in our DNA. And not because law requires it — but because it is our very business model. And with every step in our evolution, we aim to get closer to this goal. Full data control, full data rights and fair participation in data profits for our users.  But where are we today? We are working on wysker 2.0. We will implement new features that mark further milestones: Training sessions for your wysker, customization features and a re-invented notification center are just a few of the new features. But not only the wysker app keeps evolving. Our branding continually grows with it. Even our logo took a step to the next level.    We are conscious that we have been relatively silent on medium. The truth is: our dedicated team worked day and night on making the wysker vision real. And blogging simply took a back seat. To our readers, investors, and users we want to say: “We are sorry!”. But then we know — you understand. At the end of the day we are working for you, our users, our investors and our big vision.  https://medium.com/wysker/the-evolution-of-wysker-79e1c3374b38",False
32,msg38891353,https://bitcointalk.org/index.php?topic=2443093.0,,2327,Announcements (Altcoins),2018-05-29 16:59:04,filsid,Full Member,630,103,,[ANN][ICO] wysker - Join the Mobile Shopping Revolution✨,"The wysker treasure hunt  100.000 wys tokens, one video and a missing 64 digits private key.  That’s the wysker treasure hunt. Awesome! The first one who finds the six pieces to the key and unlocks the wallet, is the winner — the owner of 100.000 wys tokens!  The game is inspired by Notpron, one of my most favourite game and one of the toughest online-games on earth. It kept me inside the house for days even though my friends were playing outside in the sun.  To promote the wys token, we didn’t just want to create simple banner ads that spread out all the trending keywords: crypto, coins, Lambos, moon, hodl, whale, fud, pump and dump. So we thought, how to do something different? How to create something fun and challenging? That’s why we created the wysker treasure hunt.  The hunt began a while ago and no one has solved it yet. It’s a tough nut to crack, but it’s fun. The feedback so far has been phenomenal. We receive tons of feedback especially by people who have not been active in the crypto-sphere. That was the effect we wanted to achieve and we hope to spread the word further. https://medium.com/wysker/the-wysker-treasure-hunt-d38e54a38f63",False
33,msg27811576,https://bitcointalk.org/index.php?topic=2443093.0,,2327,Announcements (Altcoins),2018-01-10 01:37:15,NatYaros,Newbie,30,0,,[ANN][ICO] wysker - Join the Mobile Shopping Revolution✨,Hey! It is a nice idea! It is like a global referral system. I like it. Is that possible to promote a politician via your blockchain?,False
34,msg27812182,https://bitcointalk.org/index.php?topic=2443093.0,,2327,Announcements (Altcoins),2018-01-10 01:55:38,EvRo74,Sr. Member,812,261,,[ANN][ICO] wysker - Join the Mobile Shopping Revolution✨,"Hello, team!  Where can I see the current tokensales amount?  And why do you need so much time to start the Ad platform (about a year)?",False
35,msg27874103,https://bitcointalk.org/index.php?topic=2443093.0,,2327,Announcements (Altcoins),2018-01-10 23:05:29,LuBro,Member,210,12,,[ANN][ICO] wysker - Join the Mobile Shopping Revolution✨,"Will there be any compensation in relation to the ICO, as the ETH price has risen steadily since its inception? Are there any compensatory payments or are these stakes still being used?",False
36,msg28215340,https://bitcointalk.org/index.php?topic=2443093.0,,2327,Announcements (Altcoins),2018-01-15 22:41:58,wysker,Newbie,52,0,,[ANN][ICO] wysker - Join the Mobile Shopping Revolution✨,"https://i.imgur.com/p7ZVt7Pl.jpg  As you know, we’re only 15 days away from our worldwide wysker app launch. Everything is up and running and we’re getting ready for the big day.  We just published a new medium article with some great and exciting announcements, make sure to check it out https://medium.com/wysker/https-medium-com-wysker-things-are-getting-real-t-15days-5e28fa9ff836",False
37,msg28443016,https://bitcointalk.org/index.php?topic=2443093.0,,2327,Announcements (Altcoins),2018-01-19 03:11:00,CryptoCurators,Newbie,67,0,,[ANN][ICO] wysker - Join the Mobile Shopping Revolution✨,9 days left untill the launch! Time to get in is now!,False
38,msg28455406,https://bitcointalk.org/index.php?topic=2443093.0,,2327,Announcements (Altcoins),2018-01-19 08:12:27,LuBro,Member,210,12,,[ANN][ICO] wysker - Join the Mobile Shopping Revolution✨,"I hope there'll be a lot of people joining us. This is definitely going to be a big deal this year, I'm curious to see what's coming. and will definitely continue to support it.",False
39,msg28640267,https://bitcointalk.org/index.php?topic=2443093.0,,2327,Announcements (Altcoins),2018-01-21 21:25:24,CryptoCurators,Newbie,67,0,,[ANN][ICO] wysker - Join the Mobile Shopping Revolution✨,There still is tome to join. If you have any questions ask them on telegram!,False
40,msg28640513,https://bitcointalk.org/index.php?topic=2443093.0,,2327,Announcements (Altcoins),2018-01-21 21:30:28,umstit,Newbie,5,0,,[ANN][ICO] wysker - Join the Mobile Shopping Revolution✨,Hi dev do you have bounty program?,False
41,msg28685628,https://bitcointalk.org/index.php?topic=2443093.0,msg28640513,2327,Announcements (Altcoins),2018-01-22 14:24:17,LuBro,Member,210,12,,[ANN][ICO] wysker - Join the Mobile Shopping Revolution✨,"   Hey mate, I'm not an dev, but I can give you the information:  You can find the link of the Bounty right here: WYS Bounty Program",False
42,msg28969190,https://bitcointalk.org/index.php?topic=2443093.0,,2327,Announcements (Altcoins),2018-01-26 13:27:10,CryptoCurators,Newbie,67,0,,[ANN][ICO] wysker - Join the Mobile Shopping Revolution✨,Few days left to join the presale and catch the 30% boons! The mainsale starts on 1st February!,False
43,msg28994110,https://bitcointalk.org/index.php?topic=2443093.0,msg28640267,2327,Announcements (Altcoins),2018-01-26 20:01:26,wysker,Newbie,52,0,,[ANN][ICO] wysker - Join the Mobile Shopping Revolution✨,   Here's the link to our telegram channel: https://t.me/wysker,False
44,msg29092744,https://bitcointalk.org/index.php?topic=2443093.0,,2327,Announcements (Altcoins),2018-01-28 11:12:52,niggau,Newbie,2,0,,[ANN][ICO] wysker - Join the Mobile Shopping Revolution✨,"Great project, looking forward to the app launch.  You should list your ICO on https://icodrops.com by the way",False
45,msg29168290,https://bitcointalk.org/index.php?topic=2443093.0,,2327,Announcements (Altcoins),2018-01-29 13:21:00,zckeles,Full Member,176,100,,[ANN][ICO] wysker - Join the Mobile Shopping Revolution✨,what is ico price?,False
46,msg29209981,https://bitcointalk.org/index.php?topic=2443093.0,,2327,Announcements (Altcoins),2018-01-30 04:34:13,CryptoCurators,Newbie,67,0,,[ANN][ICO] wysker - Join the Mobile Shopping Revolution✨,19 hours left until the worldwide iOS and android app launch! You can see countdown here https://www.timeanddate.com/countdown/launch?iso=20180131T00&p0=136&msg=Wysker+app+releases+worldwide%21+&font=slab&csz=1  Get ready to fly!,False
47,msg29323944,https://bitcointalk.org/index.php?topic=2443093.0,,2327,Announcements (Altcoins),2018-01-31 16:07:44,vobid,Newbie,27,0,,[ANN][ICO] wysker - Join the Mobile Shopping Revolution✨,"Why does it say Total Supply 3,000,000,000 WYS on etherscan.io (https://etherscan.io/token/0xd8950fdeaa10304b7a7fd03a2fc66bc39f3c711a) and 362'460'000 WYS on Wysker ICO (https://www.wystoken.org/index.html) ?  This looks pretty shady! ",False
48,msg29449981,https://bitcointalk.org/index.php?topic=2443093.0,,2327,Announcements (Altcoins),2018-02-02 12:12:27,phoenixdowndee,Full Member,784,113,,[ANN][ICO] wysker - Join the Mobile Shopping Revolution✨,"wyster has a task on Crowdholding. Log in, co-create and earn Yupies for your feedback.  http://bit.ly/2EzLPMa",False
49,msg29670336,https://bitcointalk.org/index.php?topic=2443093.0,msg29449981,2327,Announcements (Altcoins),2018-02-05 18:08:19,CryptoCurators,Newbie,67,0,,[ANN][ICO] wysker - Join the Mobile Shopping Revolution✨,  Token sale is now live!!,False
50,msg29720504,https://bitcointalk.org/index.php?topic=2443093.0,,2327,Announcements (Altcoins),2018-02-06 13:31:58,CryptoCurators,Newbie,67,0,,[ANN][ICO] wysker - Join the Mobile Shopping Revolution✨,Find lambo on freshly released Wysker app! https://wys.sh/Pwwizw5JV1lVCS89n0sBF9OKlmULl Now ready for Android and iOS version will be released soon!,False
51,msg29773488,https://bitcointalk.org/index.php?topic=2443093.0,,2327,Announcements (Altcoins),2018-02-07 08:51:31,Crypto_GO,Newbie,2,0,,[ANN][ICO] wysker - Join the Mobile Shopping Revolution✨,Ein kurzes deutsches Review zur Wysker ICO  https://cryptogo.de/wysker-tinder-for-shopping/  Kurzzusammenfassung: Im Gegensatz zu vielen anderen Blockchain Startups verfügt Wysker über eine einwandfrei funktionierende App. Der Einsatz der Blockchaintechnologie und der intrinsische Wert des WYS Tokens sind jedoch fragwürdig. Zusätzlich erhalten die Terms and Conditions einige zweifelhafte Aussagen.,False
52,msg30277113,https://bitcointalk.org/index.php?topic=2443093.0,,2327,Announcements (Altcoins),2018-02-14 13:54:14,wysker,Newbie,52,0,,[ANN][ICO] wysker - Join the Mobile Shopping Revolution✨,"Get in on the wysker Treasuer Hunt !  https://www.youtube.com/watch?v=Ajhyirdd9CE   TREASURE HUNT Watch our launch video carefully. We’ve hidden 6 secret codes in it that lead to a wallet address via a private key. The finder gets 100,000 wys tokens (worth 6000 USD). Your victory is right around the corner. Never give up !",False
53,msg26077725,https://bitcointalk.org/index.php?topic=2443093.0,,2327,Announcements (Altcoins),2017-12-10 12:02:00,CryptoCurators,Newbie,67,0,,[ANN][ICO] wysker - Join the Mobile Shopping Revolution✨,Let us know if you have any questions and make sure to join our telegram https://t.me/joinchat/HIZi0Q8O0dE2KyYrKtEteg !,False
54,msg26165753,https://bitcointalk.org/index.php?topic=2443093.0,,2327,Announcements (Altcoins),2017-12-11 21:39:27,CryptoCurators,Newbie,67,0,,[ANN][ICO] wysker - Join the Mobile Shopping Revolution✨,Join our bounty to get some free nwys tokens! https://bitcointalk.org/index.php?topic=2418514.new#new,False
