id,msg_id,parent_id,link_id,Count_read,Forum,Time,Author,Rank,Activity,Merit,Trust,Title,Body,ScamHeader
121,msg33332844,https://bitcointalk.org/index.php?topic=2967381.0,,2364,Announcements (Altcoins),2018-03-28 03:39:06,issac1209,Newbie,87,0,,[ANN][ICO] BAAPPAY - The Evolution of the Payment Platform is Here,When do you have the video DEMO for POS device in detailed . I would like to see more with actual credit card & crypto transactions .,False
122,msg33336136,https://bitcointalk.org/index.php?topic=2967381.0,,2364,Announcements (Altcoins),2018-03-28 05:08:10,sircy,Sr. Member,504,250,,[ANN][ICO] BAAPPAY - The Evolution of the Payment Platform is Here,"vision and concept brought inside the project is very interesting, but even though lately many projects are popping up with concepts that are more interesting, but I believe that this project has its own advantages, which are not owned in another project. success always for this project.",False
123,msg33343921,https://bitcointalk.org/index.php?topic=2967381.0,msg33336136,2364,Announcements (Altcoins),2018-03-28 07:38:20,bestpikka,Full Member,574,102,,[ANN][ICO] BAAPPAY - The Evolution of the Payment Platform is Here,  With an experienced team and have special skill I am sure that future projects could be growing and get a lot of support from the participants.,False
124,msg33394037,https://bitcointalk.org/index.php?topic=2967381.0,msg33332844,2364,Announcements (Altcoins),2018-03-28 19:09:41,Hsingh,Newbie,47,0,,[ANN][ICO] BAAPPAY - The Evolution of the Payment Platform is Here,   Below is the POS Demo video link. Stay tuned with us. Soon we will be coming up with more detailed demo video's.   https://www.youtube.com/watch?v=ay3kt88i1Tc,False
125,msg33394545,https://bitcointalk.org/index.php?topic=2967381.0,,2364,Announcements (Altcoins),2018-03-28 19:17:26,Hsingh,Newbie,47,0,,[ANN][ICO] BAAPPAY - The Evolution of the Payment Platform is Here,"Hello Folks,  We wanted to share the exciting news with everyone that BaapPay completed the sale with Private and Pre-sale contributors, thus we will replace the Public sale with airdrops.  We are expecting to release parts of our platform: devices, point of sale software, crypto- fiat merchant accounts, within 3-4 months.  We will be taking pre-orders for the devices within the next 1-2 months.  Our App Store,  PayPal like payment gateway,  liquidity pool and wallets will be released according to our road map  As for our Bounty program, it will continue until April 30th.  We thank all the contributors and community support, we could have not done it without you!!  Stay Tuned for more updates.",False
126,msg33394630,https://bitcointalk.org/index.php?topic=2967381.0,msg33336136,2364,Announcements (Altcoins),2018-03-28 19:18:48,Hsingh,Newbie,47,0,,[ANN][ICO] BAAPPAY - The Evolution of the Payment Platform is Here,"   Thanks for supporting us.  We are expecting to release parts of our platform: devices, point of sale software, crypto- fiat merchant accounts, within 3-4 months.  We will be taking pre-orders for the devices within the next 1-2 months.  Stay Tuned for more updates.",False
127,msg33395062,https://bitcointalk.org/index.php?topic=2967381.0,msg33343921,2364,Announcements (Altcoins),2018-03-28 19:25:12,Hsingh,Newbie,47,0,,[ANN][ICO] BAAPPAY - The Evolution of the Payment Platform is Here,"   Thanks for the appreciations.   Like I mentioned before, Soon we will be releasing some parts of our platform like smart devices, merchant account(crypto-fiat both), point of sale software in another 3-4 months. Pre-orders booking fro our smart terminals will be starting in another couple of months.  Stay tuned with us for more information.",False
128,msg33421291,https://bitcointalk.org/index.php?topic=2967381.0,,2364,Announcements (Altcoins),2018-03-29 06:46:50,Ethan112,Newbie,78,0,,[ANN][ICO] BAAPPAY - The Evolution of the Payment Platform is Here,Wonderful project with drdicated team.. all the best team,False
129,msg33445032,https://bitcointalk.org/index.php?topic=2967381.0,,2364,Announcements (Altcoins),2018-03-29 13:00:57,Isaac45,Newbie,81,0,,[ANN][ICO] BAAPPAY - The Evolution of the Payment Platform is Here,on facebook you showed pics of airdrops but didnt say anything. so does that mean you will have airdrops?,False
130,msg33459182,https://bitcointalk.org/index.php?topic=2967381.0,,2364,Announcements (Altcoins),2018-03-29 16:05:00,FilipeHenriques,Member,494,12,,[ANN][ICO] BAAPPAY - The Evolution of the Payment Platform is Here,Portuguese ANN is available : https://bitcointalk.org/index.php?topic=3217902.msg33458926#msg33458926,False
131,msg33459608,https://bitcointalk.org/index.php?topic=2967381.0,,2364,Announcements (Altcoins),2018-03-29 16:10:13,Ananastasia,Newbie,30,0,,[ANN][ICO] BAAPPAY - The Evolution of the Payment Platform is Here,Looks like a good project with a great team,False
132,msg33465993,https://bitcointalk.org/index.php?topic=2967381.0,msg33445032,2364,Announcements (Altcoins),2018-03-29 17:39:13,Hsingh,Newbie,47,0,,[ANN][ICO] BAAPPAY - The Evolution of the Payment Platform is Here,"   Yes, soon we will be launching with the Airdrops. Team is working on it.  Stay tuned with us for more updates.   ",False
133,msg33466527,https://bitcointalk.org/index.php?topic=2967381.0,msg33459182,2364,Announcements (Altcoins),2018-03-29 17:46:45,Hsingh,Newbie,47,0,,[ANN][ICO] BAAPPAY - The Evolution of the Payment Platform is Here,   Please submit your links in the bounty thread for consideration. Below is the link  https://bitcointalk.org/index.php?topic=3141616.msg32481900#msg32481900,False
134,msg32487480,https://bitcointalk.org/index.php?topic=2967381.0,msg32486218,2364,Announcements (Altcoins),2018-03-17 02:29:19,Baappay,Newbie,96,0,,[ANN][ICO] BAAPPAY - The Evolution of the Payment Platform is Here,"   Thanks! wait until you see our other demo which will be detailed, with actual credit card & crypto transactions, integrated into our point of sale software",False
135,msg32505766,https://bitcointalk.org/index.php?topic=2967381.0,,2364,Announcements (Altcoins),2018-03-17 09:55:35,issac1209,Newbie,87,0,,[ANN][ICO] BAAPPAY - The Evolution of the Payment Platform is Here,I am absolutely impressed by the project but why has this not gone viral? Your project/whitepaper is solid yet seem to go unnoticed. You really need to attend more events and get the word out.,False
136,msg32530297,https://bitcointalk.org/index.php?topic=2967381.0,msg32505766,2364,Announcements (Altcoins),2018-03-17 16:18:23,Miiike,Legendary,1414,1042,,[ANN][ICO] BAAPPAY - The Evolution of the Payment Platform is Here,"   A lack of publicity, IMO. They still have chances, though. Didn't try to take advantage on this situation, but I think an airdrop will boost your project awareness",False
137,msg32530959,https://bitcointalk.org/index.php?topic=2967381.0,,2364,Announcements (Altcoins),2018-03-17 16:28:00,franklinrichards,Jr. Member,240,5,,[ANN][ICO] BAAPPAY - The Evolution of the Payment Platform is Here,"BaapPay is a multi-layered platfoam equipped with paymen gateways, sales and software systems, and the BaaWorld app store. as cryptococcal adoption increasingly penetrates the bussiness and consumer lives, the will be a point where : buying, selling and trading cryptocurrency will be a part of everyday life these future projets will contunue to grow.",False
138,msg32550468,https://bitcointalk.org/index.php?topic=2967381.0,msg32530959,2364,Announcements (Altcoins),2018-03-17 22:26:34,Baappay,Newbie,96,0,,[ANN][ICO] BAAPPAY - The Evolution of the Payment Platform is Here,   Thanks for the cut and paste!!,False
139,msg32550742,https://bitcointalk.org/index.php?topic=2967381.0,msg32530297,2364,Announcements (Altcoins),2018-03-17 22:32:21,Baappay,Newbie,96,0,,[ANN][ICO] BAAPPAY - The Evolution of the Payment Platform is Here,"   Our problem, our priority is releasing the platform instead of marketing, however that should change as soon as we release our devices, POS and payment integration in the coming weeks. However, we do have a lot interest from  big time investors......Airdrops will be coming!!",False
140,msg32550890,https://bitcointalk.org/index.php?topic=2967381.0,msg32530297,2364,Announcements (Altcoins),2018-03-17 22:36:01,Hakamoto,Full Member,266,100,,[ANN][ICO] BAAPPAY - The Evolution of the Payment Platform is Here,   I agree to bring to the project the maximum number of investors - it is necessary to apply all kinds of advertising opportunities. Airdrop is a very good idea.,False
141,msg32564855,https://bitcointalk.org/index.php?topic=2967381.0,msg32505766,2364,Announcements (Altcoins),2018-03-18 05:59:12,RoryRoryRory3,Newbie,39,0,,[ANN][ICO] BAAPPAY - The Evolution of the Payment Platform is Here,"   I agree, you haven't even started the ICO yet you seem to have everything developed and planned. Get the word out devs!!",False
142,msg32583765,https://bitcointalk.org/index.php?topic=2967381.0,msg32564855,2364,Announcements (Altcoins),2018-03-18 11:29:36,Mythul,Sr. Member,644,250,,[ANN][ICO] BAAPPAY - The Evolution of the Payment Platform is Here,  Project seems interesting. Looked at whitepaper BAAPPAY buildan paygate system. I am actually concern about Smart SPOS,False
143,msg32585323,https://bitcointalk.org/index.php?topic=2967381.0,,2364,Announcements (Altcoins),2018-03-18 11:53:00,Blakekeke10,Newbie,51,0,,[ANN][ICO] BAAPPAY - The Evolution of the Payment Platform is Here,Liking the video guys! Just some airdrops and this should be to the moon!:wink:,False
144,msg32598197,https://bitcointalk.org/index.php?topic=2967381.0,msg32583765,2364,Announcements (Altcoins),2018-03-18 14:39:18,Baappay,Newbie,96,0,,[ANN][ICO] BAAPPAY - The Evolution of the Payment Platform is Here,   What are your concerns about the SPOS?,False
145,msg32647172,https://bitcointalk.org/index.php?topic=2967381.0,,2364,Announcements (Altcoins),2018-03-19 06:51:14,Carterfinley65,Newbie,91,0,,[ANN][ICO] BAAPPAY - The Evolution of the Payment Platform is Here,What is the fee per transaction through your POS ?,False
146,msg32701854,https://bitcointalk.org/index.php?topic=2967381.0,msg32647172,2364,Announcements (Altcoins),2018-03-19 20:03:45,Baappay,Newbie,96,0,,[ANN][ICO] BAAPPAY - The Evolution of the Payment Platform is Here,"   in 4-5 months when we are ready to release the product into the market, we will give a complete breakdown of the fees and cost",False
147,msg32709387,https://bitcointalk.org/index.php?topic=2967381.0,,2364,Announcements (Altcoins),2018-03-19 22:21:42,coinadon,Newbie,98,0,,[ANN][ICO] BAAPPAY - The Evolution of the Payment Platform is Here,"very smart dev, it will be a great succesfull ico.  Sukhpreet Singh  Founder & CEO  Successful entrepreneur, ICO and Blockchain enthusiast. Sukhpreet Singh is a early Cryptocurrency investor and successfully founded several B2C ventures. Desires to apply his extensive experience to build a  blockchain based online payment processing solution incorporating both fiat and crypto",False
148,msg32730371,https://bitcointalk.org/index.php?topic=2967381.0,,2364,Announcements (Altcoins),2018-03-20 07:14:11,kotasweladapola,Newbie,194,0,,[ANN][ICO] BAAPPAY - The Evolution of the Payment Platform is Here,Amazing project. Just went through the brief description and others views as well. Hope BaapPay having the capability to deliver great results through their project. I will post a good analysis about them once refer their white paper fully. Good luck all.,False
149,msg32767114,https://bitcointalk.org/index.php?topic=2967381.0,msg32709387,2364,Announcements (Altcoins),2018-03-20 16:34:42,Hsingh,Newbie,47,0,,[ANN][ICO] BAAPPAY - The Evolution of the Payment Platform is Here,   Thanks for your kind words for our CEO!!,False
150,msg32846814,https://bitcointalk.org/index.php?topic=2967381.0,,2364,Announcements (Altcoins),2018-03-21 17:02:49,piaomar,Jr. Member,252,1,,[ANN][ICO] BAAPPAY - The Evolution of the Payment Platform is Here,BAAPPAY project has a good vision to make it easier for us if doing transaction using cryptocurrency. it's a good projects and deserve to be supported. I hope that many investors are join with this project.,False
151,msg32918579,https://bitcointalk.org/index.php?topic=2967381.0,msg32846814,2364,Announcements (Altcoins),2018-03-22 16:11:22,Hsingh,Newbie,47,0,,[ANN][ICO] BAAPPAY - The Evolution of the Payment Platform is Here,   Thanks for Supporting us. Stay Tuned for more updates.,False
152,msg32952651,https://bitcointalk.org/index.php?topic=2967381.0,,2364,Announcements (Altcoins),2018-03-23 05:06:10,celofiguj,Member,132,10,,[ANN][ICO] BAAPPAY - The Evolution of the Payment Platform is Here,"As you posted earlier that demo of POS is ready and will be circulated in the market. So, Is the demo ready?",False
153,msg32953077,https://bitcointalk.org/index.php?topic=2967381.0,msg32952651,2364,Announcements (Altcoins),2018-03-23 05:18:02,Baappay,Newbie,96,0,,[ANN][ICO] BAAPPAY - The Evolution of the Payment Platform is Here,"   We are expecting to have the first half of our platform completed and released into the market within 4-5 months(POS, device, fiat,crypto payment gateway). Below is the link for the demo video.  We will be taking pre orders for our devices starting within 2-3 months. There shall also be another website dedicated to the retail sales and customer support pertaining to the products.  https://www.youtube.com/watch?v=ay3kt88i1Tc",False
154,msg32115143,https://bitcointalk.org/index.php?topic=2967381.0,msg32112653,2364,Announcements (Altcoins),2018-03-12 06:12:28,Baappay,Newbie,96,0,,[ANN][ICO] BAAPPAY - The Evolution of the Payment Platform is Here,"   We should have a video out this week, maybe by thrusday",False
155,msg32149443,https://bitcointalk.org/index.php?topic=2967381.0,,2364,Announcements (Altcoins),2018-03-12 15:30:56,mohammed0102,Newbie,73,0,,[ANN][ICO] BAAPPAY - The Evolution of the Payment Platform is Here,Great Project! what exchanges will you be on?,False
156,msg32184570,https://bitcointalk.org/index.php?topic=2967381.0,,2364,Announcements (Altcoins),2018-03-13 03:14:59,logan0312,Newbie,70,0,,[ANN][ICO] BAAPPAY - The Evolution of the Payment Platform is Here,Do you guys plan to promote your product on any blockchain festival ?,False
157,msg32198911,https://bitcointalk.org/index.php?topic=2967381.0,msg32149443,2364,Announcements (Altcoins),2018-03-13 08:39:12,Baappay,Newbie,96,0,,[ANN][ICO] BAAPPAY - The Evolution of the Payment Platform is Here,    We will list the exchanges after the ico is done,False
158,msg32198983,https://bitcointalk.org/index.php?topic=2967381.0,msg32184570,2364,Announcements (Altcoins),2018-03-13 08:40:29,Baappay,Newbie,96,0,,[ANN][ICO] BAAPPAY - The Evolution of the Payment Platform is Here,"   yes, there is one in Toronto or Montreal that we will try to attend next month",False
159,msg32278709,https://bitcointalk.org/index.php?topic=2967381.0,,2364,Announcements (Altcoins),2018-03-14 09:33:50,thomas1980,Newbie,44,0,,[ANN][ICO] BAAPPAY - The Evolution of the Payment Platform is Here,You can contribute with ETH or BTC.,False
160,msg32290176,https://bitcointalk.org/index.php?topic=2967381.0,msg32278709,2364,Announcements (Altcoins),2018-03-14 12:37:34,Baappay,Newbie,96,0,,[ANN][ICO] BAAPPAY - The Evolution of the Payment Platform is Here,"   BTC, LTC, XRP, BCH USD",False
161,msg32344991,https://bitcointalk.org/index.php?topic=2967381.0,,2364,Announcements (Altcoins),2018-03-15 06:20:34,Basterian7789,Newbie,103,0,,[ANN][ICO] BAAPPAY - The Evolution of the Payment Platform is Here,"Good idea, I like it. But I don't understand you will have its own payment system? Or you will work with Visa/Mastercard?",False
162,msg32377946,https://bitcointalk.org/index.php?topic=2967381.0,msg32344991,2364,Announcements (Altcoins),2018-03-15 15:04:22,TobyToby12,Newbie,71,0,,[ANN][ICO] BAAPPAY - The Evolution of the Payment Platform is Here,   I guess that they create their own payment system .,False
163,msg32393351,https://bitcointalk.org/index.php?topic=2967381.0,msg32377946,2364,Announcements (Altcoins),2018-03-15 18:49:01,Baappay,Newbie,96,0,,[ANN][ICO] BAAPPAY - The Evolution of the Payment Platform is Here,   Yes we will have our own payment system and you can use visa or mastercard on our devices,False
164,msg32416777,https://bitcointalk.org/index.php?topic=2967381.0,,2364,Announcements (Altcoins),2018-03-16 04:33:24,Freddie197,Newbie,92,0,,[ANN][ICO] BAAPPAY - The Evolution of the Payment Platform is Here,Do you have your company registration number ? I would like to do some research before I thinking about investment !,False
165,msg32426193,https://bitcointalk.org/index.php?topic=2967381.0,,2364,Announcements (Altcoins),2018-03-16 07:55:04,Archie1973,Newbie,84,0,,[ANN][ICO] BAAPPAY - The Evolution of the Payment Platform is Here,That was a cool demo of the device. It is actually functional?,False
166,msg32447378,https://bitcointalk.org/index.php?topic=2967381.0,msg32416777,2364,Announcements (Altcoins),2018-03-16 13:36:59,Baappay,Newbie,96,0,,[ANN][ICO] BAAPPAY - The Evolution of the Payment Platform is Here,"   Yes, we are registered in Canada, province of Ontario",False
167,msg32447701,https://bitcointalk.org/index.php?topic=2967381.0,,2364,Announcements (Altcoins),2018-03-16 13:41:33,STI_2M,Member,264,11,,[ANN][ICO] BAAPPAY - The Evolution of the Payment Platform is Here,Hello everybody! I didn't understand if you have an escrow or not?,False
168,msg32467213,https://bitcointalk.org/index.php?topic=2967381.0,msg32447701,2364,Announcements (Altcoins),2018-03-16 18:29:24,Baappay,Newbie,96,0,,[ANN][ICO] BAAPPAY - The Evolution of the Payment Platform is Here,   Are you referring to the PayPal like payment gateway?escrow resolution center?,False
169,msg32467318,https://bitcointalk.org/index.php?topic=2967381.0,msg32426193,2364,Announcements (Altcoins),2018-03-16 18:31:06,Baappay,Newbie,96,0,,[ANN][ICO] BAAPPAY - The Evolution of the Payment Platform is Here,"    If you referring the the video we just release, that was a commercial video, however, we should have a personal demo by the team next week. The Point sale demo should be up today",False
170,msg32482940,https://bitcointalk.org/index.php?topic=2967381.0,,2364,Announcements (Altcoins),2018-03-16 23:38:15,djwatt3,Full Member,504,137,,[ANN][ICO] BAAPPAY - The Evolution of the Payment Platform is Here,Telegram link doesn't work,False
171,msg32484813,https://bitcointalk.org/index.php?topic=2967381.0,msg32482940,2364,Announcements (Altcoins),2018-03-17 00:39:28,Baappay,Newbie,96,0,,[ANN][ICO] BAAPPAY - The Evolution of the Payment Platform is Here,   Baappay ICO Launch https://t.me/joinchat/HMAe-RLEmYZMuCS8dfIGWAy,False
172,msg32485251,https://bitcointalk.org/index.php?topic=2967381.0,,2364,Announcements (Altcoins),2018-03-17 00:57:52,Baappay,Newbie,96,0,,[ANN][ICO] BAAPPAY - The Evolution of the Payment Platform is Here,"This is our commercial video, however, next week we should release a demo with all the features and actually credit card-crypto functionalities  on our smart terminal  https://i.imgur.com/bF8R9bX.jpg  https://youtu.be/DtUOlHVLUb4",False
173,msg32486218,https://bitcointalk.org/index.php?topic=2967381.0,,2364,Announcements (Altcoins),2018-03-17 01:39:02,davidwu1212,Newbie,69,0,,[ANN][ICO] BAAPPAY - The Evolution of the Payment Platform is Here,"This looks like a really promising project. I just saw the video and loved the whole concept. This is what they crypto community needs, adoption by the masses!",False
174,msg31642217,https://bitcointalk.org/index.php?topic=2967381.0,,2364,Announcements (Altcoins),2018-03-05 16:31:03,Riley678,Newbie,79,0,,[ANN][ICO] BAAPPAY - The Evolution of the Payment Platform is Here,What type of features can we expect in the POS,False
175,msg31657249,https://bitcointalk.org/index.php?topic=2967381.0,msg31642217,2364,Announcements (Altcoins),2018-03-05 20:28:23,Baappay,Newbie,96,0,,[ANN][ICO] BAAPPAY - The Evolution of the Payment Platform is Here,"    -Payment methods are  Cryptocurrency, Credit Card, debit, Cash, Check, edit and add your own  -Cryptocurrency log of all sales, as well as, spot rate sold at  -Languages will include: English, Arabic, French, German, Indonesian, Italian, Spanish, Spanish, Vietnamese,  -Both fiat and cryptocurrency, your able to have whole or partial inventory counts. You can also set Inventory alerts and warnings.  -The point of sale software will have multi-locations-, where you can have more than one location.  -we given the option to integrated mailchimp, thus you can email your existing customers. -we will have 30 plus detailed reports  -create promotions attributes, ie, 20% off over $50 spent, etc  -Create barcode labels for your products  - Track your employee's sign in and sign out , with an integrated time clock feature and they will see them when they log in.  -Set up commissions for each employee.  -Customer Rewards Program  -Store Accounts feature where you can give your customers/suppliers a line of credit.  -employees can send messages internally and owners can send messages and announcements to all of your employees",False
176,msg31666745,https://bitcointalk.org/index.php?topic=2967381.0,,2364,Announcements (Altcoins),2018-03-06 00:03:21,Harvey1960,Newbie,54,0,,[ANN][ICO] BAAPPAY - The Evolution of the Payment Platform is Here,Do you plan to have a livestream on youtube or social channel . Maybe your CEO will have a livestream to answer all the questions ?,False
177,msg31667013,https://bitcointalk.org/index.php?topic=2967381.0,msg31666745,2364,Announcements (Altcoins),2018-03-06 00:13:33,Baappay,Newbie,96,0,,[ANN][ICO] BAAPPAY - The Evolution of the Payment Platform is Here,"    Once we release the demo and device, we could set up something like that",False
178,msg31705010,https://bitcointalk.org/index.php?topic=2967381.0,msg31667013,2364,Announcements (Altcoins),2018-03-06 13:38:58,Lareina,Full Member,434,100,,[ANN][ICO] BAAPPAY - The Evolution of the Payment Platform is Here,"  If I remember correctly, does the development of this project seem to require a similar payment license?",False
179,msg31712622,https://bitcointalk.org/index.php?topic=2967381.0,msg31705010,2364,Announcements (Altcoins),2018-03-06 15:20:25,Baappay,Newbie,96,0,,[ANN][ICO] BAAPPAY - The Evolution of the Payment Platform is Here,"   Yes your are correct, however, payment licenses would be related to how we release our platform. For example, if we were to release just the Point of sale software, would have different requirements. Thus, within a month or two of completion, we would be able to integrate payment for both fiat and crypto, via third party. Our liquidity pool etc, would not be applicable at this time. At this time, we might offer an option of Bitcoin convert to Eur (only these currencies) to your bank account, however, if this were to be implemented, transactions would be not instantaneously. You would need to wait for full confirmations. (this function would be apart of our full platform).  For the devices, although they may have the capability of receiving and transmitting payment (which you will be able to see in the demo), however, without proper certifications and meeting standard requirements, we will not be able to obtain payment licensing. (North American has stricter standards than other countries)  This why we have stated in our road map, that device integration will be released in Q3.  More specifically we expect it to be 5-6 months, as payment processor / Acquirer would than need to verify the certifications and standards of the devices and receiving/transmitting capabilities.  As for our full complete platform payment gateway, again, will need to proper certifications and meet standard requirements to obtain any type of payment license. Thus, as stated before, payment licensing will be required as correlated to what is being released.  ",False
180,msg31738747,https://bitcointalk.org/index.php?topic=2967381.0,,2364,Announcements (Altcoins),2018-03-06 22:26:26,Hsingh,Newbie,47,0,,[ANN][ICO] BAAPPAY - The Evolution of the Payment Platform is Here,"Hi Folks,  Earn ""5 STAKES"" more for each below mentioned activity on TELEGRAM:  Link to join Telegram https://t.me/joinchat/HMAe-RLEmYZMuCS8dfIGWA  1.  Add ""BAAPPAY"" logo as your profile picture 2.  Write ""BaapPay - ICO"" in your Profile Name  Below is the link to download ""BAAPPAY"" Logo.  https://imgur.com/oBA0v8C  In case of any queries, please let me know.",False
181,msg31759278,https://bitcointalk.org/index.php?topic=2967381.0,,2364,Announcements (Altcoins),2018-03-07 07:55:30,Blakekeke10,Newbie,51,0,,[ANN][ICO] BAAPPAY - The Evolution of the Payment Platform is Here,Keep up good work guys! bought presale wainting for 10x  ,False
182,msg31780986,https://bitcointalk.org/index.php?topic=2967381.0,,2364,Announcements (Altcoins),2018-03-07 13:48:41,Dylan365,Newbie,76,0,,[ANN][ICO] BAAPPAY - The Evolution of the Payment Platform is Here,"hey guys, I think everyone should be aware. Investing your money in digital assets or earning them require you to read and learn a lot about wallets and crypto world. by a lot, i mean “a lot”. This really understand this token, it needs to be studied carefully as well, from their technical background, to their strategies, to their team dev. I think this is a really interesting project, Good luck team!",False
183,msg31853538,https://bitcointalk.org/index.php?topic=2967381.0,,2364,Announcements (Altcoins),2018-03-08 14:06:45,Adam.678,Newbie,44,0,,[ANN][ICO] BAAPPAY - The Evolution of the Payment Platform is Here,ETH is cheap right now . I think I'll join this project,False
