id,msg_id,parent_id,link_id,Count_read,Forum,Time,Author,Rank,Activity,Merit,Trust,Title,Body,ScamHeader
52,msg35359257,https://bitcointalk.org/index.php?topic=2967381.0,,2364,Announcements (Altcoins),2018-04-23 03:06:34,duncaneastlance,Newbie,292,0,,[ANN][ICO] BAAPPAY - The Evolution of the Payment Platform is Here,dev the week #5 on bounty is from 4-22-2018/4-29-2018 what should we do on 4-30-2018 just include on week number 5 ha make udjustment make it 4-22-2018 until 4-30-2018 ha?,False
53,msg35397910,https://bitcointalk.org/index.php?topic=2967381.0,msg35359257,2364,Announcements (Altcoins),2018-04-23 14:51:43,Hsingh,Newbie,47,0,,[ANN][ICO] BAAPPAY - The Evolution of the Payment Platform is Here,"   Hi, Please contact on below link for bounty program related queries.  https://bitcointalk.org/index.php?topic=3141616.680",False
54,msg33990340,https://bitcointalk.org/index.php?topic=2967381.0,msg33943720,2364,Announcements (Altcoins),2018-04-05 11:47:07,William1978,Newbie,76,0,,[ANN][ICO] BAAPPAY - The Evolution of the Payment Platform is Here,"     Cant wait for the list to be released, good luck for the team!",False
55,msg33995727,https://bitcointalk.org/index.php?topic=2967381.0,,2364,Announcements (Altcoins),2018-04-05 13:05:45,James1977,Newbie,74,0,,[ANN][ICO] BAAPPAY - The Evolution of the Payment Platform is Here,"I am already in a telegram group, Very excited to join this project, it seems the project is really managed by competent smart people. Success and always fight Team !",False
56,msg34005196,https://bitcointalk.org/index.php?topic=2967381.0,,2364,Announcements (Altcoins),2018-04-05 15:09:11,thomas1980,Newbie,44,0,,[ANN][ICO] BAAPPAY - The Evolution of the Payment Platform is Here,This project team has a really good vision on how to continue the work in the future. Looking forward for the project! .This is going to be just another amazing and successful ICO.,False
57,msg34010800,https://bitcointalk.org/index.php?topic=2967381.0,msg33905531,2364,Announcements (Altcoins),2018-04-05 16:22:56,Hsingh,Newbie,47,0,,[ANN][ICO] BAAPPAY - The Evolution of the Payment Platform is Here,"   Hi, Please contact on below link for registering under bounty program.  https://bitcointalk.org/index.php?topic=3141616.680",False
58,msg34039354,https://bitcointalk.org/index.php?topic=2967381.0,,2364,Announcements (Altcoins),2018-04-06 02:31:08,duncaneastlance,Newbie,292,0,,[ANN][ICO] BAAPPAY - The Evolution of the Payment Platform is Here,dev youre still not giving me the right code for a junior member,False
59,msg34039571,https://bitcointalk.org/index.php?topic=2967381.0,msg34039354,2364,Announcements (Altcoins),2018-04-06 02:37:56,pusaka,Hero Member,641,500,,[ANN][ICO] BAAPPAY - The Evolution of the Payment Platform is Here,"   Jr. Member is not allowed to participate.  Please talking about of the program bounty of this thread https://bitcointalk.org/index.php?topic=3141616.0  Quote from: Baappay on April 04, 2018, 06:42:32 PM Congrats to the community as Baappay will be listed on ForkDelta exchange within the next few days  Why forkdelta? Idex is better than forkdelta. and when you will be listed on the big exchanges?",False
60,msg34073882,https://bitcointalk.org/index.php?topic=2967381.0,msg34039571,2364,Announcements (Altcoins),2018-04-06 12:45:25,Baappay,Newbie,96,0,,[ANN][ICO] BAAPPAY - The Evolution of the Payment Platform is Here,"    We are accepting jr member, as I have a signature below. Also, for exchanges, we will have some exciting news, within the next month or so, that will really boost the value of the coin.",False
61,msg34088604,https://bitcointalk.org/index.php?topic=2967381.0,,2364,Announcements (Altcoins),2018-04-06 15:53:26,Hsingh,Newbie,47,0,,[ANN][ICO] BAAPPAY - The Evolution of the Payment Platform is Here,"Hi Folks,  Checkout about Baappay Smart Terminal through this video.  BaapPay will revolutionize the way merchants do business, welcome to the future!!!  https://www.youtube.com/watch?v=VMDfYC1q02s&t=6s",False
62,msg34118579,https://bitcointalk.org/index.php?topic=2967381.0,msg34073882,2364,Announcements (Altcoins),2018-04-07 01:59:39,duncaneastlance,Newbie,292,0,,[ANN][ICO] BAAPPAY - The Evolution of the Payment Platform is Here,   thank you so much dev i recieve a msg containing the right code for junior member and his saying special thanks to me for bringing this issue up maybe it would be much better if you give me merit dev even just for only one lol joke haha just joking dev uhm am i right now on my code on signature campaign what is your comment dev thank you so much im so excited on your next good news about baappay the more good news the more exciting for us to promote the new way of payment using POS #BAAPPAY hihi,False
63,msg34120392,https://bitcointalk.org/index.php?topic=2967381.0,,2364,Announcements (Altcoins),2018-04-07 03:01:59,danie161,Newbie,82,0,,[ANN][ICO] BAAPPAY - The Evolution of the Payment Platform is Here,"The project team is constantly working to ensure that this project deserves the attention of people from all over the world, this is one of the most promising projects this year.",False
64,msg34120986,https://bitcointalk.org/index.php?topic=2967381.0,,2364,Announcements (Altcoins),2018-04-07 03:21:00,Kyera,Newbie,126,0,,[ANN][ICO] BAAPPAY - The Evolution of the Payment Platform is Here,"Great Project, great potential. Good luck to everyone who supports!",False
65,msg34132063,https://bitcointalk.org/index.php?topic=2967381.0,,2364,Announcements (Altcoins),2018-04-07 07:51:19,MtheS,Jr. Member,161,1,,[ANN][ICO] BAAPPAY - The Evolution of the Payment Platform is Here,BAAPPAY has any AirDrop or Bounty Campaign bro ? I want to promote this project .,False
66,msg34141078,https://bitcointalk.org/index.php?topic=2967381.0,,2364,Announcements (Altcoins),2018-04-07 10:34:14,sudhakark,Member,238,10,,[ANN][ICO] BAAPPAY - The Evolution of the Payment Platform is Here,"BaapPay involves many layers that absorb many features like credit card payments designed for online, software that records the sales and also helps in creating our own BaapWorld app store. BaapPay gives trust to users where cryptocurrency supports for a long time and helps in increasing profits in business and that help out to live consumers in an easy way, cryptocurrency becomes an important point in the future where people can buy, sell and trade in cryptocurrencies. The BaapPay main aim is to secure the license that helps them to work with other countries and also helps them to hold all the other activities of each country. BaapPay helps users to purchase products online through credit or debit cards or cryptocurrencies. Thus, vendors have a right to exchange cryptocurrency into fiat or can use the same cryptocurrency without exchange.  BaapPay brings all together where credit, debit cards, crypto currencies and bank accounts can place in one place. Traders can add the BaapPay purchase or adds them to websites and blogs within minutes.",False
67,msg34233160,https://bitcointalk.org/index.php?topic=2967381.0,,2364,Announcements (Altcoins),2018-04-08 16:18:51,evalovebanana,Newbie,48,0,,[ANN][ICO] BAAPPAY - The Evolution of the Payment Platform is Here,can I join?,False
68,msg34254489,https://bitcointalk.org/index.php?topic=2967381.0,msg34233160,2364,Announcements (Altcoins),2018-04-08 21:30:13,Baappay,Newbie,96,0,,[ANN][ICO] BAAPPAY - The Evolution of the Payment Platform is Here,    Yes you can join the bounty program https://bitcointalk.org/index.php?topic=3141616.msg32481900#msg32481900,False
69,msg34261080,https://bitcointalk.org/index.php?topic=2967381.0,,2364,Announcements (Altcoins),2018-04-09 00:53:24,duncaneastlance,Newbie,292,0,,[ANN][ICO] BAAPPAY - The Evolution of the Payment Platform is Here,dev can we retweet all your past tweet that we didnt tweeted because we just started on march 30 also in facebook i wondering if we can share all before post also,False
70,msg34272788,https://bitcointalk.org/index.php?topic=2967381.0,,2364,Announcements (Altcoins),2018-04-09 06:40:01,LoveStory,Member,406,10,,[ANN][ICO] BAAPPAY - The Evolution of the Payment Platform is Here,interesting and appropriate projects to flourish and this project provides many advantages for all success always this project for its future.,False
71,msg34274305,https://bitcointalk.org/index.php?topic=2967381.0,,2364,Announcements (Altcoins),2018-04-09 07:11:19,Freddie197,Newbie,92,0,,[ANN][ICO] BAAPPAY - The Evolution of the Payment Platform is Here," I think you may know about this already. #BaapPay smart terminal is an Android-based 5.5-inch capacitive touchscreen with features like GPS, Bluetooth, barcode scanner, built-in speaker, microphone, thermal printer, and wifi-4G capabilities. This device accepts NFC, chip, swipe payment and is EMV & PCI certified.",False
72,msg34289320,https://bitcointalk.org/index.php?topic=2967381.0,,2364,Announcements (Altcoins),2018-04-09 11:20:08,Ethan112,Newbie,78,0,,[ANN][ICO] BAAPPAY - The Evolution of the Payment Platform is Here,"BaapPay is a multi-layered platform that integrates both fiat and cryptocurrency payment services for merchants, that will confirm and guarantee all payments in seconds.",False
73,msg34306036,https://bitcointalk.org/index.php?topic=2967381.0,msg34261080,2364,Announcements (Altcoins),2018-04-09 15:17:51,Hsingh,Newbie,47,0,,[ANN][ICO] BAAPPAY - The Evolution of the Payment Platform is Here,"   Hi, Please contact on below link for bounty program related queries.  https://bitcointalk.org/index.php?topic=3141616.680",False
74,msg33689049,https://bitcointalk.org/index.php?topic=2967381.0,msg33643524,2364,Announcements (Altcoins),2018-04-01 15:38:18,Baappay,Newbie,96,0,,[ANN][ICO] BAAPPAY - The Evolution of the Payment Platform is Here,"    Yes, our office is in Mississauga Ontario,  Canada and our company is registered in Canada",False
75,msg33689086,https://bitcointalk.org/index.php?topic=2967381.0,msg33646849,2364,Announcements (Altcoins),2018-04-01 15:38:45,Baappay,Newbie,96,0,,[ANN][ICO] BAAPPAY - The Evolution of the Payment Platform is Here,   thanks Filipe!,False
76,msg33699873,https://bitcointalk.org/index.php?topic=2967381.0,msg33668049,2364,Announcements (Altcoins),2018-04-01 17:51:41,Baappay,Newbie,96,0,,[ANN][ICO] BAAPPAY - The Evolution of the Payment Platform is Here,    The clip you saw on facebook was just a sneak peek. We should be doing other demos of all the features. We uploaded the video on youtube now  https://youtu.be/WovU3UF8_Uw,False
77,msg33723268,https://bitcointalk.org/index.php?topic=2967381.0,msg33699873,2364,Announcements (Altcoins),2018-04-02 01:58:26,Daniel355,Newbie,76,0,,[ANN][ICO] BAAPPAY - The Evolution of the Payment Platform is Here,   Thank you for a more detailed demonstration. I'll consider this video as the answer to my previous comment.,False
78,msg33747127,https://bitcointalk.org/index.php?topic=2967381.0,,2364,Announcements (Altcoins),2018-04-02 10:30:50,Max79,Newbie,81,0,,[ANN][ICO] BAAPPAY - The Evolution of the Payment Platform is Here,"Sellers can add a #BaapPay purchase/order button on their websites, and blogs within minutes. so good.",False
79,msg33781778,https://bitcointalk.org/index.php?topic=2967381.0,msg33747127,2364,Announcements (Altcoins),2018-04-02 18:07:55,Baappay,Newbie,96,0,,[ANN][ICO] BAAPPAY - The Evolution of the Payment Platform is Here,"   Yes, however, we expect to release that feature later on this year.",False
80,msg33801209,https://bitcointalk.org/index.php?topic=2967381.0,,2364,Announcements (Altcoins),2018-04-03 01:00:30,duncaneastlance,Newbie,292,0,,[ANN][ICO] BAAPPAY - The Evolution of the Payment Platform is Here,dev in the bounty do we really need to tweet everyday about baappay or two tweet in a week is enough just retweet everyday?,False
81,msg33801301,https://bitcointalk.org/index.php?topic=2967381.0,msg33631288,2364,Announcements (Altcoins),2018-04-03 01:04:50,duncaneastlance,Newbie,292,0,,[ANN][ICO] BAAPPAY - The Evolution of the Payment Platform is Here,   yeah exactly this is my exact question i see theres a option that a junior member can join the signature campaign but the start code there is just for a MEMBER it doesnt start with JR MEMBER. thats why im confused am right in my code because i just copy this code to someone jr also in his campaigning baappay signature also if im wrong can you provide me dev the right code if its okay,False
82,msg33806295,https://bitcointalk.org/index.php?topic=2967381.0,,2364,Announcements (Altcoins),2018-04-03 03:49:23,Teddy1968,Newbie,75,0,,[ANN][ICO] BAAPPAY - The Evolution of the Payment Platform is Here,Already joined and recommend that others do it. The project deserves our attention and support!,False
83,msg33815084,https://bitcointalk.org/index.php?topic=2967381.0,,2364,Announcements (Altcoins),2018-04-03 07:13:56,David454545,Member,71,20,,[ANN][ICO] BAAPPAY - The Evolution of the Payment Platform is Here,"The prospects for the development of a more sophisticated cryptocurrency market remain significant, despite the fact the number of cryptocurrency payments is still negligible.",False
84,msg33849671,https://bitcointalk.org/index.php?topic=2967381.0,msg33806295,2364,Announcements (Altcoins),2018-04-03 15:38:36,Hsingh,Newbie,47,0,,[ANN][ICO] BAAPPAY - The Evolution of the Payment Platform is Here,   Thanks for supporting us. Stay tuned with us for more updates.,False
85,msg33855275,https://bitcointalk.org/index.php?topic=2967381.0,,2364,Announcements (Altcoins),2018-04-03 16:46:02,annajewel100,Newbie,90,0,,[ANN][ICO] BAAPPAY - The Evolution of the Payment Platform is Here,"I really like the workings of this project, pretty stunning and like a good idea to join, hopefully run well",False
86,msg33887102,https://bitcointalk.org/index.php?topic=2967381.0,,2364,Announcements (Altcoins),2018-04-04 03:27:12,Masteriano4423,Newbie,152,0,,[ANN][ICO] BAAPPAY - The Evolution of the Payment Platform is Here,"A project for merchants,consumers and developers.Point of sale software is in demand in market as cryptocurrency market is very lucrative but same time much volatile",False
87,msg33893957,https://bitcointalk.org/index.php?topic=2967381.0,,2364,Announcements (Altcoins),2018-04-04 06:20:00,Basterian7789,Newbie,103,0,,[ANN][ICO] BAAPPAY - The Evolution of the Payment Platform is Here,"I think that your project has a great future, due to the fact that your team has a clear strategy of how to develop in future. Worthy project!",False
88,msg33905088,https://bitcointalk.org/index.php?topic=2967381.0,,2364,Announcements (Altcoins),2018-04-04 09:26:14,willliamjames,Newbie,88,0,,[ANN][ICO] BAAPPAY - The Evolution of the Payment Platform is Here,digital way to make popular ur coin..well idea,False
89,msg33905531,https://bitcointalk.org/index.php?topic=2967381.0,,2364,Announcements (Altcoins),2018-04-04 09:34:00,sadness4me,Newbie,140,0,,[ANN][ICO] BAAPPAY - The Evolution of the Payment Platform is Here,Reserve Vietnamese Translate Bounty  Please contact me phanthekhuongts@gmail.com,False
90,msg33912588,https://bitcointalk.org/index.php?topic=2967381.0,,2364,Announcements (Altcoins),2018-04-04 11:32:43,Oscar1979,Newbie,92,0,,[ANN][ICO] BAAPPAY - The Evolution of the Payment Platform is Here,"Very serious idea. It is a pity that at present, various structures are trying to shield themselves from the achievements of progress and are in no hurry to introduce blockchain technology and recognize cryptocurrency as a means of payment. Although there are many positive examples of the type of Telegram. So I think your project is very ambitious. I'll keep an eye on your height",False
91,msg33943720,https://bitcointalk.org/index.php?topic=2967381.0,,2364,Announcements (Altcoins),2018-04-04 18:42:32,Baappay,Newbie,96,0,,[ANN][ICO] BAAPPAY - The Evolution of the Payment Platform is Here,Congrats to the community as Baappay will be listed on ForkDelta exchange within the next few days,False
92,msg33964851,https://bitcointalk.org/index.php?topic=2967381.0,,2364,Announcements (Altcoins),2018-04-05 03:57:39,Oscar1979,Newbie,92,0,,[ANN][ICO] BAAPPAY - The Evolution of the Payment Platform is Here,Seeing that you guys to be listed on the first exchange . Fork Delta . Congrats . Great moves !,False
93,msg33973089,https://bitcointalk.org/index.php?topic=2967381.0,msg33912588,2364,Announcements (Altcoins),2018-04-05 07:18:45,critolika,Full Member,448,100,,[ANN][ICO] BAAPPAY - The Evolution of the Payment Platform is Here,  a very interesting project and many advantages hopefully many will be interested in this project so that this project will grow successfully.,False
94,msg33489039,https://bitcointalk.org/index.php?topic=2967381.0,,2364,Announcements (Altcoins),2018-03-30 02:42:25,Edward1977,Newbie,74,0,,[ANN][ICO] BAAPPAY - The Evolution of the Payment Platform is Here,I would like to see your detail roadmap . I want to see in detail each section what you will do,False
95,msg33500330,https://bitcointalk.org/index.php?topic=2967381.0,,2364,Announcements (Altcoins),2018-03-30 07:16:06,Alexander195,Newbie,46,0,,[ANN][ICO] BAAPPAY - The Evolution of the Payment Platform is Here,Do you have bounty translation whitepaper in Iran ? I would like to join,False
96,msg33530379,https://bitcointalk.org/index.php?topic=2967381.0,,2364,Announcements (Altcoins),2018-03-30 14:52:44,Intaryna,Newbie,343,0,,[ANN][ICO] BAAPPAY - The Evolution of the Payment Platform is Here,best project so far this year check  out their ranking https://icoranker.com/ico/baappay/,False
97,msg33541868,https://bitcointalk.org/index.php?topic=2967381.0,,2364,Announcements (Altcoins),2018-03-30 17:30:06,Freddie197,Newbie,92,0,,[ANN][ICO] BAAPPAY - The Evolution of the Payment Platform is Here,I have been watching your project for 1 months . Have you got any partners in development POS app yet ?,False
98,msg33553494,https://bitcointalk.org/index.php?topic=2967381.0,msg33489039,2364,Announcements (Altcoins),2018-03-30 20:35:29,Baappay,Newbie,96,0,,[ANN][ICO] BAAPPAY - The Evolution of the Payment Platform is Here,   You can have a look at our road map https://baappaytoken.com/#roadmap,False
99,msg33553640,https://bitcointalk.org/index.php?topic=2967381.0,msg33500330,2364,Announcements (Altcoins),2018-03-30 20:37:58,Baappay,Newbie,96,0,,[ANN][ICO] BAAPPAY - The Evolution of the Payment Platform is Here,"   hello, you can visit the bounty thread and contact the bounty manager, https://bitcointalk.org/index.php?topic=3141616.msg32481900#msg32481900",False
100,msg33554351,https://bitcointalk.org/index.php?topic=2967381.0,msg33541868,2364,Announcements (Altcoins),2018-03-30 20:50:08,Baappay,Newbie,96,0,,[ANN][ICO] BAAPPAY - The Evolution of the Payment Platform is Here,"    Cartly is one of the companies that we are working with and we have been approached by several developers and companies. However, before we release our sdk for the integration, we want to release our devices and POS,  to iron out any possible problems.",False
101,msg33566223,https://bitcointalk.org/index.php?topic=2967381.0,,2364,Announcements (Altcoins),2018-03-31 02:47:43,Ellis1234,Newbie,41,0,,[ANN][ICO] BAAPPAY - The Evolution of the Payment Platform is Here,Hey I see you have a real products. BUt I have researched your project on some social channels . I see nothing . I think this is the time you guys should focus on marketing .,False
102,msg33566467,https://bitcointalk.org/index.php?topic=2967381.0,,2364,Announcements (Altcoins),2018-03-31 02:55:41,duncaneastlance,Newbie,292,0,,[ANN][ICO] BAAPPAY - The Evolution of the Payment Platform is Here,seems good on joining in your bounty program,False
103,msg33568599,https://bitcointalk.org/index.php?topic=2967381.0,msg33566223,2364,Announcements (Altcoins),2018-03-31 04:05:44,Miiike,Legendary,1414,1042,,[ANN][ICO] BAAPPAY - The Evolution of the Payment Platform is Here,"   If you look at the post above and below you, you'll see that they have a bounty project, which covers the social channels too. So yeah, they actually are focusing on marketing too.",False
104,msg33570276,https://bitcointalk.org/index.php?topic=2967381.0,,2364,Announcements (Altcoins),2018-03-31 04:55:23,duncaneastlance,Newbie,292,0,,[ANN][ICO] BAAPPAY - The Evolution of the Payment Platform is Here,hi dev i just want to ask if im right on my bounty signature is this the right code because i cant see the code for jr member on bounty thread,False
105,msg33579084,https://bitcointalk.org/index.php?topic=2967381.0,,2364,Announcements (Altcoins),2018-03-31 08:09:41,Romanlevi6886,Newbie,36,0,,[ANN][ICO] BAAPPAY - The Evolution of the Payment Platform is Here,I recommend everyone to participate. A large-scale project with a team of professionals.,False
106,msg33581980,https://bitcointalk.org/index.php?topic=2967381.0,msg33579084,2364,Announcements (Altcoins),2018-03-31 08:57:24,qory,Hero Member,1050,500,,[ANN][ICO] BAAPPAY - The Evolution of the Payment Platform is Here,"  there may be regret if not knowing or even doubting it most people can participate in support, they certainly need it and this becomes the advantage of both",False
107,msg33624510,https://bitcointalk.org/index.php?topic=2967381.0,msg33566223,2364,Announcements (Altcoins),2018-03-31 19:25:31,Baappay,Newbie,96,0,,[ANN][ICO] BAAPPAY - The Evolution of the Payment Platform is Here,   this is our bounty program https://bitcointalk.org/index.php?topic=3141616.500,False
108,msg33626196,https://bitcointalk.org/index.php?topic=2967381.0,msg33570276,2364,Announcements (Altcoins),2018-03-31 19:53:02,Baappay,Newbie,96,0,,[ANN][ICO] BAAPPAY - The Evolution of the Payment Platform is Here,"    i think you may cut copied the wrong code, go to https://bitcointalk.org/index.php?topic=3141616.0 and copy past member code. If it still doesnt work, plz msg us",False
109,msg33631288,https://bitcointalk.org/index.php?topic=2967381.0,msg33626196,2364,Announcements (Altcoins),2018-03-31 21:34:02,Miiike,Legendary,1414,1042,,[ANN][ICO] BAAPPAY - The Evolution of the Payment Platform is Here,"   He's a junior rank, and your signature thread doesn't have a bbcode for junior rank, although you allow that rank to join. That's the problem he asked, you need to provide a code for Jr member",False
110,msg33643524,https://bitcointalk.org/index.php?topic=2967381.0,,2364,Announcements (Altcoins),2018-04-01 04:08:00,Samuel185,Newbie,90,0,,[ANN][ICO] BAAPPAY - The Evolution of the Payment Platform is Here,Where is your main office ? Do you have your company registered license ?,False
111,msg33646849,https://bitcointalk.org/index.php?topic=2967381.0,,2364,Announcements (Altcoins),2018-04-01 05:38:13,FilipeHenriques,Member,494,12,,[ANN][ICO] BAAPPAY - The Evolution of the Payment Platform is Here,Portuguese people. If you want a full read on the project please follow the Portuguese ANN Thread (Whitepaper included)   ANN THREAD [PT] WHITEPAPER [PT],False
112,msg33648778,https://bitcointalk.org/index.php?topic=2967381.0,msg33465993,2364,Announcements (Altcoins),2018-04-01 06:21:56,Augustyusuf,Jr. Member,532,1,,[ANN][ICO] BAAPPAY - The Evolution of the Payment Platform is Here, ,False
113,msg33668049,https://bitcointalk.org/index.php?topic=2967381.0,,2364,Announcements (Altcoins),2018-04-01 11:20:59,Daniel355,Newbie,76,0,,[ANN][ICO] BAAPPAY - The Evolution of the Payment Platform is Here," It looks very cool when watching your video but it looks like you are hooking a mobile phone into the case, and on the screen is an application. Show everyone nearer in more detail what is happening on the screen to dispel my assumption.",False
114,msg32966605,https://bitcointalk.org/index.php?topic=2967381.0,,2364,Announcements (Altcoins),2018-03-23 09:30:43,bayibufo,Copper Member,86,0,,[ANN][ICO] BAAPPAY - The Evolution of the Payment Platform is Here,"In demo it shows you can accept cryptocurrency but  if someone wants to convert to fiat then and there at the transaction time, Is that possible?",False
115,msg32973476,https://bitcointalk.org/index.php?topic=2967381.0,,2364,Announcements (Altcoins),2018-03-23 11:19:14,Dino Platform,Newbie,90,0,,[ANN][ICO] BAAPPAY - The Evolution of the Payment Platform is Here,I guess it will help to address different payment difficulties,False
116,msg32989300,https://bitcointalk.org/index.php?topic=2967381.0,,2364,Announcements (Altcoins),2018-03-23 15:03:32,Pecoraros,Newbie,62,0,,[ANN][ICO] BAAPPAY - The Evolution of the Payment Platform is Here,Baappay demo POS doesn't shows Russian language? Will you be catering to Russians?,False
117,msg33011009,https://bitcointalk.org/index.php?topic=2967381.0,,2364,Announcements (Altcoins),2018-03-23 20:21:50,duyetbng,Jr. Member,107,2,,[ANN][ICO] BAAPPAY - The Evolution of the Payment Platform is Here,When developers will be getting Sdk`s to integrate?,False
118,msg33011650,https://bitcointalk.org/index.php?topic=2967381.0,msg32966605,2364,Announcements (Altcoins),2018-03-23 20:33:23,Baappay,Newbie,96,0,,[ANN][ICO] BAAPPAY - The Evolution of the Payment Platform is Here,"   The product that we are releasing in 4-5 months will only have the fiat payment gateway, cryptocurrency gateway,(both will have the online ecom gateway too) devices and Point of sale software . However, the Paypal like interface,  liquidity pool, app store, wallets and crypto to fiat will be release accordingly to our road map.",False
119,msg33016548,https://bitcointalk.org/index.php?topic=2967381.0,msg32989300,2364,Announcements (Altcoins),2018-03-23 22:12:16,Baappay,Newbie,96,0,,[ANN][ICO] BAAPPAY - The Evolution of the Payment Platform is Here,"   No, maybe in future",False
120,msg33016573,https://bitcointalk.org/index.php?topic=2967381.0,msg33011009,2364,Announcements (Altcoins),2018-03-23 22:12:57,Baappay,Newbie,96,0,,[ANN][ICO] BAAPPAY - The Evolution of the Payment Platform is Here,"    That will be in our later development phases, integrating with our Appstore",False
