id,msg_id,parent_id,link_id,Count_read,Forum,Time,Author,Rank,Activity,Merit,Trust,Title,Body,ScamHeader
195,msg41401826,https://bitcointalk.org/index.php?topic=3372186.0,,7615,Announcements (Altcoins),2018-07-03 05:59:10,chunt,Newbie,183,0,,📢 [ANN]Black Insurance digital insurance company on the blockchain,"The future is bright with Black Insurance, thanks for your support Drwoo!    ===  ""Innovation takes place on an international level"". Take a closer look on 5 insurtech battles:     http://www.digitalinsuranceagenda.com/191/the-five-insurtech-battles/  To learn more about Black: http://www.black.insure/  Black Insurance Introduction Video: https://www.youtube.com/watch?v=xf8VKYGEB3w",False
196,msg41402447,https://bitcointalk.org/index.php?topic=3372186.0,,7615,Announcements (Altcoins),2018-07-03 06:13:51,Somz1,Full Member,420,102,,📢 [ANN]Black Insurance digital insurance company on the blockchain,"How would you work with local banks and other sectors of a country to allow a person with you're tokens to claim insurance? Regardless of anything else the local sectors will need cash to transfer or be transferred, so how does it work?",False
197,msg41438184,https://bitcointalk.org/index.php?topic=3372186.0,msg41402447,7615,Announcements (Altcoins),2018-07-03 15:21:47,gxmonitor,Newbie,205,0,,📢 [ANN]Black Insurance digital insurance company on the blockchain,"   The brokers that operate on the black platform, are transacting in fiat currencies with their customers. There are three reasons for that 1) insured assets are valued in fiat, so insurance must also be transacted in fiat. If ETH goes down 30%, your car repairs would still cost the same, thus if you want your insurance compensation in fiat, the premiums must be nominated in fiat as well. 2) cryptos are still not widely adopted. Many people can't buy insurance if they can only pay in crypto; since we aim to become very big, we need to include everyone. 3) Regulation around charging premiums in cryptos is tricky at this point. Once the premium is received by the broker, the broker converts it into BLCK tokens and so on.",False
198,msg41438302,https://bitcointalk.org/index.php?topic=3372186.0,msg41402716,7615,Announcements (Altcoins),2018-07-03 15:23:23,gxmonitor,Newbie,205,0,,📢 [ANN]Black Insurance digital insurance company on the blockchain,"   We really appreciate your views, please keep supporting our project.",False
199,msg40658816,https://bitcointalk.org/index.php?topic=3372186.0,,7615,Announcements (Altcoins),2018-06-22 12:13:14,gxmonitor,Newbie,205,0,,📢 [ANN]Black Insurance digital insurance company on the blockchain,"The insurance industry is one of the few examples, in which the blockchain can produce a significant impact. In the insurance business, it is clear that traditional insurers are a centralized source of delays and inefficiencies. Blockchain technology allows replacing these insurers with efficient automated processes, reducing administrative overhead and time to market.  https://medium.com/@jilliangodsil/blockchain-based-insurance-disrupting-an-industry-372171266e55",False
200,msg40773290,https://bitcointalk.org/index.php?topic=3372186.0,,7615,Announcements (Altcoins),2018-06-24 05:51:59,chunt,Newbie,183,0,,📢 [ANN]Black Insurance digital insurance company on the blockchain,"How blockchain technology can save you money on insurance?  ""...Now, new platforms are making insurance simpler, more accessible, and cheaper. Blockchain technology is now being used to remove inefficiency in the insurance industry, ultimately reducing your insurance costs. ""  http://ow.ly/LBYR30kAMNv   To learn more about Black Insurance, please visit http://www.black.insure/  Black Insurance Introduction Video: https://www.youtube.com/watch?v=xf8VKYGEB3w",False
201,msg40788399,https://bitcointalk.org/index.php?topic=3372186.0,,7615,Announcements (Altcoins),2018-06-24 10:06:32,gxmonitor,Newbie,205,0,,📢 [ANN]Black Insurance digital insurance company on the blockchain,"Black Insurance will use two types of tokens:  Black Platform Token (BLCK). All platform users will use BLCK for managing insurance on the Black platform, and demand for BLCK will increase as more insurance business is conducted on the platform.  Black Syndicate Tokens  (BST) which is a security token. BST will be issued when the platform is ready.To learn more about Black:  http://www.black.insure/",False
202,msg40839969,https://bitcointalk.org/index.php?topic=3372186.0,msg40422528,7615,Announcements (Altcoins),2018-06-24 21:53:13,drwoo,Sr. Member,642,250,,📢 [ANN]Black Insurance digital insurance company on the blockchain,    Couldn't it also be an option that any individual can come up with an insurance product and offer it via your platform?,False
203,msg40854459,https://bitcointalk.org/index.php?topic=3372186.0,msg40839969,7615,Announcements (Altcoins),2018-06-25 05:51:44,chunt,Newbie,183,0,,📢 [ANN]Black Insurance digital insurance company on the blockchain,"   Hi Drwoo, due to legal and technical requirements, currently we will offer the platform for Agents, Brokers and MGAs to launch their insurance startup.  We connect the idea to the capital directly, replacing the parties that are not needed in the value chain with  technology.  We  will  do  this  through  crowdfunding,  also  giving  smaller  investors  a  way  in.  This  leaner  model  gives  more  responsibilities  to  insurance  brokers  and  control  over  the  products  they  are selling. Insurers as we know them today are simply a trusted third party - blockchain gives us an alternative to that and the need for insurers disappears.",False
204,msg40872697,https://bitcointalk.org/index.php?topic=3372186.0,,7615,Announcements (Altcoins),2018-06-25 11:39:46,gxmonitor,Newbie,205,0,,📢 [ANN]Black Insurance digital insurance company on the blockchain,"We're proud to announce Alex Norta, Adviser at Black Insurance, will be speaking at BlockchainSummit at Olympia, London (26/27 June).  https://twitter.com/BlockchainHQ/status/1009769409546727424",False
205,msg40922409,https://bitcointalk.org/index.php?topic=3372186.0,,7615,Announcements (Altcoins),2018-06-26 06:09:37,chunt,Newbie,183,0,,📢 [ANN]Black Insurance digital insurance company on the blockchain,"The research claimed that those companies that would benefit most from blockchain include those with the need for (1) transparency in transactions, (2) current dependence legacy storage systems and (3) a high volume of transmitted information. https://techcrunch.com/2018/04/19/do-you-need-a-blockchain/?guccounter=1  To find out more about Black Insurance, please visit https://www.black.insure/  Please check out our introduction video too! https://www.youtube.com/watch?v=xf8VKYGEB3w",False
206,msg40939660,https://bitcointalk.org/index.php?topic=3372186.0,,7615,Announcements (Altcoins),2018-06-26 11:24:14,gxmonitor,Newbie,205,0,,📢 [ANN]Black Insurance digital insurance company on the blockchain,"Permissioned blockchains deployed in insurance consortia yield comprehensive industry benefits across the value chain in three categories: (1) preventing fraud, (2) championing interoperability in multi-party processes and (3) facilitating consumer trust and ease of auditing through data transparency and immutability.  https://insurtechnews.com/insights/insurance-on-the-blockchain",False
207,msg40962779,https://bitcointalk.org/index.php?topic=3372186.0,msg40854459,7615,Announcements (Altcoins),2018-06-26 17:23:25,drwoo,Sr. Member,642,250,,📢 [ANN]Black Insurance digital insurance company on the blockchain,    I understand. I just thought it might be very interesting if individuals could offer insurance for very specific things they personally know or experienced.,False
208,msg40989088,https://bitcointalk.org/index.php?topic=3372186.0,msg40962779,7615,Announcements (Altcoins),2018-06-27 05:36:37,chunt,Newbie,183,0,,📢 [ANN]Black Insurance digital insurance company on the blockchain,"    Hi Drwoo, I agree! Democratising insurance further will only benefit us all   When the legal and technical requirements change, we will be happy to explore these opportunities.  ======  To begin our review of the “Insurance Economy” supported by Black Insurance, we would like to illustrate the high-level, value exchanges that are happening between participants. https://medium.com/blackinsurance/the-black-platform-value-exchange-overview-and-transaction-scenarios-ea850633f469  To find out more about Black Insurance, please visit https://www.black.insure/  Please check out our introduction video too! https://www.youtube.com/watch?v=xf8VKYGEB3w",False
209,msg40990375,https://bitcointalk.org/index.php?topic=3372186.0,,7615,Announcements (Altcoins),2018-06-27 06:10:34,FrankDi,Newbie,28,0,,📢 [ANN]Black Insurance digital insurance company on the blockchain,"Looking forward for more upgrades. Riveting activity, well-advised business.  Good luck fellows!",False
210,msg41003914,https://bitcointalk.org/index.php?topic=3372186.0,msg40990375,7615,Announcements (Altcoins),2018-06-27 10:30:42,gxmonitor,Newbie,205,0,,📢 [ANN]Black Insurance digital insurance company on the blockchain,   We really appreciate your support. Please stay tuned for more updates about our project.,False
211,msg41019945,https://bitcointalk.org/index.php?topic=3372186.0,,7615,Announcements (Altcoins),2018-06-27 15:03:30,Rasta99,Newbie,411,0,,📢 [ANN]Black Insurance digital insurance company on the blockchain,I like this project I have participated in airdrop program in telegram I wait distributed airdrop program,False
212,msg41021338,https://bitcointalk.org/index.php?topic=3372186.0,,7615,Announcements (Altcoins),2018-06-27 15:25:48,copy,Newbie,35,0,,📢 [ANN]Black Insurance digital insurance company on the blockchain,"Hi! What are you called ""Black"" insurance? Black is associated with something unregulated and illegal (Black market)",False
213,msg41057048,https://bitcointalk.org/index.php?topic=3372186.0,msg41019216,7615,Announcements (Altcoins),2018-06-28 05:53:50,chunt,Newbie,183,0,,📢 [ANN]Black Insurance digital insurance company on the blockchain,"   Пpивeт, Eвгeния77, cпacибo зa вaшy пoддepжкy!  Пoжaлyйcтa, нe cтecняйтecь cлeдoвaть зa нaми: Beб-caйт: http://www.black.insure/ Twitter: https://twitter.com/BlackInsure Facebook: https://www.facebook.com/blackinsure/ Teлeгpaммa: https://t.me/BlackInsurance Linkedin: https://www.linkedin.com/company/black-insurance/",False
214,msg41057090,https://bitcointalk.org/index.php?topic=3372186.0,msg41019945,7615,Announcements (Altcoins),2018-06-28 05:54:55,chunt,Newbie,183,0,,📢 [ANN]Black Insurance digital insurance company on the blockchain,"   Hi Rasta,  I believe you mean our bounty program, we do not have airdrop campaign now.   Please refer to our Bounty telegram group for any bounty related questions. Our bounty managers will be happy to help you. https://t.me/BlackInsuranceBountyGroup  This is the Bounty Bitcointalk thread: https://bitcointalk.org/index.php?topic=3379115.0unty info",False
215,msg41057127,https://bitcointalk.org/index.php?topic=3372186.0,msg41020460,7615,Announcements (Altcoins),2018-06-28 05:55:36,chunt,Newbie,183,0,,📢 [ANN]Black Insurance digital insurance company on the blockchain,"   Hi White_Firop, thank you for your support!     Please feel free to follow us: Website: http://www.black.insure/ Twitter: https://twitter.com/BlackInsure Facebook: https://www.facebook.com/blackinsure/ Telegram: https://t.me/BlackInsurance Linkedin: https://www.linkedin.com/company/black-insurance/",False
216,msg41057309,https://bitcointalk.org/index.php?topic=3372186.0,msg41021338,7615,Announcements (Altcoins),2018-06-28 05:59:59,chunt,Newbie,183,0,,📢 [ANN]Black Insurance digital insurance company on the blockchain,"   Hi Copy, great question! Black does not imply illegal, we are totally legal!   Black is a digital insurance company on blockchain. Our platform connects insurance brokers directly with capital enabling them to launch their own virtual insurance companies. Thus removing the trusted third parties (Insurance Companies) from the value chain.  First, Black is a platform where our business users can design insurance covers, get them capitalised, and write policies. Formally, it's Black Insurance that is writing the policies on behalf of the business users, but we don't design, underwrite or sell the insurance products ourselves - that's up to our users.  We have a roadmap for applying for an insurance license just in Europe (EEA), currently. Becoming a licensed insurer is unfortunately a costly and time consuming exercise, but we have great advisors and everything is in place.  This means that in 2019, we and our users are only eligible to write insurance policies in EEA. However, a portion of the future business users (we have a network of dozens insurance brokers and other parties) already have the necessary licenses, and they can start issuing policies in other countries right after the platform is live. Down the road, we intend to apply for licenses at other markets as well, with current plans to start expansion with the US.  To learn more about Black: http://www.black.insure/  Black Insurance Introduction Video: https://www.youtube.com/watch?v=xf8VKYGEB3w",False
217,msg41074863,https://bitcointalk.org/index.php?topic=3372186.0,,7615,Announcements (Altcoins),2018-06-28 11:30:12,gxmonitor,Newbie,205,0,,📢 [ANN]Black Insurance digital insurance company on the blockchain,How Blockchain Will Help Small Businesses Challenge Even the Largest Rivals...  https://www.entrepreneur.com/article/312923,False
218,msg41087564,https://bitcointalk.org/index.php?topic=3372186.0,,7615,Announcements (Altcoins),2018-06-28 14:46:11,jbhjjhiufga122,Newbie,26,0,,📢 [ANN]Black Insurance digital insurance company on the blockchain,I like this project. It seems great but how can I join it?,False
219,msg40211347,https://bitcointalk.org/index.php?topic=3372186.0,,7615,Announcements (Altcoins),2018-06-16 03:59:11,Diemhb1994,Newbie,72,0,,📢 [ANN]Black Insurance digital insurance company on the blockchain,"I see there are many project join into insurance themes, what are the difference between your project and other project? What are your special features that others project didn't have?",False
220,msg40214715,https://bitcointalk.org/index.php?topic=3372186.0,msg40211347,7615,Announcements (Altcoins),2018-06-16 06:05:44,gxmonitor,Newbie,205,0,,📢 [ANN]Black Insurance digital insurance company on the blockchain,"   You are right. There are many projects in insurance sector.  Black will be a licensed insurance company that provides insurance capacity to Agents, Brokers and MGAs enabling them to launch their own virtual insurance companies.  Insurance business will be generated by local MGAs / Brokers / Agents whose responsibility is designing insurance products for a market, pricing and selling the product and organizing claims handling.  Delegating business to local agents makes the Black business model scalable while bringing business decisions closer to end customers.   Black Insurance will use two types of tokens:  Black Platform Token (BLCK). All platform users will use BLCK for managing insurance on the Black platform, and demand for BLCK will increase as more insurance business is conducted on the platform.  Black Syndicate Tokens  (BST) which is a security token. BST will be issued when the platform is ready.",False
221,msg40266260,https://bitcointalk.org/index.php?topic=3372186.0,,7615,Announcements (Altcoins),2018-06-16 23:50:40,godblessyou12,Newbie,140,0,,📢 [ANN]Black Insurance digital insurance company on the blockchain,"Get whitelisted and earn a 25% bonus: Register now and get 25% bonus throughout the pre-sale and ICO. https://www.black.insure/presale/  If you have any query regarding whitelist , we are here to assist you.",False
222,msg40274782,https://bitcointalk.org/index.php?topic=3372186.0,,7615,Announcements (Altcoins),2018-06-17 05:11:30,chunt,Newbie,183,0,,📢 [ANN]Black Insurance digital insurance company on the blockchain,"Why insurance is broken and how Black Insurance can fix it?  If you have missed the video by our CEO, Risto Rossar, please feel free to watch it here: https://www.youtube.com/watch?v=xf8VKYGEB3w  To find out more about Black Insurance:  Website: http://www.black.insure/ Twitter: https://twitter.com/BlackInsure Facebook: https://www.facebook.com/blackinsure/ Telegram: https://t.me/BlackInsurance Linkedin: https://www.linkedin.com/company/black-insurance/ Bitcointalk: https://bitcointalk.org/index.php?topic=3372186.msg35347792#msg35347792 Whitepaper: https://www.black.insure/whitepaper.pdf Lightpaper: https://www.black.insure/lightpaper.pdf",False
223,msg40276603,https://bitcointalk.org/index.php?topic=3372186.0,msg40276376,7615,Announcements (Altcoins),2018-06-17 06:01:18,chunt,Newbie,183,0,,📢 [ANN]Black Insurance digital insurance company on the blockchain,"   Hi Keehl, thank you for your support!  Black connects insurance entrepreneurs with innovative ideas to the capital they seek.  An example:  An insurance startup “CryptInsure” has recognised the need for insuring crypto wallets hosted by third parties. They list their product on the Black platform after it has been approved by the Black experts. A syndicate focus   ing on crypto products recognises the product and decides to invest. CryptInsure gets the needed funding and starts to distribute the product to customers. All done in 2 months.  To learn more about Black: http://www.black.insure/  Black Insurance Introduction Video: https://www.youtube.com/watch?v=xf8VKYGEB3w  Black Insurance ICO will start around Fall 2018, please feel free to register now to enjoy 25% bonus! https://www.black.insure/presale/",False
224,msg40279997,https://bitcointalk.org/index.php?topic=3372186.0,msg40278643,7615,Announcements (Altcoins),2018-06-17 07:21:37,gxmonitor,Newbie,205,0,,📢 [ANN]Black Insurance digital insurance company on the blockchain,    We are really glad that you like our project. Keep supporting us.  Our whitelist registrations are open. Register now and get 25% bonus throughout the pre-sale and ICO.  https://www.black.insure/presale/,False
225,msg40354065,https://bitcointalk.org/index.php?topic=3372186.0,,7615,Announcements (Altcoins),2018-06-18 05:50:34,chunt,Newbie,183,0,,📢 [ANN]Black Insurance digital insurance company on the blockchain,"When an event requires an exchange of information, most insurers strive to share the least amount possible, in many cases using manual, paper-based processes. This is insurers’ way of making sure that there are no sensitive leaks, and it reflects the fear that digital exchanges of data may not be secure. But what if there were a technology that changed this? Blockchain technology! https://www.bcg.com/publications/2018/first-all-blockchain-insurer.aspx  To find out more about Black Insurance, please visit https://www.black.insure/  Please check out our introduction video too! https://www.youtube.com/watch?v=xf8VKYGEB3w",False
226,msg40368981,https://bitcointalk.org/index.php?topic=3372186.0,,7615,Announcements (Altcoins),2018-06-18 10:34:40,gxmonitor,Newbie,205,0,,📢 [ANN]Black Insurance digital insurance company on the blockchain,"Meet Mart, Black COO: “When I heard about Black Insurance, I immediately thought: “Damn this is BIG”.” 😊  https://medium.com/blackinsurance/meet-mart-black-coo-when-i-heard-about-black-insurance-i-immediately-though-damn-this-is-bc2eab259e54",False
227,msg40417927,https://bitcointalk.org/index.php?topic=3372186.0,,7615,Announcements (Altcoins),2018-06-19 03:03:33,chunt,Newbie,183,0,,📢 [ANN]Black Insurance digital insurance company on the blockchain,"Hi Iqbal!  Thank you for your kind words and support!  Black Insurance ICO will start around Fall 2018, please feel free to register now to enjoy 25% bonus! https://www.black.insure/presale/  =====  In the insurance industry tokens can be a very useful abstraction. In  fact, tokens are the key ingredient enabling smart contract-based  insurances on the Black Insurance platform.  https://medium.com/blackinsurance/tokenizing-the-insurance-business-1cd88fde22fe  To find out more about Black Insurance, please visit https://www.black.insure/  Please check out our introduction video too! https://www.youtube.com/watch?v=xf8VKYGEB3w ",False
228,msg40418521,https://bitcointalk.org/index.php?topic=3372186.0,msg40099077,7615,Announcements (Altcoins),2018-06-19 03:22:16,drwoo,Sr. Member,642,250,,📢 [ANN]Black Insurance digital insurance company on the blockchain,   Can anyone offer an insurance product or is it for institutions? Could I decide to offer insurance for something on your platform?,False
229,msg40422528,https://bitcointalk.org/index.php?topic=3372186.0,,7615,Announcements (Altcoins),2018-06-19 05:31:07,chunt,Newbie,183,0,,📢 [ANN]Black Insurance digital insurance company on the blockchain,"Hi Drwoo!  Thanks for joining us!  Black will be a licensed insurance company that provides insurance capacity to Agents, Brokers and MGAs enabling them to launch their own virtual insurance companies.  Insurance business will be generated by local MGAs / Brokers / Agents whose responsibility is designing insurance products for a market, pricing and selling the product and organizing claims handling.  Delegating business to local agents makes the Black business model scalable while bringing business decisions closer to end customers.",False
230,msg40435660,https://bitcointalk.org/index.php?topic=3372186.0,,7615,Announcements (Altcoins),2018-06-19 09:46:26,gxmonitor,Newbie,205,0,,📢 [ANN]Black Insurance digital insurance company on the blockchain,Black Insurance makes use of several unique properties the Blockchain has to offer.  Cutting out Trusted Third Parties 🙅  Transparency 💯  Automation 👍  https://medium.com/blackinsurance/the-advantages-of-blockchain-based-insurance-products-ffb6229eaa94,False
231,msg40492075,https://bitcointalk.org/index.php?topic=3372186.0,,7615,Announcements (Altcoins),2018-06-20 03:43:02,chunt,Newbie,183,0,,📢 [ANN]Black Insurance digital insurance company on the blockchain,"Meet our COO, Mart!  “When I heard about Black Insurance, I immediately thought: “Damn this is BIG”.""  Also, Black has really strong founders. As a wise man once told, idea is just a multiplier of execution. Bundeep and Risto have proved to deliver operational high growth businesses one after another.  https://medium.com/blackinsurance/meet-mart-black-coo-when-i-heard-about-black-insurance-i-immediately-though-damn-this-is-bc2eab259e54   To find out more about Black Insurance, please visit https://www.black.insure/  Please check out our introduction video too! https://www.youtube.com/watch?v=xf8VKYGEB3w",False
232,msg40505580,https://bitcointalk.org/index.php?topic=3372186.0,,7615,Announcements (Altcoins),2018-06-20 08:54:58,kominfo.id,Member,107,10,,📢 [ANN]Black Insurance digital insurance company on the blockchain,to many digital insurance concept at blockchain but still no one good i hope this project can be more usefull,False
233,msg40510404,https://bitcointalk.org/index.php?topic=3372186.0,msg40505482,7615,Announcements (Altcoins),2018-06-20 10:19:46,gxmonitor,Newbie,205,0,,📢 [ANN]Black Insurance digital insurance company on the blockchain,   We are glad to see that you like our Project. Please keep supporting our project.,False
234,msg40510520,https://bitcointalk.org/index.php?topic=3372186.0,msg40505580,7615,Announcements (Altcoins),2018-06-20 10:21:55,gxmonitor,Newbie,205,0,,📢 [ANN]Black Insurance digital insurance company on the blockchain,"   You are right. There are many projects in insurance sector.  Black will be a licensed insurance company that provides insurance capacity to Agents, Brokers and MGAs enabling them to launch their own virtual insurance companies.  Insurance business will be generated by local MGAs / Brokers / Agents whose responsibility is designing insurance products for a market, pricing and selling the product and organizing claims handling.  Delegating business to local agents makes the Black business model scalable while bringing business decisions closer to end customers.   Black Insurance will use two types of tokens:  Black Platform Token (BLCK). All platform users will use BLCK for managing insurance on the Black platform, and demand for BLCK will increase as more insurance business is conducted on the platform.  Black Syndicate Tokens  (BST) which is a security token. BST will be issued when the platform is ready.",False
235,msg40513875,https://bitcointalk.org/index.php?topic=3372186.0,msg40510770,7615,Announcements (Altcoins),2018-06-20 11:22:27,gxmonitor,Newbie,205,0,,📢 [ANN]Black Insurance digital insurance company on the blockchain,   We are really pleased by your complement. Keep supporting our project. Our pre-sale registrations are open. You can register and get 25% bonus.  https://www.black.insure/presale/,False
236,msg40565630,https://bitcointalk.org/index.php?topic=3372186.0,,7615,Announcements (Altcoins),2018-06-21 05:49:04,chunt,Newbie,183,0,,📢 [ANN]Black Insurance digital insurance company on the blockchain,"Insurance is an industry, like many others, that has been plagued by ongoing issues that can be solved through the use of blockchain technology.  Let's take a look at how insurance claims can be processed using this technology.  https://medium.com/blackinsurance/ever-wondered-how-insurance-claims-can-be-processed-on-the-blockchain-heres-how-9ce27cff5cf4  To find out more about Black Insurance, please visit https://www.black.insure/  Please check out our introduction video too! https://www.youtube.com/watch?v=xf8VKYGEB3w",False
