id,msg_id,parent_id,link_id,Count_read,Forum,Time,Author,Rank,Activity,Merit,Trust,Title,Body,ScamHeader
362,msg38556718,https://bitcointalk.org/index.php?topic=3372186.0,,7615,Announcements (Altcoins),2018-05-25 22:00:27,godblessyou12,Newbie,140,0,,📢 [ANN]Black Insurance digital insurance company on the blockchain,Please watch this introductory video from our team! Watch how Black Insurance works! https://www.youtube.com/watch?v=xf8VKYGEB3w,False
363,msg38559019,https://bitcointalk.org/index.php?topic=3372186.0,,7615,Announcements (Altcoins),2018-05-25 22:33:06,godblessyou12,Newbie,140,0,,📢 [ANN]Black Insurance digital insurance company on the blockchain,Black Insurance makes use of several unique properties the Blockchain has to offer.  Cutting out Trusted Third Parties 🙅  Transparency 💯  Automation 👍  https://medium.com/blackinsurance/the-advantages-of-blockchain-based-insurance-products-ffb6229eaa94,False
364,msg38562127,https://bitcointalk.org/index.php?topic=3372186.0,,7615,Announcements (Altcoins),2018-05-25 23:19:07,godblessyou12,Newbie,140,0,,📢 [ANN]Black Insurance digital insurance company on the blockchain,Black Insurance makes use of several unique properties the Blockchain has to offer.  Cutting out Trusted Third Parties 🙅  Transparency 💯  Automation 👍  https://medium.com/blackinsurance/the-advantages-of-blockchain-based-insurance-products-ffb6229eaa94,False
365,msg38589006,https://bitcointalk.org/index.php?topic=3372186.0,msg35434788,7615,Announcements (Altcoins),2018-05-26 06:40:07,Jondum,Newbie,253,0,,📢 [ANN]Black Insurance digital insurance company on the blockchain,   this is an interesting and brilliant thing. Black insurance further simplifies the risk claims of the insured to the insurer by using the token utlitas. based blockchain technology will keep all data securely in transparent business operations. I hope success for Black Insurance,False
366,msg38589305,https://bitcointalk.org/index.php?topic=3372186.0,msg38589006,7615,Announcements (Altcoins),2018-05-26 06:44:15,gxmonitor,Newbie,205,0,,📢 [ANN]Black Insurance digital insurance company on the blockchain,   We really appreciate your gesture towards our project. Keep supporting our project.,False
367,msg38589409,https://bitcointalk.org/index.php?topic=3372186.0,,7615,Announcements (Altcoins),2018-05-26 06:45:23,ALexiron2ew,Member,132,10,,📢 [ANN]Black Insurance digital insurance company on the blockchain,So You Have Bounty?,False
368,msg38611250,https://bitcointalk.org/index.php?topic=3372186.0,msg38589409,7615,Announcements (Altcoins),2018-05-26 11:23:02,gxmonitor,Newbie,205,0,,📢 [ANN]Black Insurance digital insurance company on the blockchain,"   Yes, we do have bounty. Our Bounty telegram group https://t.me/BlackInsuranceBountyGroup",False
369,msg38638879,https://bitcointalk.org/index.php?topic=3372186.0,,7615,Announcements (Altcoins),2018-05-26 18:07:14,godblessyou12,Newbie,140,0,,📢 [ANN]Black Insurance digital insurance company on the blockchain,Please watch this introductory video from our team! Watch how Black Insurance works! https://www.youtube.com/watch?v=xf8VKYGEB3w,False
370,msg38641629,https://bitcointalk.org/index.php?topic=3372186.0,,7615,Announcements (Altcoins),2018-05-26 18:53:59,godblessyou12,Newbie,140,0,,📢 [ANN]Black Insurance digital insurance company on the blockchain,Black Insurance is amongst the 3% of startups that really change the insurance at its core. https://insuranceblog.accenture.com/insurtech-refocus-on-underserved-elements-of-the-insurance-value-chain-to-unlock-growth,False
371,msg38646055,https://bitcointalk.org/index.php?topic=3372186.0,,7615,Announcements (Altcoins),2018-05-26 20:13:29,godblessyou12,Newbie,140,0,,📢 [ANN]Black Insurance digital insurance company on the blockchain,Black Insurance makes use of several unique properties the Blockchain has to offer.  Cutting out Trusted Third Parties 🙅  Transparency 💯  Automation 👍  https://medium.com/blackinsurance/the-advantages-of-blockchain-based-insurance-products-ffb6229eaa94,False
372,msg38647194,https://bitcointalk.org/index.php?topic=3372186.0,,7615,Announcements (Altcoins),2018-05-26 20:34:32,blockchain-man,Full Member,532,100,,📢 [ANN]Black Insurance digital insurance company on the blockchain,I learned about the project and saw Black Insurance as a third party to simplify the insurer's risk requirements for the insurer in a transparent manner. Black insurance has a great function that is profitable by some insurance categories that will transfer to the BST owner. Can you share more specific issues?,False
373,msg38649755,https://bitcointalk.org/index.php?topic=3372186.0,,7615,Announcements (Altcoins),2018-05-26 21:22:16,godblessyou12,Newbie,140,0,,📢 [ANN]Black Insurance digital insurance company on the blockchain,"How can Blockchain be used and implemented in the insurance industry?  Due to the security, transparency, and decentralisation of the information managed, Blockchain opens disruptive scenarios in various insurance areas:1. Risk data would be available to all players  2. In developing retail products3. Efficient process of identifying customers (""know your customer"" - KYC) 4. Fraud prevention5. With the use of DLT, the claim could be submitted without customer intervention via smart devices, the verification of the insured party, the validity of the coverage, and the completeness of the accident data would be automatic.",False
374,msg38652459,https://bitcointalk.org/index.php?topic=3372186.0,,7615,Announcements (Altcoins),2018-05-26 22:18:50,godblessyou12,Newbie,140,0,,📢 [ANN]Black Insurance digital insurance company on the blockchain,"please kindly visit to our airdrop telegram group for you to claim your free airdrop token.thank you and welcome to black insurance community!   For any refferal/bounty query, refer to our Bounty telegram group https://t.me/BlackInsuranceBountyGroup  Black Insurance Bounty Group This is the group where all your bounty related questions and problems find answers.",False
375,msg38655083,https://bitcointalk.org/index.php?topic=3372186.0,,7615,Announcements (Altcoins),2018-05-26 23:22:42,godblessyou12,Newbie,140,0,,📢 [ANN]Black Insurance digital insurance company on the blockchain,"Digital Insurance Provider on Blockchain, Black Insurance Ropes in Professor Alex Norta as the Scientific Advisor.  The goal of Black platform is to empower the insurance brokers by connecting them directly with capital, allowing them to launch their own virtual insurance companies.  http://altcoinalerts.com/digital-insurance-provider-on-blockchain-black-insurance-ropes-in-professor-alex-norta-as-the-scientific-advisor/",False
376,msg38660866,https://bitcointalk.org/index.php?topic=3372186.0,msg38647194,7615,Announcements (Altcoins),2018-05-27 03:15:13,chunt,Newbie,183,0,,📢 [ANN]Black Insurance digital insurance company on the blockchain,"   Hello blockchain-man  Black connects insurance entrepreneurs with innovative ideas to the capital they seek.  An example:  An insurance startup “CryptInsure” has recognised the need for insuring crypto wallets hosted by third parties. They list their product on the Black platform after it has been approved by the Black experts. A syndicate focusing on crypto products recognises the product and decides to invest. CryptInsure gets the needed funding and starts to distribute the product to customers. All done in 2 months.  Black Insurance will use two types of tokens:  Black Platform Token (BLCK). All platform users will use BLCK for managing insurance on the Black platform, and demand for BLCK will increase as more insurance business is conducted on the platform.  Black Syndicate Tokens (BST) is a security token. BST will be issued when the platform is ready. BSTs can only be purchased and owned by verified “Accredited Investors”. BSTs are investments created by Syndicates that will earn a profit, and the amount and types of BSTs will grow and shrink based on the different types of Syndicates that exist at any given time.  The Black Platform will allow Investors to join together into an investment fund called a Syndicate, and Investors will receive Tokens from the Syndicate in exchange for their investments.  These Black Syndicate Tokens (BSTs) are a special class of Tokens that will be issued when Syndicates are being launched or when they are distributing Profit to their Investors. Each Syndicate will issue their own BST with a unique name and Risk / Reward profile. In its most basic form, a BST will behave like an interest-bearing security (a bond), where holders will calculate the value of a BST as the combination of historical payments.  Black whitepaper: https://drive.google.com/viewerng/viewer?url=https://www.black.insure/wp-content/uploads/2018/05/whitepaper-min.pdf",False
377,msg38683635,https://bitcointalk.org/index.php?topic=3372186.0,,7615,Announcements (Altcoins),2018-05-27 10:17:36,gxmonitor,Newbie,205,0,,📢 [ANN]Black Insurance digital insurance company on the blockchain,"Hello friends, we are gearing up for our pre-ico. We want to know geographic reach of our project. Can you please let us know from which county you are ?",False
378,msg38721863,https://bitcointalk.org/index.php?topic=3372186.0,msg38589006,7615,Announcements (Altcoins),2018-05-27 18:22:01,crypto|george,Newbie,143,0,,📢 [ANN]Black Insurance digital insurance company on the blockchain,    Thank you for the support! Pleas also check our website at https://www.black.insure/ for more information about the project or join our telegram group for discussions.,False
379,msg38310463,https://bitcointalk.org/index.php?topic=3372186.0,,7615,Announcements (Altcoins),2018-05-23 18:24:54,godblessyou12,Newbie,140,0,,📢 [ANN]Black Insurance digital insurance company on the blockchain,Read how can Blockchain be used and implemented in the insurance industry!!  https://www.generali.com/info/discovering-generali/all/2018/Blockchain-revolution,False
380,msg38321503,https://bitcointalk.org/index.php?topic=3372186.0,,7615,Announcements (Altcoins),2018-05-23 20:30:19,godblessyou12,Newbie,140,0,,📢 [ANN]Black Insurance digital insurance company on the blockchain,"MGA Boost Provides Insurtechs with Insurer Access, Backend Operations https://www.insurancejournal.com/news/national/2018/05/17/489497.htm",False
381,msg38329413,https://bitcointalk.org/index.php?topic=3372186.0,,7615,Announcements (Altcoins),2018-05-23 22:20:40,godblessyou12,Newbie,140,0,,📢 [ANN]Black Insurance digital insurance company on the blockchain,Black Insurance is amongst the 3% of startups that really change the insurance at its core. https://insuranceblog.accenture.com/insurtech-refocus-on-underserved-elements-of-the-insurance-value-chain-to-unlock-growth,False
382,msg38337455,https://bitcointalk.org/index.php?topic=3372186.0,msg38331037,7615,Announcements (Altcoins),2018-05-24 00:42:35,chunt,Newbie,183,0,,📢 [ANN]Black Insurance digital insurance company on the blockchain,   Welcome Kasonudy! Please let us know if you have any question.,False
383,msg38337960,https://bitcointalk.org/index.php?topic=3372186.0,,7615,Announcements (Altcoins),2018-05-24 00:53:20,godblessyou12,Newbie,140,0,,📢 [ANN]Black Insurance digital insurance company on the blockchain,Black connects insurance entrepreneurs with innovative ideas to the capital they seek.  An example:  An insurance startup “CryptInsure” has recognised the need for insuring crypto wallets hosted by third parties. They list their product on the Black platform after it has been approved by the Black experts. A syndicate focusing on crypto products recognises the product and decides to invest. CryptInsure gets the needed funding and starts to distribute the product to customers. All done in 2 months.  http://www.black.insure/,False
384,msg38351162,https://bitcointalk.org/index.php?topic=3372186.0,,7615,Announcements (Altcoins),2018-05-24 04:23:41,chunt,Newbie,183,0,,📢 [ANN]Black Insurance digital insurance company on the blockchain,"Fintech expert, scientist, and blockchain visionary Professor Alex Norta has joined forces with Black Insurance, helping with technical whitepaper. Black promises to be a gamechanger in the world of digital insurance by using the blockchain to transfer risk directly from clients to financial backers.Highlighting the potential of Black Insurance, the company’s founder Risto Rossar said, “I have been in the insurance industry for over eighteen years and I realized that I don’t care about insurance. In fact, no one should care about insurance. It should be as simple as breathing and work without customers having to worry about it. We can solve a lot of inefficiencies through technology and will disrupt the insurance industry from the inside, building a seamless process that customers don’t have to deal with.”  To find out more, please visit https://www.black.insure/",False
385,msg38355597,https://bitcointalk.org/index.php?topic=3372186.0,,7615,Announcements (Altcoins),2018-05-24 05:24:34,chunt,Newbie,183,0,,📢 [ANN]Black Insurance digital insurance company on the blockchain,Black connects insurance entrepreneurs with innovative ideas to the capital they seek.  An example:  An insurance startup “CryptInsure” has recognised the need for insuring crypto wallets hosted by third parties. They list their product on the Black platform after it has been approved by the Black experts. A syndicate focus   ing on crypto products recognises the product and decides to invest. CryptInsure gets the needed funding and starts to distribute the product to customers. All done in 2 months.  http://www.black.insure/,False
386,msg38398214,https://bitcointalk.org/index.php?topic=3372186.0,,7615,Announcements (Altcoins),2018-05-24 13:09:35,mahvia,Copper Member,231,0,,📢 [ANN]Black Insurance digital insurance company on the blockchain,Do i get it right that brokers make products and Black will back it up like the insurance company and if claims happen Black will pay for it? Brokers have no liability?,False
387,msg38428393,https://bitcointalk.org/index.php?topic=3372186.0,,7615,Announcements (Altcoins),2018-05-24 18:13:39,godblessyou12,Newbie,140,0,,📢 [ANN]Black Insurance digital insurance company on the blockchain,We just finished the introduction video https://www.youtube.com/watch?v=xf8VKYGEB3w,False
388,msg38433780,https://bitcointalk.org/index.php?topic=3372186.0,,7615,Announcements (Altcoins),2018-05-24 19:11:19,godblessyou12,Newbie,140,0,,📢 [ANN]Black Insurance digital insurance company on the blockchain,Black Insurance is amongst the 3% of startups that really change the insurance at its core. https://insuranceblog.accenture.com/insurtech-refocus-on-underserved-elements-of-the-insurance-value-chain-to-unlock-growth,False
389,msg38438102,https://bitcointalk.org/index.php?topic=3372186.0,,7615,Announcements (Altcoins),2018-05-24 20:11:18,godblessyou12,Newbie,140,0,,📢 [ANN]Black Insurance digital insurance company on the blockchain,https://www.linkedin.com/feed/update/urn:li:activity:6400978474835681280,False
390,msg38441600,https://bitcointalk.org/index.php?topic=3372186.0,,7615,Announcements (Altcoins),2018-05-24 21:10:41,godblessyou12,Newbie,140,0,,📢 [ANN]Black Insurance digital insurance company on the blockchain,https://www.linkedin.com/feed/update/urn:li:activity:6400978474835681280,False
391,msg38442784,https://bitcointalk.org/index.php?topic=3372186.0,,7615,Announcements (Altcoins),2018-05-24 21:34:24,godblessyou12,Newbie,140,0,,📢 [ANN]Black Insurance digital insurance company on the blockchain,https://www.youtube.com/watch?v=xf8VKYGEB3w,False
392,msg38444632,https://bitcointalk.org/index.php?topic=3372186.0,,7615,Announcements (Altcoins),2018-05-24 22:11:49,godblessyou12,Newbie,140,0,,📢 [ANN]Black Insurance digital insurance company on the blockchain,"Digital Insurance Provider on Blockchain, Black Insurance Ropes in Professor Alex Norta as the Scientific Advisor.  The goal of Black platform is to empower the insurance brokers by connecting them directly with capital, allowing them to launch their own virtual insurance companies.  http://altcoinalerts.com/digital-insurance-provider-on-blockchain-black-insurance-ropes-in-professor-alex-norta-as-the-scientific-advisor/",False
393,msg38446089,https://bitcointalk.org/index.php?topic=3372186.0,,7615,Announcements (Altcoins),2018-05-24 22:43:50,SalmaBR,Newbie,42,0,,📢 [ANN]Black Insurance digital insurance company on the blockchain,"Enabling token holders to invest into insurance and creating digital insurance platform for them, demands secure data storage and smart contracts. And I am sure the expertise provided and guaranteed by the mixed team that consists of insurance industry veterans and blockchain experts can meet the expectations requiered. The best of luck to the team!",False
394,msg38447214,https://bitcointalk.org/index.php?topic=3372186.0,,7615,Announcements (Altcoins),2018-05-24 23:11:09,godblessyou12,Newbie,140,0,,📢 [ANN]Black Insurance digital insurance company on the blockchain,"New Beazley tie-up to automate weather insurance claims | Insurance Business  https://m.insurancebusinessmag.com/au/news/breaking-news/new-beazley-tieup-to-automate-weather-insurance-claims-99525.aspx   To find out more about Black Insurance, please visit https://www.black.insure/",False
395,msg38449359,https://bitcointalk.org/index.php?topic=3372186.0,,7615,Announcements (Altcoins),2018-05-25 00:11:14,chunt,Newbie,183,0,,📢 [ANN]Black Insurance digital insurance company on the blockchain,Black Insurance makes use of several unique properties the Blockchain has to offer.  Cutting out Trusted Third Parties  Transparency  Automation  https://medium.com/blackinsurance/the-advantages-of-blockchain-based-insurance-products-ffb6229eaa94,False
396,msg38468535,https://bitcointalk.org/index.php?topic=3372186.0,,7615,Announcements (Altcoins),2018-05-25 05:56:07,chunt,Newbie,183,0,,📢 [ANN]Black Insurance digital insurance company on the blockchain,"Insurance has been too slow to adapt to the digital transformation despite its potential for disruption. It faces pressure from new entrants and customers.   https://buff.ly/2II21vN  To find out more about Black Insurance, please visit https://www.black.insure/",False
397,msg38499637,https://bitcointalk.org/index.php?topic=3372186.0,,7615,Announcements (Altcoins),2018-05-25 11:38:58,gxmonitor,Newbie,205,0,,📢 [ANN]Black Insurance digital insurance company on the blockchain,"Digital Insurance Provider on Blockchain, Black Insurance Ropes in Professor Alex Norta as the Scientific Advisor.  The goal of Black platform is to empower the insurance brokers by connecting them directly with capital, allowing them to launch their own virtual insurance companies.  http://altcoinalerts.com/digital-insurance-provider-on-blockchain-black-insurance-ropes-in-professor-alex-norta-as-the-scientific-advisor/",False
398,msg38536888,https://bitcointalk.org/index.php?topic=3372186.0,,7615,Announcements (Altcoins),2018-05-25 18:07:00,godblessyou12,Newbie,140,0,,📢 [ANN]Black Insurance digital insurance company on the blockchain,"New Beazley tie-up to automate weather insurance claims | Insurance Business  https://m.insurancebusinessmag.com/au/news/breaking-news/new-beazley-tieup-to-automate-weather-insurance-claims-99525.aspx   To find out more about Black Insurance, please visit https://www.black.insure/",False
399,msg38090967,https://bitcointalk.org/index.php?topic=3372186.0,,7615,Announcements (Altcoins),2018-05-21 21:35:26,godblessyou12,Newbie,140,0,,📢 [ANN]Black Insurance digital insurance company on the blockchain,Black Insurance is amongst the 3% of startups that really change the insurance at its core. https://insuranceblog.accenture.com/insurtech-refocus-on-underserved-elements-of-the-insurance-value-chain-to-unlock-growth,False
400,msg38091736,https://bitcointalk.org/index.php?topic=3372186.0,,7615,Announcements (Altcoins),2018-05-21 21:45:28,godblessyou12,Newbie,140,0,,📢 [ANN]Black Insurance digital insurance company on the blockchain,"https://i.imgur.com/RVrQz5j.png?1  Website | Lightpaper | Whitepaper | Twitter | Facebook | Telegram | Bitcointalk | Linkedin   Black will use the blockchain to transfer risk directly from clients (insureds) to financial backers (Black Syndicate Token holders): minimizing all inefficiencies storing all data securely in blockchains transparent  business operations using smart contracts faster innovation by platform members Black Insurance will use two types of tokens: Black Platform Token (BLCK). BLCK powers the infrastructure, providing access to the platform and for conducting voting on system updates to the platform (utility token). All platform users will use BLCK for managing insurance on the Black platform, and demand for BLCK will increase as more insurance business is conducted on the platform. Black Syndicate Tokens (BST) (issued when the platform is ready). BST is an investment in insurance capital, and a specific BST is created for each syndicate (security token), The profitability of the insurance portfolio for a specific syndicate will pass-through to the holders of it’s BST.  The Black Insurance is a B2B platform.  It is built for insurance industry participants,including brokers, MGAs, insurers and investors.It connects insurance entrepreneurs with innovative ideas to the capital they seek. All policies are written on blockchain, greatly reducing transaction costs and giving everyone an equal playing field for conducting business. The Black platform creates a blockchain ecosystem for all parties that will bring transparency, democracy and efficiency to the insurance industry. Join us in social networks  https://i.imgur.com/bNVydoR.pnghttps://i.imgur.com/ImHeiiy.png?1https://i.imgur.com/MTTM5PT.png?1https://i.imgur.com/FaQw7pL.png?1",False
401,msg38093775,https://bitcointalk.org/index.php?topic=3372186.0,,7615,Announcements (Altcoins),2018-05-21 22:13:22,godblessyou12,Newbie,140,0,,📢 [ANN]Black Insurance digital insurance company on the blockchain,Black will use the blockchain to transfer risk directly from clients (insureds) to financial backers (Black Syndicate Token holders): minimizing all inefficiencies storing all data securely in blockchains transparent  business operations using smart contracts faster innovation by platform members,False
402,msg38095396,https://bitcointalk.org/index.php?topic=3372186.0,,7615,Announcements (Altcoins),2018-05-21 22:35:46,godblessyou12,Newbie,140,0,,📢 [ANN]Black Insurance digital insurance company on the blockchain,"MGA Boost Provides Insurtechs with Insurer Access, Backend Operations https://www.insurancejournal.com/news/national/2018/05/17/489497.htm",False
403,msg38096449,https://bitcointalk.org/index.php?topic=3372186.0,,7615,Announcements (Altcoins),2018-05-21 22:49:07,godblessyou12,Newbie,140,0,,📢 [ANN]Black Insurance digital insurance company on the blockchain,"igital Insurance Provider on Blockchain, Black Insurance Ropes in Professor Alex Norta as the Scientific Advisor.  The goal of Black platform is to empower the insurance brokers by connecting them directly with capital, allowing them to launch their own virtual insurance companies.  The new Scientific Advisor for Black Insurance, Professor Alex Norta is the owner of Norta & Partners, offering holistic consultation and software development service in the field of blockchain technology. He has advised and written whitepapers for many successful blockchain projects such as: Neo, Qtum, Cedex, Datawallet, Cashaa and many more. In the past, he has worked as a post-doctorial researcher on the SOAMeS project at the computer-science department of Helsinki University. His research on a PhD about dynamic inter-organizational business process collaboration was featured in an FP6-EU research project called CrossWork.  “The insurance industry today is slow with bringing products to market because of excessive bureaucracy that distorts free-market mechanisms to the detriment of customers,” explains Prof. Norta.  “Blockchain technology is a means to replace this excessive bureaucracy with a novel control mechanism that is much cheaper, faster and more trustable. Thus, the insurance industry can start to meet the markets needs quick and in a cost effective way.”  http://altcoinalerts.com/digital-insurance-provider-on-blockchain-black-insurance-ropes-in-professor-alex-norta-as-the-scientific-advisor/",False
404,msg38098817,https://bitcointalk.org/index.php?topic=3372186.0,,7615,Announcements (Altcoins),2018-05-21 23:23:35,godblessyou12,Newbie,140,0,,📢 [ANN]Black Insurance digital insurance company on the blockchain,"Digital Insurance Provider on Blockchain, Black Insurance Ropes in Professor Alex Norta as the Scientific Advisor.  The goal of Black platform is to empower the insurance brokers by connecting them directly with capital, allowing them to launch their own virtual insurance companies.  http://altcoinalerts.com/digital-insurance-provider-on-blockchain-black-insurance-ropes-in-professor-alex-norta-as-the-scientific-advisor/",False
405,msg38101101,https://bitcointalk.org/index.php?topic=3372186.0,,7615,Announcements (Altcoins),2018-05-21 23:57:28,godblessyou12,Newbie,140,0,,📢 [ANN]Black Insurance digital insurance company on the blockchain,Black Insurance is amongst the 3% of startups that really change the insurance at its core. https://insuranceblog.accenture.com/insurtech-refocus-on-underserved-elements-of-the-insurance-value-chain-to-unlock-growth,False
