id,msg_id,parent_id,link_id,Count_read,Forum,Time,Author,Rank,Activity,Merit,Trust,Title,Body,ScamHeader
1,msg32912997,https://bitcointalk.org/index.php?topic=1575177.0,,17360,Announcements (Altcoins),2018-03-22 14:54:16,hemant111,Newbie,57,0,,"[ANN] [ICO] BITPARK - New P2P Insurance Platform, ICO 1st untill August 15th",waiting for update,False
2,msg33415814,https://bitcointalk.org/index.php?topic=1575177.0,,17360,Announcements (Altcoins),2018-03-29 04:47:52,candyconstantino11,Newbie,84,0,,"[ANN] [ICO] BITPARK - New P2P Insurance Platform, ICO 1st untill August 15th","interesting ,hope that the team will update new information,ill keep following it for sure",False
3,msg37581897,https://bitcointalk.org/index.php?topic=1575177.0,,17360,Announcements (Altcoins),2018-05-17 15:16:08,hemant111,Newbie,57,0,,"[ANN] [ICO] BITPARK - New P2P Insurance Platform, ICO 1st untill August 15th",Livecoin deposit not working,False
4,msg39065859,https://bitcointalk.org/index.php?topic=1575177.0,msg37581897,17360,Announcements (Altcoins),2018-05-31 14:53:42,klarki,Legendary,1554,1127,,"[ANN] [ICO] BITPARK - New P2P Insurance Platform, ICO 1st untill August 15th",   Deposit and withdrawal are now available)  trading pairs:  BPC/BTC: https://www.livecoin.net/en/trade/index?currencyPair=BPC%2FBTC BPC/ETH: https://www.livecoin.net/en/trade/index?currencyPair=BPC%2FETH,False
5,msg39965804,https://bitcointalk.org/index.php?topic=1575177.0,,17360,Announcements (Altcoins),2018-06-12 15:52:53,hemant111,Newbie,57,0,,"[ANN] [ICO] BITPARK - New P2P Insurance Platform, ICO 1st untill August 15th",this stupid coin is no more in coinmarketcap and after some day livecoin also delist .....,False
6,msg45377177,https://bitcointalk.org/index.php?topic=1575177.0,msg39965804,17360,Announcements (Altcoins),2018-09-08 11:01:11,klarki,Legendary,1554,1127,,"[ANN] [ICO] BITPARK - New P2P Insurance Platform, ICO 1st untill August 15th",  What makes you think so? There are many alternative services:  https://www.coinhills.com/market/bpc/ https://coincodex.com/crypto/bitpark-coin/ https://coinlib.io/coin/BPC/Bitpark+Coin https://www.worldcoinindex.com/coin/bitpark%20coin,False
7,msg45377820,https://bitcointalk.org/index.php?topic=1575177.0,,17360,Announcements (Altcoins),2018-09-08 11:18:07,CarrieDu,Newbie,14,0,,"[ANN] [ICO] BITPARK - New P2P Insurance Platform, ICO 1st untill August 15th",From whitepaper its very interesting and worthy to invest project. An all in one place for crypto users. Will it support multinational currencies in the idea’s ecosystem???!,False
8,msg48653003,https://bitcointalk.org/index.php?topic=1575177.0,,17360,Announcements (Altcoins),2018-12-13 22:23:16,DesktopCommando,Newbie,352,0,,"[ANN] [ICO] BITPARK - New P2P Insurance Platform, ICO 1st untill August 15th",Does this coin still have a community ?  has slight movement - may get listed soon on Emblemvault if the Dev's are still about  https://etherscan.io/token/0xf3d29fb98d2dc5e78c87198deef99377345fd6f1  If interested contact emblem@unspecified.me its free of charge (optional donation)  https://twitter.com/unspecifiedllc/status/1058389912737775618,False
9,msg48653063,https://bitcointalk.org/index.php?topic=1575177.0,msg48653003,17360,Announcements (Altcoins),2018-12-13 22:28:22,allfriends88,Full Member,560,100,,"[ANN] [ICO] BITPARK - New P2P Insurance Platform, ICO 1st untill August 15th","   Yes I think so, they lose their community because their supporters don't seem to get any updates or late in receiving information from the team, it's very unfortunate.",False
10,msg20729407,https://bitcointalk.org/index.php?topic=1575177.0,,17360,Announcements (Altcoins),2017-08-09 03:17:12,ZaoXhou,Sr. Member,471,251,,"[ANN] [ICO] BITPARK - New P2P Insurance Platform, ICO 1st untill August 15th","does not make sense , can work fine with bitcoin for no need the new coin...",False
11,msg20789866,https://bitcointalk.org/index.php?topic=1575177.0,,17360,Announcements (Altcoins),2017-08-11 10:36:28,Zabivelli,Full Member,378,100,,"[ANN] [ICO] BITPARK - New P2P Insurance Platform, ICO 1st untill August 15th",Bitpark moved to Bitshares I read  ..i think decentralized exchanges are the future..lets say in 3 to 6 months the popularity will rise.  why so quite here?,False
12,msg20816933,https://bitcointalk.org/index.php?topic=1575177.0,,17360,Announcements (Altcoins),2017-08-12 12:58:12,Bitgenius777,Full Member,420,100,,"[ANN] [ICO] BITPARK - New P2P Insurance Platform, ICO 1st untill August 15th",This coin is a joke. Because the marketing demonstrates how disinterested the dev is in it.,False
13,msg20928747,https://bitcointalk.org/index.php?topic=1575177.0,,17360,Announcements (Altcoins),2017-08-16 14:24:38,Exavier,Member,89,10,,"[ANN] [ICO] BITPARK - New P2P Insurance Platform, ICO 1st untill August 15th",To bad too. Coin looked like a interesting idea.,False
14,msg21269808,https://bitcointalk.org/index.php?topic=1575177.0,,17360,Announcements (Altcoins),2017-08-28 05:52:17,coins467,Member,77,10,,"[ANN] [ICO] BITPARK - New P2P Insurance Platform, ICO 1st untill August 15th",low trade volume,False
15,msg21398975,https://bitcointalk.org/index.php?topic=1575177.0,,17360,Announcements (Altcoins),2017-09-01 04:21:31,coins467,Member,77,10,,"[ANN] [ICO] BITPARK - New P2P Insurance Platform, ICO 1st untill August 15th",no reply from dev,False
16,msg22996028,https://bitcointalk.org/index.php?topic=1575177.0,,17360,Announcements (Altcoins),2017-10-14 10:26:27,hemant111,Newbie,57,0,,"[ANN] [ICO] BITPARK - New P2P Insurance Platform, ICO 1st untill August 15th",coin devloper where r u .......,False
17,msg24034902,https://bitcointalk.org/index.php?topic=1575177.0,,17360,Announcements (Altcoins),2017-11-04 16:16:09,hemant111,Newbie,57,0,,"[ANN] [ICO] BITPARK - New P2P Insurance Platform, ICO 1st untill August 15th",i think bitpark coin ...have no holder and no devloper .......because no one talk about future growth of bitpark.........nobody try to bitpark listed in more exchange ..................bitpark holder please remove your low price sell order,False
18,msg24988479,https://bitcointalk.org/index.php?topic=1575177.0,,17360,Announcements (Altcoins),2017-11-22 00:30:10,forfunnystuff,Newbie,10,0,,"[ANN] [ICO] BITPARK - New P2P Insurance Platform, ICO 1st untill August 15th","this coin is a real slow burner, these guys don't hype anything they just post the news as it happens. definitely a long hold.  https://bitpark.net/blog.html",False
19,msg26016081,https://bitcointalk.org/index.php?topic=1575177.0,,17360,Announcements (Altcoins),2017-12-09 09:05:01,Dubrovin,Full Member,323,100,,"[ANN] [ICO] BITPARK - New P2P Insurance Platform, ICO 1st untill August 15th",Hello! And who knows the news about the alpha version of the platform? The project is interesting and promising if it will continue to develop what I wish him!,False
20,msg26086003,https://bitcointalk.org/index.php?topic=1575177.0,,17360,Announcements (Altcoins),2017-12-10 14:41:46,hemant111,Newbie,57,0,,"[ANN] [ICO] BITPARK - New P2P Insurance Platform, ICO 1st untill August 15th",Please Send update News about Bitpark,False
21,msg26109467,https://bitcointalk.org/index.php?topic=1575177.0,,17360,Announcements (Altcoins),2017-12-10 22:46:24,ljb281,Newbie,48,0,,"[ANN] [ICO] BITPARK - New P2P Insurance Platform, ICO 1st untill August 15th",has anyone heard anything from devs? very low volume on livecoin...,False
22,msg27323291,https://bitcointalk.org/index.php?topic=1575177.0,,17360,Announcements (Altcoins),2018-01-02 03:15:15,hemant111,Newbie,57,0,,"[ANN] [ICO] BITPARK - New P2P Insurance Platform, ICO 1st untill August 15th",update pls,False
23,msg28010890,https://bitcointalk.org/index.php?topic=1575177.0,msg27323291,17360,Announcements (Altcoins),2018-01-12 21:59:22,Driendy,Full Member,315,101,,"[ANN] [ICO] BITPARK - New P2P Insurance Platform, ICO 1st untill August 15th",   +65% today . It looks like someone knows something we don't,False
24,msg29372606,https://bitcointalk.org/index.php?topic=1575177.0,,17360,Announcements (Altcoins),2018-02-01 10:16:13,Geekxplore,Jr. Member,56,3,,"[ANN] [ICO] BITPARK - New P2P Insurance Platform, ICO 1st untill August 15th",What is Bitpark Coin? Bitpark is a platform that offers P2P insurance services and is traded in the form of a cryptocurrency . Read More https://www.geekxplore.com/what-is-bitpark-coin.html,False
25,msg32114384,https://bitcointalk.org/index.php?topic=1575177.0,,17360,Announcements (Altcoins),2018-03-12 05:54:37,hemant111,Newbie,57,0,,"[ANN] [ICO] BITPARK - New P2P Insurance Platform, ICO 1st untill August 15th",no update ........,False
26,msg32117869,https://bitcointalk.org/index.php?topic=1575177.0,msg32114384,17360,Announcements (Altcoins),2018-03-12 07:12:05,rahmad2nd,Legendary,1470,1000,,"[ANN] [ICO] BITPARK - New P2P Insurance Platform, ICO 1st untill August 15th","  indeed this is very confusing to the participants and investors, it has been a long time since they have provided an update on the bitpark project i hope this problem can be resolved soon, because there has been a sense of disappointment waiting for a long time",False
27,msg32736282,https://bitcointalk.org/index.php?topic=1575177.0,,17360,Announcements (Altcoins),2018-03-20 08:49:48,hemant111,Newbie,57,0,,"[ANN] [ICO] BITPARK - New P2P Insurance Platform, ICO 1st untill August 15th",i think devloper of bitpark going to make another coin for new scam.......,False
28,msg32885743,https://bitcointalk.org/index.php?topic=1575177.0,,17360,Announcements (Altcoins),2018-03-22 07:59:04,NickCrypto,Full Member,266,101,,"[ANN] [ICO] BITPARK - New P2P Insurance Platform, ICO 1st untill August 15th",Check out Bitpark Coin chart at BitScreener https://bitscreener.com/coins/bitpark-coin,False
29,msg32886771,https://bitcointalk.org/index.php?topic=1575177.0,msg32885743,17360,Announcements (Altcoins),2018-03-22 08:16:01,Jasad,Legendary,1134,1000,,"[ANN] [ICO] BITPARK - New P2P Insurance Platform, ICO 1st untill August 15th","   has been very long without any updates, may have disappointed many people who have contributed to this project already many who think bad, there is no clarification from them for that matter",False
30,msg17769880,https://bitcointalk.org/index.php?topic=1575177.0,msg17688996,17360,Announcements (Altcoins),2017-02-07 19:26:16,BETAWI,Sr. Member,518,250,,"[ANN] [ICO] BITPARK - New P2P Insurance Platform, ICO 1st untill August 15th",   Do you mean to claim the reward of twitter bounty ? it seems not everyone gets the reward (maybe processed gradually),False
31,msg17855892,https://bitcointalk.org/index.php?topic=1575177.0,,17360,Announcements (Altcoins),2017-02-15 03:15:00,coins467,Member,77,10,,"[ANN] [ICO] BITPARK - New P2P Insurance Platform, ICO 1st untill August 15th",no volume,False
32,msg17873334,https://bitcointalk.org/index.php?topic=1575177.0,,17360,Announcements (Altcoins),2017-02-16 15:35:32,coins467,Member,77,10,,"[ANN] [ICO] BITPARK - New P2P Insurance Platform, ICO 1st untill August 15th",when we go big exchange,False
33,msg17896616,https://bitcointalk.org/index.php?topic=1575177.0,msg17613911,17360,Announcements (Altcoins),2017-02-18 17:51:02,coinbit71,Jr. Member,90,2,,"[ANN] [ICO] BITPARK - New P2P Insurance Platform, ICO 1st untill August 15th",    ahhhh good news to hear thankyou to keep us aware.,False
34,msg17917619,https://bitcointalk.org/index.php?topic=1575177.0,,17360,Announcements (Altcoins),2017-02-20 17:10:25,Spratan,Hero Member,696,507,,"[ANN] [ICO] BITPARK - New P2P Insurance Platform, ICO 1st untill August 15th",I have just noticed Bitpark is on coinmarketcap.com. Good !,False
35,msg17932098,https://bitcointalk.org/index.php?topic=1575177.0,msg17917619,17360,Announcements (Altcoins),2017-02-21 23:12:24,rolik2001,Hero Member,1120,500,,"[ANN] [ICO] BITPARK - New P2P Insurance Platform, ICO 1st untill August 15th",  very good now wait on bittrex and news from team,False
36,msg17941087,https://bitcointalk.org/index.php?topic=1575177.0,msg17932098,17360,Announcements (Altcoins),2017-02-22 17:58:27,Spratan,Hero Member,696,507,,"[ANN] [ICO] BITPARK - New P2P Insurance Platform, ICO 1st untill August 15th",  I received a en email to request my token before end of February. It seems that news are coming.,False
37,msg17956709,https://bitcointalk.org/index.php?topic=1575177.0,,17360,Announcements (Altcoins),2017-02-24 01:04:41,cvasy,Sr. Member,382,250,,"[ANN] [ICO] BITPARK - New P2P Insurance Platform, ICO 1st untill August 15th",my send balance button not wrok ,False
38,msg17956718,https://bitcointalk.org/index.php?topic=1575177.0,msg17956709,17360,Announcements (Altcoins),2017-02-24 01:05:49,rolik2001,Hero Member,1120,500,,"[ANN] [ICO] BITPARK - New P2P Insurance Platform, ICO 1st untill August 15th",  where dont work ?? ,False
39,msg17956741,https://bitcointalk.org/index.php?topic=1575177.0,msg17941249,17360,Announcements (Altcoins),2017-02-24 01:09:06,albrots,Sr. Member,283,250,,"[ANN] [ICO] BITPARK - New P2P Insurance Platform, ICO 1st untill August 15th","  ICO is over no translation again , now time for claiming your rewards",False
40,msg17956758,https://bitcointalk.org/index.php?topic=1575177.0,msg17956718,17360,Announcements (Altcoins),2017-02-24 01:11:23,cvasy,Sr. Member,382,250,,"[ANN] [ICO] BITPARK - New P2P Insurance Platform, ICO 1st untill August 15th","  iam recived email to submit my ETH address and iam see a button to request the BITPARK tokens, i cant klik this button (https://ico.bitpark.net/about2ndico)",False
41,msg17963570,https://bitcointalk.org/index.php?topic=1575177.0,,17360,Announcements (Altcoins),2017-02-24 15:00:25,4rzun4,Sr. Member,623,250,,"[ANN] [ICO] BITPARK - New P2P Insurance Platform, ICO 1st untill August 15th","Hi Dev, have you distribution rewards to participant of twitter campaign when last crowdsale ? Please confirm about this!  Thanks!",False
42,msg17963731,https://bitcointalk.org/index.php?topic=1575177.0,msg17698394,17360,Announcements (Altcoins),2017-02-24 15:15:06,logictense,Hero Member,1274,511,,"[ANN] [ICO] BITPARK - New P2P Insurance Platform, ICO 1st untill August 15th","   Eth chain has ramped up loads of tokens during 2016, hundreds of thousands bucks have been made through crowdfunding of REP, Golem, First blood and other kindred shits that have no real world utility as of yet. And u expect this one to hit new heights in terms of innovation and tech superiority? Oh boy, I doubt that.",False
43,msg18014486,https://bitcointalk.org/index.php?topic=1575177.0,,17360,Announcements (Altcoins),2017-02-28 19:11:56,BETAWI,Sr. Member,518,250,,"[ANN] [ICO] BITPARK - New P2P Insurance Platform, ICO 1st untill August 15th","Hi @bitpark_ Your ico is finish and your coin has been listed on exchanger, why you aren't active here give some update about your project? ",False
44,msg18076747,https://bitcointalk.org/index.php?topic=1575177.0,,17360,Announcements (Altcoins),2017-03-05 17:41:46,mcholid80,Newbie,11,0,,"[ANN] [ICO] BITPARK - New P2P Insurance Platform, ICO 1st untill August 15th","Nothing updates since crowdsale ended, what happend?",False
45,msg18658557,https://bitcointalk.org/index.php?topic=1575177.0,,17360,Announcements (Altcoins),2017-04-19 17:14:19,coins467,Member,77,10,,"[ANN] [ICO] BITPARK - New P2P Insurance Platform, ICO 1st untill August 15th",any update about growth,False
46,msg18684621,https://bitcointalk.org/index.php?topic=1575177.0,,17360,Announcements (Altcoins),2017-04-21 15:23:02,coins467,Member,77,10,,"[ANN] [ICO] BITPARK - New P2P Insurance Platform, ICO 1st untill August 15th",dev team working or not,False
47,msg19039144,https://bitcointalk.org/index.php?topic=1575177.0,,17360,Announcements (Altcoins),2017-05-15 22:03:05,Spratan,Hero Member,696,507,,"[ANN] [ICO] BITPARK - New P2P Insurance Platform, ICO 1st untill August 15th",Is it dead ? No news but prices still high.,False
48,msg19817663,https://bitcointalk.org/index.php?topic=1575177.0,,17360,Announcements (Altcoins),2017-06-28 10:16:50,forfunnystuff,Newbie,10,0,,"[ANN] [ICO] BITPARK - New P2P Insurance Platform, ICO 1st untill August 15th",Looks like project is still in full swing per website blog. Can't wait for the inevitable  interest in Japan to move from btc to alts.,False
49,msg20729259,https://bitcointalk.org/index.php?topic=1575177.0,,17360,Announcements (Altcoins),2017-08-09 03:06:36,coins467,Member,77,10,,"[ANN] [ICO] BITPARK - New P2P Insurance Platform, ICO 1st untill August 15th",when BITPARK come on another exchanges,False
50,msg17324481,https://bitcointalk.org/index.php?topic=1575177.0,,17360,Announcements (Altcoins),2016-12-28 11:09:40,bitpark_,Newbie,8,0,,"[ANN] [ICO] BITPARK - New P2P Insurance Platform, ICO 1st untill August 15th","We're developers of BITPARK.   Currently we are negotiating with the developer of BipCoin and Livecoin.  We've already asked coinmaretcap.com to correct the wrong info.  When further development of the matter happens, we'll announce it here.  Thanks,   ",False
51,msg17326771,https://bitcointalk.org/index.php?topic=1575177.0,,17360,Announcements (Altcoins),2016-12-28 15:31:43,Papajager,Hero Member,784,503,,"[ANN] [ICO] BITPARK - New P2P Insurance Platform, ICO 1st untill August 15th",https://www.livecoin.net,False
52,msg17326787,https://bitcointalk.org/index.php?topic=1575177.0,msg17326771,17360,Announcements (Altcoins),2016-12-28 15:34:07,rancemo,Member,90,10,,"[ANN] [ICO] BITPARK - New P2P Insurance Platform, ICO 1st untill August 15th",     It's actually BPC/BTC now.,False
53,msg17326799,https://bitcointalk.org/index.php?topic=1575177.0,msg17326787,17360,Announcements (Altcoins),2016-12-28 15:35:04,MWD64,Sr. Member,476,250,,"[ANN] [ICO] BITPARK - New P2P Insurance Platform, ICO 1st untill August 15th","   FINALLY.  Hey, I built that! That was what I suggested as a replacement. Nice.",False
54,msg17356043,https://bitcointalk.org/index.php?topic=1575177.0,,17360,Announcements (Altcoins),2016-12-31 13:58:36,hdn,Hero Member,663,500,,"[ANN] [ICO] BITPARK - New P2P Insurance Platform, ICO 1st untill August 15th","Hi all, BPC is now on livecoin but im unable to xfer from either wallet, i dont know wether i do the right way because im never use the wallet, appreciate if somebody to assist on how to xfer BPC from wallet to livecoin. thank u in advance.",False
55,msg17357935,https://bitcointalk.org/index.php?topic=1575177.0,,17360,Announcements (Altcoins),2016-12-31 18:23:32,gold969,Sr. Member,1064,251,,"[ANN] [ICO] BITPARK - New P2P Insurance Platform, ICO 1st untill August 15th","Dear friends and girlfriends! Happy New Year! I wish you success, good health and good luck to you and your family, and let come true all the most cherished dreams!",False
56,msg17391298,https://bitcointalk.org/index.php?topic=1575177.0,,17360,Announcements (Altcoins),2017-01-04 08:25:00,honghaisea,Hero Member,938,502,,"[ANN] [ICO] BITPARK - New P2P Insurance Platform, ICO 1st untill August 15th","shit !  BPC not BIP, lost my  btc for buying BIP.   rubish BPC. WTF!!!",False
57,msg17391389,https://bitcointalk.org/index.php?topic=1575177.0,msg17391298,17360,Announcements (Altcoins),2017-01-04 08:40:35,honghaisea,Hero Member,938,502,,"[ANN] [ICO] BITPARK - New P2P Insurance Platform, ICO 1st untill August 15th",  such a stupid coin like bpc would be 40sat. livecoin.com is a rubish exchange    go away from livecoin.,False
58,msg17391428,https://bitcointalk.org/index.php?topic=1575177.0,,17360,Announcements (Altcoins),2017-01-04 08:45:53,Simple858,Hero Member,714,500,,"[ANN] [ICO] BITPARK - New P2P Insurance Platform, ICO 1st untill August 15th","Wait for DEV to make Announctment. Here are the latest news from Bitpark:  Invited users within Japan are currently experiencing the alpha version of our service; Our objective for this release was to receive feedback from invited users within Japan during a limited-time release period. This release also gave us the chance to explain to others the kind of service we hope to provide to users. In doing so, we were able to garner feedback regarding the platform we strive to become.  Through engaging in the alpha version release, we have receive praised for our service — users tell us that the insurance platform we aim to create promises to provide many benefits for customers. We also received feedback regarding the service provision stage that will allow us to make improvements to the service moving forward.  By commencing with this alpha version release, we have attained better clarity as to what kind of insurance platform we should provide to our users. As we proceed forward with development of an upgraded version, we will take all of these suggestions and ideas into special consideration.   Although we are running behind schedule, we are also in the midst of negotiating with several coin exchange platforms to host our original currency. We will make an announcement as soon as negotiations have been completed.",False
59,msg17444687,https://bitcointalk.org/index.php?topic=1575177.0,,17360,Announcements (Altcoins),2017-01-08 21:53:49,MWD64,Sr. Member,476,250,,"[ANN] [ICO] BITPARK - New P2P Insurance Platform, ICO 1st untill August 15th","I want to thank Bitpark Coin for promptly fixing the issue as picking the same ticker symbol BIP as my coin, BipCoin. It caused problems, but the problems are gone now that they've changed their ticker to BPC.  And Bitpark Coin did a good job of promptly taking care of it.  I'll mention this on my radio show tonight.  Best of luck with Bitpark Coin.  MWD BipCoin",False
60,msg17444771,https://bitcointalk.org/index.php?topic=1575177.0,,17360,Announcements (Altcoins),2017-01-08 22:05:45,bittrojan,Hero Member,602,500,,"[ANN] [ICO] BITPARK - New P2P Insurance Platform, ICO 1st untill August 15th","No escrow. You know what that means,  SCAM!",False
61,msg17553759,https://bitcointalk.org/index.php?topic=1575177.0,,17360,Announcements (Altcoins),2017-01-19 13:37:04,Yaremi,Legendary,1610,1049,,"[ANN] [ICO] BITPARK - New P2P Insurance Platform, ICO 1st untill August 15th","Hello. Dear BITPARK community!  BITPARK [BPC] is listed at Livecoin.net Exchange and available for trading.  So, we're asking you to add our Exchange in the official list of Exchanges where people can trade.  Welcome all traders. Thanks!",False
62,msg17613568,https://bitcointalk.org/index.php?topic=1575177.0,,17360,Announcements (Altcoins),2017-01-25 04:51:46,coins467,Member,77,10,,"[ANN] [ICO] BITPARK - New P2P Insurance Platform, ICO 1st untill August 15th",how to download bitpark wallet any wallet create by bitpark or just laugh,False
63,msg17613911,https://bitcointalk.org/index.php?topic=1575177.0,,17360,Announcements (Altcoins),2017-01-25 05:46:30,thepo1m,Hero Member,658,500,,"[ANN] [ICO] BITPARK - New P2P Insurance Platform, ICO 1st untill August 15th","Good to know that this project is not dead after all, the word on the street was that the developer has dissapeared with the ICO fund",False
64,msg17614719,https://bitcointalk.org/index.php?topic=1575177.0,,17360,Announcements (Altcoins),2017-01-25 07:45:57,coins467,Member,77,10,,"[ANN] [ICO] BITPARK - New P2P Insurance Platform, ICO 1st untill August 15th",anyone know where is bitpark wallet ........or permanently store in ether wallet,False
65,msg17634000,https://bitcointalk.org/index.php?topic=1575177.0,msg17614719,17360,Announcements (Altcoins),2017-01-26 21:42:10,mendra_2009,Full Member,420,100,,"[ANN] [ICO] BITPARK - New P2P Insurance Platform, ICO 1st untill August 15th",   Bitpark is using smart contract from Ethereum,False
66,msg17634231,https://bitcointalk.org/index.php?topic=1575177.0,,17360,Announcements (Altcoins),2017-01-26 22:07:32,CryptoSmile,Full Member,770,102,,"[ANN] [ICO] BITPARK - New P2P Insurance Platform, ICO 1st untill August 15th","To view your Bitpark (BPC) balance, proceed as: 1. Go to https://www.myetherwallet.com 2. Click Send Ether & Tokens 3. Select the format of your private key, example: i'm using ""Private Key"" format. Paste your private key and than click ""Unlock"" your Wallet 4. Click Add Custom Token - Address: 0xf3d29fb98d2dc5e78c87198deef99377345fd6f1 - Token Symbol: BPC - Decimal: 8 5. Click Save",False
67,msg17657656,https://bitcointalk.org/index.php?topic=1575177.0,,17360,Announcements (Altcoins),2017-01-29 01:46:52,anehh,Sr. Member,600,250,,"[ANN] [ICO] BITPARK - New P2P Insurance Platform, ICO 1st untill August 15th","Hi anyone join twitter campaign, whether there are received reward from Bitpark bounty?",False
68,msg17688996,https://bitcointalk.org/index.php?topic=1575177.0,,17360,Announcements (Altcoins),2017-01-31 22:12:27,imtiazmahmood,Sr. Member,476,250,,"[ANN] [ICO] BITPARK - New P2P Insurance Platform, ICO 1st untill August 15th","how i get tokens on eth webwallet i have make setup but i don't know how i pay for tokens?  To view your Bitpark (BPC) balance, proceed as: 1. Go to https://www.myetherwallet.com 2. Click Send Ether & Tokens 3. Select the format of your private key, example: i'm using ""Private Key"" format. Paste your private key and than click ""Unlock"" your Wallet 4. Click Add Custom Token - Address: 0xf3d29fb98d2dc5e78c87198deef99377345fd6f1 - Token Symbol: BPC - Decimal: 8 5. Click Save  Same Setup i did but there show 0 token, dev can you please guide me more please?",False
69,msg17698394,https://bitcointalk.org/index.php?topic=1575177.0,msg17326799,17360,Announcements (Altcoins),2017-02-01 17:49:42,bittraffic,Hero Member,1288,514,,"[ANN] [ICO] BITPARK - New P2P Insurance Platform, ICO 1st untill August 15th","   So bitpark lives on livecoin! Who would have thought. There is also another insurance base crypto I saw moments ago. TRUST token base on ethereum, the devs of the team also has no escrow like this one.",False
