id,msg_id,parent_id,link_id,Count_read,Forum,Time,Author,Rank,Activity,Merit,Trust,Title,Body,ScamHeader
70,msg16976186,https://bitcointalk.org/index.php?topic=1575177.0,msg16975962,17360,Announcements (Altcoins),2016-11-24 13:30:02,kamvreto,Legendary,1232,1012,,"[ANN] [ICO] BITPARK - New P2P Insurance Platform, ICO 1st untill August 15th",   can you post with english language please?  bitpark from rusian? ,False
71,msg16981200,https://bitcointalk.org/index.php?topic=1575177.0,,17360,Announcements (Altcoins),2016-11-24 21:30:52,btcforks,Member,84,10,,"[ANN] [ICO] BITPARK - New P2P Insurance Platform, ICO 1st untill August 15th","ICO has ended but there is no recent news here, I hope it stays good and I wait for the latest news to come on this thread",False
72,msg17012180,https://bitcointalk.org/index.php?topic=1575177.0,,17360,Announcements (Altcoins),2016-11-27 23:49:18,PM.coins,Sr. Member,616,250,,"[ANN] [ICO] BITPARK - New P2P Insurance Platform, ICO 1st untill August 15th","Yeah, Dev Last Active: September 24,2016 it's very bad, not profesional team",False
73,msg17012704,https://bitcointalk.org/index.php?topic=1575177.0,,17360,Announcements (Altcoins),2016-11-28 01:21:25,asti5034,Newbie,56,0,,"[ANN] [ICO] BITPARK - New P2P Insurance Platform, ICO 1st untill August 15th","no news from dev, huftt",False
74,msg17061129,https://bitcointalk.org/index.php?topic=1575177.0,msg17041146,17360,Announcements (Altcoins),2016-12-02 16:33:36,globalbtc21,Member,82,10,,"[ANN] [ICO] BITPARK - New P2P Insurance Platform, ICO 1st untill August 15th",   yes may be he is sleeping with some more dev's /// lol people waiting for the platform and updates,False
75,msg17061261,https://bitcointalk.org/index.php?topic=1575177.0,msg17012180,17360,Announcements (Altcoins),2016-12-02 16:45:42,synthgauge,Hero Member,1063,501,,"[ANN] [ICO] BITPARK - New P2P Insurance Platform, ICO 1st untill August 15th", ,False
76,msg17061368,https://bitcointalk.org/index.php?topic=1575177.0,,17360,Announcements (Altcoins),2016-12-02 16:56:59,nezto77,Hero Member,868,501,,"[ANN] [ICO] BITPARK - New P2P Insurance Platform, ICO 1st untill August 15th",no news and updates from dev?,False
77,msg17091007,https://bitcointalk.org/index.php?topic=1575177.0,msg17061368,17360,Announcements (Altcoins),2016-12-05 18:28:13,synthgauge,Hero Member,1063,501,,"[ANN] [ICO] BITPARK - New P2P Insurance Platform, ICO 1st untill August 15th","     No, only updates from me. I can provide an update if u want.",False
78,msg17091833,https://bitcointalk.org/index.php?topic=1575177.0,msg17091007,17360,Announcements (Altcoins),2016-12-05 20:05:14,gold969,Sr. Member,1064,251,,"[ANN] [ICO] BITPARK - New P2P Insurance Platform, ICO 1st untill August 15th",  are there news ?,False
79,msg17165522,https://bitcointalk.org/index.php?topic=1575177.0,,17360,Announcements (Altcoins),2016-12-13 00:25:08,Jian_Liux,Sr. Member,433,250,,"[ANN] [ICO] BITPARK - New P2P Insurance Platform, ICO 1st untill August 15th","Whether at ico not reach the target, so the team does not work anymore bitpark. Come dev, many people have been waiting for you to provide clarification",False
80,msg17171449,https://bitcointalk.org/index.php?topic=1575177.0,,17360,Announcements (Altcoins),2016-12-13 15:06:30,jeha2015,Full Member,150,100,,"[ANN] [ICO] BITPARK - New P2P Insurance Platform, ICO 1st untill August 15th","my hope, bitpark listed soon",False
81,msg17224192,https://bitcointalk.org/index.php?topic=1575177.0,,17360,Announcements (Altcoins),2016-12-18 18:03:01,globalbtc21,Member,82,10,,"[ANN] [ICO] BITPARK - New P2P Insurance Platform, ICO 1st untill August 15th","they are not reading out threads , hope they will do something",False
82,msg17244410,https://bitcointalk.org/index.php?topic=1575177.0,msg17224192,17360,Announcements (Altcoins),2016-12-20 17:52:50,gold969,Sr. Member,1064,251,,"[ANN] [ICO] BITPARK - New P2P Insurance Platform, ICO 1st untill August 15th","  remained only to hope . my opinion - I got nothing, only chinks on a purse which nobody is needed ! it is possible to vote on an exchange, but it is not github !",False
83,msg17244877,https://bitcointalk.org/index.php?topic=1575177.0,,17360,Announcements (Altcoins),2016-12-20 18:39:24,disconnectme,Hero Member,1120,504,,"[ANN] [ICO] BITPARK - New P2P Insurance Platform, ICO 1st untill August 15th","Where are Bitpark developers, they should please try to communicate with us, the exchange news came around October and the team just decided to enter again into their shell",False
84,msg17294066,https://bitcointalk.org/index.php?topic=1575177.0,,17360,Announcements (Altcoins),2016-12-25 10:13:54,MWD64,Sr. Member,476,250,,"[ANN] [ICO] BITPARK - New P2P Insurance Platform, ICO 1st untill August 15th","The ticker symbol ""BIP"" is taken   BIP is used by our coin BipCoin which was released Aug 20, 2016: https://bitcointalk.org/index.php?topic=1592050.0  The first 3 letters of every BipCoin address are BIP.  We're already on an exchange (Cryptopia) as BIP.  We're listed on  BipCoin was written up in CoinTelegraph this week: https://cointelegraph.com/news/bipcoin-to-provide-censorship-proof-dns-succeed-where-namecoin-failed  BipCoin is an active coin with active development.  We're already on coinmarketcap.com as BIP: https://coinmarketcap.com/currencies/bipcoin/  The first time I see you using ""BIP"" is November 9th, 2016: https://bitcointalk.org/index.php?topic=1575177.msg16828194#msg16828194  I STRONGLY suggest you change your symbol from BIP to something else, while it's still easy and non-embarrassing to do so.   I'd suggest maybe BPC which is not taken according to a quick search on https://coinmarketcap.com/currencies/views/all/ coinmarketcap. (Surprising that you didn't search there before deciding on ""BIP."")  I wish you you and your coin well. But it's going to be a constant hassle for you and for us if you don't change it. Including that you may lose business from people buying our coin when they think they're buying your coin.  I think this is something that people investing in your ICO would not be happy with.  I know you are on at least one exchange, LiveCoin, but they would probably change it if you ask them now before there's a lot of volume.  Please let me know what you decide to to.   Take care, MWD, BipCoin Dev team.",False
85,msg17294939,https://bitcointalk.org/index.php?topic=1575177.0,msg17294880,17360,Announcements (Altcoins),2016-12-25 12:15:32,MWD64,Sr. Member,476,250,,"[ANN] [ICO] BITPARK - New P2P Insurance Platform, ICO 1st untill August 15th","   I see your answer is simply the date of the ICO announcement. But that's not the date you are started using the symbol BIP. It wasn't on this thread until November. And as far as I can tell it wasn't used in commerce anywhere until you got listed on livecoin. That started this month, didn't it?  You still aren't listed on https://coinmarketcap.com/ which is commonly considered the ""first use in commerce"" for cryptos ticker symbols. The also won't list two coins with the same symbol.  My request isn't a ""YOU MUST STOP USING THIS SYMBOL."" I can't make you do that. It's much more ""You'd be crazy to keep using this symbol, and it will work against you, not for you, to not change it now before you use your symbol a lot more places.""  So is your answer that you are on the team of this coin and that you refuse to consider changing it? I'd love it if you're clear in your reply. A date is not a clear reply.",False
86,msg17299808,https://bitcointalk.org/index.php?topic=1575177.0,msg17299161,17360,Announcements (Altcoins),2016-12-25 23:38:31,MWD64,Sr. Member,476,250,,"[ANN] [ICO] BITPARK - New P2P Insurance Platform, ICO 1st untill August 15th","   I'm surprised there are investors who want to respond. I finally read this whole thread. Last two or 3 pages seem to be largely people who invested money saying they never got their token, and that the dev team is no longer responding to their emails.",False
87,msg17309757,https://bitcointalk.org/index.php?topic=1575177.0,,17360,Announcements (Altcoins),2016-12-27 00:39:42,lm1369,Newbie,21,0,,"[ANN] [ICO] BITPARK - New P2P Insurance Platform, ICO 1st untill August 15th","Here there is a great problem with the pools. I have mined xmr and it pays to me a day what the calculators mark. I mining bipcoin I have left it several times because I do not see that the payments are consistent with the calculators, almost always it is the half. For example today, that it started paying well and then that the difficulty raised, it stops doing. With my speed, it has to pay me 1.25 Bip per hour at this moment but there is a payment that was late almost 8 hours and was 5.2 Bip  http://i68.tinypic.com/r9kkfd.jpg",False
88,msg17309821,https://bitcointalk.org/index.php?topic=1575177.0,msg17309757,17360,Announcements (Altcoins),2016-12-27 00:50:30,MWD64,Sr. Member,476,250,,"[ANN] [ICO] BITPARK - New P2P Insurance Platform, ICO 1st untill August 15th","    This is not the BipCoin tread.  This is the tread of Bitpark Coin, a totally irresponsible coin that fucked up BipCoin and probably no one will ever list Bitpark Coin on an exchange again. Because Bitpark Coin were sloppy and picked a ticker symbol (BIP) that was already in use by another coin (BipCoin). BipCoin is a known coin, and has been already being mined and sold and bought for months. Bitpark Coin didn't bother checking. It takes 2 minutes to check. Now people are buying one coin thinking they're buying another.  I got it taken care off, alerted all exchanges about it, and listing places, but it's still incorrectly listed one place. Hopefully that will change soon.  I spent most of my whole Christmas dealing with bullshit fallout from Bitpark Coin's flaky bullshit. Should have been with my family, but instead was minimizing damage done by a coin that seems like it's run by 8 year olds.   Here's the thread for our coin, BipCoin. The page I'm linking to is more detail about Bitpark Coin's huge fuck up. But yeah this is the thread where posting should get an answer. Thanks! https://bitcointalk.org/index.php?topic=1720595.msg17307807#msg17307807  Before you do though, I'm curious, can you tell me how you ended up posting here? Feel free to post it here. Bitcoin Park deserve to deal with off-topic posts since they've effectively made my coin an off-topic COIN some places where we already were. And they MAY HAVE MADE IT HARDER FOR BipCoin TO GET LISTED ON OTHER EXCHANGES.",False
89,msg17309864,https://bitcointalk.org/index.php?topic=1575177.0,,17360,Announcements (Altcoins),2016-12-27 00:57:41,MWD64,Sr. Member,476,250,,"[ANN] [ICO] BITPARK - New P2P Insurance Platform, ICO 1st untill August 15th"," I'm not going to sue Bitcoin Park, but I'd probably have a good case, with the damage they caused by stealing our ticker symbol and getting their coin listed as my coin on some of the same places we're listed.  And I can't submit to any exchanges or press or anything until this is fixed, because I'll have to explain it, which will complicate things with whoever I'm submitting our coin to.  We're in the middle of a fundraiser for our Dot-Bip plans. If we don't reach our goal now, we'll always wonder if this had something to do with it, since some people already think WE did something sleazy because of our coin feeding from ticker of another coin now on many services, when we actually did nothing at all.  If Bitcoin Park were smart, they'd immediately change their ticker symbol, then offer me some BTC for the hassle they've caused me, just to slightly restore faith in their coin. But I don't think they're smart, because they are not responding to emails from me. Or from their investors, according to some posts on this thread.",False
90,msg16715962,https://bitcointalk.org/index.php?topic=1575177.0,,17360,Announcements (Altcoins),2016-10-28 23:41:33,MbakNarti,Sr. Member,681,254,,"[ANN] [ICO] BITPARK - New P2P Insurance Platform, ICO 1st untill August 15th","Q4 2016:  INVITE ONLY Bitpark Mujin Community Alpha Open/start trade (bittrex.com , etc.)  When about Q4?",False
91,msg16752453,https://bitcointalk.org/index.php?topic=1575177.0,,17360,Announcements (Altcoins),2016-11-02 10:44:19,mooccowmoo,Full Member,396,100,,"[ANN] [ICO] BITPARK - New P2P Insurance Platform, ICO 1st untill August 15th",hallo BITPARK,False
92,msg16752649,https://bitcointalk.org/index.php?topic=1575177.0,,17360,Announcements (Altcoins),2016-11-02 11:04:39,bittraffic,Hero Member,1288,514,,"[ANN] [ICO] BITPARK - New P2P Insurance Platform, ICO 1st untill August 15th","isn't this like inchain which is currently on ICO? They need to have at least 5M USD to start the project as they say and if they don't have the amount, the project may be cancelled and funds will be returned. Its somehow what is worrisome for the bounty hunters these days.  The team just get the best out of them.",False
93,msg16765052,https://bitcointalk.org/index.php?topic=1575177.0,msg16660394,17360,Announcements (Altcoins),2016-11-03 15:59:08,coinmenace,Hero Member,882,500,,"[ANN] [ICO] BITPARK - New P2P Insurance Platform, ICO 1st untill August 15th",   Where did you get that info that ICO is delayed till January? Dev is already on holiday witht the BTC collected in 1st & 2nd ICO phases.,False
94,msg16795256,https://bitcointalk.org/index.php?topic=1575177.0,,17360,Announcements (Altcoins),2016-11-06 17:45:13,mooccowmoo,Full Member,396,100,,"[ANN] [ICO] BITPARK - New P2P Insurance Platform, ICO 1st untill August 15th",https://twitter.com/icobitpark/status/794879892126994432 ,False
95,msg16828194,https://bitcointalk.org/index.php?topic=1575177.0,,17360,Announcements (Altcoins),2016-11-09 22:48:44,gold969,Sr. Member,1064,251,,"[ANN] [ICO] BITPARK - New P2P Insurance Platform, ICO 1st untill August 15th","BITPARK Token distribution date has changed from November 1 to November 9.  There is still some effect to Ethereum network starting last month. Therefore we have been observing the situation by test sending/receiving Tokens among synchronized multiple platforms. Starting today we are test sending BITPARK Token (BIP) to your registered BITPARK Token (BIP).  Please confirm with your Wallet.  Once you made sure of receiving 0.0001 BIP, open the browser about2ndico page. Press the button of ""Request The BITPARK Tokens.",False
96,msg16828203,https://bitcointalk.org/index.php?topic=1575177.0,msg16828194,17360,Announcements (Altcoins),2016-11-09 22:50:36,gold969,Sr. Member,1064,251,,"[ANN] [ICO] BITPARK - New P2P Insurance Platform, ICO 1st untill August 15th",  https://bitpark.net/blog.html,False
97,msg16838828,https://bitcointalk.org/index.php?topic=1575177.0,msg16828203,17360,Announcements (Altcoins),2016-11-10 23:07:01,kaconk,Hero Member,971,502,,"[ANN] [ICO] BITPARK - New P2P Insurance Platform, ICO 1st untill August 15th","   i'm a participant for this coin. but i'm forget to submit the eth address before, how to claim the coin? what the address contract for bitpark coin. (address, name, decimal).",False
98,msg16842966,https://bitcointalk.org/index.php?topic=1575177.0,,17360,Announcements (Altcoins),2016-11-11 11:01:40,jacaf01,Hero Member,742,500,,"[ANN] [ICO] BITPARK - New P2P Insurance Platform, ICO 1st untill August 15th","Thanks you BITPARK team, I received your message  for the bounty distribution, but I tried to register an account using the description given on this page https://bitpark.net/campaign_howto.html, this message  ""An error occurred.  Sorry, the page you are looking for is currently unavailable. Please try again later.  If you are the system administrator of this resource then you should check the error log for details.  Faithfully yours, nginx.""  is what I was getting.  Any solution to this. Thanks",False
99,msg16843222,https://bitcointalk.org/index.php?topic=1575177.0,msg16842966,17360,Announcements (Altcoins),2016-11-11 11:39:17,5ato5hi8itcoin,Member,168,10,,"[ANN] [ICO] BITPARK - New P2P Insurance Platform, ICO 1st untill August 15th",  awaiting further information from them in this thread,False
100,msg16854906,https://bitcointalk.org/index.php?topic=1575177.0,,17360,Announcements (Altcoins),2016-11-12 15:26:34,rolik2001,Hero Member,1120,500,,"[ANN] [ICO] BITPARK - New P2P Insurance Platform, ICO 1st untill August 15th",when we see bitpark on bittrex,False
101,msg16863880,https://bitcointalk.org/index.php?topic=1575177.0,msg16838828,17360,Announcements (Altcoins),2016-11-13 14:28:43,CryptoSmile,Full Member,770,102,,"[ANN] [ICO] BITPARK - New P2P Insurance Platform, ICO 1st untill August 15th",   Token contract address: 0xf3d29fb98d2dc5e78c87198deef99377345fd6f1 Token name: BITPARK Symbol: BIP Decimal: 8,False
102,msg16866890,https://bitcointalk.org/index.php?topic=1575177.0,msg16863283,17360,Announcements (Altcoins),2016-11-13 20:10:56,rolik2001,Hero Member,1120,500,,"[ANN] [ICO] BITPARK - New P2P Insurance Platform, ICO 1st untill August 15th",  team work very long,False
103,msg16873173,https://bitcointalk.org/index.php?topic=1575177.0,msg16866890,17360,Announcements (Altcoins),2016-11-14 13:18:27,gold969,Sr. Member,1064,251,,"[ANN] [ICO] BITPARK - New P2P Insurance Platform, ICO 1st untill August 15th","     мoнeты пpишли  ocтaлocь дoждaтьcя выxoдa нa биpжи , гдe мы cмoжeм yзнaть o вpeмeни выxoдa нa биpжи ?",False
104,msg16873909,https://bitcointalk.org/index.php?topic=1575177.0,,17360,Announcements (Altcoins),2016-11-14 14:41:16,len01,Hero Member,602,500,,"[ANN] [ICO] BITPARK - New P2P Insurance Platform, ICO 1st untill August 15th",not yet update from dev last tweet from bitpark on nov 5 https://twitter.com/icobitpark/status/794879892126994432,False
105,msg16873978,https://bitcointalk.org/index.php?topic=1575177.0,msg16873909,17360,Announcements (Altcoins),2016-11-14 14:49:14,btcdie,Sr. Member,358,250,,"[ANN] [ICO] BITPARK - New P2P Insurance Platform, ICO 1st untill August 15th","  I'm receive DM from the dev today. ""Thank you for participating in our campaign. Please visit to the following application page to receive your reward. https://bitpark.net/campaign_howto.html"". anyone receive notif from the dev too?",False
106,msg16876469,https://bitcointalk.org/index.php?topic=1575177.0,,17360,Announcements (Altcoins),2016-11-14 19:43:43,mendra_2009,Full Member,420,100,,"[ANN] [ICO] BITPARK - New P2P Insurance Platform, ICO 1st untill August 15th","Team of BITPARK infrequently updated news about their projects, I was difficult to follow this thread",False
107,msg16879960,https://bitcointalk.org/index.php?topic=1575177.0,msg16873173,17360,Announcements (Altcoins),2016-11-15 05:28:19,rolik2001,Hero Member,1120,500,,"[ANN] [ICO] BITPARK - New P2P Insurance Platform, ICO 1st untill August 15th",  нигдe пoкa нaдo cлeдить зa oфф твитepвми биpж,False
108,msg16903166,https://bitcointalk.org/index.php?topic=1575177.0,msg16842966,17360,Announcements (Altcoins),2016-11-17 10:14:56,ostrogoto2012,Hero Member,966,500,,"[ANN] [ICO] BITPARK - New P2P Insurance Platform, ICO 1st untill August 15th",   got same problem!,False
109,msg16955372,https://bitcointalk.org/index.php?topic=1575177.0,,17360,Announcements (Altcoins),2016-11-22 16:14:18,mendra_2009,Full Member,420,100,,"[ANN] [ICO] BITPARK - New P2P Insurance Platform, ICO 1st untill August 15th","This crowdsale is ended, why a team bitpark slow respon about news update  It's very bad!",False
110,msg16464827,https://bitcointalk.org/index.php?topic=1575177.0,,17360,Announcements (Altcoins),2016-10-05 16:32:59,PM.coins,Sr. Member,616,250,,"[ANN] [ICO] BITPARK - New P2P Insurance Platform, ICO 1st untill August 15th",No answer about 2FA fiture?,False
111,msg16560845,https://bitcointalk.org/index.php?topic=1575177.0,,17360,Announcements (Altcoins),2016-10-14 14:03:38,Crypto Man,Newbie,74,0,,"[ANN] [ICO] BITPARK - New P2P Insurance Platform, ICO 1st untill August 15th","          The latest news from the tweeter for September 19:  ""BITPARK #ICO: From September 15th to October 15th. 1st week bonus: 10% bonus. https://ico.bitpark.net""   No more news!",False
112,msg16560968,https://bitcointalk.org/index.php?topic=1575177.0,,17360,Announcements (Altcoins),2016-10-14 14:14:52,wrxbuzz,Sr. Member,293,250,,"[ANN] [ICO] BITPARK - New P2P Insurance Platform, ICO 1st untill August 15th","So many gave scammer money, no wonder there are so many scammers in the community",False
113,msg16563845,https://bitcointalk.org/index.php?topic=1575177.0,msg16560941,17360,Announcements (Altcoins),2016-10-14 19:05:19,coinmenace,Hero Member,882,500,,"[ANN] [ICO] BITPARK - New P2P Insurance Platform, ICO 1st untill August 15th",   any news about dev - looks like he is gone and went on holiday. haven't logged in since 24-Sept.  are these figures correct?  Quote 1st ICO finished. Thank you very much. 5 million tokens 408 Investors 38.48637671 BTC Raised  Quote 2nd ICO: from September 15th to October 15th BTC Raised ฿15.4126235 Investors 256,False
114,msg16565288,https://bitcointalk.org/index.php?topic=1575177.0,,17360,Announcements (Altcoins),2016-10-14 21:50:11,Valdemar,Member,170,10,,"[ANN] [ICO] BITPARK - New P2P Insurance Platform, ICO 1st untill August 15th",Any update?,False
115,msg16570931,https://bitcointalk.org/index.php?topic=1575177.0,,17360,Announcements (Altcoins),2016-10-15 13:00:28,Mallyx,Hero Member,854,509,,"[ANN] [ICO] BITPARK - New P2P Insurance Platform, ICO 1st untill August 15th",Seem the ICO 2nd round has been extended until 20th Oct. The dev don't seem to be a lot on BTCTalk but you can find updates on Twitter and on the official website. https://twitter.com/BITPARK_ https://bitpark.net/  Take care.,False
116,msg16572059,https://bitcointalk.org/index.php?topic=1575177.0,,17360,Announcements (Altcoins),2016-10-15 14:47:58,indobitcoin.tk,Sr. Member,700,250,,"[ANN] [ICO] BITPARK - New P2P Insurance Platform, ICO 1st untill August 15th",any social med bounty dev??? i want joined socisl med campaign thank you,False
117,msg16581495,https://bitcointalk.org/index.php?topic=1575177.0,,17360,Announcements (Altcoins),2016-10-16 12:10:20,dilemamis,Full Member,249,100,,"[ANN] [ICO] BITPARK - New P2P Insurance Platform, ICO 1st untill August 15th",https://twitter.com/BITPARK_/status/787335804062277632 soon,False
118,msg16627684,https://bitcointalk.org/index.php?topic=1575177.0,,17360,Announcements (Altcoins),2016-10-20 15:59:42,bandung01,Full Member,128,100,,"[ANN] [ICO] BITPARK - New P2P Insurance Platform, ICO 1st untill August 15th",What it's  bounty ?,False
119,msg16635909,https://bitcointalk.org/index.php?topic=1575177.0,,17360,Announcements (Altcoins),2016-10-21 11:37:00,dilemamis,Full Member,249,100,,"[ANN] [ICO] BITPARK - New P2P Insurance Platform, ICO 1st untill August 15th",no launch ,False
120,msg16641324,https://bitcointalk.org/index.php?topic=1575177.0,,17360,Announcements (Altcoins),2016-10-21 22:19:49,mendra_2009,Full Member,420,100,,"[ANN] [ICO] BITPARK - New P2P Insurance Platform, ICO 1st untill August 15th",There are 2 account: - https://twitter.com/BITPARK_ - https://twitter.com/icobitpark  Which official twitter of Bitpark?,False
121,msg16645535,https://bitcointalk.org/index.php?topic=1575177.0,msg16641324,17360,Announcements (Altcoins),2016-10-22 10:54:10,Mallyx,Hero Member,854,509,,"[ANN] [ICO] BITPARK - New P2P Insurance Platform, ICO 1st untill August 15th",   It's https://twitter.com/BITPARK_ (written on OP),False
122,msg16646261,https://bitcointalk.org/index.php?topic=1575177.0,msg16646250,17360,Announcements (Altcoins),2016-10-22 12:31:39,Mallyx,Hero Member,854,509,,"[ANN] [ICO] BITPARK - New P2P Insurance Platform, ICO 1st untill August 15th","   ICO is over, you can find some news on the blog: https://bitpark.net/blog.html Not that much atm, seem like the dev isn't a lot on BTCTalk.",False
123,msg16650602,https://bitcointalk.org/index.php?topic=1575177.0,msg16645535,17360,Announcements (Altcoins),2016-10-22 21:34:26,mendra_2009,Full Member,420,100,,"[ANN] [ICO] BITPARK - New P2P Insurance Platform, ICO 1st untill August 15th","   So sorry, for bitpark twitter bounty?  ",False
124,msg16656113,https://bitcointalk.org/index.php?topic=1575177.0,,17360,Announcements (Altcoins),2016-10-23 13:08:41,Spratan,Hero Member,696,507,,"[ANN] [ICO] BITPARK - New P2P Insurance Platform, ICO 1st untill August 15th",No news from devs. Moreover I noticed removed posts...,False
125,msg16656233,https://bitcointalk.org/index.php?topic=1575177.0,,17360,Announcements (Altcoins),2016-10-23 13:23:42,axrhuls,Sr. Member,248,250,,"[ANN] [ICO] BITPARK - New P2P Insurance Platform, ICO 1st untill August 15th","OP is offline for 1 month, you guys still bump this scam?     Can't you analyze it? If not, you hardly earn money from crypto",False
126,msg16656411,https://bitcointalk.org/index.php?topic=1575177.0,,17360,Announcements (Altcoins),2016-10-23 13:45:20,sulec70,Sr. Member,373,250,,"[ANN] [ICO] BITPARK - New P2P Insurance Platform, ICO 1st untill August 15th","yEP! bitpark_ he is Last Active: September 24, 2016  I think this JOKE!",False
127,msg16658590,https://bitcointalk.org/index.php?topic=1575177.0,,17360,Announcements (Altcoins),2016-10-23 17:30:41,mendra_2009,Full Member,420,100,,"[ANN] [ICO] BITPARK - New P2P Insurance Platform, ICO 1st untill August 15th",Is there anyone here who joined crowdsale Bitpark yesterday?,False
128,msg16660394,https://bitcointalk.org/index.php?topic=1575177.0,,17360,Announcements (Altcoins),2016-10-23 21:38:36,Spratan,Hero Member,696,507,,"[ANN] [ICO] BITPARK - New P2P Insurance Platform, ICO 1st untill August 15th",ICO delayed till January ,False
129,msg16695042,https://bitcointalk.org/index.php?topic=1575177.0,msg16658590,17360,Announcements (Altcoins),2016-10-27 02:04:09,hdn,Hero Member,663,500,,"[ANN] [ICO] BITPARK - New P2P Insurance Platform, ICO 1st untill August 15th",   I join 1st ico and received token few days after 1st completed,False
