id,msg_id,parent_id,link_id,Count_read,Forum,Time,Author,Rank,Activity,Merit,Trust,Title,Body,ScamHeader
185,msg15835382,https://bitcointalk.org/index.php?topic=1575177.0,msg15819628,17360,Announcements (Altcoins),2016-08-06 05:49:14,electronicash,Legendary,1414,1006,,"[ANN] [ICO] BITPARK - New P2P Insurance Platform, ICO 1st untill August 15th",   Me too. But then i learned some lesson and that i'd rather buy the coon on exchange after all they'd be cheaper later when those users who bought during dumped thier coins. Less risk when doing that.,False
186,msg15840836,https://bitcointalk.org/index.php?topic=1575177.0,,17360,Announcements (Altcoins),2016-08-06 18:28:48,klarki,Legendary,1554,1127,,"[ANN] [ICO] BITPARK - New P2P Insurance Platform, ICO 1st untill August 15th","I am also interested in this issue. Now the weekend, apparently this is not the answer.",False
187,msg15853446,https://bitcointalk.org/index.php?topic=1575177.0,,17360,Announcements (Altcoins),2016-08-08 04:18:38,OCTOPARTY,Hero Member,532,500,,"[ANN] [ICO] BITPARK - New P2P Insurance Platform, ICO 1st untill August 15th","I have participated in the ICO. I didn't throw too much at it, but figured may as well throw some btc down for the extra 50%.  I do have some questions though:  1. What is the reason for holding 2 ICO sales? 2. How much are you looking to raise in the ICOs? 3. What markets are you looking to add Bitpark to first? Smaller exchanges or are you shooting for Bittrex or Poloniex right away? 4. It doesn't look like the first ICO has too much traction. What is the advantage of people participating in the first ICO versus the second ICO sale later?  Thanks!  Edit: Never mind on some of the questions. I see the advantage is the 50% bonus and the cheaper price is for the first phase of the ICO.",False
188,msg15853459,https://bitcointalk.org/index.php?topic=1575177.0,,17360,Announcements (Altcoins),2016-08-08 04:20:59,legendbtc,Hero Member,770,500,,"[ANN] [ICO] BITPARK - New P2P Insurance Platform, ICO 1st untill August 15th",It seems Bit park is having some good thinking in Mind.,False
189,msg15856904,https://bitcointalk.org/index.php?topic=1575177.0,,17360,Announcements (Altcoins),2016-08-08 12:25:04,regexlove,Full Member,610,100,,"[ANN] [ICO] BITPARK - New P2P Insurance Platform, ICO 1st untill August 15th","Interesting goals!  But ICO has a logic error, you can't have both:  Fixed amount of coins distributed per ICO round  +  Fixed amount of discount per ICO round.  The fixed discount rate of the first round must determine either the price or the amount of the following rounds.   and a few English issues(?):            (Better?: We do not require a minimum amount of Bitcoin to be raised during the first round of the ICO. Or: Minimum amount of Bitcoin to be raised: None     ICO 2st September 5th until October 15th      (2nd ICO)  , leading to the obvious interpretation options:  ICO was designed in a hurry; or only people in a hurry shall participate the ICO; or ICO shall not be too successful.  More: What about whitepaper, yellowpaper, github, ...?  I came to bitpark being advertised on coinmarketcap booked through google, last time i noticed an ICO this way was Ziftrcoin. Will you publish the bitcoin wallet's public key of all ICO funds? (Ziftrcoin didn't) Did someone participate yet and is willing to share to what bitcoin address they send it?  Filenames may not mean anything, just also rather generic/hurried than not  https://bitpark.net/images/person1.png  https://bitpark.net/images/person2.png",False
