id,msg_id,parent_id,link_id,Count_read,Forum,Time,Author,Rank,Activity,Merit,Trust,Title,Body,ScamHeader
993,msg28926831,https://bitcointalk.org/index.php?topic=2659341.0,msg28898830,14728,Announcements (Altcoins),2018-01-25 21:30:24,celestio,Sr. Member,770,250,,[ANN] The Decentralized platform for gaming DApp's. MVP in development.,   Are you saying solidity is too fast for this application or too slow?,False
994,msg28936129,https://bitcointalk.org/index.php?topic=2659341.0,,14728,Announcements (Altcoins),2018-01-26 02:07:21,AllCoinHunter,Member,280,15,,[ANN] The Decentralized platform for gaming DApp's. MVP in development.,"Jackpot game project is very interested in many people, especially with the concept as done by sp8de very interesting and arguably make a lot of people to try luck in a concept like this.",False
995,msg28936958,https://bitcointalk.org/index.php?topic=2659341.0,msg28936129,14728,Announcements (Altcoins),2018-01-26 02:36:24,Jaka.Sembuh,Full Member,448,100,,[ANN] The Decentralized platform for gaming DApp's. MVP in development.,"  It is true the gambling projects like this will certainly attract many participants to support and join the project, as many of the benefits offered by the project to participants.",False
996,msg28941522,https://bitcointalk.org/index.php?topic=2659341.0,,14728,Announcements (Altcoins),2018-01-26 05:04:27,mafia15,Member,214,10,,[ANN] The Decentralized platform for gaming DApp's. MVP in development.,When will the bounty campaign starts been waiting for the announcement about your bounty,False
997,msg28948537,https://bitcointalk.org/index.php?topic=2659341.0,,14728,Announcements (Altcoins),2018-01-26 07:52:14,ggcript,Full Member,392,100,,[ANN] The Decentralized platform for gaming DApp's. MVP in development.,Good afternoon. Can I buy tokens for DASH?,False
998,msg28948614,https://bitcointalk.org/index.php?topic=2659341.0,msg28948537,14728,Announcements (Altcoins),2018-01-26 07:53:58,askon,Full Member,252,100,,[ANN] The Decentralized platform for gaming DApp's. MVP in development.,"  No, only ETH, ADA  and, of course, bitcoins are accepted.",False
999,msg28948817,https://bitcointalk.org/index.php?topic=2659341.0,,14728,Announcements (Altcoins),2018-01-26 07:57:27,specialAU,Member,378,10,,[ANN] The Decentralized platform for gaming DApp's. MVP in development.,Hey. How long is it left before the end of the preliminary sale of Spade tokens?,False
1000,msg28949207,https://bitcointalk.org/index.php?topic=2659341.0,msg28948817,14728,Announcements (Altcoins),2018-01-26 08:04:18,jager44,Full Member,350,100,,[ANN] The Decentralized platform for gaming DApp's. MVP in development.,"  Hi. There’re less than two weeks, so I’d advise u to hurry up.",False
1001,msg28949707,https://bitcointalk.org/index.php?topic=2659341.0,,14728,Announcements (Altcoins),2018-01-26 08:13:01,californybit,Full Member,392,100,,[ANN] The Decentralized platform for gaming DApp's. MVP in development.,How much does receive the person who managed to win the competition and get the right to mine the block? Will it be a fixed amount in tokens of your platform?,False
1002,msg28950069,https://bitcointalk.org/index.php?topic=2659341.0,,14728,Announcements (Altcoins),2018-01-26 08:19:36,romfish,Full Member,378,101,,[ANN] The Decentralized platform for gaming DApp's. MVP in development.,Good afternoon. What role does the Publicly Verifiable Secret Sharing protocol play on your platform? I’ve never heard about it before.,False
1003,msg28954328,https://bitcointalk.org/index.php?topic=2659341.0,,14728,Announcements (Altcoins),2018-01-26 09:31:18,Ackedy,Member,210,10,,[ANN] The Decentralized platform for gaming DApp's. MVP in development.,Hi there. I don’t really understand how did you manage to turn a really predictable POS protocol into the system which really generates random numbers.,False
1004,msg28954466,https://bitcointalk.org/index.php?topic=2659341.0,msg28954328,14728,Announcements (Altcoins),2018-01-26 09:33:29,MadduckUK,Full Member,336,100,,[ANN] The Decentralized platform for gaming DApp's. MVP in development.,  It became possible due to Follow-The-Satoshi procedure which is the core of  Ouroboros protocol that is used on this platform. ,False
1005,msg28954636,https://bitcointalk.org/index.php?topic=2659341.0,msg28954466,14728,Announcements (Altcoins),2018-01-26 09:36:39,Ackedy,Member,210,10,,[ANN] The Decentralized platform for gaming DApp's. MVP in development.,  How does this wonderful protocol work? Can you describe the principles of its operation?,False
1006,msg28954756,https://bitcointalk.org/index.php?topic=2659341.0,msg28954636,14728,Announcements (Altcoins),2018-01-26 09:38:37,MadduckUK,Full Member,336,100,,[ANN] The Decentralized platform for gaming DApp's. MVP in development.,  No problem! First a random smallest unit of the system is being chosen – Satoshi – it has its own serial number. The protocol determines who owns this Satoshi and this user receives the right to create a block.,False
1007,msg28869264,https://bitcointalk.org/index.php?topic=2659341.0,msg28850040,14728,Announcements (Altcoins),2018-01-25 05:23:30,Bitventurer,Sr. Member,488,250,,[ANN] The Decentralized platform for gaming DApp's. MVP in development.,"   Please, refer to our roadmap.",False
1008,msg28869401,https://bitcointalk.org/index.php?topic=2659341.0,msg28847664,14728,Announcements (Altcoins),2018-01-25 05:27:50,Bitventurer,Sr. Member,488,250,,[ANN] The Decentralized platform for gaming DApp's. MVP in development.,"   The key is the frequency, my friend. There are many ways to come up with something random using the block contents. None of them is without its problems that are quite fundamental in nature. The point is, however, how do you produce 1000 different RN/second.",False
1009,msg28872434,https://bitcointalk.org/index.php?topic=2659341.0,msg28822307,14728,Announcements (Altcoins),2018-01-25 06:43:42,Bitventurer,Sr. Member,488,250,,[ANN] The Decentralized platform for gaming DApp's. MVP in development.,"    Not exactly one hundred percent correct. There will be some house edge: the point is that it will be driven purely by the market forces: given that anyone can reproduce any DApp that is created, the house edge will be the MR=MC-ish equilibrium.",False
1010,msg28872516,https://bitcointalk.org/index.php?topic=2659341.0,msg28819253,14728,Announcements (Altcoins),2018-01-25 06:45:35,Bitventurer,Sr. Member,488,250,,[ANN] The Decentralized platform for gaming DApp's. MVP in development.,   We have public (distributed) randomness.,False
1011,msg28872607,https://bitcointalk.org/index.php?topic=2659341.0,msg28812799,14728,Announcements (Altcoins),2018-01-25 06:47:41,Bitventurer,Sr. Member,488,250,,[ANN] The Decentralized platform for gaming DApp's. MVP in development.,"   Referring to the whitepaper is very important for understanding the nature of any project.  In short, the entropy is generated purely on-chain: no oracles, no third parties, full by-the-book decentralization.",False
1012,msg28872666,https://bitcointalk.org/index.php?topic=2659341.0,msg28818877,14728,Announcements (Altcoins),2018-01-25 06:48:59,Bitventurer,Sr. Member,488,250,,[ANN] The Decentralized platform for gaming DApp's. MVP in development.,   Why reinvent the wheel? We will rely on Cardano.,False
1013,msg28872873,https://bitcointalk.org/index.php?topic=2659341.0,msg28808575,14728,Announcements (Altcoins),2018-01-25 06:53:36,Bitventurer,Sr. Member,488,250,,[ANN] The Decentralized platform for gaming DApp's. MVP in development.,    Scaling is one of the major areas where POS systems offer solution sot the currently existing problems. Cardano is POS.,False
1014,msg28872955,https://bitcointalk.org/index.php?topic=2659341.0,msg28806452,14728,Announcements (Altcoins),2018-01-25 06:55:21,Bitventurer,Sr. Member,488,250,,[ANN] The Decentralized platform for gaming DApp's. MVP in development.,   It consists of combining several well-known results in the domain of academic cryptography. Reading Ouroboros WP helps. An easiser digest is offered in our WP,False
1015,msg28874785,https://bitcointalk.org/index.php?topic=2659341.0,,14728,Announcements (Altcoins),2018-01-25 07:34:03,MkrKing,Member,322,12,,[ANN] The Decentralized platform for gaming DApp's. MVP in development.,Good afternoon. What is the current token to ETH rate?,False
1016,msg28874932,https://bitcointalk.org/index.php?topic=2659341.0,msg28874785,14728,Announcements (Altcoins),2018-01-25 07:36:35,CAraBuss,Member,336,10,,[ANN] The Decentralized platform for gaming DApp's. MVP in development.,  You get 98.88 tokens for 1 ETH. It’s the most profitable possible price.,False
1017,msg28875475,https://bitcointalk.org/index.php?topic=2659341.0,,14728,Announcements (Altcoins),2018-01-25 07:47:30,dayasinfo,Full Member,294,100,,[ANN] The Decentralized platform for gaming DApp's. MVP in development.,Hi there. You describe dozens of theories that seem to be attractive in your WP. But can I find actual confirmation for them?,False
1018,msg28877510,https://bitcointalk.org/index.php?topic=2659341.0,,14728,Announcements (Altcoins),2018-01-25 08:24:31,ptbs,Newbie,238,0,,[ANN] The Decentralized platform for gaming DApp's. MVP in development.,Hi there. Can anyone name me the exact date of the start of public ICO?,False
1019,msg28877917,https://bitcointalk.org/index.php?topic=2659341.0,msg28877510,14728,Announcements (Altcoins),2018-01-25 08:32:07,alcoholbtc,Full Member,336,100,,[ANN] The Decentralized platform for gaming DApp's. MVP in development.,"  Yeah, sure. It starts February 8, 2018. You shouldn’t miss jackpot!",False
1020,msg28893052,https://bitcointalk.org/index.php?topic=2659341.0,,14728,Announcements (Altcoins),2018-01-25 12:42:50,Mops,Full Member,266,101,,[ANN] The Decentralized platform for gaming DApp's. MVP in development.,"Good afternoon. I’ve got a question for you as specialists: what language do you consider to be the best for creation of slots and casinos? If possible, give reasons for your choice, please.",False
1021,msg28893290,https://bitcointalk.org/index.php?topic=2659341.0,,14728,Announcements (Altcoins),2018-01-25 12:46:40,fgreg2692june,Member,322,10,,[ANN] The Decentralized platform for gaming DApp's. MVP in development.,"Will your protocol be compatible with really fair casino? I mean, won’t it be too expensive to use it?",False
1022,msg28898147,https://bitcointalk.org/index.php?topic=2659341.0,,14728,Announcements (Altcoins),2018-01-25 13:57:06,slavonicpl,Member,238,10,,[ANN] The Decentralized platform for gaming DApp's. MVP in development.,"Why did you decide to choose Plutus as a programming language? In my opinion, Solidity is a more suitable option",False
1023,msg28898297,https://bitcointalk.org/index.php?topic=2659341.0,msg28898147,14728,Announcements (Altcoins),2018-01-25 13:59:17,hollybit,Full Member,252,100,,[ANN] The Decentralized platform for gaming DApp's. MVP in development.,  The team members have announced repeatedly that they’re very experienced in Solidity so they decided that it will restrain the development of the platform.,False
1024,msg28898633,https://bitcointalk.org/index.php?topic=2659341.0,msg28898297,14728,Announcements (Altcoins),2018-01-25 14:03:49,slavonicpl,Member,238,10,,[ANN] The Decentralized platform for gaming DApp's. MVP in development.,  How will it restrain the development? It’s one of the most appropriate for programming language for blokchain technologies. Many will agree with me. ,False
1025,msg28898830,https://bitcointalk.org/index.php?topic=2659341.0,msg28898633,14728,Announcements (Altcoins),2018-01-25 14:06:18,hollybit,Full Member,252,100,,[ANN] The Decentralized platform for gaming DApp's. MVP in development.,"  The main disadvantage of Solidity is that speed of protocol’s operation can reduce significantly ‘cause of scaling, it’s unacceptable for gambling.",False
1026,msg28898982,https://bitcointalk.org/index.php?topic=2659341.0,msg28898830,14728,Announcements (Altcoins),2018-01-25 14:08:23,slavonicpl,Member,238,10,,[ANN] The Decentralized platform for gaming DApp's. MVP in development.,  I got it. The reason is really strong. Does Cardano protocol which will serve as a basis of the platform also use this programming language?,False
1027,msg28809137,https://bitcointalk.org/index.php?topic=2659341.0,msg28808893,14728,Announcements (Altcoins),2018-01-24 09:32:32,MadduckUK,Full Member,336,100,,[ANN] The Decentralized platform for gaming DApp's. MVP in development.,"  The Ouroboros protocol allows every node to maintain the integrity of the system, so when new one is added, the platform’s efficiency should only increase.",False
1028,msg28809223,https://bitcointalk.org/index.php?topic=2659341.0,msg28809137,14728,Announcements (Altcoins),2018-01-24 09:33:55,Ackedy,Member,210,10,,[ANN] The Decentralized platform for gaming DApp's. MVP in development.,  Looks good enough. What about the security of this protocol? Has anyone tested it for resistance to multiple attacks?,False
1029,msg28810880,https://bitcointalk.org/index.php?topic=2659341.0,,14728,Announcements (Altcoins),2018-01-24 10:00:54,spottcoin,Full Member,406,100,,[ANN] The Decentralized platform for gaming DApp's. MVP in development.,"Good afternoon. What kind of random number generation mechanism was used in Cardano Casino? It’s your prototype, right?",False
1030,msg28812799,https://bitcointalk.org/index.php?topic=2659341.0,,14728,Announcements (Altcoins),2018-01-24 10:33:14,unkletoken,Full Member,350,100,,[ANN] The Decentralized platform for gaming DApp's. MVP in development.,"Will universal random numbers be generated in the very blockchain, or simply transferred to it from an external source? This is very important for understanding of the operation of your service.",False
1031,msg28817842,https://bitcointalk.org/index.php?topic=2659341.0,msg28708335,14728,Announcements (Altcoins),2018-01-24 12:01:43,b1o1o1h,Member,350,10,,[ANN] The Decentralized platform for gaming DApp's. MVP in development.,"  The team is working to attract large companies, but we can’t reveal information about this yet. Follow us and you won’t miss the news about it!",False
1032,msg28818272,https://bitcointalk.org/index.php?topic=2659341.0,msg28709046,14728,Announcements (Altcoins),2018-01-24 12:08:44,b1o1o1h,Member,350,10,,[ANN] The Decentralized platform for gaming DApp's. MVP in development.,"  When the protocol is finalized, everyone will be able to get acquainted with the list of necessary skills. But, of course, the games will be no less colorful than in other casinos.",False
1033,msg28818877,https://bitcointalk.org/index.php?topic=2659341.0,,14728,Announcements (Altcoins),2018-01-24 12:18:14,specialAU,Member,378,10,,[ANN] The Decentralized platform for gaming DApp's. MVP in development.,Cardano offers its own flexible and finance application-tailored scripting language. Will you borrow this ready-made solution or will you develop your own language for scripts?,False
1034,msg28819095,https://bitcointalk.org/index.php?topic=2659341.0,msg28720488,14728,Announcements (Altcoins),2018-01-24 12:21:51,b1o1o1h,Member,350,10,,[ANN] The Decentralized platform for gaming DApp's. MVP in development.,"  Not yet, but the team is working on it. When a bounty program is developed, the message about it will appear in the first post of this topic.",False
1035,msg28819253,https://bitcointalk.org/index.php?topic=2659341.0,,14728,Announcements (Altcoins),2018-01-24 12:24:29,app2endad,Member,364,10,,[ANN] The Decentralized platform for gaming DApp's. MVP in development.,Hello. How does your platform manage to completely exclude the interference of any third parties in the process of determination of the match result or the number on the roulette table?,False
1036,msg28819692,https://bitcointalk.org/index.php?topic=2659341.0,msg28730749,14728,Announcements (Altcoins),2018-01-24 12:31:49,b1o1o1h,Member,350,10,,[ANN] The Decentralized platform for gaming DApp's. MVP in development.,"  No, the process will be fully automated. All in all, it’d be simply awful from the point of view of the user interface, and we’re eager to create the most transparent and comfortable conditions for the players.",False
1037,msg28820973,https://bitcointalk.org/index.php?topic=2659341.0,msg28733237,14728,Announcements (Altcoins),2018-01-24 12:50:43,b1o1o1h,Member,350,10,,[ANN] The Decentralized platform for gaming DApp's. MVP in development.,  Information about the possibility of acquiring technology will be announced in the near future. There will be an answer to your question. Stay with us!,False
1038,msg28821600,https://bitcointalk.org/index.php?topic=2659341.0,msg28743520,14728,Announcements (Altcoins),2018-01-24 13:00:23,b1o1o1h,Member,350,10,,[ANN] The Decentralized platform for gaming DApp's. MVP in development.,"  It works on the basis of two very simple, but perfectly compatible mechanisms. The principle of its operation is described in detail on page 12 of our WP.",False
1039,msg28822307,https://bitcointalk.org/index.php?topic=2659341.0,msg28747822,14728,Announcements (Altcoins),2018-01-24 13:10:59,b1o1o1h,Member,350,10,,[ANN] The Decentralized platform for gaming DApp's. MVP in development.,"  No, the chance of winning and losing will be approximately equal, so both players and casino owners will be pleased. Moreover, casinos will be able to reduce the cost of internal transactions significantly, which compensates for possible losses.",False
1040,msg28843998,https://bitcointalk.org/index.php?topic=2659341.0,msg28808575,14728,Announcements (Altcoins),2018-01-24 18:40:43,Bitventurer,Sr. Member,488,250,,[ANN] The Decentralized platform for gaming DApp's. MVP in development.,"    We will address scalability by developing our own procedure for generating public random numbers: I cannot disclose the idea as of now, but it has to do with bitcoin hashes.. But in a way that no one has ever done it before. Hint: how would you generate random numbers at absolutely arbitrary frequencies using bitcoin hash as a seed? You can drop your ideas/suggestions, ladies, and gentlemen:)",False
1041,msg28847664,https://bitcointalk.org/index.php?topic=2659341.0,msg28843998,14728,Announcements (Altcoins),2018-01-24 19:50:39,Sword555,Sr. Member,476,251,,[ANN] The Decentralized platform for gaming DApp's. MVP in development.,   That's an interesting response. Using the hash as a seed and using a little algorithmic magic on it could be as close to a randomly generated number as a computer could come up with.,False
1042,msg28850040,https://bitcointalk.org/index.php?topic=2659341.0,msg28818272,14728,Announcements (Altcoins),2018-01-24 20:36:14,joblessminer,Full Member,644,101,,[ANN] The Decentralized platform for gaming DApp's. MVP in development.,    Are there any estimates on when the protocol will be finalized? Months I assume?,False
1043,msg28850747,https://bitcointalk.org/index.php?topic=2659341.0,,14728,Announcements (Altcoins),2018-01-24 20:49:46,Dolmatov,Newbie,156,0,,[ANN] The Decentralized platform for gaming DApp's. MVP in development.,"Does someone know, Bounty program will continue till ICO end?",False
1044,msg28852622,https://bitcointalk.org/index.php?topic=2659341.0,,14728,Announcements (Altcoins),2018-01-24 21:30:15,imtiazmahmood,Sr. Member,476,250,,[ANN] The Decentralized platform for gaming DApp's. MVP in development.,project looks like very interested. i will keep my eye on SP 8 D E. i joined this pre-sale.,False
1045,msg28869224,https://bitcointalk.org/index.php?topic=2659341.0,msg28852622,14728,Announcements (Altcoins),2018-01-25 05:22:20,Bitventurer,Sr. Member,488,250,,[ANN] The Decentralized platform for gaming DApp's. MVP in development.,"   We will work hard on justifying every bit of faith you hold in our project, my man.",False
1046,msg28869234,https://bitcointalk.org/index.php?topic=2659341.0,msg28850747,14728,Announcements (Altcoins),2018-01-25 05:22:41,Bitventurer,Sr. Member,488,250,,[ANN] The Decentralized platform for gaming DApp's. MVP in development.,   Yes,False
1047,msg28747448,https://bitcointalk.org/index.php?topic=2659341.0,,14728,Announcements (Altcoins),2018-01-23 12:15:36,reallyhawk,Member,224,10,,[ANN] The Decentralized platform for gaming DApp's. MVP in development.,Good day. Do you have tools for tables design? I’m looking for a system that would allow me to create crypto casino from scratch.,False
1048,msg28747822,https://bitcointalk.org/index.php?topic=2659341.0,,14728,Announcements (Altcoins),2018-01-23 12:21:29,spyQQgood,Newbie,224,0,,[ANN] The Decentralized platform for gaming DApp's. MVP in development.,Are you sure that poker tables and casinos wont incur losses if people are going to win fair amount of time? Most of them survive only because of the frequent losings.,False
1049,msg28774159,https://bitcointalk.org/index.php?topic=2659341.0,msg28747822,14728,Announcements (Altcoins),2018-01-23 19:19:53,Sword555,Sr. Member,476,251,,[ANN] The Decentralized platform for gaming DApp's. MVP in development.,"   I think SPADE is using Fees, which makes the games able to be more fair while not incurring losses.",False
1050,msg28779913,https://bitcointalk.org/index.php?topic=2659341.0,msg28708142,14728,Announcements (Altcoins),2018-01-23 21:08:03,Crypto_Man1212,Full Member,574,100,,[ANN] The Decentralized platform for gaming DApp's. MVP in development.,"   Still wondering about this, didn't see if it has been answered.",False
1051,msg28792048,https://bitcointalk.org/index.php?topic=2659341.0,msg28779913,14728,Announcements (Altcoins),2018-01-24 02:54:34,Bitventurer,Sr. Member,488,250,,[ANN] The Decentralized platform for gaming DApp's. MVP in development.,"   All the classics, my friend. We will implement poker at first. See, blackjack is not a straightforward option as it would require us to decentralize the house (or simply modify the rules a bit). We do not intend to act as a casino, we only provide the platform. The distributed house is much more demanding in terms of the system design and economics. Poker is easy.",False
1052,msg28792138,https://bitcointalk.org/index.php?topic=2659341.0,msg28774159,14728,Announcements (Altcoins),2018-01-24 02:57:05,Bitventurer,Sr. Member,488,250,,[ANN] The Decentralized platform for gaming DApp's. MVP in development.,"   People don't win the fair amount of time as they are not rational. I have worked in gambling institutions: greed is much worse than any house edge or biased randomness.  We create the fee structure that incentivizes the developers of games. In equilibrium, there will be no casino in a centralized sense.",False
1053,msg28792196,https://bitcointalk.org/index.php?topic=2659341.0,msg28747448,14728,Announcements (Altcoins),2018-01-24 02:59:17,Bitventurer,Sr. Member,488,250,,[ANN] The Decentralized platform for gaming DApp's. MVP in development.,"    You will have to wait for SP8DE to be developed till the end to allow for this. For now, your safe option would be to address some whitelabel guys with the casino soft and some blockchain experience. But mind that SP8DE is coming, the revolution it will be there soon.",False
1054,msg28792318,https://bitcointalk.org/index.php?topic=2659341.0,msg28743520,14728,Announcements (Altcoins),2018-01-24 03:03:08,Bitventurer,Sr. Member,488,250,,[ANN] The Decentralized platform for gaming DApp's. MVP in development.,   Commitments (using any regular efficient centralized PRN generator)->Fair Coin Tossing protocol->Public Secret Sharing to guarantee the output delivery. Easy.,False
1055,msg28792388,https://bitcointalk.org/index.php?topic=2659341.0,msg28741889,14728,Announcements (Altcoins),2018-01-24 03:05:39,Bitventurer,Sr. Member,488,250,,[ANN] The Decentralized platform for gaming DApp's. MVP in development.,"   Goooood question, bro. There are applications of SP8DE that we will sell to classic brick-and-mortar casinos. We see the major value coming from: 1. Token as a loyalty point; 2. Ensuring fairness of any classic machine where RNG is used (such as certain types of slot machines, etc.).",False
