id,msg_id,parent_id,link_id,Count_read,Forum,Time,Author,Rank,Activity,Merit,Trust,Title,Body,ScamHeader
1,msg47429894,https://bitcointalk.org/index.php?topic=2659341.0,msg47287329,14728,Announcements (Altcoins),2018-10-30 17:00:20,Bitventurer,Sr. Member,488,250,,[ANN] The Decentralized platform for gaming DApp's. MVP in development.,   We are working hard on it and there's more to come in November and December You can read about our plans here - https://sp8de.com/sp8de-development-in-october-bringing-fairness-to-blockchain/,False
2,msg47499773,https://bitcointalk.org/index.php?topic=2659341.0,msg47257718,14728,Announcements (Altcoins),2018-11-01 20:50:15,Fu Mei Mei,Full Member,378,100,,[ANN] The Decentralized platform for gaming DApp's. MVP in development.,"   hello mate, it looks like you are too fast to back here if you see the roadmap of this project seems to need a longer time until ready for full launched and operational for the design team of SP8DE I appreciate your work, now interface of the website looks more beautiful and cool than before",False
3,msg48076438,https://bitcointalk.org/index.php?topic=2659341.0,msg47499773,14728,Announcements (Altcoins),2018-11-20 15:54:19,Bitventurer,Sr. Member,488,250,,[ANN] The Decentralized platform for gaming DApp's. MVP in development.,"  Hello, thank you for your kind words! Our design team is working hard, that is true! By the way, we've had an AMA collecting questions from our community and answering them, you may find some new information here! https://sp8de.com/sp8de-ama-everything-you-wanted-to-ask/",False
4,msg48461307,https://bitcointalk.org/index.php?topic=2659341.0,,14728,Announcements (Altcoins),2018-12-05 09:54:59,Bitventurer,Sr. Member,488,250,,[ANN] The Decentralized platform for gaming DApp's. MVP in development.,Find our latest news here! https://sp8de.com/sp8de-development-in-november/,False
5,msg51224522,https://bitcointalk.org/index.php?topic=2659341.0,,14728,Announcements (Altcoins),2019-05-26 14:27:24,wahyuagung26,Full Member,392,102,,[ANN] The Decentralized platform for gaming DApp's. MVP in development., I have check sp8de github and find eos-smart-contract repository. Do you have a plan to swap token from eth to eos ?,False
6,msg51960775,https://bitcointalk.org/index.php?topic=2659341.0,,14728,Announcements (Altcoins),2019-07-26 17:23:51,sandrozc,Newbie,28,8,,[ANN] The Decentralized platform for gaming DApp's. MVP in development.,3 Key Takeways From Cardano Founder's Recent Video Update : 3 Key Takeways From Cardano Founder's Recent Video Update :,False
7,msg43397360,https://bitcointalk.org/index.php?topic=2659341.0,,14728,Announcements (Altcoins),2018-08-03 13:01:01,Bitventurer,Sr. Member,488,250,,[ANN] The Decentralized platform for gaming DApp's. MVP in development.,"Come play with us! As you know, we started creating test infrastructure, and our demo-site will have demo-games. We want to make one of the games specially for you! Participate in our game concept contest and vote for the best ideas to make your dream game come true!  Find the contest rules on our forum: https://forum.sp8de.com/t/sp8de-game-concept-competition/148/",False
8,msg43415738,https://bitcointalk.org/index.php?topic=2659341.0,,14728,Announcements (Altcoins),2018-08-03 18:42:40,AlloM,Full Member,756,102,,[ANN] The Decentralized platform for gaming DApp's. MVP in development.,It is hard to know who are increasing the sell pressure to bring the price down to this level. Early investors already lost too much but who can afford to sell while dev are still active and working on this platform.,False
9,msg43546531,https://bitcointalk.org/index.php?topic=2659341.0,msg43415738,14728,Announcements (Altcoins),2018-08-05 19:25:41,lx001,Hero Member,1064,502,,[ANN] The Decentralized platform for gaming DApp's. MVP in development.,"  Early investors did lose a lot, but there are also people who have won the jackpots. I think it was a big mistake to distribute such amounts into single hands, they should have burned the unsold tokens. I'm glad to see that there's at least some volume now.",False
10,msg43815095,https://bitcointalk.org/index.php?topic=2659341.0,,14728,Announcements (Altcoins),2018-08-10 08:39:47,Bitventurer,Sr. Member,488,250,,[ANN] The Decentralized platform for gaming DApp's. MVP in development.,Welcome to the new SP8DE web-site! The brand identity was updated and many new features about the project were added.,False
11,msg44117555,https://bitcointalk.org/index.php?topic=2659341.0,,14728,Announcements (Altcoins),2018-08-15 10:42:13,Bitventurer,Sr. Member,488,250,,[ANN] The Decentralized platform for gaming DApp's. MVP in development.,"CHAOS is the new name of the SP8DE protocol. SP8DE remains the company name, yet, as the project develops, it requires its own name, the name which would highlight its very essence.  CHAOS is a high-speed hybrid protocol, next-generation, provably fair random number generator. It uniquely combines safety and security with high speeds, providing a fully transparent, fair and efficient solution – as if the chaotic “rhythm” of the universe is harnessed to serve the gaming community.",False
12,msg44557571,https://bitcointalk.org/index.php?topic=2659341.0,msg42980048,14728,Announcements (Altcoins),2018-08-23 13:30:57,muarip,Full Member,495,100,,[ANN] The Decentralized platform for gaming DApp's. MVP in development.,   I hope that with that happening it will make a big thing for the success of this project in the future because I see all the tokens experiencing a bad decline.,False
13,msg44563294,https://bitcointalk.org/index.php?topic=2659341.0,msg44557571,14728,Announcements (Altcoins),2018-08-23 15:29:20,Bitventurer,Sr. Member,488,250,,[ANN] The Decentralized platform for gaming DApp's. MVP in development.,"  Yes, we'll have exciting news on the product developing right next week (we always report in the last week of the month). The market is very rough right now, if we look at the biggest coins - it's a great decline, and they are trying hard. But for us the most important part of it all is to launch the product successfully, because as utility token it takes its value from being actually used in real business.",False
14,msg44563486,https://bitcointalk.org/index.php?topic=2659341.0,,14728,Announcements (Altcoins),2018-08-23 15:33:05,Bitventurer,Sr. Member,488,250,,[ANN] The Decentralized platform for gaming DApp's. MVP in development.,"Speaking of which, right before we have the Stage 3 completed, we published the transcript of the video AMA with Mikhail Vakhrin, one of SP8DE co-founders. Misha talks about Life after ICO: https://steemit.com/blockchain/@sp8deofficial/life-after-ico-ama-with-mikhail-vakhrin",False
15,msg44820317,https://bitcointalk.org/index.php?topic=2659341.0,,14728,Announcements (Altcoins),2018-08-28 11:42:19,Bitventurer,Sr. Member,488,250,,[ANN] The Decentralized platform for gaming DApp's. MVP in development.,"SP8DE Game Concept Contest is over!  For a few weeks we were collecting game ideas, and then our community voted for them to pick the game concepts which will make the first SP8DE game, dedicated to the SP8DE community!  Top 3 picks:  Space Adventures Russian Mafia Dude, Where’s My Lambo?  We start making the SP8DE game! Thanks to all participants!",False
16,msg44851187,https://bitcointalk.org/index.php?topic=2659341.0,msg44563294,14728,Announcements (Altcoins),2018-08-28 23:52:04,muarip,Full Member,495,100,,[ANN] The Decentralized platform for gaming DApp's. MVP in development.,   All types of coins feel that the altcoin has experienced a very bad decline for the past few months. Time to be patient to see prices go back up.,False
17,msg44982131,https://bitcointalk.org/index.php?topic=2659341.0,,14728,Announcements (Altcoins),2018-08-31 15:14:53,Bitventurer,Sr. Member,488,250,,[ANN] The Decentralized platform for gaming DApp's. MVP in development.,"Meanwhile, we have the Stage 3 of the MVP development completed! Just one more stage is left, and then SP8DE MVP is ready. You can find more info in this post: https://forum.sp8de.com/t/sp8de-mvp-development-stage-3-completed/196",False
18,msg46154360,https://bitcointalk.org/index.php?topic=2659341.0,,14728,Announcements (Altcoins),2018-09-25 14:50:57,Loopper,Full Member,616,100,,[ANN] The Decentralized platform for gaming DApp's. MVP in development.,"I see this project has an active development team and always makes new things on this project journey, Whether this will have good new things for this project.",False
19,msg46292069,https://bitcointalk.org/index.php?topic=2659341.0,,14728,Announcements (Altcoins),2018-09-29 03:00:35,SwissBoo,Jr. Member,588,1,,[ANN] The Decentralized platform for gaming DApp's. MVP in development.,Anyone trying to get this listed on SETUPMASTERNODES.com ?,False
20,msg46410096,https://bitcointalk.org/index.php?topic=2659341.0,msg46292069,14728,Announcements (Altcoins),2018-10-02 00:22:40,Loopper,Full Member,616,100,,[ANN] The Decentralized platform for gaming DApp's. MVP in development.,   I don't want to register because I am still looking for more information about this. SETUPMASTERNODES.com. Did you try it?,False
21,msg46532495,https://bitcointalk.org/index.php?topic=2659341.0,,14728,Announcements (Altcoins),2018-10-05 09:57:05,Bitventurer,Sr. Member,488,250,,[ANN] The Decentralized platform for gaming DApp's. MVP in development.,"Meanwhile, the crucial step of our MVP development is completed! You can find all the details here: https://sp8de.com/sp8de-mvp-development-stage-4-completed/",False
22,msg46665168,https://bitcointalk.org/index.php?topic=2659341.0,,14728,Announcements (Altcoins),2018-10-08 21:27:50,lx001,Hero Member,1064,502,,[ANN] The Decentralized platform for gaming DApp's. MVP in development.,"Please explain what is going on with the volume, I see tens of thousands one day and practically zero on the next one, and it happens all the time. I have already asked this but could not get any reply, is this Latoken exchange legit? Are they artificially increasing the volume? Anyone had any trades, is it safe to deposit there?",False
23,msg47001527,https://bitcointalk.org/index.php?topic=2659341.0,msg46154360,14728,Announcements (Altcoins),2018-10-18 02:57:58,MelodyCrypto,Full Member,434,100,,[ANN] The Decentralized platform for gaming DApp's. MVP in development.,"   even so, I don't see price changes on SPX Tokens. But when I look other altcoins with a larger supply, they have more expensive prices if compared with SPX Tokens if it continues like this, is the ICO still worthy of being a future investment?",False
24,msg47013361,https://bitcointalk.org/index.php?topic=2659341.0,msg47001527,14728,Announcements (Altcoins),2018-10-18 11:05:19,Bitventurer,Sr. Member,488,250,,[ANN] The Decentralized platform for gaming DApp's. MVP in development.,"  Hello, the project is not in the ICO phase anymore. As an investment project, SP8DE is a utility token which means its price is defined by many factors, actual token usage being the most important of those. You can find some more info on the token utility in this blog article: https://sp8de.com/spx-tokens-what-you-need-to-know/ MVP was just completed and SP8DE has entered the integration phase for commercial use-cases soon to be announced. So just as planned, demand will be generated by actual users.",False
25,msg47260497,https://bitcointalk.org/index.php?topic=2659341.0,msg47257718,14728,Announcements (Altcoins),2018-10-25 16:01:52,Bitventurer,Sr. Member,488,250,,[ANN] The Decentralized platform for gaming DApp's. MVP in development.,"  Yes, it's in the stage of active development: this month MVP - our core protocol - was finalized, and now there's a lot going on. There will be another BIG update published till the end of month, and here you can find everything on the MVP: https://sp8de.com/sp8de-mvp-development-stage-4-completed/",False
26,msg47287329,https://bitcointalk.org/index.php?topic=2659341.0,msg47260497,14728,Announcements (Altcoins),2018-10-26 11:51:45,muarip,Full Member,495,100,,[ANN] The Decentralized platform for gaming DApp's. MVP in development.,"   Good development but if you make a renovation on this project, Will it have a good impact and good prices in the future.",False
27,msg41134206,https://bitcointalk.org/index.php?topic=2659341.0,,14728,Announcements (Altcoins),2018-06-29 08:36:50,Bitventurer,Sr. Member,488,250,,[ANN] The Decentralized platform for gaming DApp's. MVP in development.,"Thank you! In July we successfully completed the first stage of the MVP development and now we are ready to tell you a little about it!  So, what does it all mean and how far did it take us down our road to a more transparent and efficient gaming world?  This time we were focused on the infrastructure creation for our end users. It was a complicated task, as our solution caters to all kinds of iGaming industry operators, both on-line and land-based, who provide all kinds of games with their own specific rules and features.  We can now report that a big part of the infrastructure has been created, including that of personal cabinets (user accounts) which allows us to register and authorize new users within the system. These users can start using it right away.  The user can now purchase SPX tokens, deposit them and realize transactions. Remember the question, “how are the tokens to be used?”. For casinos and other iGaming providers they are the currency which will be used to address the random numbers generator (RNG), buy a a subscription or purchase other system services. The value of the token will be recognized as it is used in numerous transactions and provides access to pure randomness and transparency.  The current development stage allows users to access the API with its basic interface. A universal solution for all kinds of games is provided – as we mentioned earlier, the Sp8de protocol doesn’t need to know the rules of the game except those that are most common to the game (number of possible outcomes); therefore, it can be widely applied to a large array of different gaming products. It’s an additional proof of fairness – Sp8de protocol cannot have any impact on the process except that for which it is designed, so it provides equally fair and transparent conditions to both the casino and the player.  As the system evolves, there will be more opportunities provided for both casinos and players. The next big update will be available in late July and then we actually will show you some of the system on the interface level. As the MVP development goes on, the system will become more and more sophisticated providing not only incredible speed and total transparency but also security and opportunity to create totally new users experience – again, in July we will tell you about some amazing features which are not present in the market yet and are waiting for the right minute to be “unlocked”!",False
28,msg41137651,https://bitcointalk.org/index.php?topic=2659341.0,,14728,Announcements (Altcoins),2018-06-29 09:42:23,Bitventurer,Sr. Member,488,250,,[ANN] The Decentralized platform for gaming DApp's. MVP in development.,Thank you for all the great wishes!,False
29,msg41224420,https://bitcointalk.org/index.php?topic=2659341.0,,14728,Announcements (Altcoins),2018-06-30 15:48:07,gues,Newbie,61,0,,[ANN] The Decentralized platform for gaming DApp's. MVP in development.,"I have a question about the token listing on other larger exchangers, such as Binance. Is this expected in the future?",False
30,msg41344437,https://bitcointalk.org/index.php?topic=2659341.0,msg41224420,14728,Announcements (Altcoins),2018-07-02 09:00:11,Bitventurer,Sr. Member,488,250,,[ANN] The Decentralized platform for gaming DApp's. MVP in development.,"    Hello, we have made a Q&A where we are addressing the most actual questions. Binance is also there I'll just copy the answer here:  To be listed at a big exchange we have to meet certain criteria. - MVP availability. This will be released by the end of October 2018 - A loyal community. We appreciate your ongoing support, if you can recommend our project to your friends and colleagues, this will assist the project.  So in the end of Q3 - beginning of Q4 2018 we'll have many great news.  You can find more questions answered here: https://forum.sp8de.com/t/q-a-find-the-answers-to-your-questions-here/121/1",False
31,msg41344472,https://bitcointalk.org/index.php?topic=2659341.0,msg41225348,14728,Announcements (Altcoins),2018-07-02 09:00:59,Bitventurer,Sr. Member,488,250,,[ANN] The Decentralized platform for gaming DApp's. MVP in development.,   Thank you! Your support is precious for us!,False
32,msg41465985,https://bitcointalk.org/index.php?topic=2659341.0,,14728,Announcements (Altcoins),2018-07-04 01:17:51,kalstarzz,Full Member,756,100,,[ANN] The Decentralized platform for gaming DApp's. MVP in development.,is there no plan to add exchange site for this token? if there is already an exchange plan where you want to go.,False
33,msg41484139,https://bitcointalk.org/index.php?topic=2659341.0,msg41465985,14728,Announcements (Altcoins),2018-07-04 08:49:20,Bitventurer,Sr. Member,488,250,,[ANN] The Decentralized platform for gaming DApp's. MVP in development.,"  Hello, SPX token is currently traded at Bleutrade and Latoken exchanges. There's a strategy to expand the presence, and with MVP deployed (3-4Q 2018) it will be traded at the largest exchanges as well.",False
34,msg41498789,https://bitcointalk.org/index.php?topic=2659341.0,,14728,Announcements (Altcoins),2018-07-04 12:53:24,muarip,Full Member,495,100,,[ANN] The Decentralized platform for gaming DApp's. MVP in development.,What about the progress of this project? Whether the token price starts to decline as Bitcoin prices are currently declining.,False
35,msg41559654,https://bitcointalk.org/index.php?topic=2659341.0,msg41498789,14728,Announcements (Altcoins),2018-07-05 10:34:18,Bitventurer,Sr. Member,488,250,,[ANN] The Decentralized platform for gaming DApp's. MVP in development.,"  Yes, the market dynamics is negative now, especially for BTC. Although we need to rememeber the real value and opportunities of growth come with the token being actually used - it means, with MVP delivered and systems integrated (4Q 2018).",False
36,msg42110317,https://bitcointalk.org/index.php?topic=2659341.0,msg41559654,14728,Announcements (Altcoins),2018-07-13 16:51:15,onecall123,Sr. Member,798,251,,[ANN] The Decentralized platform for gaming DApp's. MVP in development.,"  You're right, will be patient unless MVP is available and marketing is done otherwise it become worthless complaining the decline. I'm sticking to holding my SPXs long term. The project is just getting started, so will keep SPX for a long time.",False
37,msg42170151,https://bitcointalk.org/index.php?topic=2659341.0,msg42110317,14728,Announcements (Altcoins),2018-07-14 16:54:42,muarip,Full Member,495,100,,[ANN] The Decentralized platform for gaming DApp's. MVP in development.,   That's a good thing to do to see the progress of this project and see their token has a very good price.,False
38,msg42170734,https://bitcointalk.org/index.php?topic=2659341.0,,14728,Announcements (Altcoins),2018-07-14 17:04:41,Chisholm Jitsu,Newbie,27,0,,[ANN] The Decentralized platform for gaming DApp's. MVP in development.,Expect a lot of investor maintenance your plan when Token Sales will start.,False
39,msg42406022,https://bitcointalk.org/index.php?topic=2659341.0,,14728,Announcements (Altcoins),2018-07-18 11:10:50,Bitventurer,Sr. Member,488,250,,[ANN] The Decentralized platform for gaming DApp's. MVP in development.,,False
40,msg42408719,https://bitcointalk.org/index.php?topic=2659341.0,,14728,Announcements (Altcoins),2018-07-18 11:57:14,CryptoChartIndex,Jr. Member,78,1,,[ANN] The Decentralized platform for gaming DApp's. MVP in development.,"Sp8de is now listed on CryptoChartIndex , Now you can get all information regarding SPX on CryptoChartIndex!",False
41,msg42420465,https://bitcointalk.org/index.php?topic=2659341.0,,14728,Announcements (Altcoins),2018-07-18 15:06:29,Bitventurer,Sr. Member,488,250,,[ANN] The Decentralized platform for gaming DApp's. MVP in development.,"And today one of SP8DE's co-founder talked to Crypto Best, answering difficult questions! If you want to know more about our ambitions, plans and secret features, you can watch the VIDEO https://youtu.be/leuX1wfafNA!",False
42,msg42442865,https://bitcointalk.org/index.php?topic=2659341.0,,14728,Announcements (Altcoins),2018-07-18 22:41:28,Didin,Full Member,399,100,,[ANN] The Decentralized platform for gaming DApp's. MVP in development.,"This project now on coinmarketcap https://coinmarketcap.com/currencies/sp8de and i hope i can see this project in major exchange soon,,",False
43,msg42800101,https://bitcointalk.org/index.php?topic=2659341.0,msg42442865,14728,Announcements (Altcoins),2018-07-24 16:16:13,muarip,Full Member,495,100,,[ANN] The Decentralized platform for gaming DApp's. MVP in development.,   I have seen this project and their tokens are severely dampened by the decline in Bitcoin prices until now and they should be looking for the latest ideas to make their tokens more priced.,False
44,msg42980048,https://bitcointalk.org/index.php?topic=2659341.0,msg42800101,14728,Announcements (Altcoins),2018-07-27 16:02:09,Bitventurer,Sr. Member,488,250,,[ANN] The Decentralized platform for gaming DApp's. MVP in development.,"  Hello, we are paying much attention to it  Lately we had one of our co-founders talking (there's a link to the podcast in the thread) and he covers this topic as well here: https://forum.sp8de.com/t/mikhail-vakhrin-sp8de-co-founder-talks-to-crypto-beast-podcast-transcript/150/9",False
45,msg42980507,https://bitcointalk.org/index.php?topic=2659341.0,,14728,Announcements (Altcoins),2018-07-27 16:10:58,Bitventurer,Sr. Member,488,250,,[ANN] The Decentralized platform for gaming DApp's. MVP in development.,We are proud to announce that the second stage of MVP development is successfully completed! Further development of the basic protocol and user interfaces - that's what we achieved in this month. Another big step!,False
46,msg43218739,https://bitcointalk.org/index.php?topic=2659341.0,,14728,Announcements (Altcoins),2018-07-31 13:57:23,Bitventurer,Sr. Member,488,250,,[ANN] The Decentralized platform for gaming DApp's. MVP in development.,"We are proud to announce that the second stage of MVP development has been successfully completed! The previous stage was mostly dedicated to the infrastructure creation for the end users. A big part of the infrastructure, which allowed for the creation of personal cabinets (user accounts), purchases, token deposits, and the ability to execute transactions and to access the basic API, was developed in the previous stage.  Within the current stage the basic protocol development went further to provide the verified randomness and ease of integration. There were significant changes made to: •   The modules of integration; •   Randomness generation; •   Operations history (storage module).  New members joined development team, and their expertise in UX/UI helps us to create easy to use, smooth interfaces. Technical sophistication now meets simplicity and comfort, and much of their time was dedicated to further development of users’ infrastructure and security systems.  There also was significant progress made with regards to the clients library development, in August these works are expected to be 100% completed, which means that the system now can be efficiently integrated with both the on-line and land-based gaming providers back-end.  That was a great step for us, but even more important things are yet to come! As all of these core elements are executed, we will be able to finalize the core systems and start building the testing environment throughout the next stage. Shortly, within the next month, we will be developing the demo web-site showcasing how our system works, and of course this web-site will contain demo-games!  After that - the crucial stage of fine-tuning and debugging, warming up the engine, and checking everything one last time, and… and then everything is ready for us to play!",False
47,msg38360738,https://bitcointalk.org/index.php?topic=2659341.0,,14728,Announcements (Altcoins),2018-05-24 06:29:14,Kasabus,Hero Member,1218,530,,[ANN] The Decentralized platform for gaming DApp's. MVP in development.,"Hi guys, any update on the exchanges, it seems like the volume is very low as we are not even listed in coinmarketcap. By the way, I would like to thank you for releasing the bounty, now we can breath because for sure some of the bounty hunters will dump and its time to buy more.",False
48,msg38364423,https://bitcointalk.org/index.php?topic=2659341.0,,14728,Announcements (Altcoins),2018-05-24 07:10:45,minchubby,Newbie,238,0,,[ANN] The Decentralized platform for gaming DApp's. MVP in development.,"I have not many SPX but iam very disappointed with current price on Idex, is there any big news/ partner/ exchange for this project to help their price go up ? give me some good news please ",False
49,msg38497560,https://bitcointalk.org/index.php?topic=2659341.0,,14728,Announcements (Altcoins),2018-05-25 11:14:48,Praveen Bhardwaj,Newbie,135,0,,[ANN] The Decentralized platform for gaming DApp's. MVP in development.,Project looks good i think you just need only hard other thing will ok .,False
50,msg38504469,https://bitcointalk.org/index.php?topic=2659341.0,,14728,Announcements (Altcoins),2018-05-25 12:31:16,blackdarko,Newbie,12,0,,[ANN] The Decentralized platform for gaming DApp's. MVP in development.,"Listened to team's Q/A yesterday. These guys are solid and their project hasn't got the attention it deserves. gl to the team, i hope u'll deliver",False
