id,msg_id,parent_id,link_id,Count_read,Forum,Time,Author,Rank,Activity,Merit,Trust,Title,Body,ScamHeader
702,msg29782289,https://bitcointalk.org/index.php?topic=2659341.0,msg29714099,14728,Announcements (Altcoins),2018-02-07 11:26:04,b1o1o1h,Member,350,10,,[ANN] The Decentralized platform for gaming DApp's. MVP in development.,"  It’s a pity that you think so. If you study our WP, you’ll understand that we’re offering a revolution solution and we’ve worked out all the aspects of its realization. Everything is fair and transparent.",False
703,msg29782544,https://bitcointalk.org/index.php?topic=2659341.0,,14728,Announcements (Altcoins),2018-02-07 11:30:34,advertkane121,Member,210,10,,[ANN] The Decentralized platform for gaming DApp's. MVP in development.,"For the ETH blockchain development, they used Solidity. It shows its high efficiency. Perhaps you should turn attention to it?",False
704,msg29789022,https://bitcointalk.org/index.php?topic=2659341.0,,14728,Announcements (Altcoins),2018-02-07 13:11:21,MadduckUK,Full Member,336,100,,[ANN] The Decentralized platform for gaming DApp's. MVP in development.,"Hello. Could you tell us more about your transactional logic? As far as I know, you've decided to stray from the classic concept.",False
705,msg29792017,https://bitcointalk.org/index.php?topic=2659341.0,,14728,Announcements (Altcoins),2018-02-07 13:55:09,shara,Member,378,10,,[ANN] The Decentralized platform for gaming DApp's. MVP in development.,"I am a novice programmer and I would like to find out in what language it will be possible to write applications, that will be compatible with your platform? Thanks for your reply.",False
706,msg29793159,https://bitcointalk.org/index.php?topic=2659341.0,msg29774911,14728,Announcements (Altcoins),2018-02-07 14:12:53,muarip,Full Member,495,100,,[ANN] The Decentralized platform for gaming DApp's. MVP in development.,"   if they have not reached the limit of the pre-sale achievement, will they the addition of pre-sale time?",False
707,msg29708024,https://bitcointalk.org/index.php?topic=2659341.0,msg29707696,14728,Announcements (Altcoins),2018-02-06 09:53:15,crick3698,Newbie,308,0,,[ANN] The Decentralized platform for gaming DApp's. MVP in development.,  Ok. The platform is going to create games  as well or just provide tools for developing them?,False
708,msg29708269,https://bitcointalk.org/index.php?topic=2659341.0,msg29708024,14728,Announcements (Altcoins),2018-02-06 09:57:43,devilini,Member,238,10,,[ANN] The Decentralized platform for gaming DApp's. MVP in development.,"  As far as I know, both. They will have to create a couple of apps anyways just so they can see the way protocol works.",False
709,msg29708507,https://bitcointalk.org/index.php?topic=2659341.0,msg29708269,14728,Announcements (Altcoins),2018-02-06 10:02:07,crick3698,Newbie,308,0,,[ANN] The Decentralized platform for gaming DApp's. MVP in development.,"  Got it, thank you for the explanation. When is the platfrom going to be launched? I wouldn’t mind participating in testing.",False
710,msg29708839,https://bitcointalk.org/index.php?topic=2659341.0,,14728,Announcements (Altcoins),2018-02-06 10:08:17,sorrelin,Jr. Member,154,1,,[ANN] The Decentralized platform for gaming DApp's. MVP in development.,Greetings. How many tokens were sold during pre-ICO?,False
711,msg29709212,https://bitcointalk.org/index.php?topic=2659341.0,msg29708839,14728,Announcements (Altcoins),2018-02-06 10:15:21,dayasinfo,Full Member,294,100,,[ANN] The Decentralized platform for gaming DApp's. MVP in development.,   Around 650 million. Hard cap is going to be reached soon!,False
712,msg29710301,https://bitcointalk.org/index.php?topic=2659341.0,,14728,Announcements (Altcoins),2018-02-06 10:34:27,ilcaramba,Newbie,252,0,,[ANN] The Decentralized platform for gaming DApp's. MVP in development.,Hey there. I’m quite tired that there are no new unique apps on the gambling market. IS your protocol going to solve this problem?,False
713,msg29710891,https://bitcointalk.org/index.php?topic=2659341.0,,14728,Announcements (Altcoins),2018-02-06 10:45:51,rosemarie151212,Member,378,10,,[ANN] The Decentralized platform for gaming DApp's. MVP in development.,Why did you choose Cardano? There are a lot of blockchains  out there today.,False
714,msg29712354,https://bitcointalk.org/index.php?topic=2659341.0,,14728,Announcements (Altcoins),2018-02-06 11:12:11,MkrKing,Member,322,12,,[ANN] The Decentralized platform for gaming DApp's. MVP in development.,Hi. Can you protocol process transactions and generate random numbers fast? Gamblers dont like to wait.,False
715,msg29713249,https://bitcointalk.org/index.php?topic=2659341.0,,14728,Announcements (Altcoins),2018-02-06 11:27:37,coin63,Full Member,252,100,,[ANN] The Decentralized platform for gaming DApp's. MVP in development.,Hey. Dont you think that your focus on enlarging the platform might lead to increasing the fees for transactions?,False
716,msg29714099,https://bitcointalk.org/index.php?topic=2659341.0,,14728,Announcements (Altcoins),2018-02-06 11:42:46,DimiZb,Sr. Member,405,250,,[ANN] The Decentralized platform for gaming DApp's. MVP in development.,"This looks like a scam, to be honest, why the design is so lame?",False
717,msg29714803,https://bitcointalk.org/index.php?topic=2659341.0,,14728,Announcements (Altcoins),2018-02-06 11:55:52,arakx,Member,238,10,,[ANN] The Decentralized platform for gaming DApp's. MVP in development.,Are there any functions restrictions of smart-contracts in your platform? Can they be used only in gambling apps?,False
718,msg29716015,https://bitcointalk.org/index.php?topic=2659341.0,msg29594514,14728,Announcements (Altcoins),2018-02-06 12:17:35,b1o1o1h,Member,350,10,,[ANN] The Decentralized platform for gaming DApp's. MVP in development.,"  It’s necessary to use blockchain and off-chain technology together, which can lead to the bunch of mistakes. We’re eager to create protocol which will operate fully on-chain.",False
719,msg29716558,https://bitcointalk.org/index.php?topic=2659341.0,msg29594627,14728,Announcements (Altcoins),2018-02-06 12:26:36,b1o1o1h,Member,350,10,,[ANN] The Decentralized platform for gaming DApp's. MVP in development.,  But the player whom the block was created for wont receive the result and this will be very uncomfortable for him.,False
720,msg29716897,https://bitcointalk.org/index.php?topic=2659341.0,msg29595354,14728,Announcements (Altcoins),2018-02-06 12:32:20,b1o1o1h,Member,350,10,,[ANN] The Decentralized platform for gaming DApp's. MVP in development.,  Transactions in blockchain can be executed fast and cheap. We’ve found a solution and use it in our product.,False
721,msg29717670,https://bitcointalk.org/index.php?topic=2659341.0,msg29631598,14728,Announcements (Altcoins),2018-02-06 12:45:05,b1o1o1h,Member,350,10,,[ANN] The Decentralized platform for gaming DApp's. MVP in development.,  The Ouroboros doesnt let miners to influence the result of the game.,False
722,msg29718185,https://bitcointalk.org/index.php?topic=2659341.0,msg29633979,14728,Announcements (Altcoins),2018-02-06 12:54:23,b1o1o1h,Member,350,10,,[ANN] The Decentralized platform for gaming DApp's. MVP in development.,"  Yes, your protocol is perfectly suitable for card games, too, including poker, so there’s no need to worry.",False
723,msg29718703,https://bitcointalk.org/index.php?topic=2659341.0,msg29649032,14728,Announcements (Altcoins),2018-02-06 13:03:01,b1o1o1h,Member,350,10,,[ANN] The Decentralized platform for gaming DApp's. MVP in development.,"  Yes, we’re developing our own system and we’re planning that it will be much more effective than Fate Channels.",False
724,msg29720929,https://bitcointalk.org/index.php?topic=2659341.0,,14728,Announcements (Altcoins),2018-02-06 13:38:46,newboi,Full Member,280,100,,[ANN] The Decentralized platform for gaming DApp's. MVP in development.,Is your protocol using Proof-of-Work mechanism or you have developed something unique?,False
725,msg29769124,https://bitcointalk.org/index.php?topic=2659341.0,,14728,Announcements (Altcoins),2018-02-07 07:27:21,Ackedy,Member,210,10,,[ANN] The Decentralized platform for gaming DApp's. MVP in development.,Good afternoon. What is the starting date of the main sale of tokens?,False
726,msg29769650,https://bitcointalk.org/index.php?topic=2659341.0,msg29769124,14728,Announcements (Altcoins),2018-02-07 07:37:33,16009,Full Member,364,100,,[ANN] The Decentralized platform for gaming DApp's. MVP in development.,"  On February 8, so it won't be long now.",False
727,msg29632405,https://bitcointalk.org/index.php?topic=2659341.0,msg29632278,14728,Announcements (Altcoins),2018-02-05 07:51:44,advertkane121,Member,210,10,,[ANN] The Decentralized platform for gaming DApp's. MVP in development.,   But there should be a kind of solution for this problem. It seems that it slows down the development of the entire blockchain casino industry.,False
728,msg29632580,https://bitcointalk.org/index.php?topic=2659341.0,msg29632405,14728,Announcements (Altcoins),2018-02-05 07:55:09,ggcript,Full Member,392,100,,[ANN] The Decentralized platform for gaming DApp's. MVP in development.,   That’s the problem which Spade protocol is trying to solve. Due to it the cost of execution of transaction wont be incredibly high.,False
729,msg29633979,https://bitcointalk.org/index.php?topic=2659341.0,,14728,Announcements (Altcoins),2018-02-05 08:21:51,jager44,Full Member,350,100,,[ANN] The Decentralized platform for gaming DApp's. MVP in development.,Good afternoon. It’s quite easy to implement the mechanism of random numbers into slots. But will the protocol be able to withstand their implementation into multiuser games?,False
730,msg29636475,https://bitcointalk.org/index.php?topic=2659341.0,,14728,Announcements (Altcoins),2018-02-05 09:07:50,deort,Member,406,31,,[ANN] The Decentralized platform for gaming DApp's. MVP in development.,Good afternoon. Can anyone tell me what will be the price of the token in the first round of the public sale?,False
731,msg29636724,https://bitcointalk.org/index.php?topic=2659341.0,msg29636475,14728,Announcements (Altcoins),2018-02-05 09:12:19,bit679,Full Member,392,100,,[ANN] The Decentralized platform for gaming DApp's. MVP in development.,   It seems i can. You’ll get 88.888 tokens for 1 ETH.,False
732,msg29644648,https://bitcointalk.org/index.php?topic=2659341.0,,14728,Announcements (Altcoins),2018-02-05 11:27:22,app2endad,Member,364,10,,[ANN] The Decentralized platform for gaming DApp's. MVP in development.,Edgeless – is the first casino in the world which wont charge commissions for the benefit of gambling house. Do you consider it to be your competitor? ,False
733,msg29649032,https://bitcointalk.org/index.php?topic=2659341.0,,14728,Announcements (Altcoins),2018-02-05 12:39:15,sinfazat22ron,Member,364,10,,[ANN] The Decentralized platform for gaming DApp's. MVP in development.,Fate Channels – the mechanism of supply of random numbers of FunFair casino proves itself good enough in the long run. Perhaps you should implement it into your project?,False
734,msg29649499,https://bitcointalk.org/index.php?topic=2659341.0,msg29506652,14728,Announcements (Altcoins),2018-02-05 12:46:13,b1o1o1h,Member,350,10,,[ANN] The Decentralized platform for gaming DApp's. MVP in development.,   We’re going to cooperate actively with the games developers.,False
735,msg29649605,https://bitcointalk.org/index.php?topic=2659341.0,,14728,Announcements (Altcoins),2018-02-05 12:47:45,notbad4day,Member,392,10,,[ANN] The Decentralized platform for gaming DApp's. MVP in development.,Good afternoon. Why was Cardano blokchain chosen as a base? Why not start developing your own blokchain at once?,False
736,msg29649733,https://bitcointalk.org/index.php?topic=2659341.0,msg29507448,14728,Announcements (Altcoins),2018-02-05 12:49:58,b1o1o1h,Member,350,10,,[ANN] The Decentralized platform for gaming DApp's. MVP in development.,  Because at the dawn of appearance of new technology it wasnt developed enough so there was lack of tools necessary for realization of ideas.,False
737,msg29650037,https://bitcointalk.org/index.php?topic=2659341.0,msg29516781,14728,Announcements (Altcoins),2018-02-05 12:54:38,b1o1o1h,Member,350,10,,[ANN] The Decentralized platform for gaming DApp's. MVP in development.,"  Allegedly, anyone who is skilled enough can become a games developer on the platform.",False
738,msg29650585,https://bitcointalk.org/index.php?topic=2659341.0,msg29517211,14728,Announcements (Altcoins),2018-02-05 13:03:07,b1o1o1h,Member,350,10,,[ANN] The Decentralized platform for gaming DApp's. MVP in development.,"  The problem was that the first bitcoin casinos differed from the others only ‘cause they accepted cryptocurrencies as a payment method. As for us, we’re focused on details and will ensure the esecution of all the procedures on-chain.",False
739,msg29650983,https://bitcointalk.org/index.php?topic=2659341.0,msg29571708,14728,Announcements (Altcoins),2018-02-05 13:08:49,b1o1o1h,Member,350,10,,[ANN] The Decentralized platform for gaming DApp's. MVP in development.,"   It’s possible to manipulate them, this excludes appearance of pure randomness.",False
740,msg29651746,https://bitcointalk.org/index.php?topic=2659341.0,msg29572107,14728,Announcements (Altcoins),2018-02-05 13:19:46,b1o1o1h,Member,350,10,,[ANN] The Decentralized platform for gaming DApp's. MVP in development.,"  It’s compatible, but it provide the miners that own special computing power to influence the result of the game.",False
741,msg29654565,https://bitcointalk.org/index.php?topic=2659341.0,msg29572597,14728,Announcements (Altcoins),2018-02-05 14:01:23,b1o1o1h,Member,350,10,,[ANN] The Decentralized platform for gaming DApp's. MVP in development.,   This was just one of the arguments against it. The second one is the huge computational overhead.,False
742,msg29664189,https://bitcointalk.org/index.php?topic=2659341.0,,14728,Announcements (Altcoins),2018-02-05 16:28:28,Fu Mei Mei,Full Member,378,100,,[ANN] The Decentralized platform for gaming DApp's. MVP in development.,"in pre-sale stage the results are very satisfactory, I can not imagine how much money raise in results when ICO stage later, maybe will sold out quickly do not forget to join our bounty program guys to increase the amount of SPX you have https://bitcointalk.org/index.php?topic=2718430.0",False
743,msg29702161,https://bitcointalk.org/index.php?topic=2659341.0,,14728,Announcements (Altcoins),2018-02-06 08:04:43,CorebyAmos254,Newbie,14,0,,[ANN] The Decentralized platform for gaming DApp's. MVP in development.,Hi. When does the main round of ICO start?,False
744,msg29702350,https://bitcointalk.org/index.php?topic=2659341.0,msg29702161,14728,Announcements (Altcoins),2018-02-06 08:08:50,hollybit,Full Member,252,100,,[ANN] The Decentralized platform for gaming DApp's. MVP in development.,   Very soon on Feb 8.,False
745,msg29707449,https://bitcointalk.org/index.php?topic=2659341.0,,14728,Announcements (Altcoins),2018-02-06 09:43:02,crick3698,Newbie,308,0,,[ANN] The Decentralized platform for gaming DApp's. MVP in development.,Does it mean that Spade create a platform for app developing or it create apps?,False
746,msg29707696,https://bitcointalk.org/index.php?topic=2659341.0,msg29707449,14728,Announcements (Altcoins),2018-02-06 09:47:17,devilini,Member,238,10,,[ANN] The Decentralized platform for gaming DApp's. MVP in development.,  Spade is a protocol that can be used for decentralized  gambling apps.,False
747,msg29570988,https://bitcointalk.org/index.php?topic=2659341.0,msg29570847,14728,Announcements (Altcoins),2018-02-04 08:18:21,ilcaramba,Newbie,252,0,,[ANN] The Decentralized platform for gaming DApp's. MVP in development.,"  But the platform has an experienced team of programmers, why not solve this problem?",False
748,msg29571179,https://bitcointalk.org/index.php?topic=2659341.0,msg29570988,14728,Announcements (Altcoins),2018-02-04 08:22:15,kentuckykid,Member,238,10,,[ANN] The Decentralized platform for gaming DApp's. MVP in development.,  Because the differential characteristic of the protocol is the fact that the entire process of generation of a random number is carried out on-chain.,False
749,msg29571378,https://bitcointalk.org/index.php?topic=2659341.0,msg29571179,14728,Announcements (Altcoins),2018-02-04 08:26:09,ilcaramba,Newbie,252,0,,[ANN] The Decentralized platform for gaming DApp's. MVP in development.,"  I thought that all the blockchain casinos work on chain so i dont really understand the prospects of this project, or maybe i miss smth.",False
750,msg29571708,https://bitcointalk.org/index.php?topic=2659341.0,,14728,Announcements (Altcoins),2018-02-04 08:32:57,MkrKing,Member,322,12,,[ANN] The Decentralized platform for gaming DApp's. MVP in development.,Good afternoon. Many platforms use random oracles in gambling games. Why did you decide to refuse to use them?,False
751,msg29572107,https://bitcointalk.org/index.php?topic=2659341.0,,14728,Announcements (Altcoins),2018-02-04 08:40:59,defender77,Full Member,266,100,,[ANN] The Decentralized platform for gaming DApp's. MVP in development.,The technology requiring block hash would suit perfectly for generation of random numbers. Or isnt it compatible with your protocol?,False
752,msg29572249,https://bitcointalk.org/index.php?topic=2659341.0,,14728,Announcements (Altcoins),2018-02-04 08:43:46,energycrypt,Full Member,364,100,,[ANN] The Decentralized platform for gaming DApp's. MVP in development.,Good afternoon. How long is  it until the end of the ICO?,False
753,msg29572421,https://bitcointalk.org/index.php?topic=2659341.0,msg29572249,14728,Announcements (Altcoins),2018-02-04 08:47:14,hollybit,Full Member,252,100,,[ANN] The Decentralized platform for gaming DApp's. MVP in development.,  There’re 4 days so i’d advise you not to miss the possibility to purchase tokens at a bargain price.,False
754,msg29572597,https://bitcointalk.org/index.php?topic=2659341.0,,14728,Announcements (Altcoins),2018-02-04 08:50:58,crick3698,Newbie,308,0,,[ANN] The Decentralized platform for gaming DApp's. MVP in development.,Hey there. You refused to use commitment schemes. Is the possibility to influence the winning the reason of your decision?,False
755,msg29576925,https://bitcointalk.org/index.php?topic=2659341.0,,14728,Announcements (Altcoins),2018-02-04 10:08:45,rosemarie151212,Member,378,10,,[ANN] The Decentralized platform for gaming DApp's. MVP in development.,What bonus on purchase of tokens is valid within the frameworks of the pre-ICO?,False
756,msg29577227,https://bitcointalk.org/index.php?topic=2659341.0,msg29576925,14728,Announcements (Altcoins),2018-02-04 10:14:51,Immer,Full Member,392,100,,[ANN] The Decentralized platform for gaming DApp's. MVP in development.,"  If i understood the WP correctly, it’s 100%. There wont be more profitable offer.",False
757,msg29594514,https://bitcointalk.org/index.php?topic=2659341.0,,14728,Announcements (Altcoins),2018-02-04 14:42:37,slavonicpl,Member,238,10,,[ANN] The Decentralized platform for gaming DApp's. MVP in development.,"What prevents from using a set of ready online games which are popular among casino visitors? You could place all of them on-chain, and this could remain unnoticed by the final user.",False
758,msg29594627,https://bitcointalk.org/index.php?topic=2659341.0,,14728,Announcements (Altcoins),2018-02-04 14:44:11,CorebyAmos254,Newbie,14,0,,[ANN] The Decentralized platform for gaming DApp's. MVP in development.,"If one of the players understands that he lose and refuses to reveal the secret, you can impose a fine on him. As for me, it’s easier than to develop a complex protocol like yours.",False
759,msg29595354,https://bitcointalk.org/index.php?topic=2659341.0,,14728,Announcements (Altcoins),2018-02-04 14:54:08,superwallet,Full Member,280,100,,[ANN] The Decentralized platform for gaming DApp's. MVP in development.,Good afternoon. Why processing transactions in blockchain takes much more time although it’s cheaper?,False
760,msg29631598,https://bitcointalk.org/index.php?topic=2659341.0,,14728,Announcements (Altcoins),2018-02-05 07:35:55,lok5874,Member,196,10,,[ANN] The Decentralized platform for gaming DApp's. MVP in development.,Miners can see and change the block headers much earlier the others. Doesnt this damage the fairness of generation of random numbers?,False
761,msg29631684,https://bitcointalk.org/index.php?topic=2659341.0,,14728,Announcements (Altcoins),2018-02-05 07:37:29,Ackedy,Member,210,10,,[ANN] The Decentralized platform for gaming DApp's. MVP in development.,Hey there. How many tokens have already been sold?,False
762,msg29631745,https://bitcointalk.org/index.php?topic=2659341.0,,14728,Announcements (Altcoins),2018-02-05 07:38:47,advertkane121,Member,210,10,,[ANN] The Decentralized platform for gaming DApp's. MVP in development.,"Hi there. I’ve heard that there’s enough of people who wanna try their’s luck in blockchain casino, but anyway, smth prevents them from this. How do you think, what’s that?",False
763,msg29631866,https://bitcointalk.org/index.php?topic=2659341.0,msg29631745,14728,Announcements (Altcoins),2018-02-05 07:41:05,ggcript,Full Member,392,100,,[ANN] The Decentralized platform for gaming DApp's. MVP in development.,   I guess the reason is that there’re high commissions on transactions within the platform. The prevent many people from use of the platform.,False
764,msg29632051,https://bitcointalk.org/index.php?topic=2659341.0,msg29631866,14728,Announcements (Altcoins),2018-02-05 07:45:01,advertkane121,Member,210,10,,[ANN] The Decentralized platform for gaming DApp's. MVP in development.,   I think you’re wrong. A real player can hardly be stopped by such sort of thing as high commission. The reason is smth else.,False
765,msg29632237,https://bitcointalk.org/index.php?topic=2659341.0,msg29631684,14728,Announcements (Altcoins),2018-02-05 07:48:31,spottcoin,Full Member,406,100,,[ANN] The Decentralized platform for gaming DApp's. MVP in development.,"   While there’s only the pre-sale being held, but there’re more than 600 million tokens sold already.",False
766,msg29632278,https://bitcointalk.org/index.php?topic=2659341.0,msg29632051,14728,Announcements (Altcoins),2018-02-05 07:49:15,ggcript,Full Member,392,100,,[ANN] The Decentralized platform for gaming DApp's. MVP in development.,"   The commission isn’t only high, it’s also absurdly disproportional.  This can be noticed only buy people that are really used to bet it big.",False
767,msg29502825,https://bitcointalk.org/index.php?topic=2659341.0,msg29502534,14728,Announcements (Altcoins),2018-02-03 06:52:48,deort,Member,406,31,,[ANN] The Decentralized platform for gaming DApp's. MVP in development.,"  I hope, that it will sometime, and very confidently. So, can you explain what is the fundamental difference?",False
768,msg29503062,https://bitcointalk.org/index.php?topic=2659341.0,,14728,Announcements (Altcoins),2018-02-03 06:58:21,Ackedy,Member,210,10,,[ANN] The Decentralized platform for gaming DApp's. MVP in development.,Good afternoon. How many days are left before the start of the public sale of tokens?,False
769,msg29503130,https://bitcointalk.org/index.php?topic=2659341.0,msg29502825,14728,Announcements (Altcoins),2018-02-03 06:59:50,hunterofmoney,Full Member,280,100,,[ANN] The Decentralized platform for gaming DApp's. MVP in development.,"   I thought it was obvious. At online casinos you do not need to maintain large buildings, bars and hotels and spend a lot of money on the security system.",False
770,msg29503312,https://bitcointalk.org/index.php?topic=2659341.0,msg29503130,14728,Announcements (Altcoins),2018-02-03 07:04:59,deort,Member,406,31,,[ANN] The Decentralized platform for gaming DApp's. MVP in development.,"  Yes, but a security system is needed even at online casino. Will Spade be protected from hacker attacks, won’t it?",False
771,msg29503484,https://bitcointalk.org/index.php?topic=2659341.0,msg29503062,14728,Announcements (Altcoins),2018-02-03 07:09:29,spottcoin,Full Member,406,100,,[ANN] The Decentralized platform for gaming DApp's. MVP in development.,"  A little less than a week, but I would advise you to buy them now – while the discount is still valid.",False
772,msg29503508,https://bitcointalk.org/index.php?topic=2659341.0,msg29503312,14728,Announcements (Altcoins),2018-02-03 07:10:06,hunterofmoney,Full Member,280,100,,[ANN] The Decentralized platform for gaming DApp's. MVP in development.,"   I assume that no one is immune to hacker attacks. The thing is that it won’t do any harm to decentralized platforms, so I'm not worried about Spade’s security.",False
773,msg29506652,https://bitcointalk.org/index.php?topic=2659341.0,,14728,Announcements (Altcoins),2018-02-03 08:25:57,notbad4day,Member,392,10,,[ANN] The Decentralized platform for gaming DApp's. MVP in development.,"Good afternoon. Mostly often, a platform buys games from producers and preserve the rights for them. Will your platform adhere to the same policy?",False
774,msg29507448,https://bitcointalk.org/index.php?topic=2659341.0,,14728,Announcements (Altcoins),2018-02-03 08:43:59,qqniceguyqq,Member,361,10,,[ANN] The Decentralized platform for gaming DApp's. MVP in development.,"What do you think, why the first attempts to move the on-chain gambling failed? It is important for understanding the strategy your platform.",False
775,msg29509551,https://bitcointalk.org/index.php?topic=2659341.0,,14728,Announcements (Altcoins),2018-02-03 09:29:32,sinfazat22ron,Member,364,10,,[ANN] The Decentralized platform for gaming DApp's. MVP in development.,Hello. Will tokens be sold at a nominal price at the main stage the ICO?,False
