id,msg_id,parent_id,link_id,Count_read,Forum,Time,Author,Rank,Activity,Merit,Trust,Title,Body,ScamHeader
62,msg22082974,https://bitcointalk.org/index.php?topic=2194462.0,msg22075382,2987,Announcements (Altcoins),2017-09-21 18:50:07,birkomester,Full Member,336,100,,[ANN][ICO][ZEUS] ⚡️ ZEUS - First EcoMining ⚡️,"   Hi! Bounty campaign will be announced on Monday, 25.09 in the appropriate branch.",False
63,msg22177040,https://bitcointalk.org/index.php?topic=2194462.0,msg22074727,2987,Announcements (Altcoins),2017-09-24 16:31:41,MakersONE,Full Member,546,105,,[ANN][ICO][ZEUS] ⚡️ ZEUS - First EcoMining ⚡️,"   Wow, guys. It's really cool. There is a useful project, no matter whether it is blockchain or not. The only question about the growth of coins in the future. Are there any guarantees for investors?",False
64,msg22177191,https://bitcointalk.org/index.php?topic=2194462.0,,2987,Announcements (Altcoins),2017-09-24 16:36:48,emya,Newbie,150,0,,[ANN][ICO][ZEUS] ⚡️ ZEUS - First EcoMining ⚡️,ZEUS ? Blockchain or not ?,False
65,msg22232039,https://bitcointalk.org/index.php?topic=2194462.0,msg22177040,2987,Announcements (Altcoins),2017-09-26 08:03:11,birkomester,Full Member,336,100,,[ANN][ICO][ZEUS] ⚡️ ZEUS - First EcoMining ⚡️,"   Our token is guaranteed by the activity of plant for disposal of waste, electricity production 4,4 megawatts/per hour, crypto mining and sale of agricultural fertilizers.",False
66,msg22232355,https://bitcointalk.org/index.php?topic=2194462.0,msg22177191,2987,Announcements (Altcoins),2017-09-26 08:14:50,birkomester,Full Member,336,100,,[ANN][ICO][ZEUS] ⚡️ ZEUS - First EcoMining ⚡️,    The ZEUS Token is produced on the basis of the Ethereum’s blockchain,False
67,msg22232584,https://bitcointalk.org/index.php?topic=2194462.0,,2987,Announcements (Altcoins),2017-09-26 08:22:47,dave111223,Legendary,1162,1001,,[ANN][ICO][ZEUS] ⚡️ ZEUS - First EcoMining ⚡️,Haha for once the lightnings emoji is well chosen,False
68,msg22232929,https://bitcointalk.org/index.php?topic=2194462.0,,2987,Announcements (Altcoins),2017-09-26 08:33:32,Muheng,Member,162,10,,[ANN][ICO][ZEUS] ⚡️ ZEUS - First EcoMining ⚡️,great project with nice roadmap. good luck for ICO on November.,False
69,msg22435839,https://bitcointalk.org/index.php?topic=2194462.0,,2987,Announcements (Altcoins),2017-10-01 14:50:24,qiman,Hero Member,924,504,,[ANN][ICO][ZEUS] ⚡️ ZEUS - First EcoMining ⚡️,I made a video in Chinese for the ZEUS PROJECT FOR OUR CHINESE altcoin enthusiasts. I hope it is to your liking and we will follow the project with my Wife who is a full time altcoin buff and we are looking forward to the ICO. Here my video for your perusal and we will be happy to see the project get a good innings. ZEUS TOKEN review in CHINESE: https:/ /www.youtube.com/watch?v=HVePlXV-Xco ,False
70,msg22435980,https://bitcointalk.org/index.php?topic=2194462.0,,2987,Announcements (Altcoins),2017-10-01 14:53:52,ealarry,Full Member,195,100,,[ANN][ICO][ZEUS] ⚡️ ZEUS - First EcoMining ⚡️,"first building waste processing plant project This idea is very novel, I also pray that it can subvert our lives, as long as the environmental contribution to the project, can focus on support, because I believe that my country will pay attention to it",False
