id,msg_id,parent_id,link_id,Count_read,Forum,Time,Author,Rank,Activity,Merit,Trust,Title,Body,ScamHeader
1,msg28896222,https://bitcointalk.org/index.php?topic=2194462.0,msg25883585,2987,Announcements (Altcoins),2018-01-25 13:30:54,TentallyMooN,Member,392,10,,[ANN][ICO][ZEUS] ⚡️ ZEUS - First EcoMining ⚡️,"     I've been following this project for a very long time, I think I've already read all the articles and publications about it! Very interesting project for my opinion",False
2,msg28897010,https://bitcointalk.org/index.php?topic=2194462.0,,2987,Announcements (Altcoins),2018-01-25 13:41:00,kimjenglot,Member,364,10,,[ANN][ICO][ZEUS] ⚡️ ZEUS - First EcoMining ⚡️,does this campaign seem to be over ? and will be listing market where this zeuz token ?,False
3,msg28897024,https://bitcointalk.org/index.php?topic=2194462.0,,2987,Announcements (Altcoins),2018-01-25 13:41:09,dspencer,Member,126,10,,[ANN][ICO][ZEUS] ⚡️ ZEUS - First EcoMining ⚡️,"A very big undertaking. There are vast amounts of garbage collected worldwide. Though I wish you luck, you'll need a little more than that to turn the tide!",False
4,msg28918660,https://bitcointalk.org/index.php?topic=2194462.0,,2987,Announcements (Altcoins),2018-01-25 18:57:30,birkomester,Full Member,336,100,,[ANN][ICO][ZEUS] ⚡️ ZEUS - First EcoMining ⚡️,"Dear Community!  We have to inform You that Hard Cap was not raised during the ICO.  We’ve analyzed and revealed some shortcomings in our work on the ICO project. The major flow of money was in fiat from large investors, this is because our advertising company was not massive enough and aimed on communications with major investors, presentations and road shows, and also because of not correctly chosen strategy on the functions and economy of the token, which was not clear and attractive for private investors. We decided to fix all the shortcomings. On March, 1 we are going to present an updated roadmap where you will see short-term scheme of token use.  Till that time we’ll continue to work under the previous roadmap: - complete the design documentation of the plant; - purchase, place and after a few months, without waiting for the plant construction, start mining power and realising of contract for hashrate sale and rent on attractive terms for which you can pay ZET with discount; - get credit funds of customary investors in the Project.  We plan the output of the Project on the second round of ICO with a work product (hashrate sell and rent of mining facilities) and a clear position as for the token use and its benefits. It will be more transparent for the investor and give more confidence when buying the token. Also the roadmap will contain plan and time of the token release on cryptocurrency exchanges.  Release roadmap scheduled on March 1, 2018, you’ll be informed by e-mail and in social networks.",False
5,msg29207206,https://bitcointalk.org/index.php?topic=2194462.0,,2987,Announcements (Altcoins),2018-01-30 03:13:57,junder,Hero Member,611,500,,[ANN][ICO][ZEUS] ⚡️ ZEUS - First EcoMining ⚡️,"ICO has ended, I joined in the social bounty when it will be distributed? thanks in advance.",False
6,msg29207319,https://bitcointalk.org/index.php?topic=2194462.0,,2987,Announcements (Altcoins),2018-01-30 03:17:29,GoldZeus,Newbie,75,0,,[ANN][ICO][ZEUS] ⚡️ ZEUS - First EcoMining ⚡️,"Hey, this coin is called like my name ",False
7,msg29362742,https://bitcointalk.org/index.php?topic=2194462.0,,2987,Announcements (Altcoins),2018-02-01 07:19:42,junder,Hero Member,611,500,,[ANN][ICO][ZEUS] ⚡️ ZEUS - First EcoMining ⚡️,Why no team of zeus is update on this thread I see ICO has ended and no confirmed by the team or the dev. this project is dead?,False
8,msg29849085,https://bitcointalk.org/index.php?topic=2194462.0,,2987,Announcements (Altcoins),2018-02-08 10:22:25,di_bit,Newbie,2,0,,[ANN][ICO][ZEUS] ⚡️ ZEUS - First EcoMining ⚡️,"The idea sounds really promising, good luck with implementing it! By the way, at the beginning of the ICO project, I work for, we used bitmedia.io to make our platform known, maybe it would be useful for you too:)",False
9,msg32895424,https://bitcointalk.org/index.php?topic=2194462.0,,2987,Announcements (Altcoins),2018-03-22 10:32:05,Palakka,Hero Member,900,1000,,[ANN][ICO][ZEUS] ⚡️ ZEUS - First EcoMining ⚡️,The website is down. It seems dead and the admin is not paid yet for all bounty.   ,False
10,msg33966700,https://bitcointalk.org/index.php?topic=2194462.0,msg29849085,2987,Announcements (Altcoins),2018-04-05 04:52:33,junder,Hero Member,611,500,,[ANN][ICO][ZEUS] ⚡️ ZEUS - First EcoMining ⚡️,"   sounds really promising? you are wrong dude, this project is already dead the website is down and telegram is already remove. It's better to read and find of this project.",False
11,msg25633264,https://bitcointalk.org/index.php?topic=2194462.0,,2987,Announcements (Altcoins),2017-12-02 22:47:15,silvestar,Legendary,1134,1002,,[ANN][ICO][ZEUS] ⚡️ ZEUS - First EcoMining ⚡️,"There is a statement phrase over there. Should we understand that Smiley will provide support? If it is like that, this project, which is important for humanity, will be successful. For mining, the project must be successful. I guess smiley miners aim to bring electricity to free and legalize crypt money with government. I think it is successful.",False
12,msg25690721,https://bitcointalk.org/index.php?topic=2194462.0,,2987,Announcements (Altcoins),2017-12-03 22:00:39,nelson4lov,Sr. Member,840,250,,[ANN][ICO][ZEUS] ⚡️ ZEUS - First EcoMining ⚡️,"The first Zeus #ASIC Bitcoin Miners are Here!    Prior to the launch of Zeus Token sale on 15th December 2017 , The Zeus team has taken a step forward to reconfirm their commitment towards building the first waste processing plant project by acquiring 100 units of AntMiner D3 Miners!  Want to Learn More about the Zeus Project and its upcoming ICO? Read: https://bitcoinexchangeguide.com/zeus-token-ico/",False
13,msg25691337,https://bitcointalk.org/index.php?topic=2194462.0,,2987,Announcements (Altcoins),2017-12-03 22:18:19,MoneroMooo,Legendary,1280,1001,,[ANN][ICO][ZEUS] ⚡️ ZEUS - First EcoMining ⚡️,"on behalf of humanity is an important and beneficial project. state support for such projects is supposed to be more. should be encouraged. me, I'll give you all the support I can do. I've followed success.",False
14,msg25883585,https://bitcointalk.org/index.php?topic=2194462.0,,2987,Announcements (Altcoins),2017-12-07 00:23:01,nelson4lov,Sr. Member,840,250,,[ANN][ICO][ZEUS] ⚡️ ZEUS - First EcoMining ⚡️,"What is Zeus Project ?  This is a question that is being asked every by new Zeus community members. The concept behind the Zeus project is one of a kind since it aims to solve the world’s garbage utilization problem.    For those who doesn't know, Zeus is building a garbage recycling factory that will generate electricity from waste products, then use that electricity to mine cryptocurrencies. The estimated revenue for recycling and mining cryptocurrencies is 13,308 BTC per year!    Find Out More: http://zeus-token.io/eng/index.html",False
15,msg26067934,https://bitcointalk.org/index.php?topic=2194462.0,,2987,Announcements (Altcoins),2017-12-10 08:04:02,Adnan Saleem,Newbie,38,0,,[ANN][ICO][ZEUS] ⚡️ ZEUS - First EcoMining ⚡️,"Have you already subscribed to our facebook? If the answer is ""no"" - here is a link https://www.facebook.com/zeusminingofficial/ … and you know what to do 😉  Reference: https://twitter.com/info_zeusteam/status/937980787265359872",False
16,msg26243214,https://bitcointalk.org/index.php?topic=2194462.0,,2987,Announcements (Altcoins),2017-12-13 06:47:45,czhen,Member,308,10,,[ANN][ICO][ZEUS] ⚡️ ZEUS - First EcoMining ⚡️,I also followed the social media campaign of this project. I think this project is good because it is engaged in the recycling of waste that is in need to reduce the pile up in the world,False
17,msg26804056,https://bitcointalk.org/index.php?topic=2194462.0,,2987,Announcements (Altcoins),2017-12-22 21:27:21,TentallyMooN,Member,392,10,,[ANN][ICO][ZEUS] ⚡️ ZEUS - First EcoMining ⚡️,"It is not entirely clear to me how everything will work here. The idea itself is understandable, but there are doubts about whether it will be possible to translate all this into reality",False
18,msg26804089,https://bitcointalk.org/index.php?topic=2194462.0,msg26377509,2987,Announcements (Altcoins),2017-12-22 21:28:18,TentallyMooN,Member,392,10,,[ANN][ICO][ZEUS] ⚡️ ZEUS - First EcoMining ⚡️,"  This, of course, is a good resource. But I especially do not see the point in this information. It's not entirely clear",False
19,msg26827597,https://bitcointalk.org/index.php?topic=2194462.0,,2987,Announcements (Altcoins),2017-12-23 11:02:09,Palakka,Hero Member,900,1000,,[ANN][ICO][ZEUS] ⚡️ ZEUS - First EcoMining ⚡️,Don't be late guys to be a part of this project here http://zeus-token.io/eng/index.html this project become a part of first eco crypto mining in the world.,False
20,msg26846836,https://bitcointalk.org/index.php?topic=2194462.0,msg26827597,2987,Announcements (Altcoins),2017-12-23 18:15:35,TentallyMooN,Member,392,10,,[ANN][ICO][ZEUS] ⚡️ ZEUS - First EcoMining ⚡️,"  But this is already interesting! I believe that this is worth a closer look! Pretty interesting and worthy of my attention, thank you",False
21,msg27208546,https://bitcointalk.org/index.php?topic=2194462.0,,2987,Announcements (Altcoins),2017-12-30 13:58:37,babedota,Full Member,350,100,,[ANN][ICO][ZEUS] ⚡️ ZEUS - First EcoMining ⚡️,I am very confused with this project when the project is very good but somehow this project is rarely updated and more quiet. but I am very confident that such a project will be successful and can get many investors in this project.,False
22,msg27225950,https://bitcointalk.org/index.php?topic=2194462.0,,2987,Announcements (Altcoins),2017-12-30 20:46:03,hana gonzales,Member,218,10,,[ANN][ICO][ZEUS] ⚡️ ZEUS - First EcoMining ⚡️,"I am sure will be many who are interested in this project, hopefully run well, and good luck brother.",False
23,msg27294722,https://bitcointalk.org/index.php?topic=2194462.0,,2987,Announcements (Altcoins),2018-01-01 12:41:00,arwanabounty,Member,280,10,,[ANN][ICO][ZEUS] ⚡️ ZEUS - First EcoMining ⚡️,"Good projects related to environment, environmentally friendly. Hopefully successful and many are investing in this project.",False
24,msg27328295,https://bitcointalk.org/index.php?topic=2194462.0,,2987,Announcements (Altcoins),2018-01-02 06:42:47,korm,Member,280,10,,[ANN][ICO][ZEUS] ⚡️ ZEUS - First EcoMining ⚡️,interesting idea,False
25,msg27443962,https://bitcointalk.org/index.php?topic=2194462.0,msg27208546,2987,Announcements (Altcoins),2018-01-04 04:23:43,liuka,Hero Member,582,501,,[ANN][ICO][ZEUS] ⚡️ ZEUS - First EcoMining ⚡️,"   yes, I think so. This project is very nice and a great concept and good idea but the dev or the team of this project is not active to update news on media. Maybe they are so busy.",False
26,msg27535867,https://bitcointalk.org/index.php?topic=2194462.0,msg27443962,2987,Announcements (Altcoins),2018-01-05 14:48:23,knuckey,Sr. Member,1069,250,,[ANN][ICO][ZEUS] ⚡️ ZEUS - First EcoMining ⚡️,"   yeah you right, i think the web need to show an info about how much the ico raised until now!!",False
27,msg28535102,https://bitcointalk.org/index.php?topic=2194462.0,,2987,Announcements (Altcoins),2018-01-20 11:06:45,Palakka,Hero Member,900,1000,,[ANN][ICO][ZEUS] ⚡️ ZEUS - First EcoMining ⚡️,I am confused of this project. the ICO will end of this month. and no confirm by dev or the team of this project. how much total fund is raised in ICO?,False
28,msg28597721,https://bitcointalk.org/index.php?topic=2194462.0,,2987,Announcements (Altcoins),2018-01-21 09:27:11,anahmih,Sr. Member,700,250,,[ANN][ICO][ZEUS] ⚡️ ZEUS - First EcoMining ⚡️,the project is not clear income and has been running long enough and not detailed information?,False
29,msg28598154,https://bitcointalk.org/index.php?topic=2194462.0,msg25690721,2987,Announcements (Altcoins),2018-01-21 09:35:29,solotraderbct,Newbie,44,0,,[ANN][ICO][ZEUS] ⚡️ ZEUS - First EcoMining ⚡️,     Wow great. Envion and Zeus might change the map of crypto mining.,False
30,msg28896046,https://bitcointalk.org/index.php?topic=2194462.0,msg28773089,2987,Announcements (Altcoins),2018-01-25 13:28:42,TentallyMooN,Member,392,10,,[ANN][ICO][ZEUS] ⚡️ ZEUS - First EcoMining ⚡️,"  I will vote, but if only it was not a waste of time. I hope that you will still meet our expectations",False
31,msg22597646,https://bitcointalk.org/index.php?topic=2194462.0,,2987,Announcements (Altcoins),2017-10-05 13:34:09,Ahooleeman,Full Member,476,111,,[ANN][ICO][ZEUS] ⚡️ ZEUS - First EcoMining ⚡️,Zeus project is listed here: https://foxico.io/project/zeus,False
32,msg22598352,https://bitcointalk.org/index.php?topic=2194462.0,,2987,Announcements (Altcoins),2017-10-05 13:54:18,CryptoDaenerys,Member,81,10,,[ANN][ICO][ZEUS] ⚡️ ZEUS - First EcoMining ⚡️,Too utopian idea. We need to see what happens next. Attention is riveted.,False
33,msg22651653,https://bitcointalk.org/index.php?topic=2194462.0,,2987,Announcements (Altcoins),2017-10-06 19:23:05,Raxitto,Sr. Member,420,250,,[ANN][ICO][ZEUS] ⚡️ ZEUS - First EcoMining ⚡️,"The average human generates around 300kg of waste annually. Today, the population of the Earth is about 7.5 billion people and is projected to reach 8 billion by 2024. In the EU, about 2 billion tons of garbage are generated annually, of which some 200 million tons are domestic waste. This theme is the heart of the FinTech start-up, Zeus. ZEUS is one of the first blockchain-based recycling company in the world, specializing in the recycling of waste in electricity for cryptomoneda mining. Taking advantage of the technical expertise and blockchain technology, ZEUS is developing an EcoCryptoMining project that combines waste management and processing to solve the biggest problem with cryptonegon mining: electricity. The electricity generated by the company's plant will be used to power a mining operation of criptomonedas.",False
34,msg22822762,https://bitcointalk.org/index.php?topic=2194462.0,msg22082974,2987,Announcements (Altcoins),2017-10-10 18:47:40,kalunomics,Full Member,588,103,,[ANN][ICO][ZEUS] ⚡️ ZEUS - First EcoMining ⚡️,  Any heads up with the bounty campaign yet?,False
35,msg22823188,https://bitcointalk.org/index.php?topic=2194462.0,,2987,Announcements (Altcoins),2017-10-10 18:59:02,verb,Sr. Member,437,250,,[ANN][ICO][ZEUS] ⚡️ ZEUS - First EcoMining ⚡️,"the idea sounds good, but we need working links and a detailed business plan to even think that this has a change of becoming reality",False
36,msg22919097,https://bitcointalk.org/index.php?topic=2194462.0,msg22651653,2987,Announcements (Altcoins),2017-10-12 17:04:55,lirene,Sr. Member,644,252,,[ANN][ICO][ZEUS] ⚡️ ZEUS - First EcoMining ⚡️,"  The project has an incredibly useful idea for the whole world, if it can be implemented, it will be the beginning for the liberation of our planet from debris. With all my heart I wish you good luck!",False
37,msg23334377,https://bitcointalk.org/index.php?topic=2194462.0,msg22822762,2987,Announcements (Altcoins),2017-10-21 20:06:12,BurhanPSG,Full Member,322,100,,[ANN][ICO][ZEUS] ⚡️ ZEUS - First EcoMining ⚡️,"  If anyone resigns, it is very reasonable because the time for this zeus project is very long. Information for ico ZEUS duration Pre ICO start: 25.10.2017 end: 25.11.2017 ICO start: 15.12.2017 end: 25.01.2018",False
38,msg23421773,https://bitcointalk.org/index.php?topic=2194462.0,,2987,Announcements (Altcoins),2017-10-23 16:37:56,Ukraine2020,Sr. Member,826,284,,[ANN][ICO][ZEUS] ⚡️ ZEUS - First EcoMining ⚡️,An unusual project ... Recycling garbage is a good and ambitious idea. I wish you success!,False
39,msg23662766,https://bitcointalk.org/index.php?topic=2194462.0,,2987,Announcements (Altcoins),2017-10-28 09:40:26,DGulari,Legendary,1232,1000,,[ANN][ICO][ZEUS] ⚡️ ZEUS - First EcoMining ⚡️,"When this pre-ICO wil be start? in whitepaper and on OP it says Pre-ICO will be start from OCT 25 but on website, it says pre-ICO soon although today already OCT 28. Is this pre-ICO delayed?",False
40,msg23855825,https://bitcointalk.org/index.php?topic=2194462.0,,2987,Announcements (Altcoins),2017-11-01 06:34:09,bejinariu,Member,71,10,,[ANN][ICO][ZEUS] ⚡️ ZEUS - First EcoMining ⚡️,I wish you success!,False
41,msg23871847,https://bitcointalk.org/index.php?topic=2194462.0,msg23662766,2987,Announcements (Altcoins),2017-11-01 13:01:33,liuka,Hero Member,582,501,,[ANN][ICO][ZEUS] ⚡️ ZEUS - First EcoMining ⚡️,   pre-ico start 25/10 in weeks ago and will be end 25/11 to participate in preico need to create an account on website here https://ico.zeus-token.io/register?lang=en,False
42,msg24108429,https://bitcointalk.org/index.php?topic=2194462.0,,2987,Announcements (Altcoins),2017-11-06 07:56:39,Jordo55,Newbie,33,0,,[ANN][ICO][ZEUS] ⚡️ ZEUS - First EcoMining ⚡️,I look forward to seeing how this project turns out. We definitely have a garbage problem that needs to be dealt with.,False
43,msg24108520,https://bitcointalk.org/index.php?topic=2194462.0,,2987,Announcements (Altcoins),2017-11-06 07:59:28,i-synthestech,Full Member,280,100,,[ANN][ICO][ZEUS] ⚡️ ZEUS - First EcoMining ⚡️,can't find your whitepaper and detailed information about the project,False
44,msg24108599,https://bitcointalk.org/index.php?topic=2194462.0,,2987,Announcements (Altcoins),2017-11-06 08:01:35,ghuang168,Sr. Member,280,250,,[ANN][ICO][ZEUS] ⚡️ ZEUS - First EcoMining ⚡️,i don't like the project idea like this . totally baloney....,False
45,msg24130178,https://bitcointalk.org/index.php?topic=2194462.0,,2987,Announcements (Altcoins),2017-11-06 15:45:13,dimcasper,Newbie,98,0,,[ANN][ICO][ZEUS] ⚡️ ZEUS - First EcoMining ⚡️,"I like the idea of this project, it seems very promising long-term project, but the development should still be done, seeing the growing community.",False
46,msg24247704,https://bitcointalk.org/index.php?topic=2194462.0,msg22597646,2987,Announcements (Altcoins),2017-11-08 17:55:44,buriks,Sr. Member,762,253,,[ANN][ICO][ZEUS] ⚡️ ZEUS - First EcoMining ⚡️,  thank for information every one hope good project future ,False
47,msg24458697,https://bitcointalk.org/index.php?topic=2194462.0,,2987,Announcements (Altcoins),2017-11-12 15:00:00,hesham51,Member,504,16,,[ANN][ICO][ZEUS] ⚡️ ZEUS - First EcoMining ⚡️,"!brilliant idea ,no wasted energy,It's really interested ",False
48,msg24551285,https://bitcointalk.org/index.php?topic=2194462.0,msg24108599,2987,Announcements (Altcoins),2017-11-14 07:54:10,Maloppo,Hero Member,670,500,,[ANN][ICO][ZEUS] ⚡️ ZEUS - First EcoMining ⚡️,"   this great idea dude, zeus project is good project you need to read be careful to understand about this project or read whitepaper here http://zeus-token.io/eng/whitepaper.pdf",False
49,msg24579499,https://bitcointalk.org/index.php?topic=2194462.0,,2987,Announcements (Altcoins),2017-11-14 16:54:32,juarezweiss,Member,308,13,,[ANN][ICO][ZEUS] ⚡️ ZEUS - First EcoMining ⚡️,Very ambitious! Using blockchain for real-world problems! Wish you luck!,False
50,msg25333310,https://bitcointalk.org/index.php?topic=2194462.0,msg24579499,2987,Announcements (Altcoins),2017-11-27 19:41:51,nelson4lov,Sr. Member,840,250,,[ANN][ICO][ZEUS] ⚡️ ZEUS - First EcoMining ⚡️,   It's high time we start using the disruptive technology that Blockchain is equipped with to solve real world problems. Recycling wastes for electricity that goes towards Cryptomining is a typical example of a real world use case of blockchain. Really excited about what the Zeus team is building here,False
51,msg22039019,https://bitcointalk.org/index.php?topic=2194462.0,,2987,Announcements (Altcoins),2017-09-20 15:21:27,birkomester,Full Member,336,100,,[ANN][ICO][ZEUS] ⚡️ ZEUS - First EcoMining ⚡️,"ZEUS EcoCryptoMining  - first building waste processing plant project which also generates electricity from waste products and uses it for mining in the world.   PROBLEM  Every person living on the planet ""produces"" about 300 kg or 1.5 m3 of waste per year. In the EU countries, about 2 billion tons of garbage per year are formed, of which about 200 million tons are household waste. Lands under dumps remain toxic for 50-100 years. In recent decades humanity has realized - either humankind wins out garbage, or garbage destroys humanity.  SOLUTION  ZEUS – the first company that offers an innovative approachin the field of garbage waste recycling.  The most effective way to reduce the amount of garbage is to recycle it at waste processing factories. The effect of the activity of such factories is undeniable - 70-80% of the waste received by the factory receives a second life, and when burning garbage, electricity is produced, which will always be in demand in the modern world.  The main difference of the company is the recycling of garbage into electricity, which is used for mining cryptocurrencies, thus contributing to the development of world’s crypto economy and decentralized systems. Thermal energy produced by mining and processing, as well as other by-products of the recycling are used by the Government to serve the needs of the population.    The mission of our project – by cleansing the planet from garbage, develop the crypto economy.   Pre-ICO start: 25.10.2017                  end: 25.11.2017  ICO           start: 15.12.2017                  end: 25.01.2018      FIND OUT MORE    WHITEPAPER   JOIN US:",False
52,msg22040972,https://bitcointalk.org/index.php?topic=2194462.0,,2987,Announcements (Altcoins),2017-09-20 16:18:03,miniapps,Full Member,308,100,,[ANN][ICO][ZEUS] ⚡️ ZEUS - First EcoMining ⚡️,Your whitepaper and site links are broken,False
53,msg22066564,https://bitcointalk.org/index.php?topic=2194462.0,,2987,Announcements (Altcoins),2017-09-21 10:31:51,birkomester,Full Member,336,100,,[ANN][ICO][ZEUS] ⚡️ ZEUS - First EcoMining ⚡️,We fixed it   Now you can follow the links,False
54,msg22066823,https://bitcointalk.org/index.php?topic=2194462.0,,2987,Announcements (Altcoins),2017-09-21 10:40:01,dzkrb1966,Full Member,602,110,,[ANN][ICO][ZEUS] ⚡️ ZEUS - First EcoMining ⚡️,"Guys, girls. Well, you discovered America. There are many such incineration plants with processing and electricity generation. For any atmosphere you will pollute. And who will allow you to build such plants?",False
55,msg22067145,https://bitcointalk.org/index.php?topic=2194462.0,,2987,Announcements (Altcoins),2017-09-21 10:50:10,Vangardo,Sr. Member,658,272,,[ANN][ICO][ZEUS] ⚡️ ZEUS - First EcoMining ⚡️,In which countries do you want to implement your project? Do you have a social bounty company? What other ideas do you have?,False
56,msg22074666,https://bitcointalk.org/index.php?topic=2194462.0,msg22067145,2987,Announcements (Altcoins),2017-09-21 14:37:57,birkomester,Full Member,336,100,,[ANN][ICO][ZEUS] ⚡️ ZEUS - First EcoMining ⚡️,"   Hi! Thank you for the questions For now we want to focus on Germany, because of great support for such an eco project of the government side. Yes, social bounty campaign will be announced on Monday, 25.09 in the appropriate branch.",False
57,msg22074727,https://bitcointalk.org/index.php?topic=2194462.0,msg22066823,2987,Announcements (Altcoins),2017-09-21 14:39:32,birkomester,Full Member,336,100,,[ANN][ICO][ZEUS] ⚡️ ZEUS - First EcoMining ⚡️,"   Hello! We've choose as a partner of Zeus project a german company Wabio which is engaged for 5 years in waste processing technology with no pollution for atmosphere so called  eco energy. Above mentioned company already built 3 plants, to resolve the problems of waste in Germany. We have signed a memorandum between us which guarantees the successful start of our project for plant building and of course all the necessary permissions  from the town authorities have been received.",False
58,msg22074936,https://bitcointalk.org/index.php?topic=2194462.0,,2987,Announcements (Altcoins),2017-09-21 14:44:47,adarwis,Sr. Member,560,251,,[ANN][ICO][ZEUS] ⚡️ ZEUS - First EcoMining ⚡️,"nice I'm sure will many who are interested with this project, the tread is also very good, so enough info provided, hopefully run well, and good luck",False
59,msg22075382,https://bitcointalk.org/index.php?topic=2194462.0,,2987,Announcements (Altcoins),2017-09-21 14:57:28,maniakbtc,Full Member,410,110,,[ANN][ICO][ZEUS] ⚡️ ZEUS - First EcoMining ⚡️,"looks like a promising project, maybe looking forward to the opportunity to participate.  there any bounty campaign?",False
60,msg22076554,https://bitcointalk.org/index.php?topic=2194462.0,,2987,Announcements (Altcoins),2017-09-21 15:33:07,Mlester,Member,80,10,,[ANN][ICO][ZEUS] ⚡️ ZEUS - First EcoMining ⚡️,"Really like the idea of the project, reducing 70-80% of garbage to be more use full stuff. That will surely save the world from garbage.",False
61,msg22076728,https://bitcointalk.org/index.php?topic=2194462.0,,2987,Announcements (Altcoins),2017-09-21 15:38:24,Ardhi,Full Member,224,100,,[ANN][ICO][ZEUS] ⚡️ ZEUS - First EcoMining ⚡️,"I like the idea of this project, with a mature planning, this project will be a very promising long-term project, but the development should still be done, seeing the growing community. Hopefully can run well",False
